Data da opinião,Nota,Título,Conteúdo
set. de 2016,4,Próximo metro Botafogo,"Metro próximo (menos 5 min de caminhada), mercado próximo. Quarto bom, limpo e silencioso. Equipe nota 10. Serve almoço por preço fixo.  A região não é muito próxima de pontos turísticos, mas o metro próximo facilita muto. Não creio que seja o hotel mais ideal para passeio, eu procuraria a região de Copacabana ou Ipanema.  Mas o hotel é muito bom.  Fica a uns 15 min do Santos Dumont, e você gasta por volta de 14,00 no Uber."
set. de 2016,5,Bom,"Boa comodidade, bons quartos e café da manhã, uma o´tima localização o ibis botafogo e boa recepção. Limpeza impecável nos quartos e a recepção disposta a lhe ajudar nas informações, check in e check out bem rápido."
set. de 2016,4,Ótima localizac,"Vale a pena pelo custo X benefício.  Nível Ibis, como todos os outros. Vale a pena se for pra ficar pouco tempo. Existem vários meios de transporte próximos ao hotel, restaurantes e mercados. O aeroporto Santos dumont também é bem próximo."
set. de 2016,4,Pequena mas atende bem,Procurávamos uma hospedagem que tivesse estacionamento num lugar estratégico para nosso roteiro. Esse hotel foi nossa escolha dentro das opções.  Os quartos são pequenos eu tive que pegar dois quartos (estava com duas crianças e meu esposo). Tudo bem organizado e com a limpeza ok também. Frigobar vazio venha com suas comidas e bebidas. Atendimento muito bom além de bem atenciosos.
ago. de 2016,5,botafogo em tudo,"Hotel agradável, extremamente bem localizado. Atendimento na recepção, bar e serviço de quarto de primeira qualidade. Gostei muito, será meu ponto de descanso no Rio. Além disto, é perto de uma livraria travessa! Perfeito."
ago. de 2016,5,"Bom, boa localização.","Vale a pena ficar hospedado, pois o padrão IBIS é ótimo. Bons quartos e café. A localização é próxima ao metrô, que possibilita que você vá para qualquer parte da cidade. Há restaurantes e lanches nas proximidades. Não recomendo ficar andando após às 19hs."
ago. de 2016,4,Hospedagem,"Hotel de bom custo X benefício. Muito bem localizado, bem perto de algumas atrações noturnas como os barzinhos da Praça Nelson Mandela. Quartos simples, bem arrumados, limpos. Uma opção para se hospedar sem gastar muito. Atendimento cortes. Recomendo"
ago. de 2016,4,Entrega o que promete,"Hotel bem localizado, próximo ao metrô e próximo à vários lugares bons para comer. Fiz uma viagem a trabalho, não tive tempo para desfrutar nada do hotel. Nem sei se oferece algo para lazer. Mas simplesmente para hospedagem, um hotel muito bom. Tudo novo, tem uma recepção agradável… O café da manhã, apesar de oferecer várias opções, acaba enjoando depois de alguns dias. As opções a la carte para almoço e jantar tem preço justo. Os funcionários do hotel são muito atenciosos."
ago. de 2016,4,Estadia para negócios,"Hotel bem localizado próximo metrô Botafogo (1 quadra), estacionamento fácil, café da manhã muito bom, quarto sossegado e completo com mesinha de trabalho. Tv com os canais básicos.Melhor custo benefício da zona sul."
ago. de 2016,4,Falta o cafe da manhã na diária,Quanto às instalações não vou me estender pois segue o padrão Íbis. A localização (próximo ao metrô e a alguns bares e restaurantes de Botafogo são outro diferencial positivo). Pena que não tem café da manhã incluso na diária. Também tinha uma happy hour muito boa no bar do lobby. Recomendo com certeza!
ago. de 2016,2,De madrugada é pessimo,O atendimento em Geral é bom sim. Mas Na ultima vez em que eu estiver neste hotel eu precisei sair as 4;40 da manha para pegar p voo as 7 h. Desculpe fiz o check out e pedi o service de cafe da madrugada assim eles chamam. O atendente que estava com as duas mãos no bolso assim continuou ate chegar no bar onde seria servido o meu cafe. Com muito mal humor e de muita ma vontade ele virou uma Mao do bolso e me serviu assim com uma Mao só parecia que para ele era um absurdo ele ter que fazer p café. Quem trabalha de Tarde nao trabalha dessa forma achei ridiculo. Foi um pessimo atendimento.
ago. de 2016,5,Boa localização e serviço,"Preço acessível, boa localização e ambiente bom. Funcionários atenciosos. Segue o estilo dos hotéis accor, hotéis padrão e de qualidade. Café da manhã bom, quartos limpos. Recomendo e voltaria ao hotel."
ago. de 2016,4,Excelente localização,"O Ibis Botafogo é um Hotel muito limpo, moderno, atendimento excelente, café da manhã razoável. O Bar é 24h e sua localização é excelente (Nas proximidades está a Estação do Metro, bares, shoppings, mercados e praia de Botafogo)."
ago. de 2016,4,Avaliação geral,"Excelente localização. Ckeck in rápido e cordial. Café da manhã padrão Ibis, avaliado como bom. Ambiente do bar agradável. quarto agradável e padrão ibis, com cama macia, travesseiros macios e chuveiro bom."
ago. de 2016,4,Bom e custo acessível,"Hotel segue o da rede Isis, muito bem localizado perto de padaria, restaurantes, supermercado e metrô e ônibus que vão a todos os pontos turísticos. Limpo, pouco barulho é um atendimento muito bom. Recomendo pois não deixa nada a desejar. Tudo ótimo."
ago. de 2016,5,Dentro dos padrões Ibis.,"Sem luxo, sem mordomias, mas com quartos agradáveis e localização privilegiada, o hotel Ibis Botafogo é uma excelente opção, dentro de todos os parâmetros de qualidade da rede de hotéis. Ao lado do metrô."
ago. de 2016,3,Exageradamente economico,"Eu diria que o Ibis é um hotel para quem está única e exclusivamente querendo gastar pouco. O de Botafogo não é diferente dos demais. Bem localizado, pois está perto do Metro, tem aquele quarto mínimo, com produtos de banho de péssima qualidade e fornecidos com má vontade pelo staff, pois provavelmente são orientados a só fornecer se o cliente pedir. O café da manhã também é constituído de produtos baratos e ruins. Muito fracos também os produtos disponíveis no bar. Enfim, um hotel econômico para quem não espera nada além disso."
ago. de 2016,4,Excelente,"O quarto é agradável, podia ser um pouco maior, o chuveiro é excelente e a televisão também é ótima, senti falta de um número maior de canais. No mais um excelente lugar, uma boa localização, próximo a ele tem táxi."
ago. de 2016,4,Localização e preço são os pontos positivos!,"Quarto padrão bem limpo, um pouco apertado só, chuveiro muito bom e bem quente com pressão. Televisão boa, poderia ter uma quantidade de canais mais amplo, achei legal que deixam uma entrada HDMI e outra componente para utilização, sempre quando viajo levo filmes no nootbook e coloco na televisão. Café da manhã era bem completo mas sem nada muito elaborado.  Fiquei no quarto 276.    Hotel: 8/10  Quarto: 7/10  Limpeza: 9/10  Café da manhã: 7/10  Atendimento: 10/10"
ago. de 2016,3,Razoável,"Hotel com boa localização, tem várias linhas de ônibus próximo ao hotel, estação de metrô Botafogo também bem próximo, ponto de táxi na frente. Hotel com atendimento muito bom, mas o WiFi com sinal muito ruim, internet muito lenta e a TV com imagem horrível!"
jul. de 2016,5,Melhor Ibis de todos!,"A cerca de cinco anos, minhas funções de trabalho me obrigam a viajar pelo Brasil, já estive em todo tipo de hotel... Mas este IBIS, além de muito bem localizado, possui uma equipe genuinamente interessada no bem estar de seus hóspedes.  WIFI bom, café normal de IBIS..."
jul. de 2016,4,Excelente relação custo beneficio,"Hospedamos em julho /2016. Marido e filhos adolescentes. Quartos com padrão Ibis, pequenos, mas com conforto. Colchões novos, chuveiros excelentes, ar condicionado ótimo. Recepcionistas muito educados e disponíveis para informações . A parte de Botafogo é bem residencial com muito comércio próximo. Não é muito turístico mas o metrô é bem perto . O café da manhã do hotel é caro e só vale a pena para que come muito . Próximo tem varias opções legais e mais em conta"
jul. de 2016,5,O melhor IBIS do Rio,"Não bastasse a localização em um bairro com tudo à mão,o Ibis Botafogo tem uma excelente e atenciosa equipe . Bufet  noturno .De fácil acesso ,próximo ao metrô é ótimo para quem vai se locomover por toda zona sul e centro. Com a ampliação do metrô até a Barra vai ficar melhor ainda."
jul. de 2016,2,Não pontuou Le club Accor,"Eu avaliaria como muito bom, pois a hospedagem foi muito boa nos quesitos de limpeza, silêncio e espaço, porém ao fazermos o check in pedi que incluissem o meu número le club já que a reserva foi feita pelo aplicativo. A atendente disse que colocaria porém não o fez. Ela também errou na cobrança do valor colondo valor superior, mas o mesmo foi acertado por quem fez o check out, no entanto ele não me deu o recibo após fecharmos o valor dizendo que enviaria por email e também não enviou. Sendo assim, não tenho como pedir para o le club adicionar os pontos."
jul. de 2016,3,Ótimo hotel mas não pontua no Le Club,"Sempre me hospedei neste IBIS, no IBIS Nova América e no IBIS Centro pela minha empresa através de um agente, sempre preferi utilizar o IBIS pois além de ter preços razoáveis, ainda conseguia pontuar no Le Club. Hoje fui informado que isso mudou para pessoas que utilizam agentes, e já não pontuo mais.    Desta forma, estou buscando outro hotel no estado do RJ que trabalhe com troca de pontuação por diárias, assim que encontrar não me hospedarei mais no IBIS."
jul. de 2016,4,Dentro da proposta,"Fui a trabalho e o hotel foi uma ótima opção. Bem localizado, quarto confortável e limpo, atendimento cordial.  O café da manhã não está incluso na diária, o que é uma pena. No entanto, o valor cobrado não me pareceu abusivo. Havia boa variedade e qualidade."
jul. de 2016,5,Novinho e luxuoso !!,"Ótimo local, hotel cheiroso, novinho e com um atendimento rápido . As recepcionistas são muito educadas e simpáticas , tentam ajudar o máximo que podem. Me senti em casa , no centrão do Rio de Janeiro.  Perto de tudo, fácil de andar a pé pelo aterrado Flamengo, passear sem medo.  Oferece conforto e qualidade nos serviços ! E o mais importante é o preço da estadia."
jul. de 2016,4,Visita ao rio,"Lugar mto bom, ótimo atendimento, recomendo com toda certeza! Fomos bem tratados e atendidos da hora que chegamos à nossa saida .Se tivesse que reclamar de algo seria apenas dos produtos do bar e do restaurante que são muito caros, preços um pouco salgados de mais ."
jul. de 2016,4,Sinto-me em casa,"Hospedo-me frequentemente nesse hotel e só tenho elogios ao staff e ao hotel em si. O preço é justo em termos de Rio de Janeiro, o atendimento é sempre cordial e a localização é muito boa. Destaque para o Cristiano da recepção e Luana do bar do lobby."
jul. de 2016,4,Excelente custo benefício,"Instalações simples mas confortáveis e com ótima localização, próximo da estação de Metrô de Botafogo.  Se vier ou precisar ir ao aeroporto Santo Dumont pode utilizar o recém inaugurado VLT junto com o Metrô.  O Ibis não tem surpresa e entrega por um preço justo um serviço de qualidade."
jul. de 2016,3,Sem surpresas,"Localização ok, próximo ao metrô. Possível se deslocar facilmente a várias regiões tanto de carro quanto de transporte coletivo. Também possui vários bares e restaurantes na redondeza.    Quarto limpo e com tudo funcionando. Assim como os outros Ibis, peca por não ter serviço de quarto."
jul. de 2016,4,Praticidade e bom atendimento.,"Bem localizado, com um bom atendimento e um ambiente bem cuidado. O serviço de estacionamento, apesar de não ser do hotel, é bastante satisfatório. O restaurante também é agradável, com refeições práticas e saborosas."
jul. de 2016,3,Preço Justo,"Hotel padrão Ibis. Excelente localização. Possui garagem. Tivemos um pequeno problema no momento do check-in pois a recepção estava muito cheia e os atendentes se complicaram, mas nada que tenha complicado a hospedagem. Me hospedaria novamente."
jul. de 2016,4,BOM HOTEL PARA ESTADIAS CURTAS,"Hotel bem localizado, próximo ao metro, Shopping e rua de comércio com varias opções para refeições e lanche, gostei da limpeza dos quartos e café da manhã, ponto a ser melhorado o atendimento na recepção, falta cordialidade, educação e simpatia por parte das pessoas que ali ficam.  Espero que os responsáveis corrijam rapidamente este ponto, pois a concorrência não espera."
jul. de 2016,3,Bom custo beneficio!,"Ao estilo Ibis este hotel tem um bom custo beneficio. Confortável, boa localização, funcionários atenciosos(com alguma exceção) e café da manhã ok(melhor do que de muito hotel de categoria superior). Ao lado do metrô Botafogo e com várias opções de comida ao redor. Vale!"
jul. de 2016,3,"Bom, mas tem oportunidades pra melhorar.","Boa localização, comércio variado nas redondezas, incomoda um pouco o engarrafamento quase constante da rua na lateral do hotel. O hotel é novo e dentro de padrões bons de qualidade. O atendimento foi bom, mas vai uma crítica para o pessoal que atende o estacionamento, onde podemos classificar o atendimento apenas como dentro do aceitável. Podem melhorar o atendimento, a educação, a cordialidade. E pesquisem bem, pois existem outros hotéis oferecendo mais por praticamente a mesma tarifa do Ibis."
jul. de 2016,3,Chegada de uma viagem longa sem o acolhimento necessário,"Fomos recebidos por uma funcionária, cujo nome não possuo, que identificou um problema no meu check in. De fato, esqueci de levar a carteira de vacinação do meu pet. A funcionária não se mostrou agradável, colaborativa, diante de uma situação de estresse como essa. Não me senti uma cliente le cub Accor, mas alguém que estava incomodando no check in. A funcionária deveria estar preparada para acalmar o hóspede nessas situações em que já nos encontramos exaustos pela viagem. Felizmente consegui resgatar a carteira de vacinação do meu pet por email, mas a situação poderia ter sido muito mais tranquila. Esta foi minha pior experiência nos hotéis Ibis."
jul. de 2016,4,Good,"Fiquei 1 noite, a trabalho e foi ok. A região é ótima, com supermercado e restaurantes perto. facilidade de acesso por metro ou taxi. Não utilizei o café da manhã e jantar. Recepção muito atenciosa.  Wi-fi não funciona em determinados locais/quartos."
jul. de 2016,4,Boa opção,"Bem localizado, limpo e com padrão de atendimento da rede Íbis, recomendo este hotel para quem quer utilizá-lo apenas para dormir.  Não recomendo para área de recreação ou com crianças.  Até porque, no RJ, é melhor ficar fora do hotel do que dentro, aproveitando as opções que a cidade oferece."
jul. de 2016,5,"Excelente serviço, empregados muito atenciosos e amigáveis e ótima localização","Adorei este hotel. É moderno, limpo e o todo pessoal é muito atencioso e amigável, especialmente o pessoal do restaurante e bar (Cláudio, Vanusa e restantes) que me fizeram sentir em casa durante a minha longa estadia no Rio. Também achei a sua localização fantástica, com o Metro bem perto. As deslocações a outros pontos da cidade como Copacabana, Ipanema, centro eram rápidas e baratas. A zona achei bastante segura com muita diversão bem perto."
jul. de 2016,4,Ótimo Ibis,"Estive no Ibis Botafogo no dia 09 de julho pela sexta vez e continua com excelente atendimento. Funcionários muito prestativos e simpáticos.!! Voltarei em breve!! A localização é excelente. ônibus , metrô e táxi de fácil acesso."
jul. de 2016,2,"Sem visão, sem serviço, sem futuro","Um hotel que não tem água no frigobar, que não lhe oferece serviço de quarto. Preciso falar mais alguma coisa? Viajo toda semana em hotéis diferentes e nunca vi isso.    O quarto você tem que sair procurando as coisas, desde o telefone da recepção (que não tem no próprio telefone - fica escondido no meio folheto de apresentação), até o acesso à luz (a luz lá longe apaga e acende a luz laaaaa distante)! O banheiro se você não tomar cuidado você cai de um altar que eles fizeram!    Na boa, o pior é deixar o hospede passando sede no quarto. Já estou de pijama, cansado, e não quero descer. Tenho que engolir essa!    Cada um sabe onde quer chegar."
jul. de 2016,4,Ótima Localização,"Hotel bem localizado, próximo ao metro de Botafogo e de fácil acesso de ônibus e táxis. Funcionários do hotel são muito receptivos.  As sextas-feiras o hotel serve uma feijoada muito boa na hora do almoço! Recomendo a quem trabalhar por perto."
jul. de 2016,5,Localização e atendimento,Este ibis está muito bem localizado no Rio. Próximo ao aeroporto e de fácil acesso. Ótimo atendimento e qualidade do café da manhã. Apesar da localização os quartos são bastante silenciosos.  Equipe da recepção muito bem preparada
jul. de 2016,4,Um Ibis bem localizado na Zona Sul do Rio,"O Ibis Botafogo está dentro dos padrões já conhecidos da rede hoteleira - quarto sem luxos mas confortável, agradável buffet de café da manhã, acesso à internet sem custos. Adorei a localização deste em particular por ser perto do metrô, restaurantes, cinemas e shopping, além de Botafogo já ser por excelência um dos pontos mais ""centrais"" da Zona Sul do Rio, bem mais perto do Aeroporto Santos Dumont e do Centro da cidade que Ipanema e Copacabana.  A destacar a simpatia do recepcionista Cristiano. Um atendimento feito com alegria e cordialidade já torna a estadia mais agradável."
jul. de 2016,2,Normal,Bom apenas para dormir. Não existe serviço de quarto. Você precisa ir até o bar pra encher o frigobar do seu quarto. Café da manhã é gostoso e o atendimento é normal. Não pretendo hospedar novamente.  Custo beneficio ruim. Café e estacionamento não estão inclusos na diária.
jul. de 2016,5,"Ambiente agradável, boa localização","Fiquei hospedado no hotel Íbis Botafogo, no final de mês de maio. O hotel é muito limpo, pouco barulho e com atendimento com muita cordialidade. O custo benefício é ótimo e fica próximo dos principais pontos turísticos. Vale a pena..."
jun. de 2016,3,Ergonomia do quarto ruim. Bom jantar,"Fui bem atendido por todos os funcionários. Ressalva para o pessoal do estacionamento no prédio, controlado pela Estapar. Pois fizeram piadinhas sobre outro hóspede que acabará de sair. Achei uma falta respeito!!!    Fiquei numa suíte com cama de casal e o básico que se espera. Tv a cabo, uma bancada com cadeira, etc....    Minhas reclamações:  1.vários pontos da suite não são ergonômicos. No banheiro o sanitario é super apertado, justamente por que colocaram o suporte do papel na altura da perna. Do outro lado tem um pedaço de parede inútil que esta ali também só para atrapalhar.    2. As portas de vidro da ducha abrem para fora, ao invés de para dentro. Na hora de sair tem que fazer malabarismo pra não molhar o banheiro todo.  3. Torneira mau regulada, e má conservação. Pois saia pouca água e na primeira vez que fui usar, saiu com uma coloração avermelhada. Como ferrugem.    Otimo jantar, com Buffet ao preço de 35 reais para hóspedes. Recomendo as sobremesas.    Café da manhã ao custo de 19 reais, também muito bom. Pena que eles também utilizam essas máquinas automáticas de café. Não é a mesma coisa!!!!    Limpeza estava ok, lençóis limpos! Mas notei um pouco de areia no chão e pó sobre móveis.    Não vi pontos que posso elencar como destaques"
jun. de 2016,5,Sempre..!,"O padrão Ibis de sempre, bom atendimento, bom café da manhã, preço justo, sem surpresas desagradáveis pois já sabe-se o que vai encontrar. Sempre que posso me hospedo num Ibis. Lanches rápidos saborosos ( fomos de misto quente ) prato do dia bem servido e bom preço. Ao meio dia, o tradicional buffet com diversas opções."
jun. de 2016,4,Tudo junto num só lugar...,"Boa localização, conforto e bom atendimento!!! Tudo junto num só lugar...  O Hotel é bem localizado perto de quase tudo, com fácil acesso ao metrô da cidade.  Os quartos são confortáveis, o café da manhã é delicioso e variado.  O ambiente é gostoso e favorável."
jun. de 2016,4,Padrão Ibis - Ótima localizacao,"Para quem está a negócios e também quer sair para jantar e ver gente bonita,ótima localização,próximo a uma área gourmet.você possui a tranquilidade de quem está a trabalho mas a duas quadras possui excelentes restaurantes para jantar. Recomendo."
jun. de 2016,5,Bem localizado!,"Fiquei uma semana hospedada. A localização é bom, diária com valor legal, atendimento muito bom!!! Muito confortável e fácil acesso! O restaurante é muito bom R$ 35,00 por pessoa, e o bar tbm é bem gostoso!"
jun. de 2016,5,Funcionários que fazem a diferença,"Minhas estadias no Ibis Botafogo sempre são muito boas. Os funcionários são sempre muito atenciosos e preocupados com nosso bem estar. O Cris é o mais simpático e bem humorado. Quando chego na recepção para o check in ele já me recebe com um ""bem vinda"" muito vibrante. Depois de um dia de trabalho e muito cansada, esse tipo de recepção faz sempre uma boa diferença!!!"
jun. de 2016,4,Muito bom,"Bem localizado (a duas quadras da estaçao Botafogo do metrô), quarto limpo e com vista para o Cristo.  Ótimo pra quem tá buscando economia e um mínimo de conforto.  A internet wifi é free, mas o café da manhã é pago à parte (R$19,00 por pessoa), assim como o estacionamento.  Reserve pelo site, volta e meia rola umas promoçoes muito boas (paguei apenas R$69,00 na diária)."
jun. de 2016,4,Confortável e fácil.,"Hotel simpático, moderno, bem localizado e confortável, bem característico do Ibis. Além de silencioso, o hotel consta com ótimo atendimento, profissionais prestativos e muito simpáticos (com a alma carioca)."
jun. de 2016,5,Recomendo,"O atendimento foi ótimo! o quarto muito bem arrumado, a comida bem preparada, os funcionários bem atenciosos..Destaque para a funcionária Tatyane Gouveia, ela foi muito simpática.. Me tratou super bem, além de realizar muito bem seu trabalho. Recomendo o hotel."
jun. de 2016,5,Conforto e qualidade. Muito bom,"Hospedei no dia dos namorados. Fui muito bem atendida pelos profissionais do restaurante e do bar. O quarto que fiquei foi bem confortável. Banheiro amplo e uma ducha maravilhosa! Com certeza voltaria e recomendo o hotel. O café da manhã, mesmo sendo pago à parte, vale muito à pena, é excelente. Tem muitas variedades e tudo muito gostoso!!  O Ibis ganhou um cliente e sua recomendação.  Parabéns!"
jun. de 2016,5,hotel bem localizado,"Ficamos no IBIS Botafogo no feriado e fomos muito bem atendidos.  Quarto bom, atendimento atencioso em todos as partes do hotel, com destaque para a atendente da cafeteria do térreo. Simpática e prestativa.  Hotel perto do metrô e com fácil acesso aos pontos turísticos."
jun. de 2016,4,bom para uma noite,"Fiz uma viajem rápida, nao fiquei muito tempo, passei apenas uma noite.  O hotel é organizado, o quarto estava bem limpo, me atenderam bem, forneceram itens que solicitei, só poderia oferecer cafe da manha, pois este é pago por fora, a hospedagem em si ja deveria cobrir esse consumo."
jun. de 2016,5,Perfeito!,"Foi minha segunda visita ao hotel, mas volto mais vezes se precisar! Ótima localização com bom custo benefício. O metrô está a poucos minutos de caminhada. No em torno da estação, há várias opções de bons bares e restaurantes. O shopping Rio Sul, que é bem completo, está no mesmo bairro."
jun. de 2016,3,muito bom,"Hotel com boa localização e ótimo preço. Perto do metrô, lojas e restaurantes. Atendimento de exelente qualidade, limpeza e funcionários atenciosos. Uma boa opção par fim de semana e feriados. Recomendo !"
jun. de 2016,3,Custo Beneficio,"Hotel básico, pra quem procura uma hospedagem rápida.  Boa localização, próximo a estação de metro e tudo que precisa por perto. ( Supermercados, farmácias, restaurantes e bares)  Atendimento bom.  Recomendo pra quem vai ter uma passagem rápida pelo Rio."
jun. de 2016,5,Parabéns!,"Gostaria de parabenizar ao serviço prestado...desde o atendimento na recepção, até a estrutura do quarto. Os funcionários atenciosos e muito simpáticos. Volto e indico com certeza! Parabéns, também, pela iniciativa da promoção do final de semana do dia dos namorados que possibilitou a minha hospedagem por um valor bem mais acessível."
jun. de 2016,3,Bom,"Lugar agradável, bem localizado, novo e com funcionários muito educados, é minha primeira vez no Ibis, com relação ao custo benefício é uma boa opção, Mas deve estar ciente que são quartos pequenos por uma diária de 279, e os travesseiros eram de espessura baixa"
jun. de 2016,3,Custo beneficio vale a pena!,"Hotel bem localizado em  Botafogo, próximo à estação de metrô com tudo que se precisa por perto! Restaurantes, Farmacia, shopping, padaria, academia... Ponto negativo: a cozinha do hotel não funciona 24h, ficando os lanches na necessidade na madrugada a cargo de ""congelados"" !!!"
jun. de 2016,5,Negócios,"O bairro é excelente, com muitas opções de bares, restaurantes, supermercados, teatros, cinema. Muito trânsito, mas o hotel é uma ótima opção pra aproveitar tudo q o bairro fornece, além de ser barato. Limpo, com funcionários cordiais e simpáticos."
jun. de 2016,5,Muito bom,"Ótima localização, hotel novo e todo moderno, com quartos confortáveis, limpos e arrumados, próximo da estação de metrô. Ótimo custo - benefício, atendeu ao que eu precisava, não tenho o que reclamar."
