Data da opinião,Nota,Título,Conteúdo
mar. de 2014,4,Padrão Ibis,"aonde quer que voce vá. vai encontrar o mesmo padrão de estadia e isso é um diferencial enorme. O mesmo tamanho de quarto, a mesma cama, o mesmo atendimento atencioso. Variando apenas a localização, mais perto ou mais longe de um aeroporto."
mar. de 2014,4,Um oasis na zona sul,"Hotel novo, inaugurado em 2013, com o melhor custo benefício dos hoteis da zona sul.    A rede hoteleira do Rio precisa de mais hoteis modernos como esse Ibis Botafogo. Com preço de quarto privativo duplo de hostel, e o padrão de qualidade de sempre da rede Ibis, parece mais um oasis na zona sul."
mar. de 2014,5,design diferenciado,"Milésimo hotel da rede, comemorado com mudança no estilo de todo hotel. Quarto amplo com cama da casal grande e confortável. Banheiro maior no padrão normal (sanitário+chuveiro+pia). Atendimento nota 10 e boa localização!! Pra quem precisa do metrô, a estação é ao lado!!! Recomendado!!"
mar. de 2014,5,Excelente!!!,"Prédio novinho, limpeza dos quartos bem feita, cama e quarto confortável, café da manhã bem servido e com bastante variedade, atendentes educados e atenciosos, próximo da estação de metrô Botafogo...."
mar. de 2014,4,Excelente Custo-Benefício,"Hotel bem localizado em Botafogo, próximo ao Santos Dumont e ao lado da estação de trem. Pela localização os deslocamentos de táxi não ficam exorbitantes. Hotel novíssimo, bom atendimento e bom café da manhã."
mar. de 2014,4,Hotel nota dez,"Bem localizado, serviço nao deixou a desejar , serviço de transporte publico proximo ao hotel. O bom da rede ibis é que o padrão vale para todos os hotéis , logo vc sabe realmente no que vai se hospedar sem ter qualquer surpresa. Vale a pena se hospedar"
mar. de 2014,5,Bom Custo Benefício!,"Hotel com ótimo custo benefício e apresenta um ambiente e serviço bastante agradável. Possui um bom café da manhã e estrutura padrão dos hotéis Ibis. Achei que valeu a pena a estadia, e voltaria novamente!"
mar. de 2014,5,Excelente,"Hotel excelente. Quarto aconchegante, cama confortabilíssima, banheiro bastante funcional e destaque para o café da manhã: muitas opções. Localização muito boa, perto de uma estação de metrô. Super recomendado."
mar. de 2014,5,"Conforto, seguro e bem localizado","Gostei bastante das acomodações, dos profissionais e principalmente do preço. Lamento apenas não disponibilizar o café da manhã para seus hóspedes. Pessoal da limpeza bastante competente e da recepção também."
mar. de 2014,4,Serviço sofrivel,"Ibis muito bem localizado, ao lado do Shopping Botafogo e do metro.  O hotel esta novinho, muito bom , mas o serviço é horrível, aguardei 30 minutos no check in e ainda me deram quarto para portadores de necessidades especiais, penalizando quem precisa de um quarto assim ja que sao poucos."
mar. de 2014,4,Padrão,"O bom dessa rede é que ela mantem o mesmo padrão em qualquer lugar do mundo, e com este hotel não foi diferente.  Apesar do atendimento inicial ter sido ruim, recomendo pela localição rpeço e serviço.  Estacionamento é pago (30,00 por 34horas) e o café da manhã também."
mar. de 2014,4,Satisfeito,Quarto excelente. Faltou toalha de rosto. O atendimento na recepção é profissional porém muito frio. Por ser cidade turística poderiam sorrir mais e dar as boas vindas aos visitantes. Desejo sucesso .
mar. de 2014,3,"Básico, mas novo","Não gostei do atendimento pois o atendente pediu que eu pagasse 11,00 logo no checkin e ainda não tinha troco para 20,00.  Achei totalmente despreparado.  O quarto é identicop aos da rede, o hotel é novissimo, o estacionamento é pago (30,00 24h)  Café da manhã tb é pago, mas preferi não tomar no hotel.  Existe uma rua movimentada bem atras, pontos de onibbus, metro e um shopping."
mar. de 2014,4,Otimo Ibis,"Ibis padrao porem novo, com otimo atendimento e lobby no andar terreo acima do padrao. Muito agradavel...  Primeiro Ibis que vejo com jantar buffet... Otimo buffet.. Parabens pela variedade e qualidade...  Unica dificildade e o acesso de veiculos para estacionamento, necessita melhor sinalizacao devido a rua com muito transito.."
mar. de 2014,5,Melhor Custo Benefício e Localização,"Passei o Carnaval no Ibis de botafogo e não me arrependi. O hotel é bem novo, os funcionários são simpaticos e prestativos. O preço foi razoável pra uma época tão agitada como o carnaval.  Fica próximo do metro, de várias linhas de ônibus, perto do shopping, diversos restaurantes...  Fiquei no décimo andar e wifi pegou sem nenhum problema!  Pra quem vai de carro, a diária do estacionamento é 30 reais... meio caro.    Recomendo."
mar. de 2014,4,Ótima Opção,"Ótimo hotel em Botafogo, bem próximo ao metrô, ligando aos principais bairros como Copacabana, Leblon e Ipanema! O hotel tem uma ótima estrutura, o quarto é bem projetado, simples, mas bastante funcional! Café-da-manhã(não incluso na diária, 16 reais por pessoa ) muito bom, bem servido e com várias opções. O serviço de restaurante tbm é muito bom, o prato é bem servido e muito gostoso! Lembrando que essa avaliação é com base no padrão do hotel."
mar. de 2014,4,Excelente Custo Benefício,"Ótima localização, boas acomodações, padrão Ibis... Cama confortável, ar condicionado perfeito, boa tv e excelente chuveiro. Bom atendimento,  preço justo (considerando que o RJ é uma das cidades mais cara do mundo para se hospedar).  Valeu a pena, pela terceira vez!"
mar. de 2014,4,Hotel novo,"Gostei bastante do hotel. O preço é bom, comparado com os hotéis do RJ. É bem localizado, perto do metrô e de bares em Botafogo. E o hotel está novo. O prédio é novo. Tem um bar 24 horas, mas esse bar não tem muitas opções. Recomendo o hotel."
mar. de 2014,3,Bom custo-benefício,"A localização é muito boa, próximo ao metrô Botafogo, supermercado, bancos, cinemas, restaurantes e shopping centers. Os quartos são limpos e as camas confortáveis. Apesar de nao possuir serviço de quarto, o atendimento da recepção, restaurante e bar são bons. Dois pontos fracos: o café da manhã (pobre em nutrientes e frutas passadas) e a internet (muito lenta e instável)."
mar. de 2014,3,Deficiente para Turismo,"Instalações boas, mas realmente é um hotel para viajem à negócios. Atendimento deficiente para turismo. Recepção sem maiores esclarecimentos sobre a cidade ... tinham informação sobre os eventos mas não sabiam informar sobre endereços e localização dos mesmos, e nem se predispunham em pesquisar para informar."
mar. de 2014,4,Ibis RJ Botafogo - Aprovado,"Instalacoes novas, atendimento bem simpatico, boa localizacao na Zona Sul e de facil acesso. O cafe da manha eh adequado ao padrao da Rede Ibis. O estacionamento conveniado poderia ser mais em conta. Proximo aa Estacao Botafogo do Metro. Ha varios Bares e Restaurantes nas imediacoes do hotel."
mar. de 2014,5,localização,"Alé de ser um hotel confortável, chamo atenção para localização (perto da estação de emtro, parada de onibus, perto de super). Enfim, botafogo é um bairro residencial, mas esse hotel realmente está muito bem localizado."
mar. de 2014,4,"Boa localização, custo beneficio positivo e entrega o que promete.","Hotel novo, ótima localização. Perto do metrô e da praia.  Fácil acesso ao centro, à zona sul e aos aeroportos.  Opções interessantes de alimentação com restaurante básico.  Equipe atenciosa.  Boa limpeza."
mar. de 2014,3,Faltam alguns servicos,"Precisa melhorar alguns serviços, boa localização,melhorar o serviço do bar, e melhorar a limpeza do quarto,melhorar a internet, a limpeza do quarto,melhorar o serviço do bar, e uma boa localização, e um bom desing."
mar. de 2014,4,Custo x benefício: recomendo !,"Com o propósito de passar dois dias no Rio, vindo de Búzios; me surpreendi com a atendimento exemplar da recepcionista que se dispôs imediatamente na busca por hospedagem. Após confirmar nossa intenção de hospedar, pedi um quarto com vista bonita. Que surpresa deliciosa e que vista: o Cristo Redentor !  Só emoções..."
mar. de 2014,5,Hotel muito confortável,"Me hospedei no Ibis Botafogo durante o carnaval de 2014. Fomos muito bem recebidos, o quarto é confortável, a cama é uma delícia e o café da manhã também. O hotel é descolado, tem uma decoração muito estilosa. Recomendo!"
mar. de 2014,4,HOTEL NOVO COM BOA QUALIDADE DE ATENDIMENTO,Hotel com Boa localização e Qualidade no Atendimento (O chek-in foi o mais rápido que vi até hoje. obs. Odeio fazer o chek-in). com bom custo benefício.    O Lugar em que o Hotel fica é Bom - Porem tem um transito realmente péssimo!!!    O Rio nessa questão esta terrível.    Mas se você optar por se deslocar pelo Metro / Transporte urbano é uma Ótima opção perto de excelentes lugares para almoçar / jantar ou mesmo fazer novos negócios.
mar. de 2014,5,Boa localização e excelente custo benefício,"o hotel é muito bem localizado. Próximo a estação Botafogo do metro e do shopping. Os quartos possuem uma boa cama, muito silencioso e janela com blecaute. Se descansa muito bem. Banheiro e chuveiro bons. o café da manhã tem um preço justo para os bons e variados produtos que são oferecidos."
mar. de 2014,5,Para viagens com a familia a lazer ou passeio,"Gostei do hotel como todo; comecando pelo excelente atendimento dos recepcionistas, pela simpatia dos funcionarios do restaurante e cafe da manha e pela limpeza interna no modo geral do hotel nao tem igual."
mar. de 2014,4,Hospedagem agradável no Rio,"Este hotel fica perto do metrô Botafogo e do shopping Botafogo. Tudo é novo e organizado. O quarto é confortável, com tv e frigobar, e o banheiro moderno com uma boa ducha quente. Atendimento atencioso. Bom custo - benefício quando comparado às tarifas dos hotéis cariocas"
mar. de 2014,3,Para viagens de negócios e curta temporada na cidade,"Gostei do hotel pelos seguintes motivos:  - atualmente pela proximidade do escritório da minha empresa,  - preço justo nas diárias,  - preço do café da manhã apesar de não estar incluso na diária, pelo buffet vale a pena!  - preço do jantar muito bom, com o serviço ""self service"" com preço fixo e coma a vontade com sobremesa inclusa, é o primeiro hotel no RJ que conheço que não é a la carte no jantar.  - o serviço em geral bom não tenho o que reclamar, levando em conta que como utilizo para passar alguns dias na semana e só para dormir."
mar. de 2014,4,Boa localização e ótimo custo.,"Hotel ao lado da estação do metrô botafogo e em um bairro com boas opções de lazer inclusive o mesmo está localizado a poucos quarteirões da praia. É limpo, o quarto é ótimo e silencioso e o atendimento é bom. RECOMENDO."
mar. de 2014,4,Bom custo-beneficio,"O Ibis Botafogo segue o padrão mundial da rede, sendo q a localização é ótima para aqueles q estão no Rio de Janeiro a negócio.    O preço da diária corresponde ao preço de uma diária num bom hostel da cidade em quarto individual. Não há necessidade de pagar pelo café pq no entrono existem ótimas opções"
mar. de 2014,3,Custo Beneficio,"O Ibis Botafogo é relativamente novo, inaugurado no ano passado tem instalações novas. Os quartos localizados em andares altos nos fundos tem vista para o Cristo Redentor. O café da manhã cobrado a parte é bom, dentro do padrão Ibis. O atendimento é fraco na recepção."
mar. de 2014,5,ótimo custo benefício,"o hotel é muito bem localizado. pertinho da estacao botafogo do metro e do shopping. o quarto e amplo, cama boa. muito silencioso e janela com blecaute. da para descansar muito bem. banheiro e chuveiro bons. o café da manhã tem um preço justo para os bons e variados produtos que são oferecidos."
mar. de 2014,4,Boa opção na zona sul,"Hotel com instalações novas, bom atendimento, seguindo o padrão IBIS. O hotel possui boa localização, perto do metro, shopping e opções de lanches rápidos. Rápido acesso até o aeroporto Santos Dumont, sendo uma boa opção para quem viaja a trabalho e tem que se deslocar ao centro do Rio de Janeiro."
mar. de 2014,3,Atendimento precário,"O hotel atende às expectativas que se tem em relação à rede Ibis, porém conta com funcionários em seu quadro que não fazem jus a carregar o nome Ibis. Enfrentamos problemas sérios com reservas de passeios.  Fora isso, as instalações seguem o padrão já conhecido."
fev. de 2014,4,Ibis sem surpresa,"Este Inis foi inaugurado em setembro de 2013 e está novo. O Ibis, exceto Museo Bogotá, nunca apresenta diferenças, até o layout dos quartos não iguais (Phuket, Copacabana, Barueri, Curitiba etc.) são os mesmos, bem como os seviços: um café da manhã caro pelo que oferece, quaros e banheiros limpos.    Vale a pena se hospedar, considerando os preços caríssimos dos quartos no Rio. Imagine na Copa..."
fev. de 2014,4,Como um Ibis deve ser,"Limpo, confortável, serviços racionais, nada demais nem de menos. Não espere, como nos hoteis de Copacabana, sair caminhando e encontrar atrações em volta; o ponto acaba exigindo um táxi para se locomover, o que é OK para uma viagem de trabalho."
fev. de 2014,4,Ótimo atendimento e localização,"O Hotel é muito novo, os quartos equipados com TVs modernas, quartos simples mas aconchegante, frigobar vazio disponível para usufruir da maneira que desejar e localização perfeita. Próximo ao aeroporto Santos Dumont, Shopping, metrô, fácil acesso ao bondinho, Cristo, Copacabana, Ipanema. Região badalada com restaurantes, baladas e etc. Voltaria com certeza"
fev. de 2014,4,OTIMO COMO SEMPRE,"O hotel é excelente, tudo funciona do jeito mais correto possivel para que o atendimento seja de alta qualidade, a relação custo x benefício é o que mais se destaca nessa hotel, pois pela localização e atrativos que o hotel oferecer é uma ótima opção!"
fev. de 2014,4,Excelente localização,"Hospedei-me novamente neste Hotel e mantenho minha avaliação como muito boa. Além da ótima localização os quartos são limpos, confortáveis com excelente climatização. O restaurante é amplo e agradável com ótimo atendimento. Os funcionários foram novamente muito atenciosos e prestativos"
fev. de 2014,4,Uma estadia confortável.,"O Hotel Ibis Botafogo tem um atendimento cordial, bar e restaurante de boa qualidade. Para quem gosta de praticar esportes como caminhada, corrida e cilclismo o hotel fica bem próximo a ciclo via que vai de Botafogo até o Aterro do Flamengo. Onde podemos praticar o esporte apreciando a vista para o Pão de Açúcar. E muito importante, para quem trabalha, possui ferro a vapor. O valor das diárias mantêm o padrão Ibis. Outra facilidade é a proximidade do Shopping Botafogo e do Shopping Rio Sul."
fev. de 2014,4,Bom custo-benefício,"Boa relação custo-benefício no Rio de Janeiro. Instalações novas, bem localizado, com quartos confortáveis, internet sem fio gratuita, e café da manhã relativamente bom. Considerando os elevados valores praticados na cidade, o hotel é uma ótima opção."
fev. de 2014,3,Rio Open,"Para a época, semana pré carnavalesca e Rio Open, conseguimos um preço bom, para uma região tão boa como o bairro de Botafogo. A vista dos quartos esqueça mas são limpinhos tem TV LCD e a cabo, com acesso a SPORTV etc. Ar condicionado muito bom."
fev. de 2014,4,O bom Ibis de sempre.,"O bom Ibis de sempre. Localizado em Botafogo, situa-se, de taxi, a R$ 20,00 da Lapa e a menos do que isto de Copacana. Com aposentos confortáveis e limpos, foi possível ter uma boa estada. Utilizamos o serviço de café da manhã, pago à parte , que classificamos como muito bom. O mesmo podemos dizer do restaurante. Quanto aos serviços de atendimento do hotel, nada de surpreendente, mas bom. Tudo simples, funcional e de relativa qualidade. Pagamos 202,00 por diária, com reserva direta pelo sítio de internet do IBIS/Accor. Recomendamos."
fev. de 2014,5,Novamente uma ótima opção!,"Voltamos ao IBIS Botafogo e novamente fomos muito bem atendidos e o hotel ofereceu toda a estrutura desejada. A localização do hotel é ótima. No jantar o filé de peixe à Fioretina, com batatas, estava apetitoso. Recomendo novamente."
fev. de 2014,4,Boa localização,"Hotel com excelente localização, proximo da estação de metro de Botafogo, proximo tambem de farmacias, supermercados, barzinhos e fast foods. Hotel novo, bem estruturado, quarto amplo, banheiro limpo, televisão com tv a cabo, porem so o que poderia ser melhorado é o Wifi do Hotel que toda hora a conexão falhava. Cafe da manha variado."
fev. de 2014,4,Fora do óbvio,"Excelente hotel da Rede Ibis, com novo lay-out nas áreas do lobby e restaurante. Sua localização também é interessante, próxima ao Shopping Botafogo e do metrô para a Zona Sul, mas fora dos lugares mais procurados pelos turistas, Local bem tranquilo e de fácil acesso."
fev. de 2014,4,Muito Bom,"Hotel novo, bem localizado, a uma quadra do metrô. Ótimo serviço. Instalações padrão IBIS. Perto da orla, com opções de restaurantes por perto. Serviços de taxi a qualquer momento. Quartos ideais para duas pessoas."
fev. de 2014,4,"Ibis novinho, bem localizado","Padrão Ibis, novinho.  Cama gostosa. Bom chuveiro, com boa quantidade de água.  Pertinho (4 quarteirões, acho) do shopping Praia Botafogo. 2 quarteirões do metrô. Perto de cinemas no shopping e de rua.  Região tranquila. Dá para fazer muita coisa a pé, sem perigo aparente.  tomamos o café do Starbucks do shopping, a pedido do meu filho, portanto não posso opinar sobre o café do hotel.  bom custo benefício."
fev. de 2014,5,localizaçao perfeita,"para quem vai fazer turismo no rio de janeiro recomendo este hotel, fica num lugar privilegiadíssimo, paga-se um preço nao muito alto e estará proximo a urca, pao de açucar e bahia de botafogo, alem da praia do flamengo"
fev. de 2014,4,estadia hotel ibis/botafogo,"O atendente confundiu o nosso quarto na reserva 2 x! mas fora isso foi tudo ok, o quarto era um tanto apertado para dormir na cama extra da minha filha.... era um quarto triplo. O que valeu mesmo foi a localização e o café da manhã que é excelente!"
fev. de 2014,4,Confortável,"Gostei bastante das instalações do hotel, principalmente pela sua localização, próximo a mercados, comércio, transportes e principalmente ao metrô. Tudo isto facilitou a minha estada no Rio de Janeiro. Fui muito bem atendido, funcionários educados e bem treinados."
fev. de 2014,4,Muito bom,"Muito bom hotel, bem localizado (próximo ao metrô). Hotel muito limpo e novo, quartos confortáveis e atendentes educados e eficazes. Há restaurante e a comida é muito boa. É o que se espera para uma boa noite de sono. Recomendo."
fev. de 2014,4,Cheiro de novo,"Os hotéis Íbis nunca me decepcionam...  Atendimento padrão, quartos funcionais, camas confortáveis, banheiros pequenos, porém atendem a necessidade básica.  Gostei da localização, no coração de Botafogo.  Voltei sempre."
fev. de 2014,4,Hotel novo e bem localizado,"O hotel fica próximo a vários bares e restaurantes. As instalações são no padrão Ibis, com a vantagem de serem novas, o que aumenta o nível de conforto. Todos os colaboradores são muito atenciosos, e o restaurante é bastante agradável."
fev. de 2014,4,Descanso,"Para quem precisa descansar bem durante as viagens de negócios no centro do Rio de Janeiro, esse é o lugar. Sem muitos itens no Hotel mas com um excelente preço a noite de sono é garantida. O café da manha é agradavel."
fev. de 2014,4,Bom hotel,"Excelente localização, com vários pontos de interesse próximo, local tranquilo, não se pode ouvir o barulho da rua no quarto, tudo bem limpo. Estacionamento terceirizado com manobrista, sendo cobrado R$30,00 o período da diária"
fev. de 2014,4,Melhor custo benefício,"Hospedar-me no Ibis Botafogo foi uma grata surpresa. Hotel novo, tudo muito limpo e organizado, funcionários muito educados e prestativos, especialmente o recepcionista Cristiano, que nos ajudou bastante, dando dicas de onde ir e o que fazer no RJ. Além disso, o hotel é bem localizado, perto de tudo. Gostei bastante."
fev. de 2014,4,Padrão Íbis mas meio escuro,"O Hotel é ótimo, tudo novo, com boas instalações, bom atendimento, bom quarto e bom chuveiro. O café da manhã é bom, mas é pago (Padrão). Além disso, internet e estacionamento também são pagos. O problema é que o local não é um dos melhores mas vale a pena!"
fev. de 2014,3,Hotel econômico com algumas restrições,"O hotel é novo e a limpeza é muito bem feita. Todavia, o quarto é um pouco pequeno e a cama é dura demais, além de o travesseiro ser um pouco desconfortável, o que causou dores nas costas da minha esposa. A vista não é boa (você só enxerga um outro prédio), e o café da manhã que é cobrado a parte não compensa, pois é caro e não é tão variado, apesar de tudo ser de qualidade. Gostei da localização e da segurança."
fev. de 2014,4,Ótimo,"Os quartos são bons, muito bem limpos e organizados. O café da manhã é bem variado com todo tipo de comida, para todos os gostos. Fui muito bem recebida por todos do hotel, voltarei lá quando for a RJ de novo com certeza."
fev. de 2014,5,Agradável,"Conforto, segurança, bom atendimento, com preço justo. Localização ótima. Café da manha com preço bom e ótima variedade. Recepcionistas, staff de higiene e estacionamento gentis e agradáveis. Com certeza vamos vir novamente e trazer a família."
fev. de 2014,4,Melhor dos que os Ibis que já fiquei,"O hotel Ibis de Botafogo foi além das minhas expectativas para um Ibis: super novo, boa comida, bom café da manhã. O quarto era impecável (somente um pouquinho pequeno, mas não sufocante). Bom atendimento."
fev. de 2014,4,Boa Opção,"Bom Hotel para quem busca algo na região de Botafogo/Copacabana.  Hotel novíssimo em folha, com boas acomodações e excelente café.  Preço alto por ser um Ibis, porém abaixo dos preços abusivos do Rio de Janeiro, sem contar que na sua maioria são Hotés velhos, caindo aos pedaços, bem diferente deste novinho em folha IBIS Botafogo.    Obs: para entrar no banheiro tem um degrau imperceptível, que chutei duas vezes e quase quebrei meu dedão.  Será que os arquitetos não pensam nisso? Ponto a melhorar !!"
fev. de 2014,4,Custo Benefício,"O hotel é muito bom, tudo funciona do jeito mais harmonioso para que o atendimento seja de alta qualidade, a relação custo x benefício é o que mais se destaca nessa hotel, pois pela localização e atrativos que o hotel oferecer é uma ótima pedida!!!"
fev. de 2014,5,Hotel novo,"O hotel é novo (inaugurado há cerca de 6 meses, segundo informação de um dos funcionários da recepção) e tudo nele está funcionando muito bem, desde a presteza da equipe no check-in e no check-out – bem como em qualquer outra coisa que o hóspede venha a precisar – até a limpeza e a organização do quarto. O café-da-manhã me surpreendeu positivamente, pois me pareceu um pouco mais variado e melhor preparado do que em outros hotéis da rede em que já me hospedei. Não vi ponto de táxi próximo ao hotel, mas isso não é problema: não tive nenhuma dificuldade para conseguir um, vários passavam a toda hora bem na frente do hotel; ainda existe um funcionário do hotel somente para chamar táxis para os hóspedes, caso estes assim prefiram. Achei Botafogo um bom bairro para ficar hospedado, mostrou-se relativamente perto dos locais mais badalados do Rio, além do preço ser mais atraente. Em resumo, a estadia foi excelente e, retornando ao Rio, certamente me hospedaria de novo por lá."
fev. de 2014,5,Muito Boa,"O serviço da rede como sempre foi muito eficiente. Meu Check-in foi realizado tão logo cheguei, sem nenhuma demora. Ainda fui ofertado com um drink de boas vindas no bar do hotel. Pessoal da recepção muito atencioso. Única ressalva que faço, é que dos três elevadores, um estava parado, provavelmente em pane, e desde o momento em que fiz o meu check-in, até quando voltei do meu quarto para tomar meu drink de boas vindas, e um pouco mais tarde (passada cerca de 1 hora), quando ainda retornei para meu quarto novamente, o elevador continuava parado e não me pareceu haver ninguém providenciando o reparo do mesmo. Foi uma situação que proporcionou um certo embaraço das pessoas aguardando o elevador."
fev. de 2014,4,Custo Benefício,"Ótimo custo benefício. Lógico que é um Íbis como qualquer outro, porém está muito bem localizado. Fica bem próximo da Estação Botafogo de Metro. Neste caso a culpa não é do hotel que o Metro no Rio não vai a muitos lugares, porém, do Maracanã a Ipanema fiz em menos de 30 minutos."
fev. de 2014,5,Atendimento excelente,"Otimo hotel, bem localizado, fácil para pegar taxi, metrô, ônibus. Tem vários restaurantes muito bons ao redor. Um excelente atendimento, por isso nota 5. Tem um preço normal para o padrão do Rio de Janeiro."
fev. de 2014,5,excelente,"Hotel moderno, limpo, funcional, excelente para hospedes que querem conforto e praticidade sem grandes luxos, porém com bom atendimento e localização. Fizemos as refeições no próprio hotel, mais uma das razões que influenciaram na escolha."
fev. de 2014,4,Um Ibis nunca decepciona,"Nunca espere luxo ou tratamento diferenciado num Ibis. O que impressiona é a honestidade dessa cadeia de hotéis. Funcionários simpáticos, boa localização, quartos limpos, cama confortável, banheiro limpo. Tudo isso você encontrará num Ibis. Some-se a isso um preço honesto e um café da manhã razoável, você terá uma noite de sono tranquila. Com certeza Esse é o melhor ibis do Rio de Janeiro."
