Data da opinião,Nota,Título,Conteúdo
dez. de 2016,5,MARAVILHOSO.,"O hotel é muito bem localizado.  Fica na avenida Cristiano Machado, uma das mais importantes da capital e de acesso ao aeroporto internacional de Confins. Tem o Minas Shopping em frente que dá até pra ir a pé.  O atendimento é excelente e rápido. Adorei desde o meu check-in onde o recepcionista me recebeu muito bem e me passou todas as informações. A noite precisei de indicações para comer e fui muito bem atendido pela recepcionista noturna.  O café da manhã é farto e muito gostoso. O local do café é lindo e moderno.  A decoração do hotel é linda os quartos são lindos e confortáveis.  Amei a ducha, a melhor que já usei em toda minha vida. Já me hospedei em muitos hotéis de outras redes e da própria Wyndham até mesmo fora do país. E em nenhum encontrei uma ducha (chuveiro) tão perfeita.  As referências por todo o hotel ao gênio Guimarães Rosa me encantou.  Eu e meus amigos adoramos a hospedagem.  Recomendo o hotel e voltarei sempre que puder."
dez. de 2016,4,muito bom,"gostei do quarto, apenas a falta de armário para pendurar as roupas compromete um pouco mas da pra resolver com os cabides pendurados na parede. Resumindo o hotel é muito bom, o atendimento também muito bom e os funcionarios atendem com simpatia, qualidade e presteza."
dez. de 2016,5,Show,"Prédio novo super conservado, apartamentos muito limpos, modernos e bem decorados além do silêncio com o esquema de abafador de ruidos. Atendimento muito bom. Localizado próximo do Minas Shopping o único ponto ruim é o trânsito pesado na região."
dez. de 2016,5,Ótimo Hotel!,"Adorei a minha estadia no hotel! Para mim a localização foi ótima, o quarto muito confortável, banheiro limpo e muito bom, com secador de cabelo disponível, e café da manhã bom. O atendimento na recepção e café da manhã também foi muito bom. Recomendo do hotel!"
dez. de 2016,2,Ruim,"Entrei no sábado dia 17/12 por volta das 7hs, tive problema no check-in e no check-out, sai por volta das 9hs e retornei por volta das 17 hs, E o quarto não foi limpo, enfim não gostei da estadia, Não voltaria novamente"
dez. de 2016,4,Hotel com bom custo benefício,Muito bom! Acomodações limpas e organizadas. Internet cai o tempo todo. Café da manhã excelente. Localização boa. Estacionamento com bom espaço para veículos médios. Próximo ao Minas Shopping Center. Próximo a bares.
dez. de 2016,5,top dos tops,"continuem assim se manter isso já está excelente, será sempre bom estar neste hotel, boa localização, perto de tudo e com o uber agora fica bem mais facil se locomover em bh, só não precisa desta pesquisa ter tantas perguntas assim para avaloação de hotel"
dez. de 2016,4,satisfeita,"gostei da experiência nesse hotel. novo, com todas as instalações funcionando bem, sem intercorrências. gostaria de ter conseguido fazer o wifi funcionar, o que não consegui. de resto, fui bem atendida."
dez. de 2016,5,Excelente,Muito bom em todos os quesitos. No dia a região ficou sem luz mas foi muito bem avisado e souberam contornar a situação sem maiores prejuízos aos hóspedes. Já fui em outros hotéis dá rede e tem o mesmo padrão
dez. de 2016,5,Muito confortável e excelente localização,"O grande diferencial do Ramada é o conforto. O quarto era ótimo, especialmente a cama. O café da manhã também é muito bom e variado. A localização é muito boa, chegamos rápido ao aeroporto e fica bem próximo ao Extra e Minas Shopping.Voltaríamos sem dúvida!"
dez. de 2016,4,Hospedagem,"Hotel muito agradável, organizado e limpo, com café da manhã muito bom, ótima acomodação.  Recepcionistas muito atenciosos e prontos para auxiliar, super indico.  Minha estadia foi rápida porém tranquila e agradável."
dez. de 2016,4,Ótimo hotel em Belo Horizonte!,"Ótimo hotel e, BH, muito boa localização, café da manha, wi-fi, na frente de um bom shopping e o serviço foi muito bom. No nosso caso que corremos a Volta da Pampulha ficou no meio de caminho e nos ajudou bastante."
dez. de 2016,1,Péssima estadia!,"Fomos em um grupo de 20 pessoas, e não fui eu quem escolhi este hotel. No dia 2/12 cheguei à noite e descobri que não tinha atendimento de jantar nos quartos. Pedi um quarto silencioso e me indicaram o 1316. Começou um barulho de motor muito alto. Desliguei o ar condicionado, mas não adiantou. Ao desligar a geladeira, descobri um monte de poeira. Liguei para a recepção e me disseram que nada podiam fazer, que o hotel estava lotado e que não tinha técnico. No banheiro tinha cabelos no chão, lixeira suja e velha , e o espelho chapiscado de pasta de dente. No outro dia a tarde,não queriam me mudar de quarto, pois afirmaram que o barulho era de uma central de ar condicionado central que fica no corredor e o técnico tinha apenas se esquecido de desligar. Me ofereceram um quarto com cama de solteiro. Eu disse que paguei cama de casal e duplo. Relatei da sujeira do quarto e dos cabelos no banheiro. Depois de muita conversa me trocaram para o quarto 1106. Qual foi minha surpresa quando vi cabelos de hóspedes anteriores neste banheiro também!! Não tinha tapete, o chão sujo. A roupa de cama áspera. Lençol pequeno, sai do colchão. Não existe segurança, qualquer pessoa entra no elevador e vai para os quartos. No domingo dia 04/12, devido a uma forte chuva, acabou a luz no hotel, meu celular não tinha mais bateria, liguei para a recepção para me telefonarem no dia 05/12 às 07:00 h para que eu pudesse me dirigir ao aeroporto. Não telefonaram. (até o telefone é sujo) . Faltam funcionários, falta limpeza, falta segurança ... Evidentemente não volto e nem recomendo."
dez. de 2016,4,Confortável,"Fui a trabalho para Belo Horizonte, e fiquei hospedado neste hotel. Quarto confortavel, serviço bom, assim como um bom café da manhã. Facilidade de estacionamento, assim como de um Shopping Center (Minas Shopping) bem em frente. Recomendo"
dez. de 2016,4,"Cultura, um diferencial","Foi a minha primeira experiência num hotel com viés cultural. Logo após a entrada do complexo tem uma ""calçada cultural"" tive sorte que no dia havia um show de rock interessante, nada que dificulte ao hóspede, sábado à tarde e curta duração.  As instalações são novas, chuveiro e ar-condicionado excelentes. A recepção é limitada então dependendo da ocasião um breve tumulto no check-in ou check-out. Restaurante atende bem e excelente comida. Próximo do VLP, metrô, shopping, comércio etc. Muito interessante: decoração com frases de escritores consagrados."
dez. de 2016,3,Poderia ser melhor,"A princípio pensei que fosse mais organizado. Mas logo no primeiro dia procurei toalhas de banho e não tinha, tive que solicitar. As duas garrafas de água como cortesia não estavam lá.  A limpeza foi tão tarde que eu passei, que sai de manhã voltei bem no fim de tarde e ainda não haviam passado lá, fiquei sem papel higiênico, mas uma vez tive solicita    Quarto sem armário, sem lixeira, TV com poucos canais.    Café da manhã com boas opções de de frutas, sucos e ainda havia água aromatizada, mas com pão de queijo péssimo, duro e sem queijo.    Os funcionários são gentis, tem boa localização e a decoração é legal."
dez. de 2016,3,"Praticidade, mas requer planejamento e treinamento","Um hotel bom que requer um serviço melhor. Estive no hotel em setembro. Tive que esperar um pouco para ser atendida porque apenas um funcionário fazia o atendimento no balcão.  No quarto, não há água nem bebidas, mas elas podem ser adquiridas no lobby do hotel.  Eu me decepcionei um pouco quando encontrei no banheiro, uma calcinha da hóspede anterior o que me deixou um pouco em dúvida quanto à atenção que dão ao processo de check in- check out. De forma educada falei com a recepção e fui prontamente atendida.  O hotel fica junto a um shopping de decoração e também próximo a um shopping maior. No shopping de decoração, uma pessoa consegue ir a pé, para fazer as unhas."
dez. de 2016,5,Recomendo,"Ótimo hotel estilo hostel, funcionários simpáticos e sempre de prontidão.  Quarto atende as expectativas mas por ser estilo hostel é para dormir apenas.  Não há serviço de quarto mas a lanchonete com snacks está 24 horas disponível ao lado da recepção."
nov. de 2016,4,Uma grata escolha em uma viagem de trabalho!,"Estive recentemente no hotel Ramada Encore Minascasa em Belo Horizonte e, em função da rotina de trabalho, a localização dessa vez me era importante. Assim se deu minha escolha pelo hotel.  A localização, em plena Avenida Cristiano Machado mas com uma entrada aprazível, próximo ao Minas Shopping e do MinasCasa Shopping, óbvio, e também de outro importante hotel da cidade.  O café da manhã achei ótimo. Alguns usuários aqui reclamam, de fato, mas penso que em função do tamanho da área de café e das dimensões do hotel, talvez em horário ""de pico"" ou com grande lotação, possa ser um inconveniente, que não passei, felizmente. Há máquina de café espresso, opções de pães e bolos, queijos e outros frios, chás e sucos, etc...  O quarto nos mesmos moldes de hotéis de rede, atualmente: funcionáis e tudo bem organizado!  Merece uma consideração a decoração caprichada, com frases de escritores mineiros salteadas pelas dependências, assim como o andar pintado em perspectiva forçada quando se sai do elevador: muito interessante!  Valeu muito a pena e voltarei outras vezes mais."
nov. de 2016,5,Excelência em serviço,"Hotel design, com linda decoração.  Quarto limpo e muito confortável, com excelente isolamento acústico. Tive uma ótima noite de sono, muito revigorante.  Café da manhã é uma delícia, assim como o buffet de jantar. Muita qualidade nos alimentos. Wi-fi gratuito e de ótima qualidade!  Equipe prestativa e alegre. O hotel é um charme, e tem como tema grandes escritores de Minas, com poesia espalhada por todo local.  Volto e recomendo!"
nov. de 2016,2,Serve para dormir,"Hotel nos mesmos padrões das redes econômicas que proliferam por aí.    Quarto simples e funcional. Nada mais.    Café da manhã ruim. Mesmos defeitos de sempre. Pães velhos, bolos velhos. Funcionários com cara de poucos amigos.    Vale pelo custo benefício, por enquanto. E só para dormir. Mas não olhe para a decoração, pois ela é horrível. As pinturas em vermelho constante no quarto oprimem."
nov. de 2016,4,Ótimo,"Fica exatamente ao lado do Ouro Minas, portanto é possivel se hospedar ai tranquilamente para ir a eventos no Hotel ao lado pagando muuito menos. Limpo, confortavel, tamanho do quarto ok, cama muito boa, cafe da manha bem satifastatorio, atendimento mto bom. Tem um guichê de aluguel de carros da Movida ao lado da recepcao. Nao sei se é algo q ocorre sempre, mas, no periodo em q fiquei, havia um buffet com poucas opcoes, mas bom, à noite, por R$30; carinho pelo q oferecia, mas mto bom para quem nao queria sair do hotel e comer uma janta propriamente dita. Próximo, há uma rua de bares e restaurantes variados e um shopping. A experiencia foi mto boa no geral!"
nov. de 2016,3,Mais ou menos,"Quem já esteve no Ramada Luxemburgo, não espere o mesmo tipo de serviço. Os quartos são confortáveis e o chuveiro é muito bom, mas a estrutura do hotel não atende a quantidade de hóspedes que por aqui transitam. Pegar elevador em horário de pico é um desafio e o café da manhã não atende à rotatividade. Não espere comer de tudo que eles oferecem, pois algumas opções, como panqueca podem não chegar."
nov. de 2016,3,Um hotel meia boca em um bom local.,"Acho que eu fui em outro hotel pelo que vi nas avaliações. Limpo? No dia 4/11 o corredor do quinto andar não estava. Muito menos o banheiro do quarto 502 (cheio de cabelo). Quando eu entrei no quarto não tinha toalha de rosto e tapete de banheiro. Eu havia pedido um quarto silencioso e achei que este não seria o ideal. Pedi a gentileza de ter alternativas e me foram muito solícitos: ofereceram duas alternativas as quais eu não vou comentar. Como é um hotel de bom nível não considerei que as alternativas eram para ser entendidas como: eu tinha recebido o quarto 502 e que ficasse quieto. No final das contas o barulho que eu identifiquei no 502 era decorrente da janela do banheiro mal fechada. A partir dai sem problemas. O quarto é legal. O café da manhã é meia boca (suco tipo artificial - ruim), frutas ok, ovos mexidos plastificados, yogurte legal, pãezinhos legais. Quebrou o galho. No dia 4/11 a janta estava boa (30 reais a vontade). Quando eu sai no dia 7 ainda tinha cabelos de hóspedes anteriores no banheiro. É só passar um aspirador! Há um horário das 18 horas às 19 horas em que as bebidas (pelo menos as cervejas) ficam pela metade do preço normal. Tenho minhas dúvidas quanto aos aspectos de segurança. Está localizado quase na frente do Minas Shopping e o Extra. Mas muito longe do centro. O estacionamento é pago (17 reais/dia)."
nov. de 2016,5,Excelente para ir a eventos no Ouro Minas,"Fui para um congresso que aconteceu no Ouro Minas então a localização foi excelente, pois encontra-se ao lado. O hotel fica dentro do Minas Casa e lá também tem academia em frente (dá três passos e está lá). O local é de fácil acesso para táxi, Uber e ônibus. O Minas Shopping fica logo em frente e tem alguns restaurantes bons no lado contrário. A estrutura do hotel é nova e muito boa. No quarto há lixeira seletiva e itens de amenidades, além de secador e espelho grande. As camas são muito confortáveis e o ambiente do quarto é excelente, inclusive com várias tomadas. Ela possuem banheiro adaptado para cadeirantes. A equipe é bem legal. Indico com certeza.    Percebi que embaixo da cama havia poeira, ou seja, não fizeram uma boa limpeza. A acústica dos quartos não é muito boa e para piorar eu tinha um vizinho de quarto que falava GRITANDO e nos acordava cedo com isto! O café começa às 6h, chegamos no sábado pontualmente neste horário, visto que depois iriamos para rodoviária pegar um ônibus para Ouro Preto. O café não estava todo colocado, saímos às 6:40 de lá e ainda haviam alguns itens faltando.    Apesar de algumas falhas indico com certeza !"
nov. de 2016,5,Muito bom!! Vale muito a pena!,"Fui em um congresso realizado no hotel ouro minas que fica ""colado"" com o hotel Ramada. Ficou super pratico e valeu muito a pena. É próximo de um shopping de médio porte e o acesso aos ponto turísticos também é bom!  O quarto que fiquei é arejado, a cama muito confortável, o chuveiro é sensacional, a água muito gostosa, a pessoa sai relaxada do banho... a colcha da cama muito macia, a TV com todos os canais. No quarto tem geladeira, ar condicionado e TV, além do chuveiro quente.  O café da manha deixou a desejar um pouco... fiquei 4 dias e os 4 dias foi servido a mesma coisa. Nada de extraordinário...  Durante o congresso tive dificuldade para achar restaurantes devido ter muita gente, os que tinham estavam cheios e o hotel possui uma área bem legal caso você compre comida fora, nesse espaço dá para comer. O hotel oferece prato, talher, microondas, copo, gelo... muito legal!!  Tem um shopping ao lado desse hotel que possui uma padaria, que também é muito boa... tipo uma delicatessen, com vários tipos de comida e bebida...  Conclusão: voltaria COM CERTEZA. Os funcionários são muito atenciosos e o hotel é super confortável!! Vale a pena!"
nov. de 2016,4,"Otimo hotel, porem longe do centro","Otimo hotel, com quarto novo, limpo, cama super confortável, bom wifi e bom ar condicionado. Cafe da manhã satisfatório. A localização que deixa a desejar, pois é localizada numa grande avenida de Belo Horizonte, longe do centro. Estacionamento pago no local a parte."
nov. de 2016,5,Hotel muito bom,"Quartos confortáveis e limpos, fiquei hospedada para um congresso que aconteceu no hotel ouro minas e fui surpreendida positivamente, já que além de ser um excelente custo benefício o ramada ainda fica bem próximo do ouro minas (próximo mesmo, da para ir por um caminho por dentro de uma calçada coberta)! O café da manhã tb é bem variado e gostoso!"
nov. de 2016,3,"Hotel novo, mas simples...","Hotel situado dentro do Shopping Minascasa, ao lado do hotel Ourominas. Essa região fica um pouco mais distante dos melhores restaurantes de BH. Hotel novo, quarto amplo e cama grande. Cafeteria de cortesia no quarto. No entanto, a limpeza do piso deixou a desejar. Banheiro bom, mas o chuveiro não tinha muita pressão quando acionava água mais quente. Atendimento razoável. Estacionamento muito bom, no Shopping Minascasa. Café da manhã bom e incluído na diária. Preço bom."
nov. de 2016,4,Bom hotel,"O hotel é limpo, a cama king muito confortável. O quarto tem frigobar porque tem pouco comercio perto e por isso é bom ter no quarto.  O banheiro é limpo mas o tamanho do vaso é apertado para pegar o chuveirinho.  No chuveiro também fica apertado para pessoas altas porque o chuveiro fica muito encostado na torneira."
nov. de 2016,4,Otimo,"Estivemos no Ramada por duas noites. O hotel é novo, apartamento muito bom, banheiros limpos de bom tamanho, cama king muito confortável e com roupa de cama de ótima qualidade. Café da manhã muito bom, bem servido. Fica em uma avenida próxima á saída para o anel rodoviário de BH, longe do centro mas bom para quem deseja visitar a Pampulha e cidades próximas à BH. Tem um shopping center bem próximo do hotel. Um único senão é que quando voltamos as 15:30 h para descansar no hotel, nosso apartamento ainda não havia sido limpo, mas solicitamos a limpeza e foi feita logo após. Em contrapartida, esqueci um item no apartamento e entrei em contato com o mesmo e eles me enviarão pelo correio. Recomento"
nov. de 2016,4,Ótima escolha,"Gostei muito deste hotel, pois apesar de não ser muito luxuoso, atendeu todas as expectativas e não deixou nada a desejar, mesmo tendo passado em um período muito movimentado. Não tenho do que me queixar de nada e retornaria certamente a ele"
nov. de 2016,5,Excelente,"Hotel muito bem localizado, próximo shopping, bancos e ao lado do ourominas. O atendimento na recepção muito bom. Café da manhã bem servido!!! Limpeza e conservação do hotel é muito boa! Para quem vai a negócio o quarto dispõe de bancada e mesa de escritório. Super recomendo o hotel. Voltaria com certeza!!"
nov. de 2016,5,Excelente Custo Benefício,"Quarto e banheiro amplos e limpos. Excelente estadia tivemos, atendimento nota 10, tanto recepção como no restaurante. Localização também muito boa.  Cama é excelente, gigante e confortável. Banheiro grande sem banheira(eu prefiro), ducha muito boa. Com certeza voltaríamos nos hospedar nesse hotel."
nov. de 2016,5,Excelente hotel!!,"O Hotel Ramada Encore é excelente, tem uma ótima localização, fica ao lado do Minas Casa, e em frente ao Minas Shopping. O atendimento é excelente, os quartos são muito limpos e o café da manhã é bastante farto!! O hotel tem uma ótima localização!!"
out. de 2016,4,Muito bom!!!!,"Hotel é muito bom. Quarto e banheiro com limpeza impecável, atendimento da recepção foi bom, apesar de notarmos alguns problemas com clientes nos dois dias que ficamos hospedados. Pelo que notamos nos 3 casos foram reservas que não foram feitas de acordo com o solicitado. Enfim, para nós foi tudo de bom!"
out. de 2016,4,Hopedagem com conforto e simpatia,"Hotel bem localizado em Belo Horizonte, perto de paradas de ônibus, VLT e taxi na porta. Próximo a um shopping, supermercado, restaurantes e bares. Com boa comodidade, a cortesia dos funcionários, limpeza e presteza são destaque no hotel. Bom café da manha e buffet satisfatoriamente agradável como opção no almoço ou jantar. Recomendo tanto para lazer quanto para negócios."
out. de 2016,1,Horrível e decepcionante!!!,"A reserva foi para quarto de casal e quando chegamos fomos acomodados (sem qualquer explicação) em quarto para portador de necessidade especial, o uso da área de banho foi estressante e inadequada. Questionamos na recepção e a explicação não foi clara e não houve nenhum interesse em solucionar a situação. PESADELO!!!"
out. de 2016,4,Final de semana em BH,"Hotel novo, com estrutura moderna e bastante organiza. Fácil localização e o atendimento excelente. Porém o estacionamento é pago.  Ótima relação custo benefício, além do conforto do Hotel, que é difícil de encontrar nessa estrutura pelo preço encontrado."
out. de 2016,3,"Tinha tudo para ser excelente, mas...","O Ramada tinha tudo para ser excelente, mas não é bem assim...    Pontos positivos:  . Localização na região que está  . Quarto amplo  . Cama confortável  . Banheiro razoável (tamanho ok com bom chuveiro)  . Sistema de compra de frigobar na recepção (deixa tudo mais prático)  . TV e ar condicionado em pleno funcionamento (e de excelente qualidade)  . Rapidez nos elevadores  . Bom secador de cabelos  . Água quente na pia  . Bons espelhos (quarto e banheiro)  . Mimo de café e chá nos quartos com chaleira  . Bom armário e um ligar legal com cabides fora do armário para colocar roupa.  . Espelho de maquiagem no banheiro    Pontos negativos:  . O Staff é atencioso. Mas por duas vezes tivemos problemas nas reservas. E a reserva feita pela hoteis.com custou a ser localizada.  . Cartão desmagnetiza com facilidade  . Sistema de estacionamento terrível (você tem que entrar no shopping Minas Casa para validar o estacionamento que sempre dá problema pra sair).  . Não existe limpeza nos quartos. A cama é arrumada, apenas. O lixo não é retirado. Sempre existem uns cabelos alienígenas no quarto (sou loira e vi muitos fios escuros pelo chão do banheiro após minhas saídas). Rolou um nojo, mas deixava a água correr pra levar. Tomei banho de chinelo por isso. Ah... os fios estavam no box.  . Deixei os talheres sujos do sistema de frigobar que elogiei ali em cima no quarto e eles não foram recolhidos.  . Barulho nos corredores (não sei se de hóspedes ou de funcionarios)  . Em um dos dias o corredor cheirava lixo. Deve ter sido horário... não sei informar.  . Não repõem o mimo lá de cima. É só o que está lá e acabou.    Acho que é isso..."
out. de 2016,5,Hotel bem localizado,"Hotel muito bom, pra mim que queria algo mais próximo do local do evento, ficar hospedada nesse hotel foi bem comodo! Porém ele fica próximo ao centro de Bh também, possibilitando a ida em bastantes lugares."
out. de 2016,4,Hotel muito bom,"Hotel novo, quartos amplos, decoração clean, cama confortável e excelente custo beneficio. Bom café da manhã e atendimento. O hotel está situado no espaço do Shopping Minas Casa e nas quinta-feiras tem um Happy Hour muito agradável no entorno com música ao vivo. O hotel também fica a poucos metros da Rua Alberto Cintra, um point de muitos bares e restaurantes bem movimentados da cidade."
out. de 2016,5,Maravilhoso,"A estrutura, o atendimento, as refeições, tudo ótimo! Equipe bem solícita. A melhor cama que já dormi em hotéis. Fora que às quintas o hotel promove a ""calçada cultural"", que fica dentro da estrutura do hotel, com food trucks e música de qualidade, sem precisar sair do hotel. Maravilhoso!"
out. de 2016,4,Bem localizado e com bom nível de conforto,"* O check-in foi bem rápido e educado, a recepção é ampla e bem arejada, e conta com itens para levar para o quarto, também tem um balcão da Movida, e todas as vezes que loquei um carro básico levei um superior, por não ter disponível o reservado;  * O quarto tem uma cama de casal, ou duas de solteiro, uma bancada com mais ou menos 2m de comprimento, armário sem porta, e uma cadeira, além do frigobar, bem arejado pelo tamanho da janela, e bem limpo;  * O banheiro é limpo, e com tamanho agradável;  * Café da manhã, tem uma variedade de frutas, pães e líquidos razoável, normalmente é cheio o local, que na minha opinião é pequena, levando em consideração o tamanho do Hotel;  * O hotel ainda serve almoço e jantar a parte, o que é bom, pois pode se jantar a noite no hotel mesmo.    Custo/benefício = bom"
out. de 2016,4,"Muito bom, mas precisa melhorar um pouco mais (crítica construtiva)","Pontos positivos:  Ótima localização. Tem uma padaria no shopping Minascasa (anexo ao hotel) que oferece ótimas opções para lanche e jantar. Os quartos de fundo são muito tranquilos. O hotel possui janela antirruído. Quarto confortável, não obstante o fato de ser pequeno. Visual muito agradável na parte interna do hotel. Estacionamento coberto com acesso direto aos quartos pelo elevador Ótima relação custo benefício.    Pontos negativos:  O café da manhã poderia ser melhor. Os alimentos ofertados sempre são os mesmos todos os dias. Para quem se hospeda por vários dias torna-se repetitivo tomar o mesmo café todos os dias. O cano do chuveiro é bem próximo da parede. Durante o banho torna-se um incômodo, já que o cotovelo esbarra com facilidade na torneira que controla a água. As chaves se desmagnetizam com facilidade. Necessidade de procurar a recepção pra magnetizar e conseguir ter acesso ao apartamento. Demora em realizar a arrumação do quarto. Mesmo liberando o apartamento bem cedo durante a manhã, a arrumação só é feita no final da tarde. Esse serviço poderia ser mais eficiente, já que durante a semana em que me hospedei o hotel não estava tão cheio.    Conclusão: As falhas descritas podem ser corrigidas. Voltaria a me hospedar neste hotel."
