Data da opinião,Nota,Título,Conteúdo
jan. de 2015,4,Muito bom,"É muito bem localizado, em frente a barraca Toa Toa.  É bem limpo, o atendimento é muito bom, bem conservado.  Achei que valeu muito a pena, pretendo voltar em breve e levar meus pais, pois é um hotel bem família, não tem bagunça de adolescentes em grupos."
jan. de 2015,5,"BOM HOTEL, ÓTIMA LOCALIZAÇÃO","O hotel fica bem em frente à barraca Toa toa.  A estrutura em si é boa, bem cuidada. Não é um hotel com instalações modernas. As portas e os guarda roupas são daqueles com cor de madeira escura, mas é tudo muito limpo e bem cuidado.  A piscina também é muito boa, com o rapaz da animação bem simpático.  Os atendentes também são muito simpáticos e prestativos.  O jantar e o café da manhã também são muito bons e variados.  Realmente o rapaz que se apresenta com o violão poderia ser melhor. Ele coloca um fundo das músicas com os outros instrumentos e fica tentando fazer uns solos no violão fora de nota o tempo todo e errando as letras das músicas. Ele também poderia tocar somente até umas 20h no máximo e não 21h...  Recomendo."
jan. de 2015,4,Quase excelente,"Estive hospedado no início desse ano (2015). Fiquei em um quarto muito confortável longe da piscina o que proporcionou a mim e minha família a possibilidade de descansar sem o som, tanto da piscina do hotel, como da praia. Não fosse o barulho do ar condicionado um pouco acima do normal, teria sido perfeito. Funcionários muito atenciosos, educados e prestativos. Ambientes muito limpos, porém formigas incomodam um pouco. Excelente café da manhã, almoço à la carte muito bom com preço honesto, já no jantar, pelo preço cobrado, poderia ter mais opções, visto ser self service. Tem ótima localização e fácil locomoção para outras praias. Recomendo e voltaria sem problemas!"
jan. de 2015,4,Melhorar em alguns aspectos,"Ficamos em um quarto em frente a piscina, o quarto era grande e a limpeza excelente. Os preços do restaurante e bar da piscina são super acessíveis, o buffet por quilo compensa muito, mas uma variação quanto aos pratos seria legal, o café da manhã é bom, mas também poderia melhorar, não achei tão farto e diverso quanto à outros hotéis e pousadas que já me hospedei.  A localização é excelente, os ônibus que levam à balsa (travessia para Arraial, Trancoso, Praia do Espelho), ao centro e passarela do álcool passam na frente do hotel, e com isso economizamos fazendo os passeio por nossa conta.  A recepção foi nossa decepção, não pelos funcionários que sempre procuravam fazer o que estava ao seu alcance, mas pelo número de funcionários insuficiente para atender à todos, em todos os dias víamos somente um funcionário na recepção, sobrecarregado, fazendo o possível, pois não dava conta de atender à solicitação de tanta gente, achamos isso um absurdo."
jan. de 2015,3,Pra quem quer agitação,"O hotel é bem grande, em frente a Barraca Tô a Toa. Fui em novembro de 2014 e já estava bem cheio. O Ponto positivo é certamente o Bar da piscina, serve refeições e drinks bem elaborados a um preço justo.  Os quartos do fundo para a mata tinha muito pernelongos, o staff do hotel passava inseticida aerosol mas nao era suficiente. Só consegui dormir após comprar um repelente eletríco.  O som do bar da piscina vai até 22h, fica impossível tirar um cochilo até este horário."
jan. de 2015,4,Hotel muito bom,"A localização é ótima, em frente à praia e a barraca Toa-Toa. A limpeza dos quartos é boa. A área de lazer com piscinas é excelente, deixou a desejar na limpeza da piscina, pois estava suja (às 12h). A recepção poderia fornecer mais informações sobre as facilidades do hotel, mas o atendimento foi simpático."
jan. de 2015,5,Ótimo Hotel,"Além da ótima localização conta com uma culinária ímpar, uma ótima área de Lazer e acesso fácil e rápido a praia, acomodações muito boas para uma ótima estadia em Porto Seguro, toda essa bonança deveria vir acompanhada de um preço um pouco salgado, a diária não é muito barata porém valhe a pena pagar um pouco mais e se hospedar bem, recomendadadissimo.    Obrigado."
jan. de 2015,4,Wagner Ferreira,"O Hotel é muito bom. A limpeza dos quartos é feita diariamente e bem feita. O serviço de quarto e do bar também é rápido e os garçons são todos gentis. Destaco o garçon Vanrlei (Van). Camarada muito simpático e prestativo e faz um coquetel fino. O ponto negativo, fica para o piso ao redor da piscina. Muito escorregadio. Vi várias crianças caindo e tive que ficar cuidando de minha filhinha o tempo todo para ela não escorregar e machucar. Isso tem que ser corrigido antes que alguém se machuque seriamente."
jan. de 2015,3,Razoavel,"Café da manhã: bom mas com poucas variedades  LImpeza: bom  Restaurante: a la carte no almoço e por kg na janta.... razoavel  Atendimento: camareiras mal humoradas, recepção ok, garçons ok, gerente ok... porém se pedir alguma coisa pra beber ou comer na piscina.... demora muiiiito.... levou 2:30 pra chegar 04 sanduiches... e veio faltando 01 ainda.... melhor ir buscar no bar as bebidas que demora menos.  Quartos: bom, travesseiros ruins, chuveiro bom, secador de cabelo ruim, toalhas de banho ruins (velhas, desgastadas)  Piscina bom, lazer bom  Muitos quartos ainda tem o ar-condicionado velho (de trator).... verifique antes e peça a troca do apto."
jan. de 2015,4,"Hotel confortável, pessoal muito atencioso. Bom para ir com a família!","Boa localização. Ponto de ônibus em frente. Ótimas piscinas com sombra para as crianças. Restaurante muito bom e pessoal muito atencioso. Boa estrutura. Como sugestão, poderia haver maior diversidades de atrações no hotel a noite, pra quem está com a família e não quer o agito da cidade. Poderia haver mais coisas no frigobar também, pois não é permitido usar o frigobar para guardar outras coisas (o que complica quando estamos com bebês pequenos, como foi o nosso caso) e o hotel só fornece água em seu frigobar. Mas no geral foi uma boa experiência."
jan. de 2015,3,Bom Custo Benefício,"A localização beira mar, em frente à Praia de Taperapuan é muito boa.O café da manhã é repetitivo e a parte de lácteos oferecidos é simplesmente péssima. Não há nada diet ou light para oferecer aos diabéticos ou hospedes em controle alimentar. A comida a quilo é cara e no que tange a frutos do mar é simplesmente horrível e cara. Os apartamentos são limpos, porém apertados e simples.Os funcionários não são muito atenciosos, melhor dizendo, talvez desmotivados por baixos salários ou carga excessiva de trabalho, ou quem sabe até por despreparo funcional. As piscinas são relativamente limpas, no entanto, encontrei detritos inoportunos na água. Hospedei-me com a família no início deste janeiro. Foi meu retorno a Porto Seguro depois de 9 anos. Penso que não voltarei mais em virtude de bem melhores opções que encontrei nos hoteis e resorts do litoral norte, a exemplo de Praia do Forte e Costa do Sauípe."
jan. de 2015,4,Muito bom hotel de praia,"Hotel confortável com instalações bem cuidadas. A maioria de seus funcionários é atenciosa e simpática, mas o serviço é lento. No quesito alimentação, o café da manhã é bom - a tapioca feita na hora é uma delícia - o hotel oferece ainda almoço à la carte e jantar em sistema de buffet - ambos pagos a parte. A comida é simples e o sabor também. Os quartos dos fundos são mais silenciosos. Quanto a localização, ele está em frente a Barraca Toa à Toa muito badalada na região. A praia tem águas calmas e fica lotada.  Apesar de constar como um dos primeiros hotéis de Porto seguro com recreação infantil, achei muito fraca, já que possuía apenas um monitor que promovia algumas brincadeiras na piscina. A noite no bar da piscina, um ""showzinho"" de música ao vivo com um cantor da região, diverte os adultos.  No período em que estive no hotel, não dei muita sorte com relação aos hóspedes que aparentemente não possuíam o hábito de hospedar-se a julgar pelo comportamento dos mesmos."
jan. de 2015,5,Otimo atendimento e comida maravilhosa!,"Olá amigos conheço vários hotéis em porto seguro até resorts, mas nenhum deles tem um atendimento tão bom quanto o Brisa da Praia, além da localização privilegiada, a comida é maravilhosa.... Parabéns super recomendo.  Kelly"
jan. de 2015,4,Muito bom,"Bem localizado, café da manhã regular, boa opção e custo benefício. Mas evitem quartos próximos da piscina, se o hotel tiver cheio fazem muito barulho, mas o wi-fi funciona apenas próximo da piscina. E existem quartos com portas ligadas a outros quartos (mas fechada a porta) porém se poder ouvir toda conversa do quarto vizinho e vice-versa."
jan. de 2015,5,Sensacional,"Simplesmente o melhor custo benefício de Porto Seguro... Já fiquei pelo menos umas 10x e cada vez que volto, minha surpresa positiva só aumenta... Da recepção as camareiras um atendimento impecável... Excelente comida... Indico muito para casais e familias!!!"
jan. de 2015,5,O melhor hotel de Porto Seguro,"Recomendo esse hotel para sua viagem se tornar perfeita. Ótima localização, limpeza, café da manhã, recepção. ... apartamentos com ótimo conforto. Sempre fico no Brisa, posso afirmar que é a melhor opção em Porto Seguro."
jan. de 2015,3,Razoável,"Essa e a palavra que define o hotel, pois é INADMISSÍVEL vc não ter o controle do ar condicionado de seu quarto , precisando pedir a recepção para que venha mudar a temperatura , o quarto e o banheiro são pequenos (Standard) e em dias de shows o som alto da barraca toa toa e dos veículos incomodam , o café da manhã tem poucas variedades. A limpeza é boa e o atendimento também mas não merece a classificação de 4 estrelas. Existem melhores opções em Porto Seguro pelo mesmo preço."
jan. de 2015,5,Ótimo!,"Gostaria de deixar registrado os dias maravilhosos que passamos neste hotel, nos sentimos em casa.Tudo cuidado com muito zelo, com um ótimo café da manha e um jantar com grande variedade. Quero agradecer ao pessoal que trabalha no hotel, em especial os garcons da piscina Maria, Sério, Van e Luciana e os funcionarios da recepção Ailque e Rafael. As camareiras são muito caprichosas na hora de arrumar o quarto, com toalhas e roupas de cama sempre limpas. Possui um recreador capaz de animar a todos com as suas atividades. Recomendo este hotel, pois além de ter uma ótima estrutura e funcionarios competentes e atenciosos, tem tambem uma boa localização que nos permite conhecer todos os lugares belos de porto seguro."
jan. de 2015,2,Ruim,"O hotel não disponibiliza o controle do ar condicionado, precisa interfonar na recepção ai o atendente vem até o quarto e muda a temperatura . Teve dias q não trocaram as toalhas do quarto. Quarto pequeno cheio de pernilongos, café da manhã com poucas opções considerando um hotel 4 estrelas achei o pior q fui até hoje."
jan. de 2015,4,"Confortável, bem localizado e seguro.","Ir para o Brisa da Praia é sinônimo que você não se preocupará com muitas coisas lá.    Prós: Em termos de localização, acredito que é um dos melhores pois fica em frente a barraca do Toa Toa, localizado na praia do Mundai, está mais perto do centro que os outros hoteis da categoria. O hotel parece novo ou recém reformado e, em todos os detalhes, ele está bem conservado. Os quartos são muito confortáveis e novos, cama boa, roupa de cama limpa, banheiro bom, cofre no quarto, ar condicionado split funcionando bem, muitos armários, bancadas e espaços pra guardar as coisa, nada de mofo ou algo parecido. Bom sinal de wifi nos quartos e áreas de uso comum. Os funcionários são atenciosos e prestativos. O café da manhã completo inclusive com tapioca. A piscina é bem grande com uma área ao seu redor também muito boa.    Contras: Como a maioria dos quartos estão com vista para a piscina, tome cuidado. Se quer privacidade ou menos barulho prefira os quartos do fundo e no segundo andar. Em alta temporada eles contratam músicos locais que fazem shows na área da piscina das 19h00 até as 21h00 mais ou menos. O som é bem alto e dá pra se ouvir do quarto. O hotel não tem quartos com vista para o mar. Outra coisa, a piscina de adultos é sempre funda, cerca de 1,40m não tendo desnível. Falta tomadas no quarto principalmente perto das camas.    O saldo do hotel foi bastante positivo. Descansamos bem em um hotel bastante confortável e bem localizado. Estamos satisfeitos e voltaríamos lá."
jan. de 2015,5,Maravilhoso,Hotel maravilhoso em frente a praia e do local toatoa é só atravessar. Café da manhã super diversificado com varios itens gostosos. Quartos otimos com varanda interna e xom vistas para a piscina. Amplo estacionamento para quem aluga carro na cidade. Tudo de bom
jan. de 2015,5,Dez em atendimento,"Atendimento nota dez dos funcionários em todo lugar do hotel. Conheci o gerente Daniel que nos atendeu prontamente a uma solicitação de troca de aposentos, por causa da internet. Atividades na piscina, música ao vivo à tardinha, ônibus, taxi, vans na porta do Hotel. Hotel hiper limpo em todas as áreas. Inclusive a piscina e torno dela todos os dias. Refeições maravilhosas, mas salgadas no preço. Mas valeu, recomendo."
jan. de 2015,5,Hotel Maravilhoso,"Fiquei hospedada no Brisa no dia 19/12 ate o dia 26/12 o que falar?  Hotel perfeito uma estrutura maravilhosa,em frente a praia, quartos limpos todos os dias , cafe da manhã com muitas variedades deliciosas,hotel bem localizado perto de restaurantes, bares, lanchonetes, passa onibus ou vans em frente ao hotel, o hotel oferecem pacotes de passeios muitos baratos, funcionarios muito eduacados e simpaticos concerteza irei voltar e me hospedar novamente no brisa...  Agradeço pela gentileza de todos os funcionarios por te me proporcionado momentos maravilhosos que jamais vou esquecer ...."
dez. de 2014,3,Um hotel popular,"Primeiro vamos aos elogios:e'frente a praia ,ao lado da famosa barraca Toatoa,com boa estrutura de construção e conservação de moveis,piso frio e boas roupas-de-cama;porem,ao se viver o hotel,aparecem seus pés de barro.Som alto na piscina que incomoda os hospedes;cobram por toalha de praia 1.50 reais;a piscina muito usada pelos hospedes estava suja e ficou assim mesmo apos nossa reclamação;musica ao vivo de mentira com play-back de péssimo gosto pra nos mas de apelo popular[leco-leco e afins]. Enfim,e' um hotel pra se dormir e nao pra se ficar muito tempo la dentro.Com a infinidade de praias e barracas da região e' um desperdiço ficar num lugar so'."
dez. de 2014,5,Excelente Hotel,"Excelente hotel para se hospedar com a família. Tudo de ótima qualidade, sem falar custo beneficio. Ótima localização, frente a orla e praia maravilhosa, com ótimo atendimento nas barracas de praia em frente ao hotel."
dez. de 2014,5,Excelente!!!,"Estivemos no Hotel Brisa da Praia no ano de 2008. Foi uma experiencia incrível. O hotel é ótimo em tudo, não deixa a desejar em absolutamente nada!!! Infraestrutura e atendimento aos hóspedes de excelente qualidade. Comida bem variada!!! Amamos e voltaremos tranquilamente!!!"
dez. de 2014,4,Excelente Hotel,"Hotel super agradável e confortável.Todos os apartamentos estão sendo reformados.Conta  com sauna e uma piscina adulto e uma infantil que são limpas todos os dias .O hotel tem um restaurante que serve almoço a la carte e jantar a kg com comida boa.Café da manhã farto com frutas,bolos,queijos e tapiocas.Limpeza do apartamento foi feita todos os dias.Tem aluguel  de buggy no hotel pelo pessoal do Banana Buggy Indico Brisa da Praia sempre e com certeza quando voltar em Porto Seguro quero me hospedar nesse hotel novamente."
dez. de 2014,5,Maravilhoso!!!!,"Ótimo hotel.... tudo que é preciso para se divertir. .. ônibus em frente ao hotel.... um segredinho para quem gosta de aproveitar o passeio sem precisar contar com o ônibus da cvc.... pegue o ônibus para passarella do álcool e divirta se .... jante no centro que é mais em conta e com mais variedades.... compre seus passeios como recifes de fora nos agentes do centro é muito mais barato... tipo 70% mais em conta... e na noite de festa do toa toa fique com suas cadeiras no patio da frente do hotel e procure pelo vendedor de capeta ""fala professor"" .... ele serve capeta como ninguém. ... depois aproveite a festa que é bem na frente.... da pra se passar um pouco na bebida.... e não perca a festa Transilvânia. .... a melhor....  Com certeza a melhor escolha de hotel.... É acordar e ir colocar o pé na areia. ....  Equipe muito bem treinada....  Aventura se e va pro centro de ônibus. ...  Recomendo demais........"
dez. de 2014,4,Um Ótimo Hotel,"Fiquei hospedada 4 dias. Tive um ótimo atendimento. A recepção é 24 horas, com bastante informação sobre os lugares turistícos. A limpeza dos quartos foi feita todos os dias. Excelente café da manhã.  Pontos negativos:  Pedimos uma pizza na lanchonete da piscina. Ela era daquelas congeladas, com recheio escasso e seca;  A ducha do quarto era com muita pressão e pouca saída de água;  O cantor de sábado cantava mal.. rsrsrsrsrsrs    Mas esses pontos não atrapalharam a estádia. Viajei com 2 amigas e adorei! O hotel também é muito indicado para familias . É tranquilo e com opções de lazer diversas. Além de ser LINDO!"
dez. de 2014,5,Melhores dias em Porto Seguro,"Eu adorei o hotel, além de ser super confortável, é moderno, aconchegante, muito bom todos os serviços prestados, café da manha, limpeza do quarta e dos ambientes comuns.  Apesar de ter viajado com amigas e ser solteira, achei um hotel que atende tanto ao tipo publico de solteiros quanto os que vão com as famílias. Aérea de recreação e jardins lindíssimos e bem cuidados e encantada com a atenção e presteza do pessoal da recepção."
dez. de 2014,5,Viagem perfeita!!!,"Fiquei hospedada no Brisa da Praia esse ano, e realmente adorei o hotel, os atendentes, os quartos limpos e o pessoal muito solicito..  Tudo que precisamos estavam sempre prontos para nos atender..  a Localização do hotel não tem melhor, bem em frente ao Tô-a-tôa..  excelente para famílias, para turma de amigos e para casais tbm..  Super indico o Brisa da praia..  Lugar gostoso, a gente se sente completamente em casa..  voltarei mil vezes se possivel...."
dez. de 2014,5,Maravilha de lugar,"Confortavel primeiramente ,depois a vista que ele proporciona é simplesmente a melhor que ja vi  atendimento muito bom ,tenho certeza que vão adorar pois foi a terceira vez que me hospedei e em todas as vezes fui tratada da melhor forma possivel,vale e muito a pena conferir."
dez. de 2014,5,Muito Bom!,"Adorei o hotel, ótima localização em frente ao complexo de laser Tôa Tôa.  O café da manhã maravilhoso, e quando se fala de lazer o hotel ganha de muitos por ali com diversas piscinas e toboáguas para as crianças se divertirem e possui atendimento na aérea de laser bem ligeiro."
dez. de 2014,3,"Atendimento muito bom mas, o hotel precisa de melhorias","O atendimento, localização e a estrutura do hotel é muito boa porém, na minha opinião precisa de melhorar algumas questões tipo: Baby copa (é pequeno, só tem um micro ondas e uma pia, não tem água filtrada para fazer a mamadeira, precisei comprar água mineral e sempre que precisa usar tem que pedir a chave na recepção); Não tem fraldário(para trocar meu bebê tinha que subir pro quarto); o café da manhã não é tão farto e sempre tinha uma fila enorme pra servir, em contar com a fila da tapioca; o restaurante é caro e sem variedade; piso da área da piscina escorregadio (levei um tombo e por sorte não estava com meu bebê no colo); não tem rampa de acesso para o segundo andar o que dificulta transitar com o carrinho de bebê."
dez. de 2014,5,Excelente !,"Excelente localização de frente ao Complexo de lazer Toa a Toa, boa área de lazer principalmente para crianças com diversos brinquedos. Atendimento atencioso, rápido e gentil, limpeza dos quartos bem eficiente."
dez. de 2014,5,Espetacular! Top,"Ótimo atendimento, todos funcionários sempre cumprimentam ao passar.  Área de lazer ótima, até com palco com shows. Toboáguas para crianças.  Restaurante lindo, se da água na boca só da apresentação dos pratos. Fora os coquetéis que tem uma decoração para cada."
dez. de 2014,5,A melhor opção!,"O Hotel que parece com a sua casa. O Brisa da Praia tem uma localização privilegiada, em frente ao mar e à poucos passos do centro de lazer Toa Toa. Hotel confortável, com funcionários mais que atenciosos, não sabem o que fazer a mais para nos agradar. Acomodações amplas e arejadas. Piscinas boas, sempre bem limpas e para todas as idades. Café da manhã farto. Vale a pena se hospedar no Brisa da Praia quando for a Porto Seguro. Super Indico!"
dez. de 2014,5,Super recomendo!,"Por 2x já me hospedei no Brisa e não tenho como não fazer elogios... Ótimo atendimento, super bem localizado na praia de Taperapuan, próximo às barracas Tôa Tôa e Axé Moi, supermercados, farmácias, bares e restaurantes.  Quarto confortável, tudo muito limpo, moderno e organizado.  O café da manhã é perfeito, muita variedade.... Típico da região!"
dez. de 2014,3,Precisa de melhoras.,"O Hotel em si é muito bom, as refeições do bar da piscina tem um preço ate que acessível se comparado a outros hoteis, porem o jantar tem um preço altíssimo o que achei abusivo ate por não ter tantas opções a serem servidas. Jantar no restaurante fica sem possibilidade pelo valor o que torna desconfortável a situação, pois quem conhece a praia de Taperapuã sabe que não é facil achar um local proximo ali para se ir a noite.    Precisei de uma ligação para uma farmacia durante a noite, o que não fui atendida. O rapaz da recepção disse que procuraria o telefone e não me retornou mais.    O controle da TV não funcionou, levei ate a recepção para solucionarem porem sai do hotel sem o controle da TV de volta, fiquei sem ele durante a estadia.    A piscina tem um cheiro ruim, assim como a água do banheiro. E o piso em volta é super escorregadio.    O quarto é bem limpo e super aconchegante.    Tive que sair do quarto as 16 horas, meu voo era as 22 então achei um pouco desconfortável ter que esperar na recepção.    As garçonetes da piscina só atendem as mesas próximas, se você sentou em um lugar mais distante, esqueça! você tera que se levantar e ir ate la fazer o pedido no balcão.    O monitor da area da piscina tambem não gostei, ele estava ali para animar e dar aulas de dança, porém a unica coisa que ele fazia era trocar de musica no meio dela, não deixava tocar completa e repetia a mesma musica umas 15 vezes ao dia. E ainda tentava cantar no microfone em cima da musica que tocava. Achei desconfortavel. Fiz uma reclamação na recepção e depois disso melhorou um pouco.    A localização do hotel é otima, de frente o toa toa."
dez. de 2014,3,Hotel razoável com excelente atendimento.,"Um bom hotel. Recepcionistas atenciosos e prontos para atender ( nota dez para Cristiano).    Comida de preço razoável na piscina, mas cara no self-service.    Piscina um pouco salgada (?) e piso ao redor bastante escorregadio.  Estranhamos o cheiro e aspecto da agua (banheiros e piscina)    Excelente localização (em frente Toa Toa) com facilidade de taxi e ônibus na porta.    O primeiro quarto que recebemos era bastante velho e com cheiro muito ruim. Solicitamos a troca e fomos atendidos prontamente( por Cristiano).    O nosso vôo era as 4 horas da manhã e infelizmente solicitaram nossa saída do quarto as 20 horas, o que foi extremamente incomodo (nem agua foi possivel conseguir), pois após as 10 hrs tudo fecha no hotel.    Mas valeu a semana."
dez. de 2014,3,Precisa de melhorias,"Hotel tem uma boa área, porem necessita de melhorias em sua estrutura.Muito boa para casais com crianças, porem com ressalvas, piso ao lado das piscinas escorregadio, onde vimos alguns tombos, falta monitores para cuidarem desse espaço.Quanto ao quarto, infelizmente fiquei em um com muitos problemas, água do chuveiro não esquentava fácil (para criança), ar condicionado sem o controle, tv pega poucos canais da Sky, que caem sempre e telefone mudo, por pelo menos um dia inteiro.Por outro lado, alguns funcionários muito prestativos, como o Rafael (recepção), Roberta e Maria (piscinas) e o gerente Elder, muito prestativo e resolve os problemas.Bem em frente ao Toa a toa, que nesta época esta calmo, porém as praias de frente e perto, não são boas para banho(escuras).Para o café é simples, e almoço e janta são caros.Resumindo, um hotel que tem tudo pra ser ótimo, mas faltam alguns acertos."
dez. de 2014,3,Brisa da praia,"Hotel é bom, mas tem uns quartos nos fundos que cheirava a mofo, com uma cama de casal no meio do quarto. A parte que fica a piscina é legal, no final da tarde alguém cantava músicas sem se aché, que eu particularmente adorei.o local também é bem localizado."
dez. de 2014,4,Confortavel,"O hotel tem uma ótima estrutura, muito bonito. Porém eu fiquei num quarto com uma porta para outro quarto. Alguns hospedes fumantes estavam no outro quarto. Nós estávamos sentindo todo o cheiro do cigarro e o barulho que os hospedes faziam. Porém pedimos para trocar de quarto e fomos atendidos. O hotel é muito bom, mais gostei mais do Sued´s, comida melhor, atendimento melhor, café da manhã excelente."
dez. de 2014,4,Recomendo,"Otimo atendimento, boa localização, boa higiene, qualidade na comida. Só não recomendo conjugado pra quem ficar sozinho no quarto, porém, logo que pedi a troca, me atenderam prontamente. Enfim, adorei e recomendo!"
