Data da opinião,Nota,Título,Conteúdo
uma avaliação Ontem,5,Memorável,Gostaria de agradecer a toda equipe do hotel pela experiência diferenciada. Destaque para a vista do nosso quarto para a Esplanada e para a piscina coberta. Um agradecimento especial ao gerente Leonardo!
21 de dez.,5,Dias de descanso e conforto,"Acomodações com excelente conforto e atendimento. Café da manhã maravilhoso. Piscina aquecida fez toda diferença. Possibilidade de ir de carro, segurança ao chegar e sair. Funcionários gentis e prestativos."
10 de dez.,1,Despertado com sirenes de incêndio,"Em pleno sábado, por volta das 10h o hotel decidiu testar as sirenes de alerta de incêndio com um barulho ensurdecedor. Não possibilitando que o cliente que pagou caro pela hospedagem tenha o direito de descansar. Além do café manhã que não tem qualidade. O pior é reclamar com o gerente e os funcionários e eles desdenharem, tentando nos fazer engolir que isso é normal."
nov. de 2022,5,ótima,"Atendimento em todos os setores foi ótimo. idem para acomodações, cafe. etc. Auxilio externo com taxi, também muito bom. Serviço de restaurante , da mesma forma, mesmo em horario especial satisfez as expectativas."
nov. de 2022,5,Vista do nosso apto muito boa.,"Fomos muito bem atendidos em todos os serviços do hotel, todos os funcionários muito bem atenciosos, em especial ao dos restaurante durante o café da manhã. Os materiais de cama e banho todos de muito boa qualidade."
out. de 2022,4,Hotel confortável,"Muito bom o hotel. Me hospedei no quarto com varanda, o qual possuía uma cama bem confortável e uma vista incrível. Café da manhã excelente. Piscina e sauna boa. A academia poderia ser melhor, possui apenas uns equipamentos para aeróbico, uns halteres e uma máquina multi uso. A equipe da recepção não foi tão agradável, porém os demais funcionários são ótimos. Qualidade de outros Windsor que já me hospedei, deixando apenas para trás os funcionários da recepção."
out. de 2022,5,4 estrelas que poderia ser cinco.,"Melhor que esperado, todo novinho, atendimento atencioso e prestativo, localização incrível, café da manhã super selecionado. Pegamos um quarto com varanda e vista pra esplanada dos ministérios e janelas com vista pra Torre, 180 graus de liberdade visual. O quarto bem planejado cabe bastantes coisas, tendo em vista que viemos com muitas malas. Só me fez falta uma banheira, mas a sala de banho com toilette tem muito espaço."
set. de 2022,5,Muito bom,"O hotel tem um perfil executivo, mas atende muito bem a quem está a passeio, como no meu caso.  As instalações são excelentes. O quarto e o banheiro são amplos e a cama super confortável.  O café da manhã é bem variado e a equipe de recepção bastante atenciosa.  Voltarei!"
set. de 2022,5,MELHOR ESTADIA DA MINHA VIDA,"Eu nunca imaginei que a rede Windsor pudesse surpreender tanto. A minha estadia foi magnífica, nada de imprevistos, atendimento com excelência. Dependências espetaculares, tudo mantido com o máximo de capricho e qualidade superior. Desde a recepção nada pode desabonar a rede Windsor, em especial o Windsor Brasilia. Café da manhã absoluto, sem igual. Viajei em setembro 2021, o Hotel estava lotado, mas nem por isso houve qualquer fato que pudesse retirar a excelência no atendimento."
set. de 2022,5,Hotel Maravilhoso,"Fomos passar o final de semana em Brasília e amamos nós hospedar no Windsor. Limpeza impecável, camas e toalhas de qualidade.  O atendimento é impecável desde a recepção até os garçons do restaurante.  Ótimo custo benefício!"
set. de 2022,5,Elogio. Estadia muito agradável.,Atendimento e instalações ótimas. Localização perfeita . Excelente serviço de alimentos e bebidas. Profissionais bem treinados e muito efeicietnes e simpáticos. recomendo bastante. Ótimo custo beneficio.
set. de 2022,5,Excelente Hotel para Hospedagem em Eventos e Outras Atividades em Brasília!,"O hotel tem uma ótima infra estrutura e o atendimento foi excelente. Os quartos contam com tv com programação por assinatura, frigobar, excelente cama, banheiro amplo, ótima visão de Brasília devido a localização, restaurante super agradável, hall amplo, serviço de quarto, etc. Tudo bem completo! O salão de eventos atendeu de forma plena as necessidades da atividade proposta. Tecnologia e wi-fi rápido e de ótima qualidade por toda a estrutura do hotel. Estão de parabéns!"
set. de 2022,5,Atendimentos perfeitos e suíte agradável e aconchegante!,"Excelente recepção, um serviço de excelência por parte dos garçons, das camareiras, comida maravilhosa, tudo perfeito! Suíte super agradável, com todo o material necessário para higienização no banheiro, enfim, tudo impecável!"
set. de 2022,5,ótimo hotel,"ótimo hotel... super recomendo... boa localização... quartos limpos, chuveiro com e bem quente... toalhas e camas bem confortáveis...  café da manha com muitas variedades... funcionários educados e prestativos"
set. de 2022,5,Hotel maravilhoso! Nota 10!,"Hotel maravilhoso desde da entrada Check- In e Checkout, passando pelos quartos ótimos e a culinária almoço, café da manhã e jantar saborosos e de muita variedade.  Funcionários super atenciosos, gentis, educados e muito prestativos.  Quartos muito limpos e bem arrumados.  Comida nota 10.  Nada a reclamar só elogios para esse hotel maravilhoso."
set. de 2022,5,Perfeito,"Por ser a primeira vez que fiquei hospedado, fiquei muito satisfeito com a recepção e estadia,.  Foi uma experiência excelente e espero retornar outras vezes, parabéns a toda equipe do hotel.  A vista que tive de Brasília e do amanhecer foi mágica."
set. de 2022,5,Atendeu as expectativas.,"Satisfatória, hotel limpo, funcionários educados, ótima localização, bom restaurante com cardápio variado e tudo muito gostoso, enxoval limpo, banheiro com ótimo chuveiro e produtos de higiene excelentes,"
set. de 2022,5,Ótimo com crianças,Toda a equipe muito atenciosa! Fomos com crianças e recebemos um super atendimento.  Piscina aquecida.  Garçons muito simpáticos e um café da manhã bem farto.  Quartos amplos e confortaveis.  Voltaremos com certeza
ago. de 2022,5,Muito noa,"Ótimo lugar e atendimento. Quarto muito limpo e bom. Serviço de quarto excelente e restaurante ótimo. Muito bem localizado. Só achei a academia com poucos aparelhos, esperava que tivesse algo mais. De resto foi tudo perfeito"
ago. de 2022,4,"Voltando à Brasília, escolheremos o Windsor novamente.","Gostamos do quarto e do banheiro amplos. O chuveiro é excelente.  Quanto à roupa de cama, gostamos mais de lençóis do que das colchas oferecidas.  O café da manhã é bom.  Funcionários atenciosos e simpáticos."
ago. de 2022,5,Voltaremos!,"Funcionários super simpáticos, instalações limpas, café da manhã muito bom.  Localização ótima, custo/benefício dentro do esperado. O hotel é 4* mas não deixa nada a desejar para um hotel de 5*. Voltaremos com certeza."
ago. de 2022,2,cuidado com s taxistas,"O porteiro pediu um taxi na minha saida e o taxista não ligou o taximetro. Cobrou um preço absusdo.  Como o porteiro fez questão de chamar o taxi e não me deixou pedir um Uber, fica a dica de não aceitarem a sugestão dos porteiros!!!! Me pareceu estranho, mas não tenho como provar que exita algum esquema!"
ago. de 2022,5,Atendimento e instalações impecáveis,Qualidade do atendimento e do restaurante impar! Desde a chegada muito bem atendido e com esclarecimentos de todos os serviços. No restaurante um cardápio adequado e seguindo sugestão do garçom pratos servidos extremamente saborosos.
ago. de 2022,5,Estadia em casal,"Hotel bem localizado, quartos limpos com um bom banheiro e uma cama confortável. O café da manhã é ótimo, a piscina aquecida é um plus para uma estadia mais aconchegante. Fomos muito bem atendidos em todos os espaços do hotel."
ago. de 2022,5,Ótimo,"Ótimo atendimento, café da manhã com itens sem glúten e sEm lactose, próximo ao shopping é uma piscina térmica bem gostosa , banheiro com secador , chuveiro maravilhoso, só achei que a acústica deixou um pouco a desejar"
ago. de 2022,4,Muito bom,"Precisa melhorar o serviço de internet, pois não conectava direito, ficava instável, conectava e desconectava sozinha, o que impossibilitava a realização de trabalhos. Quanto aos atendimento é excelente."
ago. de 2022,4,Taxa abusiva,"Me foi cobrada uma taxa de serviços de 10%. Acho absurda a obrigatoriedade. O recepcionista foi seco e impositivo. Zero de empatia. A cobrança prévia da diária é desnecessária, pous você acaba tendo que fazer outro pagamento na saída."
ago. de 2022,5,Excelente experiência,"Excelente hotel. Funcionários muito atenciosos e receptivos, localização privilegiada, proximo a um shopping, ao estádio Mane Garrincha, dos principais pontos turísticos, ambiente e quarto limpo e bem higienizado. Café da manhã com boa variedade no buffet. Cheguei no hotel antes do horário do check-in, muito atenciosos, liberaram o quarto antes do horário, já que havia disponibilidade de quarto. Recordo-me de um senhor no atendimento do Restaurante durante o café da manhã extremamente cortes, muito educado e prestativo. Observei seu atendimento gentil com todas as mesas. Equipe está de parabéns."
ago. de 2022,5,otimo,"atendimento e recepção exelente, todos super educados! o cafe da manha perfeito! o quarto super confortavel! a cama muito espacosa e a roupa de cama tambem foi impecavel. tudo limpinho e cheiroso. uma experiencia incrivel."
ago. de 2022,4,Tranquilidade!,"Foi muito bom. Vista belíssima da Cidade; Próximo do meu evento. Pude ir caminhando para o evento e outros locais que visitei em Brasília. Próximo ao Lago Paranoá que contribui para o controle da umidade , pois sou de uma região com alta taxa de umidade e não tive problemas com ressecamento de vias, etc.."
ago. de 2022,5,Muito satisfeita na hospedagem,"Lugar maravilhoso, profissionais super educados!  Lugar limpo, boa localização e um café da manhã delicioso, com muita variedades, super indico e espero voltar outras vezes, satisfeita na hospedagem !!"
ago. de 2022,5,"Hotel excelente, limpo e bem-localizado.","O hotel é bem-localizado no coração de Brasília, em quadra segura de dia e à noite. Todos os funcionários são educados e prestativos. Merece destaque a limpeza do quarto, do banheiro e dos ambientes comuns. O quarto é grande e confortável, com bom banheiro e vista incrível do centro da cidade. O café da manhã é ótimo: há diversas opções de pães, folhados, doces, frutas e sucos, além de café espresso, tapiocas e omeletes, que podem ser pedidos ao garçom. Não hesitarei em voltar quando me hospedar em Brasília novamente."
ago. de 2022,5,Topissimo,"Um dos melhores atendimentos que ja vi, Indico de olhos fechados. O quarto é maravilhosos, os atendentes são todos muito receptivos e prestativos, o Hotel é fantástico, o Café da Manhã é excelente, muitas variedades, inclusive para quem tem intolerâncias. Realmente tanto eu quanto minha esposa ficamos super satisfeitos."
ago. de 2022,5,Excelente hospedagem,"Café da manhã delicioso! Hospedagem excelente, funcionários muito atenciosos. O quarto é muito bom, a internet funciona bem e o banheiro possui banheira de hidromassagem. A piscina do hotel é estreita, mas muito aconchegante"
ago. de 2022,4,Ideal para qualquer tipo de viagem,"Totalmente satisfatório. Bom atendimento, boa localização e cozinha excelente. Café da manhã farto e bem servido. Não fiz uso do bar, nem da academia, mas aparentemente são bons, notei um bom movimento."
ago. de 2022,2,Acústica do quarto muito ruim em relação ao quarto do lado,"Hotel muito bem localizado, muito bonito, quarto confortável, banheiro e ducha espetacular mas infelizmente uma noite mal dormida, fiquei no quarto 1006...o vizinho de quarto passou a noite com a televisão ligada e foi como se tivesse dentro do nosso quarto. Acústica muito, muito ruim!"
ago. de 2022,5,Adorável,"Foi uma hospedagem tranquila. Porém acho que os manobristas e recepcionistas deveriam ser mais amistosos. Eu fui com um amigo que considero como irmão, e a recepcionista toda hora perguntando pra que duas camas? Nos julgando como casal. E se fôssemos não teríamos problema algum em dizer, mais não era o caso isso é constrangedor, amigos não tem raça ou idade… tirando isso foi tudo ótimo…."
ago. de 2022,4,Uma chateação para recordar,"Chegamos dia 30 de agosto. Eu,meu esposo e nossa filha de cinco anos. Fomos muito bem recepcionados, parabenizo o funcionário que fez o check in neste dia.  Na piscina, neste dia da chegada, estava tudo bem até dois casais chegarem: e que chegada!!! Com sua ""caixinha de som"", em alto e horrível som. Destaque para o bom atendimento que tiveram da equipe do Windsor.  A música ambiente foi ferozmente apagada pelo horrível som e nada foi feito.  Isso é certo?  Somos obrigados, nas nossas férias, a ouvir a escolha dos outros e nada ser feito?  Seriam pessoas especiais?  Não pagamos igualmente para desfrutar aquele espaço e seguir as normas do Windsor?    Realmente foi uma chateação!!!"
ago. de 2022,5,"Confortável e bem localizado, com atendimento excelente","Hotel muito bem localizado, confortável e com um excelente atendimento. Funcionários muito agradáveis e simpáticos. A preocupação de todos era atender bem aos hóspedes.  Café da manhã delicioso.  Valeu a estadia."
ago. de 2022,5,Excelente experiência na Capital Federal,"Fomos muito bem recebidos. Crew excelente, com o destaque para o atendente Lenny, um cearense gente boa, simpático e muito atencioso. Limpeza e higiene dos quartos muito boa e um café da manhã perfeito. A piscina aquecida tb agradou muito. Parabéns!"
ago. de 2022,5,Viagem para visto americano,"Hotel com uma ótima localização, proximos às principais vias e próximo ao CASV para o processo de visto americano.  Quarto bem cuidados, não empoeirado, limpos e cheiroso. Banheiro limpo, grande e funcional.  Funcionários educados e simpáticos. Chegamos antes do horário do check-in e quando o quarto estava disponível já nos avisaram.  Café da manhã com ótima variedade.  Preços de bebidas como água e refrigerantes foram bastante caros então sugiro comprar água em algum supermercado próximo."
ago. de 2022,5,excelente estrutura e atendimento,"Ótimo café da manhã, atendimento e quarto! O serviço de modo geral é bom e os funcionários bem atenciosos. A piscina e academia deixam a desejar. Mas pelas fotos, conseguimos perceber que a piscina é coberta. Na realidade ela é menor do que aparenta e a academia é minúscula.    Ainda assim, considero excelente pelo que se propõe!"
ago. de 2022,5,Meu novo lar em Bsb,"Excelente recepção, desde o manobrista até a chegada ao quarto. Café da manhã variado com opções personalizadas. Localização privilegiada e uma bela vista da cidade. Amenities de boa marca, toalhas felpudas e muitas opções de canais a cabo."
ago. de 2022,4,estada em Brasilia,"apesa de ser cliente da rede, o meu cadastrado nao constava no sistema  outro fator, foi a impossibilidade de troca de andar, eu solicitei um andar mais alte, o a equipe de atendimento informou que não teria, presenciei outros atendimentos, com acomodação em andar alto, apesar de falar do barulho, mais informaram que foi a reserva, ao sei que nao procede"
ago. de 2022,4,Estadia maravilhosa,"Quando entrei no quarto e avistei a cama me enchi de aconchego e felicidade! Que convidativa! Fiquei louca para chegar à noite, pois tinha que trabalhar ainda. Toalhas, chuveiro e serviço de quarto maravilhosos. O café da manhã é ótimo e os garçons super-simpáticos. Único ponto a ressaltar é a bandeira do Brasil na parede do quarto. Além da pintura ser feia, o atual momento, infelizmente, remete bandeiras do Brasil à figura abjeta de Jair Bolsonaro. Vontade de tirar do quarto para dormir melhor. Por isso não coloquei ótimo na experiência. Faltou sensibilidade nesse quesito."
ago. de 2022,5,Muito boa,"O hotel atendeu todas as necessidades, para quem estava na cidade a trabalho. O hotel oferece toalhas limpas e em boa quantidade. Shampoo, condicionador e creme hidratante para quem esqueceu. Bloquinho com caneta para anotações. E o quarto é bem limpo e organizado. O restaurante têm um buffet de café da manhã bem completo, bem como as opções a la carte."
ago. de 2022,5,Excelente estadia.,"Funcionários educados e solícitos. Um café da manhã farto e muito gostoso. Localização excelente, perto de vários shoppings e pontos turísticos, como a torre de tv.  Foi minha primeira vez em Brasília e tive uma excelente impressão."
ago. de 2022,5,Excelente,"Ótima localização. Muito bom o café da manhã, com funcionários super atenciosos. Quarto espaçoso e ducha excelente. O hotel ainda possui uma piscina térmica coberta, sauna e academia. Adorei minha estadia."
ago. de 2022,5,Foi uma experiência muitíssimo satisfatória,"O hotel fica em ótima localização, possui instalações muito boas, limpeza excelente, recepção e funcionários muito cordiais e prestativos. Excelente Cafe da manhã, inclusive com opção sem glúten e lactose. Possui academia de ginástica. Com certeza me hospedarei novamente, além de possuir um excelente custo benefício!"
ago. de 2022,5,Boa,Ótimo atendimento por parte dos funcionários só não acho legal a comida pois não tive sorte no prato que pedi! Foi uma parmegiana e não estava legal! Mas no mais agradeço e espero voltar mais vezes.!.
ago. de 2022,4,boa,"Excelente hotel  Excelente funcionários  Excelente Quarto  Excelente cafe da manhã  Sistema de pagamento no bar não gostei,prefiro assinar nota e pagar na saída  Wi-Fi e TV péssimo,principalmente para quem trabalha on-line"
ago. de 2022,5,Excelente,"Foi uma ótima estadia. Gostei bastante da organização, limpeza, educação de todos os profissionais e localização. Lugar muito limpo e acolhedor, acredito em ir novamente a esse hotel. Podem continuar desse jeito"
ago. de 2022,5,Um final de semana de tranquilidade e facilidades !,"O café da manhã é maravilhoso e o staff atencioso, principalmente os manobristas ! Perto de shoppings e atrações turísticas da cidade , só achei q poderia ter mais espaço nos locais de convivência dos hóspedes."
ago. de 2022,5,Certeza de uma acomodação acolhedora.,"Excelente localização. Bom gosto. Pessoal receptivo e muito atencioso. Serviço de restaurante, uma tentação. Limpeza esmerada. Banho dos sonhos: ducha e toalhas perfeitas. Exatidão entre o anúncio e serviço oferecido."
ago. de 2022,5,ótima estadia,"Hotel super bem localizado, acomodações e café da manhã excelentes! Piscina aquecida ajudou a entreter as crianças, pessoal da recepção super cortez, gostei bastante certamente voltarei em uma próxima viagem a Brasília!"
ago. de 2022,5,viagem maravilhosa.,"Tudo muito bom! Hotel e funcionários excelentes. Tudo limpo, comida muito boa. Bem localizado. Quarto espaçoso. Atendimento nota 1000; Tudo certo. Podem confiar que vale a pena. Ficamos cinco dias e já estamos com saudades."
ago. de 2022,5,Sensacional,"Uma viagem muito perfeita, piscina e sauna tudo de bom e um café da manhã impecável.  Pessoal da limpeza e recepção nota 10.  O rapaz que fez meu check-in me deu total atenção.    Muito obrigado pelo excelente atendimento."
jul. de 2022,3,"Bom hotel, mas poderia ter sido melhor.","A recepção foi boa, fui atendido super bem no chek-in, o funcionário do hotel foi até meu quarto, levou minha bagagem, explicou algumas coisas sobre o quarto e a estadia, etc, foi bem solicito. Fui a trabalho, então praticamente só ficava ali, para dormir, acordar e tomar café da manhã, que por sinal era excelente, muito variado. O que me decepcionou foi o WIFI, uma conexão horrível! a noite antes de dormi, precisava adiantar algumas coisas da empresa para o dia seguinte e a internet nunca funcionava direito, tive que utilizar os dados móveis do meu smartphone e por final, no dia do meu chekout, o recepcionista me tratou friamente, muito desagradável, já havia superado o WIFI ruim, mas a última impressão é o que vale e isso me deixou com uma visão muito ruim do hotel, de modo geral, foi uma boa estadia, voltaria a me hospedar ai, mas não seria minha primeira opção."
jul. de 2022,5,ÓTIMA OPÇÃO EM BRASÍLIA,Excelente hotel muito bem localizado - relativamente próximo à Torre de TV. Quartos confortáveis e limpeza impecável.  Café da manhã com itens de qualidade e muito saborosos. Funcionários atenciosos sem exceção.
jul. de 2022,4,Minha experiência no Windsor Brasília,"A empresa que administra o Windsor hotel reduziu a oferta de shampoo, gel de banho e kit beleza para as mulheres. Porém após co entrar na recepção sobre essa redução de oferta de tais produtos, os funcionários foram muito gentis em ofertar-los para maior conforto. O pessoal do restaurante é muito atencioso e sempre busca o melhor para seus clientes. A turma do estacionamento também. Se vc não tiver problemas com os produtos de banheiro, recomendo o Hotel."
jul. de 2022,5,Avaliação,"Very good. Muito legal está com minha esposa nesse hotel, boa piscina e sauna e ótimo atendimento, com certeza quero conhecer os outros hotéis da rede. Na minha visão, melhoraria só area de lazer e salas de jogos."
jul. de 2022,5,"Hotel excelente, lindo e novo","Hotel excelente! Tudo novo, ótimo atendimento, café da manhã da melhor qualidade, com manteiga importada, iogurte molico zero, salmão etc. Chuveiro maravilhoso! Com certeza indicaria a alguém e voltaria ao hotel!"
jul. de 2022,5,Fantástico!,"Amei tudo, o atendimento, localização, limpeza do quarto e da roupa de cama. Banheiro tudo certinho!  Café da manhã uma delícia e muitas opções!  Passando por Brasília vou ficar sempre neste hotel!  Parabéns!"
jul. de 2022,5,Excelente hospedagem,"Bem localizado, excelente atendimento da equipe (desde a chegada com o carro, até o check out). Café da manhã com muita variedade. Quartos muito limpos e cama super confortável. A única coisa que faltou foi uma TV smart para poder assistir Netflix."
jul. de 2022,5,Estadia agradável,"Passei excelentes dias com a minha família. Todos os funcionários foram muito simpáticos.  Quartos muito bem limpos e com um espaço muito bom.  Café da manhã muito bom, com opções para intolerantes a glúten e lactose!"
jul. de 2022,5,Excelente experiência,Excelente hotel. Categoria superior. Vale muito a pena! Hotel te oferece uma piscina climatizada como n excelente atendimento. Os preços condizem com a qualidade do hotel. Quarto excelente com cama king. Vale a pena conhecer.
jul. de 2022,5,Excelente !,"Estadia maravilhosa . Superou as nossas expectativas , principalmente , pelo cuidado dos funcionários com a minha família durante o café da manhã . Leite e delícias sem glúten e sem lactose... Sempre tinha um carinho a mais . Detalhes que trazem aconchego ."
jul. de 2022,4,Fabuloso,"Hotel limpo, móveis em condições de uso, toalhas de qualidade, comida do restaurante impecável, café da manhã perfeito, funcionários atenciosos!    Super recomendo, atrativo um bom preço é de excelente entrega de qualidade!"
jul. de 2022,4,Muito boa,"Excelente atendimento, café da manhã perfeito, chuveiro maravilhoso. Limpeza impecável. Único ponto que poderia melhorar é a qualidade dos colchões. São de mola e com muitos buracos. Na hora de trocar na minha opinião."
jul. de 2022,5,Maravilhosa!,"Minha estadia foi maravilhosa! Tudo impecável e um excelente atendimento. O café da manhã tem muita variedade e qualidade. E quem se hospedar no Windsor não pode deixar de ir na piscina, aquecida e coberta. Voltarei com certeza!"
jul. de 2022,5,"Estadia com meu Pet, tudo ótimo.","Equipe atenciosa, café da manhã maravilhoso, uma estadia 5 estrelas. Limpeza, cama confortável e tudo mais que se pode esperar do Windsor. Meu hotel sempre que vou a Brasilia.  Desta fez fui com meu Pet, apesar de não terem no momento todo o kit que o pet teria direito, não fez falta porque sempre levo a ""mala"" de minha cadela."
jul. de 2022,4,Surpresos,"Não acreditamos quando nos foi cobrado 11 reais pela ultilização de um prato com talheres! Lamentável!  A ausência de Netflix disponível também nos causou surpresa num hotel deste nível .  No mais um hotel muito bom, piscina realmente aquecida e café da manhã delicioso ."
jul. de 2022,5,Viagem em família,"Excelente hotel , tem uma boa localização, próximo aos principais pontos turísticos. Café da manhã excelente , hotel muito limpo e cheiroso , funcionários muito atenciosos .Quarto com uma vista linda de Brasília"
jul. de 2022,5,tudo otimo,"foi tudo bom so o cafe no sabado de manha , com o local muito pequeno e tumultuado mas os funcionarios solicitos .. o local que ficou apertado . Impossivel tomar cafe la fora com aquele vento xxxxxxxxxxxxxxxxxxxxxxxx"
jul. de 2022,4,Poderia ser excelente diante da estrutura e do valor da diária.,"De modo geral muito bom, para ficar excelente deveria ter maior variedade no café da manhã, todos os dias as mesmas coisas, embora tenha muita quantidade de opções. A estrutura e o atendimento de ótima qualidade, assim como a localização. Quarto à acomodação poderia ter uma cama e um cobertor de melhor qualidade, proporcional ao preço pago e por ser um hotel de quatro estrelas."
jul. de 2022,5,Excelente,"Tudo ótimo! Café da manhã excelente ! Atendimento de todos os colaboradores muito bom!Tem uma ótima localização , hotel muito limpo , organizado . Gostamos muito da estadia , com certeza nos hospedaríamos novamente ."
