Data da opinião,Nota,Título,Conteúdo
mai. de 2018,5,Hotel muito bom !!!,"Em termos gerais, o hotel é muito bom. Quartos limpos, excelente banheiro e ducha, camas confortáveis, um bom café da manhã e uma pizza maravilhosa lá no bar.  A distância do hotel ao centro não é problema é torna-se uma vantagem na chegada e na partida, pois já fica no corredor do aeroporto (40’, sem congestionamento).  Particularmente, apenas lamentei da última vez terem revisto o sistema de canais a cabo e terem retirado do pacote a emissora francesa TV5 Monde. Espero que volte..."
abr. de 2018,5,EXECEPCIONAL,Quarto super aconchegante. Camas impecáveis. Gentileza do pessoal do atendimento em todas as áreas. O design do hotel é algo inovador e aconchegante. A localização também é bastante estratégica. O serviço do restaurante é maravilhoso.
abr. de 2018,3,Pode melhorar,"Hotel novo, bem localizado, barato, proposta Boa.Cafe da manhã fraco, mesas do restaurante pequenas e balançam (todas).  Acesso Bom, porém poderiam oferecer estacionamento sem custos.  No geral, atendeu a necessidade."
abr. de 2018,5,Muito confortável e fácil acesso,"Ótimo acesso! Localizado em avenida movimentada e de fácil acesso, proximo a shoppings, supermercados e a poucos metros do centro. Café da manhã variado. Segurança e conforto. Muito aconchegante. Recomendo a todos."
abr. de 2018,5,Maravilhoso,"Recomendo a todos que passem pelo Hotel para ter esta experiência única! Quarto limpo, confortável! No clima da sustentabilidade! Pizza deliciosa!! Me senti em casa! Parabéns a toda a equipe! Todos totalmente profissionais!"
abr. de 2018,5,Peço justo e bem localizado,"Muito bom hotel so falta um bom restaurante , otima localizaçao , perto de tudo bom centro commercial ao lado , algumas semanas tem festival de food truck ao lado do hotel , Churrascaria maravilhosa em frente ."
abr. de 2018,5,"Conforto, pizzaria e educação da equipe","Recomendo este hotel pela agilidade no atendimento, conforto e principalmente a localização, entre o centro de BH e o aeroporto de Confins. Contem uma academia quase anexo ao hotel e dispõe de um restaurante muito bacana. O atendimento da equipe da pizzaria foi fora de sério, educados e muito práticos ... destaco os mesmos: Stephanny e Max"
abr. de 2018,5,Saudável,"Minha permanência posso afirmar que foi saudável, permitiu que eu descansasse o suficiente com muito conforto, segurança e tranquilidade.  As instalações são muito confortáveis e o espaço ideal.  O desjejum variado e de bom gosto  Atendimento da equipe sensacional, todos são prestativos e educados."
abr. de 2018,4,Boa,Em relação ao atendimento: um números maior de funcionários em momentos de movimentos e infelizmente presenciei na minha chegada um tratamento grosseiro de uma funcionária com um hospede. Não sei o nome dela.
abr. de 2018,5,Excelente,"Perfeita minha hospedagem no Encore, atendimento muito bom, o pessoal da recepção um doce, café da manhã bem variado e o horario dele tambem, bem prolongado srsrs, ótima localização, o quarto tbm atendeu as minhas expectativas, muito bom!"
abr. de 2018,5,Atendimento Show,"Hotel em boa localização de BH e excelência no atendimento. No Térreo, tem Pizzaria que além das pizzas deliciosas, tem Chopp dobrado todos os dias até 20h,nas quartas tem música ao vivo e a equipe do Hotel é bem a atenciosa. Max que trabalha na Pizzaria é muito atencioso e o atendimento é nota 1.000!!"
abr. de 2018,5,Excelente Custo-benefício,"Recomendo para viagens a serviço quando próximo do local de trabalho. Excelente localização, limpeza, café da manhã. Ainda dispõe de uma boa pizzaria no saguão, com direito a happy hour todos os dias, com música ao vivo às quartas. Recomendo!"
abr. de 2018,4,"Quartos aconchegantes, ambiente silencioso!!","Gostei muito da localização, funcionários atenciosos, quartos bem arrumados só ficou devendo o café da manhã mas o restante valeu a hospedagem! Pizzaria no próprio Hotel que vale a degustação, fácil acesso!"
abr. de 2018,5,Ótimo,"Atende minhas necessidades. Perto da avenida principal que liga aeroporto, de shopping, de restaurantes, perto da empresa motivo pelo qual foi a viagem. Ambiente agradável, café da manhã bom, instalações dos quartos bons."
abr. de 2018,5,Hotel Excelente,"Os quartos são confortáveis, bem limpos e organizados. Os atendentes são educados. O café da manhã é excelente. A pizzaria também é excelente, uma variedade de sabores das pizzas. Vale muito a pena se hospedar no Encore Minascasa."
abr. de 2018,4,Muito bom!,"Hotel muito confortável, situado próximo ao Minas Shopping e dentro do complexo Minascasa. Um pouco distante da região central, mas vale pelo custo benefício. Quartos limpos e confortáveis. Recomendo a pizza do restaurante Vert, junto à recepção."
abr. de 2018,4,Avalio como muito bom para o custo benefício,"O hotel tem bom atendimento, bela fachada e de bom acesso. o café da manhã é bom, o espaço é pequeno mas aconchegante. O serviço de alimentação é bom, pode melhorar com relação ao cardápio. No geral é satisfatório."
abr. de 2018,4,Ótimo custo beneficio,"O Café da manha do hotel é muito bom, ótima localização pra quem irá fazer negócios ou lazer na região da savassi. Os quartos e banheiros são novos, bem limpos e arrumados. Conta também com um restaurante aberto todas as noites."
abr. de 2018,4,Econômico. Bom custo benefício.,"Viajei à trabalho. O hotel é bom para essa finalidade. Fácil acesso por uma avenida movimentada de Belo Horizonte.  É a versão econômica do Ouro Minas. Ficam a 100 metros um do outro.  Este hotel fica dentro de um Shopping de móveis e decoração, que não tem praça de alimentação.  Como hotel econômico, não disponibiliza lanches e refeições no quarto. Mas no térreo tem um pizzaria, e no lado oposto do shopping tem uma padaria grande, que serve lanches e um café colonial bem variado."
abr. de 2018,4,Mto bom,"Hotel muito bom. Ao lado do tradicional Hotel Ouro Minas. Em frente ao shopping MinasBrasil.  Internet ok, cama boa. Astral elevado. Tem pizzaria junto da recepção, com boas opções. Frigobar vazio, com opções de compra na recepção"
abr. de 2018,3,APTO COM PROBLEMAS DE ENTUPIMENTO,Apto sem manutenção preventiva. O ralo do box estava entupido e consequentemente o banheiro ficava inundado durante os banhos. Acionei a manutenção e foi solucionado o problema somente no dia seguinte.
abr. de 2018,3,Relação custo/benefício duvidosa.,"O quarto não tem onde guardar a roupa. Não há acessórios extras, tipo um travesseiro, disponibilidade de canais de tv é baixa e a reserva, feita pelo hoteis.com simplesmente não correspondia ao que tinha sido largamente mostrado na reserva acarretando por final eu tendo que pagar uma taxa extra."
abr. de 2018,5,Perfeito!,"A polidez e educação dos funcionários e todo o conforto oferecido pelo hotel, mostraram que o mesmo realmente é organizado, confiável e bastante agradável de se estar.  Até mesmo o estacionamento agrada bastante."
abr. de 2018,4,Melhor custo x beneficio,"Para o meu caso, considerados localização, preço e conforto, o hotel é a melhor opcao. A cama é boa. Cafe da manha razoável. A chaleira elétrica auxilia no chá da noite. Recomendo pra estadia em Belo Horizonte."
abr. de 2018,3,Poderia ser melhor,"O atendimento não tem nenhum profissionalismo e nem treinamento algum, pois deveriam dar mais instruções para os funcionários , pois tudo que pergunta eles não sabem dizer o certo e fora que tem alguns funcionários que nem se quer tem educação para atender os hospedes.    Decepção muito grande neste hotel, não recomendo não."
abr. de 2018,4,Muito bom,"Muito bom, achei muito bom e foi uma ótima experiência estar no hotel. A cama é o ponto principal, além da quantidade opções próximas do hotel. Shoppings, restaurantes, bares, enfim. Indico hospedar-se no hotel"
abr. de 2018,5,Boa viagem,"Boa localização, com boas opções de alimentação e entretenimento perto. A pizzaria existente no térreo tem ótimas possibilidades.  É novo, com acomodações adequadas ao preço.  O estacionamento é de um shopping, pago à parte. Poderia ser incluído na diária, mediante consulta no check-in, evitando ter de se procurar onde pagar."
abr. de 2018,4,verdadeira,"acho que o café da manhã precisa apenas detalhes para fica melhor.  tipo nunca consegui comer um MAMÃO maduro SEMPRE VERDES E SEM SABOR, sugiro que mudem o fornecedor e olhe que eu viajo muito e como tem frutas boas viu. outra coisa , assim como tem pessoas que adoram café sem açúcar, lembrem que tem hóspede que gosta de café com açúcar e não de máquinas. apenas detalhes ok. resto ótimo."
mar. de 2018,5,Negócios e Pizza sempre,Local privilegiado para acesso ao aeroporto e com centro de compras top ao lado.  A pizza é um show a parte. Os vinhos sempre com variedade e a preço justo conforme o Título.  O atendimento do chef de cozinha sr. Gilvan é sempre acima da média. Parabéns ao Time.
mar. de 2018,5,Dias maravilhosos,"Que dias maravilhosos!  Ficamos nesse hotel desde da lua-de-mel em 2015.  A Equipe do Hotel é maravilhosa, atenciosa, educada e torna a nossa estadia sempre deliciosa desde do check-in!  Gostaria de agradecer o Philippe pelo carinho conosco no café da manhã. E por falar em café da manhã... Que Maravilha!!!  Nós amamos!!  Muito obrigada!!"
mar. de 2018,5,Hospedagem excepcional!,"Hotel muito bem localizado, próximo ao shopping, restaurantes e supermercado. Café da manhã maravilhoso, com grande variedade de itens, inclusive o funcionário Philippe foi sempre muito cortês. Tudo muito limpo, funcionários muito educados e bem informados. E o melhor: um preço de diária que cabe no bolso, excelente custo-beneficio! O hotel e a sua equipe estão de parabéns!!!"
mar. de 2018,4,"Estadia excelente, porém com alguns incovenientes","Começando pelos pontos positivos, o hotel é bem localizado, próximo ao minas shopping e shopping minascasa, padaria e estação do metrô. Os quartos são aconchegantes, cama e chuveiro excelentes, outro ponto maravilhoso é a equipe que trabalha do hotel, desde a recepção até a equipe de limpeza, Em especial gostaria de deixar um elogio ao funcionário Philippe, que auxiliava no café da manhã, sempre muito prestativo, atencioso e pró ativo.    O ponto negativo que tenho que informar foi que o primeiro quarto onde fomos hospedados em um andar alto tinha um problema, o ar condicionado estava com uma goteira horrível que começou por volta da meia-noite, mas entrando em contato com a recepção fomos prontamente atendidos e hospedados em outro quarto."
mar. de 2018,4,Bom hotel,"Agradável, com algumas opções dentro de um mesmo complexo, como academia e pizzaria. Boa localização. Só não recomendo pedir pra entregar no quarto, cobram absurdos 5 reais pra entregar da pizzaria no térreo do próprio hotel até o quarto. Isso mesmo, 5 reais pra alguém subir o elevador. Fora isso, um bom hotel."
mar. de 2018,5,Um local tranquilo e muito receptivo.,"O Hotel Encore é um ambiente muito aconchegante com instalações modernas. O atendimento é muito bom por toda a equipe do hotel. Fui muito bem atendido principalmente pelo Philippe, um cara super gente boa."
mar. de 2018,5,Ótimo hotel,"O hotel é muito confortável, o serviço de quarto também.  Eu e meu namorado ficamos por 4 dias e nao temos nada a reclamar, ao contrario, saímos apenas com boas lembranças.    Os hospedes ganham dois cupons de desconto na pizzaria do hotel (que è maravilhosa), indico que comprem uma pizza metade carne seca com catupiry d metade com presunto de Parma (è de outro mundo).    O Phillipe nos atendeu sempre muito bem, com boa vontade e um sorriso no rosto. Toda a equipe de funcionarios e funcionárias esta de parabéns.    Apenas uma sugestão, coloquem algum tipo de perfumaria (desorizador) no banheiro, assim casais podem ficar mais a vontade."
mar. de 2018,5,Ótimo,"Ótimo hotel, lindo e confortável. Ótima localização. Funcionários gentis.  O café da manhã é muito bom, paes crocantes e bastante variedade de buffet.  Quarto confortável, ar condicionado funciona bem, TV com vários canais e rápida. Internet boa também.    Nada a reclamar, recomendo."
mar. de 2018,5,Excelente!!!,"Hotel com ótima localização, decoração moderna e ótimo café da manhã. O quarto só não era bem arejado possui apenas uma mini janela. Gostei da chaleira elétrica (disponibilizada pelo hotel sem custos) pois facilita para quem tem crianças pequenas.  Informações: O estacionamento é no shopping minascasa (diária R$ 20,00) e a academia é terceirizada para quem deseja usar terá custo adicional (R$ 30,00 diária ou R$ 50,00 2 diárias)."
mar. de 2018,3,Hotel para executivos com serviços razoáveis,"O hotel possui boas instalações, quarto confortável e instalações novas. Roupa de cama e toalhas limpas. Mas há alguns problemas como ar-condicionado que vive dando problemas de desligar e religar, não há estacionamento - só o pago do Minas Casa Shopping - e não há opções de lazer no hotel. Há uma academia no térreo, mas conveniada. Ebulidor em garrafa de água nos quartos não funcionam."
mar. de 2018,4,Excelente custo benefício,"Bem localizado, perto de um shopping e de supermercado. Fica dentro de umas galerias com lojas, padaria etc. Quartos limpos e novos, café da manhã gostoso e bem sortido. É uma ótima opção por um baixo custo."
mar. de 2018,2,Cuidado tem pegadinha em quarto deste hotel,O hotel piorou muito cortou amenidades e piorou a limpeza. O hotel anda oferta quarto mais barato com descrição de vista para cidade porém ao chegar no hotel você comprou foi quarto de deficientes. No mesmo dia eu e dois hóspedes fomos enganados.
mar. de 2018,5,Estadia excepcional,Hotel excelente. Equipe educada e atenciosa. Quartos limpos. Roupa de cama e de banho impecáveis. Excelente custo benefício também.  Já estive outras vezes no Ramada e o hotel sempre me surpreende. Espero voltar outras vezes!
fev. de 2018,4,EQUIPE EXCEPCIONAL!!!!!,"Mais uma estadia maravilhosa no Hotel Ramada Encore. Encontramos novamente com nossos amigos que mais uma vez brilharam no atendimento e na atenção. Conceição e Paulinha a dupla fantástica nos receberam com um sorriso e acolhimento maravilhoso. Sempre alegres e dispostas a ajudar em tudo. Felipe, Stefane e Cleiton o trio excepcional do restaurante sempre prontos para nos atender. Sentimos mais que em casa com essa equipe pelo carinho enorme que recebemos. Ooooooo saudades!!!! Dessa vez tivemos a alegria de agregar a essa turma maravilhosa o Daniel. Pessoa extraordinária, super auto astral que deixou sempre nosso quarto impecável. A estas pessoas deixamos nosso terno agradecimento e esperamos estar juntos novamente o mais breve possível. (Daniella/Leonardo)"
fev. de 2018,1,"Péssima experiência, infelizmente","Estive no hotel no dia 24 com minha cachorrinha para encontrar com meu namorado. Na ocasião, comemoraríamos o aniversário dele mas infelizmente, com a chuva que teve em Belo Horizonte, o hotel ficou sem energia e não tínhamos a mínima condição de ficar no hotel.  Fomos extremamente bem recebidos pela recepção, mas não dava para ficar no hotel sem luz.  Pagamos a estadia pelo hoteis.com, pagamos R$ 50,00 pela estadia da cachorra e R$ 8,00 do estacionamento. Gostaria de receber de volta esses valores já que não desfrutamos do hotel.    Agradeço!"
fev. de 2018,4,Ótimo custo x beneficio,"Ficamos apenas uma diária no hotel, no período do carnaval, e achei tudo ótimo. O atendimento foi bacana, o quarto tem um tamanho bom, cama enorme, um kit carnaval super fofo, banheiro super ok! Café da manhã simples, mas bem gostoso. Estacionamento $20 reais e ainda ganhamos um voucher de $10 pra usar numa próxima diária ou na pizza do restaurante do hotel, mas acabamos nem usando. Super recomendo!"
fev. de 2018,5,A minha segunda casa.,"Otimo hotel.  Localizaçao estrategica,preço justo,cama confortavel,cafe da manha delicioso e atendimento nota 10.  Eu ja estive hospedada 8 vezes,nunca tive nenhum problema.  Recomendo sempre o hotel aos meus amigos e conhecidos."
fev. de 2018,4,Muito Bom!,"Hotel bem localizado, com boas instalações e funcionários com ótima educação.  O meu obrigado especial ao funcionário Felipe, que se mostrou super gentil durante nossa estada. Pra ter nota melhor ainda, faltou apenas uma área kids. Mas no geral muito bom mesmo!"
fev. de 2018,4,Grata surpresa.,"Funcionários super gentis, hotel bem decorado e mt limpo. Há um restaurante no hotel bem agradável e, quem quiser, pode ficar ao ar livre, mt gostoso. Café da manhã bem sortido. O único ponto negativo é o check in mt burocrático e, consequentemente demorado, o que acabou gerando filas."
fev. de 2018,4,Ótimo Hotel,"Hotel com um bom estacionamento (pago), Funcionários super competentes e principalmente bem localizado, deferente tem um Shopping. Só não dei 5 estrelas pq qdo estava hospedado faltou gelo no café da manhã, voltarei com certeza!"
fev. de 2018,5,"Muito Bom, Recomendo.","Boa localização, ao lado de um grande shopping, quartos limpos, pessoal atencioso com um bom atendimento, preço razoável, água de cortesia, se continuar assim com certeza voltarei e indicarei pra outras pessoas."
fev. de 2018,5,Muito bom,"Bem localizado, novo, atendimento muito bom. Pegamos uma promoção de Carnaval com preço excelente. Quarto muito agradável com tudo novo.  Fica ao lado do Hotel Ouro Minas e próximo ao Minas Shopping. Super recomendo!!!"
fev. de 2018,4,Fiquei hospedado para participar da 1ª Convenção Brasileira de Hipnose e foi uma estadia muito boa.,"Achei legal ter água de cortesia no frigobar, cama boa, atendimento bom, só o pacote de tv paga que é básico. ter três elevadores agiliza . O café da manhã é bom, sem ser excepcional. há um pizzaria no térreo."
jan. de 2018,5,Passeio,"Super recomendo pra pessoas que passam por BH a trabalho ou ate pra descanso ou passeio em família adorei o café da manhã o atendimento do Phillipe muito atencioso e prestativo o chef de cozinha Gilvan que por sua vez venho me dar bom dia achei bem diferencial quero parabenizar ele é sua equipe café perfeito cama boa queria deixa ,uma observação com a recepção pra trocar o kit de barbear esse na sua vez muito ruim preço razoável ,mas produto muito ruim mas fora isso tudo foi muito bom parabéns pro hotel !"
jan. de 2018,5,Excepcional..!!!,"Hospedei um casal de amigos neste hotel, noite de nupcias eles sairão super maravilhados com o hotel e com a recepção,  hotel com ótima localização, recepcionistas atenciosos e muito solícitos, atendimento ótimo.  Agradecimento especial a Camila Gischewsk, que cuidou da hospedagem dos meus queridos no hotel..!!!!"
jan. de 2018,5,Pizzaria,"Fomos a pizzaria, fomos muito bem atendidos por excelentes funcionarios q nos deram total atenção! td nos saimos satisfeitimos ate com trabalha da auxiliar da limpeza(nao sei dizer o nome) Ficamos algumas horas no local e fomos atendidos por stephanny,cleiton, max! pessoas atenciosas q fazem jus a seu trabalho!"
jan. de 2018,4,Equipe fantástica do hotel,"Ficamos por 10 dias hospedados no hotel e tivemos prestígio de sermos recebidos e atendidos por duas pessoas maravilhosas de sorriso no rosto, muito acolhedoras e prontas para nos mantermos confortáveis e tornar nossa estadia agradável e aconchegante (Conceição e Paula). Para completar conhecemos outras três pessoas do restaurante (Stefane, Felipe e Cleiton) fantásticas e sempre alegres que enobreceram nossas manhãs e fim de tarde com o serviço muito bem feito e a preocupação em nos manter bem. Sairemos dessa hospedagem deixando cinco amigos, mas retornaremos assim que possível. Agradecemos a hospitalidade."
jan. de 2018,4,Localização conveniente,"O Hotel é de fácil acesso para quem vem do aeroporto de Cofins. Está localizado dentro de um pequeno shopping, que possue apenas uma grande padaria como opção de alimentação. No Ramada também existe uma pizzaria. Do outro lado da pista está um shopping com lojas e muitas opções. O atendimento é rápido para check in e check out. Quarto tranquilo, conforto suficiente. Excelente para uma curta estadia."
jan. de 2018,4,Excelente custo benefício e muito silencioso!,"Cama confortável , chuveiro excelente , café da manhã agradável não deixando a nada a dever, boa estrutura, muito silencioso,boa internet, bom lobby com restaurante que atende bem, mas o destaque foi o atendimento das profissionais Conceição e Paula (equipe da recepção ) que foram super atenciosas e que me atenderam super bem com um enorme carisma, tornando nossas hospedagem agradável e prazerosa. Agradecemos o carinho e até a próxima."
jan. de 2018,2,Serviços que não fucionam,"Fiquei hospedado no Ramada Encore do dia 04 ao dia 07 de janeiro deste ano. Em TODOS os dias tivemos problema com a internet, que estava terrível. Reclamei todos os dias e todos os recepcionistas falavam que iam ""chamar a manutenção"" mas o problema persistia. Tive que responder os meus contatos pelo pacote de dados do meu celular. Já fiquei outras vezes nesse hotel e o problema de internet é recorrente. Sempre tive dificuldades para usar a internet. Outro problema foi o ar condicionado que simplesmente não ajustava a temperatura. Mesmo colocando na função de ventilação o aparelho continuava a gelar."
jan. de 2018,4,Bom custo benefício!,"Cama confortável, chuveiro bom, café da manhã muito gostoso! Tem ótima pizzaria no lob do hotel.  No quarto de casal tinha dois edredons de solteiro, solicitei na recepção um de casal mas não foi enviado. Devia ter uma placa indicando qual o estacionamento abaixo do hotel, pois é o mesmo do shopping Minascasa, na saída o estacionamento 1 estava fechado pois era domingo, tivemos que chamar os funcionários para abrir."
jan. de 2018,2,Desastre total,"Já havia ficado outras vezes neste hotel sem problemas, porém desta vez foi o caos.  Relação de problemas:    1 - Fiquei no quarto 812, ao lado de uma coluna hidráulica. Era só ligar a água que começava um zunido que demorava cerca de uma hora para parar  2 - na primeira vez que limparam o banheiro não repuseram o tapete. Conclusão, o chão do banheiro ficou todo molhado e sujo com o pisoteio.  2 - no dia seguinte, o quarto não foi limpo. em três diárias, só apareceram uma vez para limpeza do quarto. A explicação foi que era o dia da folga da menina da limpeza.  3 - CAFÉ DA MANHÃ: no 2º e 3º dia o caos estava instalado no restaurante:  3.1 - quando chegamos, havia muitas mesas vagas, porém todas sujas, com pratos e copos usados.  3.2 - quando conseguimos uma mesa, fomos nos servir mas não havia pratos. quando conseguimos os pratos, as frutas estavam q nem na chepa: só restinho amassado.  3.3 - o queijo havia acabado e só foi reposto porque pedimos, pois os funcionários sequer olhavam para os alimentos para ver se estavam precisando de reposição.  3.4 - A máquina de café/água quente estava desligada e para tomar um chá, tivemos que procurar um funcionário e pedir que trouxesse água da cozinha. era algo que deveria estar disponível junto ao buffet.  3.5 - no 3º dia só ofereceram copos descartáveis para o suco. Mas pra que: o suco de laranja com mamão tinha acabado e o de goiaba estava no fim... grosso pela decantação. Só quando já estávamos indo embora é que repuseram.  3.6 - as xícaras para o café acabavam a cada minuto.    O hotel estava cheio, porém o número de funcionários e insumos não era adequado. Eles não estão preparados para isso. Foi um caos.    Quando fui até a recepção para saber qual era o canal que eles tinham para reclamações, me orientaram para reclamar no Trip Advisor...."
