Data da opinião,Nota,Título,Conteúdo
ago. de 2018,3,Critica construtiva,"Adequar equipe de serviços ao numero de apartamentos alugados ou de pessoas envolvidas em eventos. Foi deficiente. Muito hospede para poucos funcionarios, fazendo com que o bufet ficasse desfalcado em varias oportunidades. Pouca vontade na reposição."
ago. de 2018,5,Muito arrumado e bem localizado,"Gostei muito do hotel, voltaria com certeza. Fui ao shopping a pé que fica localizado em frente ao hotel. Atendimento das recepcionistas nota 1000. Parabéns! Apenas a variedade do café da manhã poderia ser maior."
jul. de 2018,5,Hotel familiar,"O Hotel é muito agradável, Hotel bom para ir com família. Foge daquele conceito business. O restaurante é muito bom com Preço camarada. As camas são king size, os quartos são bem espaçosos, a qualidade do chuveiro é excelente. O café da manhã é bem variado e tudo muito bom."
jul. de 2018,4,Ótimo Hotel,"Muito boa a estadia, hotel amplo de muito conforto. Excelente café da manha. Área de lazer muito boa. Só vi uma diferença no atendimento pela equipe da recepção, pelo fato de eu ter feito a reserva através de aplicativo. Não me deram condições de pagamento porque fiz a reserva por aplicativo."
jul. de 2018,1,Não cumpre tarifa. Desonesto na cobrança.,"Não recomendo a viajantes corporativos que trabalham com controle de gastos mediante apresentação de notas fiscais. As Instalações e localização são boas.  Porém o hotel é desonesto na cobrança dos valores de tarifas, não cumpre tarifa tarifa acordada em site. Não emite corretamente nota fiscal de consumo.  Além de realizar muitas convenções com grupos externos que não se hospedam no hotel, porém atrapalham o sossego e mobilidade dos hóspedes."
jul. de 2018,5,Atendimento,"Equipe bem preparada e atenciosa, ótimo restaurante.Hoje experimentei o prato brasileirinho,estava divino,o ponto da carne estava sensacional.Localização do hotel atende todas as necessidades do dia a dia."
jul. de 2018,4,Hospedagem no Confort suítes flamboyant,"O atendimento dos funcionários do hotel foi maravilhoso, sempre simpáticos, prestativos e eficientes.  O quarto era bastante confortável, e as instalações oferecidas eram boas.  Tive problemas apenas com o ar condicionado que me deu muita alergia, e com ele desligado, o quarto ficou quente, por isso não consegui dormir direito. A exaustão do banheiro também não era muito boa.  Agradeço a hospitalidade de vocês."
jul. de 2018,5,Serviço excelente especialmente chefe Rafael,"Hotel super limpo organizado, quartos confortáveis, restaurante com picanha deliciosa! Atendimento no restaurante especial, low profile total! Ótimo para quem está a trabalho, pode ter seu momento no jantar de paz!"
jul. de 2018,5,AVALIAÇÃO CONFORT GOIANIA JUL/18,"Excelente localização, funcionários treinados, café da manhã muito bom, quarto e cama sem defeito, sempre que estiver em Goiânia com certeza me hospedaria novamente no HOTEL CONFORT SUITES FLAMBOYANT."
jul. de 2018,5,Muito bom,"Atendimento excelente! Muito profissional e cortês. Quartos espaçosos e muito confortaveis! Banheiros bem equipados. Estacionamento muito prático. Lugar muito bonito, proximo a shopping Flamboyant. Otima experiência."
jul. de 2018,4,Em Goiânia,"Foi a primeira vez que fico neste hotel em Goiânia. O hotel tem uma boa estrutura, atende bem as expectativas dos hóspedes quanto ao serviço. Funcionários bem educados e prestativos. O café da manhã é bem farto e tem comidinhas típicas da região, como pamonha, curau, etc. A área de lazer é bem atraente para crianças e adultos, mas a água é fria.  Localizado em frente ao shopping Flamboyant, o acesso pode ser feito a pé. Mas para quem pretende ir às feiras da lua ou do sol, precisa pegar um transporte. Os quartos são bem amplos e modernos. De modo geral, eu gostei."
jul. de 2018,5,Avaliação do Hotel,"Hotel com uma ótima recepção, café da manhã maravilhoso (com direito a uma diversa variedade de comidas e diversos sucos natuais da própria fruta). Localizado no centro de Goiânia e próximo ao shopping Flanboyan. Super indico!!"
jul. de 2018,5,Muito bom,"Excelente hotel , aconchegante e muito tranquilo, com um atendimento excepcional, possui também um buffet de café da manhã muito bom.Tem uma localização excelente, próximo ao shopping Flamboyant. Sem contar, que as instalações muito boas. Indico!!"
jul. de 2018,4,boa,"excelente recepção pela VITORIA, chec-out demorado.  a agua quente no quarto não funcionou corretamente nem na pia e no chuveiro, talvez precise dar uma manutenção neste quesito. No mais foi tudo perfeito"
jul. de 2018,4,Excelente hotel.,"Um pouco caro, mas a localização e o serviço são muito bons. Houve um pouco de demora no checkout. O café da manhã é muito bom. Quartos e banheiros excelentes. Estacionamento amplo. Destaque para a localização."
jul. de 2018,5,Muito bom,"Hotel muito bom, com acomodações excelentes, café da manhã com muita variedade. O silêncio e a qualidade das instalações garantem uma estadia tranquila. Funcionários bem treinados e muito educados. Recomendo"
jul. de 2018,4,Reforma do banheiro,"A estadia como sempre foi ótima. O banheiro foi reformado e o quarto ficou ainda melhor.    Chuveiro ótimo.    O café da manhã também é bom, no entanto já faz 8 anos que frequento o hotel e os itens permanecem os mesmos. Seria interessante ocorrer uma mudança."
jul. de 2018,4,Café da manhã delícia!,"Viemos, eu e minha família, tomar um café da manhã e fomos surpreendidos com um excelente bufê e uim ótimo e cordial atendimento. Estamos saindo muitíssimo felizes. Valeu a pena a mudança de cenário. Programão de férias!"
jul. de 2018,4,Recomendo!,"confortavel e ótima localização, em frente ao Shopping Flamboyant, o que ja facilita para as refeições e happy hour. achei a luminosidade um pouco baixa, mas é uma questão bem pessoal minha! no mais, acho uma boa opção."
jul. de 2018,4,Muito bom,"Hotel bem localizado, cama de boa qualidade e confortável, atendimento cortês dos funcionários. Recomendo. Em frente ao shopping. Estacionamento gratuito para hospedes. Cafe da manhã diversificado. Recomendo a todos."
jul. de 2018,3,Custo Benefício Ok,"Paredes muito finas fazem com que você ouça tudo o que acontece nos quartos ao lado.Atrapalha bastante o sono. Os atendentes do hotel não sabem sugerir passeios nem outro tipo de informação extra. Comida do restaurante ok,Ponto alto do hotel é a parte da piscina ( local bem cuidado e agradável)"
jul. de 2018,2,Hotel precisa se adequar a alta ocupação! Vale só a localização.,"Me hospedei pela localização. Perto do estádio onde ocorreu um tradicional evento de música. Dá pra ir a pé. Em frente há um shopping com vários bons restaurantes.    O check-in foi com demora. Muita confusão. Algumas pessoas pedindo para as recepcionistas imprimirem o ingresso do evento e outras perguntando sobre questões do estacionamento. Deveria haver um concierge fazendo isso.    O quarto é espaçoso, confortável e limpo. O ponto de consideração é pela roupa de cama e tolhas, pareciam de hotel categoria bem econômica. Além de eu abrir o frigobar e ver uma garrafa de água já aberta. Comuniquei a recepção e, evidentemente, não me cobraram.    O café da manhã é até razoável. Mas os serviços pedidos (omelete e tapioca) estavam demorando muito.    Nem usei a internet pois o sinal 4g estava funcionando bem.    Almocei no restaurante pela praticidade. Que erro. Pedi um salmão que veio quase cru por dentro e no peixe (filet) que minha esposa pediu veio seco.    Sem grandes eventos deve ser tudo mais fácil e tranquilo, além de muito mais barato. O interessante é que o evento já é conhecido na cidade e mesmo assim não conseguem colocar uma estrutura razoável para atender a demanda.    Paguei caro e não vi nada que compensasse."
jul. de 2018,5,Conforta Suítes Flamboyant,"Hotel moderno, com boa localização e com um ótimo atendimento. Funcionários sempre com sorriso no rosto!Lugar muito bom para se fazer eventos.  Camas muito confortáveis, especialmente a do quarto Business Class."
jul. de 2018,2,Refeições e atendimento,"Refeições e bebidas bem caras! Equipe da recepção demorada para fazer check out. Achei bastante desorganizada! Refeições do hotel muito caras e bebidas também! Porém, hotel limpo e bem localizado. Café da manhã bom."
jul. de 2018,5,Rápida,Serviço Sensacional. Fácil acesso. Belas mulheres no saguão. Café da manhã perfeito. Atenção de concierge e de colaboradores. Quartos espaçosos. Piscina com designe maravilhoso. Tudo muito higiênico e cheiroso.
jul. de 2018,5,Fiquei satisfeito,"Recomendo. Excelente localização, pessoal atencioso e quartos bem arrumados e limpos.  Fiquei 3 semanas hospedado e não tive nenhum problema.  Café da manhã excelente com boa variedade de alimentos.  Achei muito caro os itens do frigobar."
jul. de 2018,5,Otima estadia,"O hotel tem uma estrutura não convencional que é realmente atrativa, deixando-o bem bonito.  Os quartos são bem organizados e os chuveiros são de ótima qualidade.  Os serviços de restaurante possuem um preço justo.  O café da manhã é de excelente qualidade e variedade."
jun. de 2018,4,Bom e bem localizado,"Boa com restrições. Excelente localização, próximo de um shopping e um parque. Ótimo café da manhã. Atendentes atenciosos e gentis. Toalhas velhas e encardidas(necessidade de troca). Local tranquilo e silencioso."
jun. de 2018,4,Avaliação,Fui almoçar no hotel e não agradei do Buffet. Acho também que não deveríamos ser obrigado a ter que escrever 200 caracteres para poder enviar a mensagem. Um absurdo. Já tive que voltar aqui três vezes para tentar dar os 200 caracteres.
jun. de 2018,3,Excelente localização,"Hotel muito bem localizado, na frente do shopping Flamboyant e próximo ao Estádio Quarto reformado e confortável. Café da manhã bem variado e piscina maravilhosa. Estacionamento amplo e atendimento de qualidade. Recomendo."
jun. de 2018,4,Bom hotel,"Confuso a entrada porque é um estacionamento pago e não tem indicativo de ser do hotel, mas só entrando que vimos que era um só local, o chuveiro era ruim, muito antigo, a água cai de maneira desenforme café da manhã maravilhoso"
jun. de 2018,5,Avaliação Fabrisio Resende,"Excelente opção, muito confortável e organizado, bem localizado, academia completa e limpa, tem todos os requisitos para uma boa hospedagem em Goiânia, principalmente para quem vai a trabalho em Goiânia!!"
jun. de 2018,4,Caro pelo que apresenta de sofisticação.,"Pelo valor da diária o Hotel fica devendo um pouco no quesito sofisticação, pois apesar de ser confortável peca pela falta de cuidados acústicos na construção: corredores sem carpetes, portas comuns, piso cerâmico sem tratamento acústico. Alem de outros detalhes construtivos com baixa qualidade de acabamentos."
jun. de 2018,5,Ótima opção,"Ótima opção de hotel para hospedar em Goiânia. Próximo a shopping.  Bem localizado, não tem muito barulho nos arredores. A academia atende bem as necessidades, tem uma bonita piscina também.  Os quartos são confortáveis, espaçosos e atendimento é muito bom."
jun. de 2018,4,Hotel caro,"Hotel caro, cobra taxa de 10% por serviços a mais do que informado pelo booking, preços são diferentes do booking em relação quando se liga diretamente no hotel, estava em um casamento iria levar toda minha família (15 quartos) mesmo assim não teve nenhuma política de desconto"
jun. de 2018,5,Um dos melhores de Goiânia,"Hotel excelente em tudo! Ótimo atendimento, excelente localidade, em frente ao shopping Flamboyant, com restaurantes próximos tais como Outback e Mac Donalds. Próximo a BR 153 caso esteja viajando. Quartos amplos e espaçosos. Bem decorado e com limpeza impecável. O café da manhã é farto, e a área da piscina enorme. Ambiente muito bonito. Vale a pena para famílias e viajantes a negócio."
jun. de 2018,4,Hotel muito bem localizado e confortável,"Hotel muito bem localizado e confortável  Excelente CustoXBenefício. Hotel com fácil acesso aos principais pontos da cidade, atendimento muito bom dos funcionários, só não gostei muito do carpete no apartamento. Mas eles tem quartos reformados que não possuem mais carpete"
jun. de 2018,5,Localização excelente e bom café da manhã .,Boa localização e café da manhã excelente ! Check out prolongado até as 17 horas para quem almoça no hotel no domingo . Não precisa arrumar malas correndo . Área externa muito agradável. Ganhamos drinks de cortesia .
jun. de 2018,5,Hospedagem,"Serviços de limpeza excelente  Horário perfeito do café da manhã  Serviço elevador rápido  Recepcionista bem atencioso  Ambiente do quarto refrigerado, roupa de cama e toalhas otimas  Sabonete e shampoo boa reposição"
jun. de 2018,4,Hotel muito bom,"O hotel apresentava ótimas instalações, bem localizado, bom custo benefício, limpo e organizado. Apenas o chuveiro não esquentou o suficiente durante o banho. O restante da hospedagem foi excelente e não tenho reclamações."
jun. de 2018,3,Custo alto para apartamento inferior.,Apartamento inferior para o preço de superior. Já me hospedei outras vezes antes e desta vez não gostei. Mas com certeza Eu e minha família vamos voltar a nos hospedar no hotel. Sempre recomendo a rede de hotéis Comfort.
jun. de 2018,5,Surpreendente,"Fiquei surpresa com a qualidade do hotel, tanto das instalações, quanto da comida e do atendimento. Tudo perfeito do início ao fim. A decoração é linda, as áreas comuns são muito agradáveis. Muito perto do shopping (fomos andando duas vezes)."
jun. de 2018,5,Excelência de Atendimento,"Excelencia de Atendimento, melhor experiência que tive em minhas viagens profissionais pelo Brasil, exemplo a ser seguido por outros. Desde a chegada na recepção até o fim da hospedagem, no restaurante todos os pratos são de produtor frescos e bem ''montados''. MEGA RECOMENDO."
jun. de 2018,4,Hotel bem localizado com excelentes serviços,"Sempre que vou a Goiânia me hospedo no Comfort Flamboyant, o que faço pela localização, qualidade dos serviços e conforto dos apartamentos. O único problema que tive no apartamento 306, foi que achei o apto mto escuro, inclusive está com uma lâmpada queimada, o que prejudicou a iluminação, mas não cheguei acionar a equipe da manutenção."
jun. de 2018,2,"Despreparados, eu diria!","Atendentes ruins, mal humorados, não há edredon, a limpeza eh mal feita, uma funcionária bate na porta todos os dias de manhã perguntando se houve consumo. Totalmente descabido. Ou seja, vc não tem sossego para dormir. Sem contar a barulheira que fazem no corredor. Bem despreparos, eu achei. Tv nao tinha controle remoto, internet nao funcionou no notebook. Enfim. Prefiro mil vezes outros mais simples porém mais profissionais."
jun. de 2018,3,Não recomendo,Piscina suja o tempo todo durante toda minha estadia.  Serviços encomendados não cumpridos. No meu caso um café da manhã para comemorar um aniversário que nunca foi entregue.  Café da manhã com itens não muito fresco.
jun. de 2018,4,"""Muito bom mas...""","O hotel está muito bem localizado, em frente ao shopping e perto do parque flamboyant.  Estacionamento amplo e gratuito. O quarto é espaçoso, colchão é bom mas travesseiro muito mole. O café da manhã é bom. Está precisando de reforma - ainda tem carpete.  Fiquei no quarto 442 e no check-out reclamei de um barulho acima do quarto, porém a funcionária não deu muita atenção. Aliás esse é o ponto fraco do hotel - o atendimento dos funcionários."
jun. de 2018,4,Hotel excelente,"Hotel com ótima localização, próximo à Supermercados e Shopping. Conta com amplo estacionamento. Funcionários educados e atenciosos. Notamos a falta de apartamentos que acolham três pessoas. No mais, ótimo hotel. Aconselharia à amigos e parentes."
mai. de 2018,2,Hotel de Goiânia 3 Estrelas no máximo,"Alguns funcionário do check-out irônico, alguns despreparados profissionalmente para atuar em um 4 estrelas, muita falta de informação no check-in, vi funcionário que se espanta em alto e bom tom com desejo de hóspede na hora do check-in, nesse caso o hospede queria utilizar a academia pra correr na esteira e o funcionário disse bem alto"
mai. de 2018,4,Paragominas,"Hotel muito bom, localização excelente, em frente do shopping Flamboyant, café ótimo, quarto amplo, muito limpo, chuveiro excelente, não gostei do travesseiro, eles têm plástico e fazem muito barulho."
mai. de 2018,4,Um bom lugar para se hospedar...,"Bem legal! Ficaria novamente. Uma pena não ter usado a piscina devido ao clima. A sauna não tinha essência de eucalipto, a cama muito dura. O pessoal do quarto próximo fez muito barulho em hora imprópria, durante a madrugada. A localização é excelente. O serviço do restaurante muito bom, porém, as porções são pequenas pelo valor cobrado."
mai. de 2018,5,Otima localização em Barueri,"Nada a reclamar. Staff atencioso, localização excelente, quarto confortável, boa relação custo-benefício e serviço de modo geral muito bom. Espero retornar quando de minha próxima viagem a negócios na região"
mai. de 2018,1,"ótima estrutura, péssimo atendimento.","Os funcionários precisam aprender a ser mais transparentes com os hóspedes. Falaram que não iriam cobrar o meu estacionamento se eu me cadastrasse na recepção, mas em momento algum me falaram que estariam me cadastrando como hóspede. EU não tinha problema algum em pagar o estacionamento. NÃO ME HOSPEDEI NESSE HOTEL!!!!"
mai. de 2018,3,Cobrança de Taxa de Serviço,"O Hotel cobra uma taxa de 10% de serviços, os hospedes que estavam fazendo check out, todos sem exceção não sabiam dessa cobrança e reclamaram. Um funcionário falou que isso é normal e todos os hotéis cobram e que isso estava no contrato. Como viajo com frequência, desconheço essa cobrança.    Achei um absurdo e abusiva a cobrança, principalmente porque não sabia dessa taxa."
mai. de 2018,3,RC,"Piscina deve ser limpa pela manhã, logo cedo. Horário do café da manhã é muito bom das 06:00 às 10:30h. Não tinha carregador de malas. Quando fiz o check-in me deram um quarto que estava ocupado, mas foi resolvido prontamente."
mai. de 2018,4,Conforto e praticidade em estadia a trabalho.,"Os apartamentos são confortáveis e silenciosos. Mas prefira aqueles voltados para a área de piscina, que não sofrem a interferência do ruído de trânsito da avenida em frente ao hotel – que é extremamente barulhenta."
mai. de 2018,4,Hotel estratégico,"Ao lado do hotel estão construindo algo que produz muito barulho. Além de colocação de aparelhos de ar condicionado em parede contígua ao quarto que também gerou barulho ensurdecedor. No cafe da manhã, senti falta de alguns itens, tipo quinoa, cuscuz ( Branco e amarelo). No geral o considerei o hotel excelente!"
mai. de 2018,5,Excelente opção em Goiania,"Hotel em excelente localização, praticamente em frente ao Shopping Flamboyant e com fácil acesso a diversas opções de lazer na cidade.  Equipe atenciosa, hotel com boa estrutura. Vale a pena descansar na beira da piscina.  Café da manhã com muita variedade."
mai. de 2018,4,Excelente hotel urbano para ir com criança,"Hotel com um pátio razoável em frente à piscina muito agradável(mas gelada). Hotéis urbanos nem sempre têm espaço para as crianças correrem um pouco e esse surpreendeu, apesar de ser um estabelecimento com uma proposta mais executiva. Decoração da recepção bonita e bom atendimento. Estacionamento gratuito, quartos espaçosos e limpos (coube cama queen, cama extra e um berço). Banheiros datados necessitando reformas. Buffet de cafe da manhã excelente. Voltaria com certeza!"
mai. de 2018,4,Quarto,"muito boa estrutura, unica coisa que não gostei muito, o fato de os quartos serem de certa forma um tapete, acaba que, quem tem rinite alérgica a poeira fica com o nariz entupido, deveria achar alguma forma de zerar esta questão."
mai. de 2018,3,Simples e com bom atendimento,"O lobby é simples. O check in foi eficiente. Fiquei no andar térreo com a janela virada para a piscina (não é muito bom). Havia um degrau entre o quarto e o banheiro, com risco de tropeçar. O chuveiro era bom. O café da manhã era diversificado."
mai. de 2018,3,"Boa estrutura, boa localização, boas instalações, custo benefício compatível, mas falta aprimoraram o profissionalismo.","Bom acesso e localização, preço médio, ótimo estacionamento, infra estrutura física muito boa, quartos amplos, higiene impecável, alimentação muito boa. Ponto a melhorar: atendimento ao cliente (postura com indiferença ou frieza), apoio orientativo ao hóspede, agilidade nos serviços prestados."
mai. de 2018,4,Ótimo Hotel!,"Quartos espaçosos, piscina agradável, academia boa, atendimento agradável e café da manhã com boas opções e sucos saudáveis. Excelente localização não frente de restaurantes e perto do parque. Valeu a pena!"
mai. de 2018,3,"Precisa melhorar o cuidado com os hóspedes, quarto faltava cobertor e xícaras manchadas no café da manhã","Precisa melhorar o cuidado com os hóspedes, quarto faltava cobertor era cama dupla é só tinha cobertor pra uma cama, xícaras manchadas no café da manhã com aparência de suja, manteiga aberta sem lacrar."
mai. de 2018,5,Sincera.,"Quero destacar a qualidade profissional e pessoal da atendente Letícia Sousa, que muito contribui para uma avaliação positiva do quadro profissional do Hotel. PARABÉNS! São profissionais desse quilate que dignificam e garantem um retorno do cliente."
mai. de 2018,5,Conforto em Goiânia,"Quarto grande, limpo, cama muito confortável. Decepção só o salmão que comi no jantar, com uma crosta de massa por cima desnecessária. Café da manhã muito bom. Frigobar caríssimo. Boa sala de fitness. Ao lado de um shopping com opções de restaurantes."
mai. de 2018,5,hotel excelente!,"Eu e meu marido ficamos aqui um dia e fomos muito bem recepcionados pelo Paiva, o café da manhã e muito bom, o quarto é aconchegante e limpo! A piscina é ótima, bem limpa, os funcionários são bastante educados... enfim Adoramos!"
mai. de 2018,5,Excelente!,"Ótima estadia! Atendimento excelente, café da manhã com muitas variedades e saboroso. Área externa muito bonita, com piscina. Servem jantar com pratos elaborados a preço justo. Recomendo com certeza!!!"
mai. de 2018,5,Excelente!,"Sempre que vamos à Goiania nos hospedamos no Comfort Suítes Flamboyant, e nunca nos arrependemos. Hotel super confortável e limpo, bom café da manhã e funcionários muito atenciosos, além de uma excelente localização!  Super recomendo! 😉"
abr. de 2018,4,Muito bom,O hotel tem uma area de lazer muito boa. A piscina é grande. O café da manhã o atendimento é bom. Pena o cheiro do produto de limpeza que eles colicam nos quartos. Fiquei com dor de cabeca. Eles poderiam nunca mais passar estes produtos.
abr. de 2018,4,Excelente,"Ótima experiência, com check-in e check-out ágeis. A localização é ótima. fitness center bem completo. Piscina grande, boa pra nadar. Atendimento bom, mas o hotel recebe/recebeu vários eventos enquanto estive hospedado, o espaço do café da manhã pareceu não comportar toda demanda diferente de outra experiência que tive lá."
abr. de 2018,4,Bom atendimento,"O que mais gostei foi do bom até cimento dos funcionariis. Todos muito prestativos e dispostos a ajudar.  Os quartos são amplos e os moveis são novos, diferente de muitos hotéis que encontramos. Outro ponto positivo é a localização. Fácil acesso para diversos pontos importantes da cidade"
abr. de 2018,3,Avaliação da Ana,"O hotel é bom, o quarto é espaçoso, contudo achei a diária cara, no sentido de não valer 300 reais só para que eu pudesse dormir 1 noite.  Não tive tempo para aproveitar o espaço fitness, nem a piscina, por isso não posso avaliá-los."
abr. de 2018,3,Feddback evento,"Atendimento equipe de eventos excelente.  Atendimento recepção excelente também, em especial Leticia (turno manhã/ tarde).  Gostaria de destacar o ótimo atendimento, atenção e cordialidade do segurança Fernando, que mesmo não sendo sua função ajudou prontamente na sala de eventos.  A única coisa que poderia ser melhorado é a limpeza e qualidade dos quartos; meu apto tinha o box antigo e enferrujado e toalhas amareladas, no mais o hotel ganha em excelente atendimento."
abr. de 2018,3,Hotel que vale pela localização!,"Hotel bom com quarto espaçoso! Sua localização é boa, ficando ao lado do shopping! O aeroporto ficava a 15 minutos. Oferecem aos domingos um late check out, se realizar uma refeição no restaurante! O restaurante é bom! A piscina era bem grande, mas acabamos não a aproveitando!"
abr. de 2018,4,ótima relação custo benefício!,"hotel localizado ao lado do shopping, Espaçoso, limpo, bom café da manhã, organizado, boa academia e piscina. Perto do Centro Cultural. Boa opção sozinho ou em família. É um típico quatro estrelas, não espere fru-fru, mas muito honesto no que se propõe."
abr. de 2018,5,Otimo Hotel,"Ótimo hotel.  Funcionários sempre muito solícitos, rápidos e prestativos.  Café da manhã excelente, bem variado com muitas opções.  A localização também é ótima, em frente ao Shopping Flamboyant.  Recomendo o hotel para trabalho e lazer."
