Data da opinião,Nota,Título,Conteúdo
jul. de 2015,5,Incrível,"Assim que você chega, a imponência do lobby aliada a uma sofisticada decoração, te fazem ter a certeza que você está em um hotel de alto nível.    Todos os funcionários são gentis e prestativos. Ambos os restaurantes são maravilhosos. O buffet de feijoada do Narã aos sábados é excepcional. A melhor que já experimentei. O local é acolhedor e de bom gosto, com um atencioso atendimento.  No Arola você encontra um ambiente requintado e com serviço impecável e de primeira linha. O bartender acertou em cheio a escolha do drink e a sommelier recomendou dois vinhos perfeitos para a harmonização dos pratos.    O SPA foi uma experiência a parte. Com as mais diversas opções de massagens e massagistas nativas da Tailândia, foi definitivamente a melhor massagem que eu já fiz na vida, de bem estar e harmonia.    O quarto é espetacular, extremamente confortável. Café da manhã variado e de qualidade.    Além de ser localizado em um ponto privilegiado de São Paulo, se você preza por excelência e exclusividade, sem dúvida o Tivoli traz tudo isso."
jul. de 2015,3,Local conveniente,"Simpatico é eficaz atendimento, lamentavelmente me colocaram ao lado dos obsoletos elevadores, foi impossível ter um sono tranquilo, pois a cada subida e descida dos mesmos parecia um Boing decolando ou aterizando..."
jul. de 2015,5,Excelente,"Um hotel que entende que o atendimento é tudo. Boa estrutura em localização privilegiada. Suíte Collection muito boa. Mas o que faz realmente a diferença é o staff, primorosamente treinado para garantir uma estadia inesquecível"
jul. de 2015,4,Profissional e elegante!,"Pessoal qualificado e treinado, bastante atencioso. Na recepção não se perde tempo e as informações são precisas. Garagem muito cara, Pelo refinamento do hotel os elevadores precisam ser reformados pois são muito barulhentos; Banheiros dos quartos não reformados merecem ser reformados para ficar no nível do hotel."
jul. de 2015,5,Ótimo atendimento independente de quem vc é!,"Eu e meu noivo compramos pelo Groupon uma estadia na suite Classic Room para nossa noite de nupcias. Entramos em contato com o Hotel para fazer nossa reserva perguntando se seria possível fazer o early check in para deixarmos nossas coisas no quarto antes do casamento. Fomos atendidos pela Sra Giovanna Elia que além de fazer o trâmite necessário para realizarmos o check in as 9 da manhã, estendeu nosso check out em 2 horas e gentilmente realizou um upgrade em nossa reserva nos proporcionando estadia na suite Collection Plus (sendo que nosso voucher dava direito ao Classic Room). Foi uma experiência maravilhosa, tanto pelo quarto perfeito em que ficamos hospedados, pelo café da manhã farto e decioso, quanto pelo atendimento maravilhos que recebemos no Hotel (em momento algum recebemos tratamento diferenciado por ter adquirido um voucher). Vamos voltar, com certeza! Para comemorar nosso 1o. ano de casamento (com ou sem voucher rs)"
jul. de 2015,3,Não vale a pena,"Inadequado pra quem tem problemas respiratórios, rinite atacou.    Multa por cigarro no valor de R$ 250,00 deve ficar clara nos quartos e checkin, péssima surpresa.    Todas as multas devem ficar claras, afinal é feito um depósito calção na entrada."
jul. de 2015,5,Maravilhosa noite romântica!,"Reservei um pacote de noite romântica em um fim de semana. A suíte era maravilhosa, ganhamos uma garrafa de champanhe, café da manhã no quarto e uma massagem incríve no spa! Recomendo a todos os casais esta experiência!"
jul. de 2015,5,"Luxo e requinte por fora, cliente se sente em casa dentro","Hotel excelente, mas tive um problema com uma informação. Minha esposa ligou para falar comigo e o recepcionista disse que havia chegado acompanhado da festa da Avianca, quarta-feira à noite. Na realidade, subi acompanhado do grupo de jornalistas convidados para o evento, mas isso não foi explicado e gerou um constrangimento e desconfiança muito grande por parte de minha esposa. As ligações dela - mais de 4 seguidas - mostram a intensidade desse constrangimento."
jul. de 2015,5,31 anos de lua de mel 5 estrelas!!,"Comomoramos nossos 31 anos de casamento adquirindo o pacote romântico com direito a spa e menu degustação. Foi excelente.  Faço apenas uma crítica construtiva sobre a qualidade dos hobbyes que nos entregaram. Nao condizem com o nível do hotel, Estavam velhos e puidos. O rádio do quarto não pegava nenhuma estação e para colocar o Ifone ou Ipod só atendia se tivessemos um Ifone abaixo de 4, que não é o caso. Do resto, foi tudo maravilhoso! Atentem-se a estes pequenos detalhes!! Obrigada por tudo!!"
jul. de 2015,2,Cobrança em dobro,"Na saída fiz o pagamento das pendências e depois de um dia que tinha saído fizeram a cobrança outra vez. Tentei falar com o hotel 3 vezes e sempre ficavam de dar o retorno e nunca retornaram. Desisti de discutir por pouco, mas fica recomendação: o hotel é ótimo, o atendimento tb, mas garantam todos os recibos possíveis."
jul. de 2015,5,Sempre uma excelente escolha,"O hotel é perfeito para um fim de semana romântico. Ja havia ficado no Moffarej antes da Tivoli compra-lo, e posso afirmar, o hotel melhorou 100%. O quarto collection que eu fiquei tem tudo, é moderno, iluminação linda, indireta, suave. O banheiro é super moderno e grande. Tem até uma maquina de Nespresso no quarto. Todos os funcionários sem exceção são atenciosos e simpáticos. Achei um pouco caro o serviço de carro do hotel (taxi particular). O melhor é voce mesmo chamar um Taxi particular, aqueles pretos, que o preço vai ser por volta de 40% mais barato. O restaurante Argola na cobertura é imperdivel, com a melhor vista de São Paulo. O Hotel, mesmo apos anos na ativa, continua sendo TOP 3 de São Paulo. Recomendadissimo!!!!"
jul. de 2015,5,Negócios,"Se você não abre mão de conforto,  luxo e sofisticação, fique nesse hotel. As suítes recém reformadas estão realmente lindas! O café da manhã extraordinário. As áreas comuns muito bem decoradas! Nota dez para a equipe de vendas, em especial o Sr Rafael Peloi, que não limitou esforços para buscar uma tarifa especial para minha empresa."
jul. de 2015,5,Fantástico,"Hotel maravilhoso! Passei meu dia de noiva lá e minha noite de núpcias.Todos do hotel muito simpáticos e solícitos. Já conhecia o hotel por ter me hospedado uma noite, adorei e por isso escolhi para noite de núpcias. Com certeza voltarei a me hospedar."
jul. de 2015,4,Muito bom,"Hotel muito bom, boa recepção, só tivemos problema com um elevador, porém foi um problema pequeno. Não tivemos oportunidade de verificar todas instalações mas acredito que tudo fosse ótimo pelo pouco que ficamos"
jul. de 2015,5,Feriado incrivel,"Maravilhoso hotel tudo lindo e aconchegante, facil acesso e estacionamento rapido e seguro, quarto e banheiro limpo e cama confortavel, silencio otimo serviço de quarto, assim que saimos já arrumaram nosso quarto em menos de uma hora de utilização"
jul. de 2015,4,Qualidade,Ótima receptividade. Perfeito para o público que gosta de bom atendimento e ótimos lugares. Com uma equipe treinado para atender qualquer necessidade dos seus hóspedes. Cozinha preparada para todos os gostos.
jul. de 2015,5,Excelente,Hotel e maravilhoso atendimento de excelência tudo de primeira qualidade um hotel desse padrão e difícil de encontrar  Deixo meus agradecimento a gerente que falou comigo não me lembro o nome mais e muito educada e prestativa parabéns a toda equipe recomendo essa experiência
jul. de 2015,5,Atendimento espetacular,"Atendimento fora de série, quartos extremamente limpos. A cortesia é o mantra das pessoas que trabalham no hotel. Numa noite chegamos de um restaurante já eram 0:30hs e desejávamos beber algo no bar e apesar de anunciado que este ficava aberto apenas até à Meia noite, vimos que o garçon ainda estava lá e perguntamos se poderia nos servir, e fomos prontamente atendidos sem que nos apressassem à sair. Não existe outra avaliação a não ser, espetacular!"
jul. de 2015,5,Parabéns,"Atendimento único e especial. A Hospedagem foi impecável graças ao atendimento excepcional de toda a equipe. Fiquei hospedado a trabalho e pude perceber a preocupação na qualidade do meu descanso e demais solicitações que realizei ao hotel. o Café da manhã foi magnifico, e todos os restaurantes oferecem um cardápio excelente. Em destaque o Arola que é fantástico. Recomendo a todos."
jul. de 2015,4,bom,"boa, nada excepcional. Mais importante que a aparência é a qualidade do atendimento. O hóspede tem que se sentir importante, mais importante do que o hotel. Este conceito não se aplica ao Tivoli de forma geral. O pessoal é jovem e ainda precisa experiência."
jul. de 2015,4,Um hotel excelente.,"Penso que os serviços, de um modo geral, pelo alto nível do hotel, poderiam melhorar um pouco. Alguns pontos estratégicos, do hotel, ainda carecem de melhores práticas. O Ckeck-in, por exemplo, passa, em algumas ocasiões, das 15h. Isso é inaceitável. As refeições, nos quartos, poderiam ter um cardápio melhor e mais variado."
jul. de 2015,5,DESCANSO,"Excelente opção em São Paulo. Os quartos foram reformados e ficaram ainda mais modernos e aconchegantes. Muito bem localizado, serviços impecáveis. Todos os funcionários muito qualificados e bem treinados."
jul. de 2015,4,Noite de Nupcias,"Atendimento ótimo, porém não foi possivel late check out, e devido a ocasião, acredito que fosse interessante abrirem essa exceção. Refeições realizadas no quarto muito boas!!! Roupa de cama e banho ótimas! Muito silencioso!"
jul. de 2015,5,Segunda lua de mel!!!,"Excelente estadia, bem como atendimento.  Serviços e qualidade impecáveis.  Única ressalva seria em relação ao café da manhã (serviço de quarto),  que poderia ter opções de frios.  Em relação ao SPA, serviço, atendimento e ambientes excelentes."
jul. de 2015,5,HOTEL IMPECÁVEL,"Estive no Tivoli Mofarrej à trabalho e, confesso que me surpreendi com o hotel! O Design é muito interessante, uma decoração muito leve e sofisticada. As acomodações são amplas, confortáveis e super bem servida. O café da manhã era bem generoso e com variedades de pães, frutas e até mesmo, tapioca feita na hora. O melhor de tudo, é a proximidade do hotel com a Av. Paulista e o famoso ''Xing Ling'', onde fiz a festa! O preço é que talvez assuste alguns! Mas super indico para quem quiser gastar mais em uma viagem para São Paulo!"
jul. de 2015,5,Muito bom,"Hotel enorme, com ótimos restaurantes, excelente equipe, funcionários preparados para receber estrangeiros, várias opções de salas de reunião e espaço de eventos, perfeito para eventos corporativos. Ótima localização próxima a av. Paulista."
jul. de 2015,4,Comemoração de Bodas de Prata,"O café da manhã deveria ter frios e mais opções de bolo doce, porém o atendimento foi rápido e a comida excelente.  A caixa de chocolate com somente 4 unidades, é muito pouco, principalmente pela ótima qualidade. Aconselho 12 unidades.  Quanto ao demais itens, tudo estava a contento."
jul. de 2015,4,Muito bom,"Bem localizado, atendimento rápido e descomplicado, todos muito receptivos e simpaticos, ambiente agradavel. Super indico. Decoração de muio bom gosto, muita discrição no atendimento e cordialidade, recomendo."
jul. de 2015,5,Vista para o parque!,"O hotel é lindo, bem decorado e muito bem localizado (Pertinho da Paulista).    O café da manhã é maravilhoso! Bastante farto e variado.    O bar e a piscina são deliciosos para comer e relaxar.    Mas o que eu mais gosto é a vista. Peça um quarto com vista para o parque!    Além disso, o Arola Vintetres, restaurante localizado no 23 andar é maravilhoso e com uma vista espetacular.    Dois pontos negativos: a internet é cobrada e a qualidade dos secadores de cabelo do hotel (para um hotel 5 estrelas, deveria ser no mínimo taiff).    Destaque especial para o funcionário Felipe. Sempre simpático e disposto a resolver qualquer contratempo."
jun. de 2015,5,Excelente escolha. Recomendavel. Muito boa opção.,Muito Recomendo este hotel. Boa relação custo benefício. Bons quartos e boa cama. Nível superior. A repetir. Não tenho mais nada a acrescentar. Esta parte do questionário é uma grande seca. Deveriam reduzir o nível de exigência. Não há paciência para mais.
jun. de 2015,4,Noite de Núpcias ... única ressalva café da mh no quarto,ótimo ... ressalvas apenas sobre o café da manhã no quarto! Os pães estavam frios ... O suco quente e o leite gelado quente .... Achamos a variedade muito reduzida tratando-se de um café da mh após noite de núpcias ...
jun. de 2015,4,Muito bom,"Hotel bem situado, com infra-estruturas confortáveis e muito bem decorado. Os quartos superiores são muito confortáveis, amplos, com camas grandes e lençóis excelentes. Banhos muito bons.  Serviço irrepreensível e muito atencioso."
jun. de 2015,3,atraso Check in,O Hotel é excelente e com acomodações adequadas.  Porém em minha última estada houve atraso de mais de 1 hr no meu check in....e eu tinha compromissos posteriores.  Ao meu ver isso não poderia acontecer nunca nesta categoria de hotel.
jun. de 2015,4,Muito Bom o Hotel em um todo,"O Hotel é indescutivel, honestamente muito bom, a unica coisa que não gostei foi o desencontro de informações na hora do Checking, onde eu escoli uma suite e após confirmada foi dito que não tinha mais, mas que seria feita um upgrade....até ai sem problemas, que otimo pensei!!  Me colocaram na suite presidencial por falta de opção, mas após nos levarem a este local e depois da porta fechada, varios funcionarios, mais precisamente 3 funcionarios, abriram a porta e entraram para trancar as demais suites que ficavam dentro desta suite presidencial....sem perguntarem ou avisarem....Pergunto se tivessem visto minha mulher Nua??? Confusão na certa, correto?? Fiquei bastante desapontado com o serviço de checking e a falta de comunicação."
jun. de 2015,5,viagem,"estadia perfeita ,ótimo para hospedar-me com minha família, indico facilmente para os amigos porque o atendimento foi ótimo em todos os sentidos,na limpeza,e principalmente no atendimento, desde a hora que saí do carro"
jun. de 2015,5,Um dos Melhores em SP,"O Tivoli Mofarrej está localizado na Alameda Santos. Junto com o Renaissance, é um dos principais hoteis de luxo de SP. Destaque para o staff ultra atencioso e para o restaurante Narã - com uma sommelier que indica os melhores vinhos e uma culinária cuidadosa. Bar da piscina é excelente."
jun. de 2015,5,Luxo em São Paulo,"Ótimo hotel, estadia perfeita. Estive com minha esposa e nosso cachorro, e os cuidados com nosso pet é conosco foram perfeitos. Apesar de antigo o hotel é lindo com uma recepção maravilhosa. Vale o que se paga! Com certeza este será meu hotel nas próximas estadias em São Paulo!"
jun. de 2015,5,Recomendadíssimo,"EXCELENTE!! otima localizacao, muito aconchegante, limpo, atendimento com muita cortezia e prestatividade. Parabéns!  A Entrada do Hotel com plantas nos remetem a uma atmosfera de tranquidade. Pena que nao tivemos tempo de desfrutar do restaurante e outros serviços. Voltaremos."
jun. de 2015,5,Perfeito,"Hotel maravilhoso! Serviço de limpeza impecável, café da manhã perfeito, funcionários muito bem treinados (especialmente a equipe de conciergeque nos atendeu de maneira eficiente e muito cordial!).  Pedimos um late check out em razão do voo e fomos atendidos prontamente!.  Recomendo!"
jun. de 2015,2,Decepcionante,"A recepção do carro pelo manobrista foi difícil pois estavam descarregando o que me parecia ser coisas de maquiagem para uma noiva (obviamente deveria estar sendo feito em outro lugar e não na entrada dos hóspedes). Depois de termos descido e descarregado o carro eis que chega o manobrista cheio de amor pra dar atrás de uma gorjeta... Na recepção a mocinha não encontrava nossa ficha impressa o que levou a impressão de uma nova e mais algum tempo foi perdido aqui. O quarto no sexto andar apesar de grande não tem nada de especial. Já no banheiro, feio e super datado, percebesse a idade do hotel. Comemos no próprio hotel no Nara, uma experiência que preferimos esquecer. Tentamos o serviço de quarto para complementar o malfadado jantar e isso funcionou bem chegando em cerca de 30 minutos, exatamente como pedido. A noite foi tranquila com poucos barulhos do corredor. Fomos para o café da manhã bem cedo e pegamos o restaurante virtualmente vazio. A variedade de opções e a qualidade dos itens é excelente. O serviço contudo está longe de ser bom (principalmente considerando o salão vazio). Tivemos que abordar o garçon para pedir que servisse café e chá. No checkout até tentei pontuar os problemas listados mas depois de ter sido interrompido duas vezes pelo recepcionista percebi que estava jogando palavras ao vento.... Finalizando aguardamos cerca de 15 minutos pelo carro (um absurdo para um sábado 7 de manhã). Uma decepção. Sendo membros Unlimited do Leadears Club do The Leading Hotels of the World e esperávamos um atendimento melhor e um hotel do mesmo nível dos outros hotéis que carregar a marca LDW. De todos os hotéis do Leading que já ficamos o Tivoli é o único que decepcionou."
jun. de 2015,4,Hotel muito bonito e com localização excelente,"Reservei um quarto para a passagem de ano, pois no hotel ocorre uma famosa festa de Reveillon organizada por uma das melhores empresas de eventos de São Paulo.    O hotel possui uma localização muito boa, ao lado do parque Trianon (Ten. Siqueira Campos), e está a apenas um quarteirão da Av. Paulista. Próximo de um grande shopping recém inaugurado, e de vários restaurantes e bares dos Jardins, além da já famosa Oscar Freire para compras.    A área da piscina é bastante agradável e o serviço de bar é muito bom. O quarto em que fiquei já faz parte dos reformados, na época nem todos os andares já tinha passado pela revitalização. Além de ser silencioso era amplo e com decoração de bom gosto.    A festa que participei ocorreu nas imediações da piscina e do restaurante principal, mas na hora da passagem de ano pude subir para o heliporto do hotel, a vista é maravilhosa a noite, se tiver oportunidade não deixe de subir, inclusive um restaurante muito bacana fica no último andar.    Foi ainda me concedido um ""late check out"" sem cobrança adicional, fui o tempo todo muito bem atendido por todo staff do hotel, sempre cordial e solicito.    Tem a minha melhor recomendação."
jun. de 2015,5,Inesquecível experiência,"Sim, é preciso ir, desfrutar e avaliar pessoalmente.  Serviços muito bem prestados, com a excelência que a cidade exige, sem falar da vista maravilhosa do parque.  Indico para visitantes da cidade, ou simplesmente para os moradores que ainda precisam conhecer o que esta cidade realmente tem de bom a oferecer!"
jun. de 2015,5,Lindo hotel,"Belo hotel, quartos espaçosos e confortáveis, em ótima localização. Restaurante conceituado, com uma maravilhosa vista da cidade de São Paulo. Recepção eficiente e lobby impecável. Voltarei em breve.."
jun. de 2015,4,Entregam o que prometem,"O check in na Recepção foi impecavelmente feito pelo Sr. Rodrigo com muita distinção. Ao chegar, tudo já estava preparado e em menos de 2 minutos minha chave já estava à mão. O Room service também funcionou de forma eficiente e rápida."
jun. de 2015,4,Ótimo,"No check in tive um atendimento de excelência, mesmo com um pequeno mal entendido (por parte da minha equipe na reserva) a solução foi rapidamente resolvida. O café da manhã estava sensacional e os atendimento nessa área foi nota 10. Achei um pouco confuso e demorado ter acesso ao wi fi, era pago, mas havia uma opção gratuita desde que uma fica fosse preenchida e uma parte desta mesma ficha ficasse comigo, tornando-me membro de algo que não entendi exatamente o que era, fora isso o wi fi funcionou perfeitamente. os quartos são excelentes, muito confortáveis, achei muito elegante oferecer algumas águas gratuitas, mas no banheiro não foi muito simples entender porque fica saindo água da banheira enquanto estava usando o chuveiro. O hotel como um todo é extremamente agradável, em especial a piscina, que é cor de laranja. O atendimento é o ponto alto, absolutamente todos foram muito educados, gentis e prestativos."
jun. de 2015,3,Esperava mais de um dos melhores hoteis de São Paulo,"Quarto do oitavo andar não tem manutenção, antigo e em condições que não correspondem a um 5 estrelas em nenhum lugar do mundo. Banheiro mantém revestimento e estilo da década de 90.  O room dining deixa muito a desejar, pedi um penne muito razoável, esperava mais de um dos melhores hoteis 5 estrelas de são paulo."
jun. de 2015,3,Quartos precisam update,Um hotel 5 estrelas não ter chinelos no quarto é um detalhe não aceitável. Uma banheira com cortina plástica é igualmente incompatível com hotel de luxo. xxxxxxxxxxxxxxxxxxxxxxxxxxxxxxxxxxxxxxxxxxxxxx
jun. de 2015,5,Excepcional,"Não tem nada que eu não tenha gostado. Amei cada minuto, cada detalhe e não posso deixar de falar do atendimento INCRÍVEL, educado e delicado. Pretendo voltar assim que for para São Paulo novamente.  Super Indico o Restaurante do andar 23. Visitem a ADEGA!"
jun. de 2015,4,HOTEL DE CATEGORIA INTERNACIONAL,"Fiquei em uma suíte, que estava igual a minha hospedagem de 28 anos atrás, apesar do tempo ainda é de bom gosto.  O serviço de quarto, foi ótimo, principalmente o lanche. Não consegui fechar a torneira da banheira, que ficou vazando a noite inteira"
jun. de 2015,5,Top,"O hotel mais top que ja fiquei, super chique e sofisticado, o quarto é inteiro con paredes de vidro, a paisagem é incrível, o café da manhã é um verdadeiro banquete. Caro, mas vale a pena para uma comemoração especial."
jun. de 2015,5,Perfeito em todos os detalhes,"Acho que é o único hotel da cidade que oferece early check-in gratuito, isso foi um ponto muito forte para a nossa estadia. Recepção muito cordial e agradável, os quartos são super espaçosos, o café da manhã fantástico, muitas frutas e o melhor, eles servem tapioca feita na hora, sem falar da localização do hotel que é perfeita."
jun. de 2015,5,Otimo,"Que hotel!!!!  Só tenho elogios maravilhosos para fazer!!!  Da atendente a gerência tudo perfeito!  O valor é justo ao atendimento! Segurança muito boa e num dos lugares mais gostosos de São Paulo!! Super indico a todos que querem conforto , segurança e elegância"
jun. de 2015,4,Muito Bom,"Participei de uma reunião de trabalho e gostei muito do Hotel. Muito luxuoso. Aconselharia para outras pessoas sim o Tivoli São Paulo Mofarrej.  Não usufrui de todos os serviços, mas o quarto, recepção, hotel e salas de reuniões são excelentes    Wagner"
jun. de 2015,4,Muito bom!!!,"Adorei o Tivoli. Gostei muito do quarto, achei confortável e limpo. O serviço é excelente, com funcionários solícitos e muito educados. A localização é excelente, próximo de tudo. Me hospedaria novamente e recomendaria esse hotel com certeza."
jun. de 2015,4,Mais uma boa experiência,"Excelente experiencia no Tivoli, mais uma vez, cabendo uma reclamação apenas em relação a impossibilidade de usufruir do café da manhã, em razão da demora no check out. Por 5 minutos, perdi o café da manhã e o gerente que realizou meu check out não tentou contato com o restaurante para verificar a possibilidade de atendimento. Ressalte-se que o café da manhã foi perdido por apenas 5 minutos, cabendo ressaltar que tive que aguardar o gerente para o meu check out um longo período, já que o primeiro atendente estava em semana de treinamento."
jun. de 2015,5,Impecável,"O hotel é impecável. Atendimento, acomodações, restaurantes...tudo é muito bom. Esses aspectos aliados à uma excelente localização: nobre e acessível fazem do Tivoli Mofarrej São Paulo um hotel completo e impecável."
jun. de 2015,5,Local Excelente para hospedagem a trabalho ou lazer,"A estrutura do hotel é impecável, atendimento também.    Fiquei muito satisfeito com a hospedagem, o atendimento e o café da manha, do sono ao banho de piscina e sauna tudo foi muito bom.  Recomento ao todos."
jun. de 2015,5,Maravilhoso,"Estão de parabens pelo atendimento, pelo SPA e pela qualidade dos serviços prestados.  Foi uma noite inesquecivel, onde comemoramos 26 anos de casamento, seguramente foi a melhor comemoração que fizemos."
jun. de 2015,5,excelente,"gostei muito, voltarei outras vezes  demorou um pouco no checkin  alimentação boa, limpeza do quarto impecável, colchão muito bom, elevadores rápidos, muito bem frequentado e localizado. Vale a pena e voltarei"
