Data da opinião,Nota,Título,Conteúdo
abr. de 2019,3,Quase perfeito,"Com uma excelente localização, no Jardins na esquina da Lorena com a Campista, está unidade hoteleira está perto das melhores lojas e restaurantes da região e fica a 6 quadras da Paulista.  Os quartos são bastante confortáveis, o atendimento é impecável e o serviço só fica devendo porque em virtude da recente mudança da rede hoteleira proprietária, as toalhas dos quartos que ainda são da anterior estão em péssimo estado de conservação e o café da manhã é servido em pratos, copos e talheres de plástico.  Acredito que tão logo estás falhas sejam regularizadas, mereça uma classificação melhor. $$$"
abr. de 2019,2,Por ser Quality deveria ser muito melhor,"Cama ruim, quartos mal conservados com paredes encardidas, café da manhã fraquíssimo. Atendimento no restaurante muito devagar, foi necessário levantar e solicitar o garçom todas as vezes. Localização excelente."
abr. de 2019,5,Avaliação,"Ótima estadia, conforto e boa qualidade. Localização boa e serviços excelentes. Colaboradores educados e simpáticos. Higienização boa, banheiros muito bons. Serviço de hotelaria muito bom. Preço acessível."
abr. de 2019,3,Fiquei desapontado com a conservação do quarto,O Atendimento e serviços em geral são bons. Porém o quarto 809 no qual eu me hospedei estava em péssimo estado de conservação. Gostaria de saber se as habitações estão sendo reformadas e que isso será um evento isolado... pois meus pais são investidores e o estado das mesmas influência diretamente na ocupação do Quality Paulista.
abr. de 2019,4,ótima,"hotel com ótima localização, acomodações boas, a unica coisa que não gostei foi que foram fazer a limpeza do quarto as17 hrs no sabado e eu e minha esposa estavamos descansando, a camareira só limpou o banheiro e trocou as roupas de cama, não passou nenhum pano no chão para retirar a poeira, mas fiquei bem satisfeito com a estadia."
abr. de 2019,4,Um bom custo beneficio,"Excelente localização, quarto mediano , alguns problemas pontuais como: as toalhas de banho muito surradas, café da manhã prejudicado devido à reforma da cozinha e o quarto não estava bem limpo. Apesar disto, fomos maravilhosamente bem recebidas pelo David com sua alegria, carinho, disposição e bom humor , que nos antecipou o check in, o que nos trouxe o conforto providencial diante de um dia muito cansativo ! Muito obrigada David! Por um mundo com mais pessoas assim!"
abr. de 2019,4,Hotel agradável,"O ponto mais positivo é a cordialidade dos empregados da recepção . A localização é boa para quem viaja a negócios , porém não é recomendada para quem pretende ficar próxima a Avenida Paulista. Os quartos são amplos, mas necessitam uma melhor manutenção , com renovação de pintura e de mobiliário"
abr. de 2019,5,EXCELENTE HOTEL NO CORAÇÃO DO JARDINS.,"Fiquei pela primeira vez hospedada neste hotel no período de abril de 2019, com toda a família incluindo uma idosa e eu que sou portadora de deficiência física e achei maravilhoso nos quesitos: atendimento, localização, higiene e conforto dos quartos. O hotel fica muito próximo a todos os melhores restaurantes e lojas de SP, permitindo o acesso a eles não apenas por carro mas também a pé. Espero retornar a ele inúmeras vezes. Ressalta-se que o valor cobrado é proporcional ao que oferecem. Vale cada centavo."
abr. de 2019,5,Diária muito boa,"Boa tarde Amigos leitores,  Excelente hotel, muito bem localizado, quarto muito bom, café da manhã com bastante opções, atendimento excelente.  Piscina muito boa bate sol para quer quer pegar uma cor.  Super recomendo."
abr. de 2019,4,Avaliar para melhorar,"Considero importante esse modelo de avaliação, vez que permite aos hóspedes a oportunidade de externar sua opinião sobre a qualidade de hospedagem, e a rede hoteleira de corrigir as falhas quando houver."
abr. de 2019,4,Execelente relação custo/beneficio,"Muito bom, equipe atenciosa, acomodações limpas e confortáveis, excelente café da manhã, localização muito boa. Quartos muito bem conservados e limpos, lencois novos, conforto acustico excelente. Perto de vários restaurantes e lojas dos Jardins."
abr. de 2019,4,Fim de Semana em São Paulo ( Maratona de SP),"Hotel com ótima localização, bons restaurantes próximos e muito próximo ao shopping,hotel perfeito e com um ótimo café da manhã, quarto muito amplo e limpeza impecável, todos os funcionários sempre solícitos."
abr. de 2019,1,Pardieiro,"Péssimo, banheiro sujo , tampo do vaso com respingo de urina, mofo na banheira, sabonete usado na saboneteira do chuveiro, sofá todo sujo. Móveis velhos . Péssimo atendimento na recepção e camareira.Foi o pior hotel que hospedei em São Paulo."
abr. de 2019,3,Ótima localização,"Hotel bem localizado, oferece um bom café da manhã, porém, muitas vezes falta pratos, copos e xícaras e a reposição nem sempre é tão rápida quanto gostaria.  Estão precisando melhorar a limpeza e manutenção dos quartos."
abr. de 2019,1,PÉSSIMO ATENDIMENTO NO BALCÃO- FUNCIONÁRIA SEM PREPARO,"Na verdade, nem me hospedei, fiz por um site de reservas, cheguei meio dia e falaram que a reserva estava confirmada,mas só poderia entrar após as 14 horas. Como.ri há reunião, me deixaram subir na a academia para trocar de roupa. Ao chegar à noite, uma funcionária de nome PAULA, mal educada, despreparada e sarcástica i formou que estava cancelada a reserva e que não haviam quartos. Mostrei a confirm7no celular e ela não deu atenção. Some te depois de chamar o gerente é que um outro funcionário começou a buscar na rede quartos. Nós transferimos para um hotel distante. O que mais irritou foi o descaso e o sorrisinho sarcástico da PAULA. Me senti um lixo. Constrangido. Impotente e refém. Judicializar talvez seja a.solução pelos danos morais."
abr. de 2019,5,Boa localização e café da manhã excelente,"Hotel com localização muito boa, bairro seguro, proximo a bar, restaurante, padaria, posto de combustível, táxi. Equipe muito educada e prestativa, café da manhã exeleexce, quartos confortáveis e aconchefaacon, hotel sempre limpo e organozado, wi-fi sem problema"
abr. de 2019,5,Muito Satisfeito!!!,"Excelente Hotel, recomendo Demais, funcionários atenciosos, ótima localização, acomodações confortáveis, excelente condições de limpeza, café-da-manhã com muitas opções. Com Certeza voltaremos assim que seja possível estar em São Paulo novamente (Amamos Tudo)."
abr. de 2019,3,Bom custo beneficio com muitas falhas,"A avaliação geral do hotel fica positiva devido sua localização. A equipe de recepção é simpática e prestativa. A equipe de cafe da manha é ineficiente. A equipe de limpeza de quartos é péssima. Num edificio tao bem construído e localizado, vale a pena investir na correção das falhas, que me parecem apenas falta de treinamento."
abr. de 2019,1,Péssimo,"Qualidade péssima  Péssimo atendimento, principalmente do restaurante na hora do almoço .  Não volta mais.  Estava gestante e só fiquei lá pela comodidade de estar hospedada no mesmo local do evento. Para não precisar sair para almoçar, enfim. Nada adiantou."
abr. de 2019,1,"Péssimo atendimento, enganam o cliente quanto aos valores das tarifas","Tivemos uma péssima experiencia quando nos hospedamos no Quality Paulista. Atendimento horrivel das gerentes e da recepao. Cobraram um valor totalmente diferente da reserva realizada no website da propria empresa (nao foi utilizado site de terceiros para a reserva). Desconto para clientes Itaucard inexistente e enganoso. O valor da diária COM o desconto aplicado é o mesmo valor da diária SEM o desconto aplicado. Mostramos para 3 funcionarias (duas gerentes e uma recepcionista) que o desconto nao existia e as mesmas nao souberam responder o motivo. Fomos claramente enganados. Wifi nos quartos nao funciona, tendo que usar o hall do hotel para trabalhar. Nao recomendo para quem precisa utilizar essa ferramenta comum nos dias de hoje (internet). E nao recomendo para qualquer um que nao queira ser enganado, reservando um valor e na hora do pagamento ter que pagar um valor quase 2x maior. Mesmo possuindo em maos a reserva impressa."
abr. de 2019,4,Fabricio,"Acomodações do quarto um pouco velhas, café da manhã muito bom, hotel bem localizado, faltou toalha e sabonete no quarto tivemos que solicitar, chuveiro muito bom, serviço de quarto parabéns, televisão poderia ter mais opções de canais."
abr. de 2019,3,Mediano,"O hotel possui aposentos espaçosos, o único problema que encontrei foi o controle do ar condicionado com mal contato (provavelmente por causa da pilha), a falta de copos e sabonete no banheiro e má limpeza do banheiro (fio dental preso na parede)"
mar. de 2019,5,Perfeito,"Fui para São Paulo para a Revestir e procurava um hotel com boa localização. A escolha foi a melhor possivel, os restaurantes próximos ao hotel são muito bons além do hotel ter Perfeito atendimento, café da manhã delicioso, limpeza impecável!! Voltarei com toda certeza."
mar. de 2019,3,Atendeu o esperado.,"Hotel razoável em relação ao preço. Mas a localização não permite aproveitamento do entorno. Esperava um hotel mais próximo a lojas, shoppings, restaurantes, bares, etc. Dependendo o tipo da viagem não vale a pena se hospedar no hotel. se for só para dormir e trabalhar, pode-se pensar."
mar. de 2019,5,Muito satisfatória,"Deixei toda a avaliação no comentário que fiz.    Achei a hospedagem muito boa. O quarto era ótimo e todo o serviço oferecido foi muito bom. Não gostei da forma que o recepcionista falou comigo no início da nossa conversa, fora isto foi tudo muito bom.  E o preço da long neck. Achei o preço praticado muito alto.    Parabéns pelo trabalho de vocês!"
mar. de 2019,4,Ótimo Custo Benefício,"Hotel com preço razoável, bem localizado e bastante organizado. Atendimento cortez e produtos disponíveis de qualidade. Café da manhã básico, porém atende às necessidades. Limpeza e arrumação bastante eficientes."
mar. de 2019,2,Hospedagem de baixa qualidade,"Apesar da ótima localização do hotel, não é recomendado hospedagem nesse hote da rede quality antes que sejam feitas as modernizações dos quartos( não existe tomada de 3 pinos), treinamento de gentileza com os recepcionistas e treinamento de organização do café da manhã."
mar. de 2019,2,Atendimento ruim,O atendimento foi muito ruim e eles se mostraram muito pouco interessados em resolver os problemas! Tive problemas com a reserva e eles simplesmente se recusaram a resolver o problema e me aconselharam a trocar de quarto no meio da hospedagem!
mar. de 2019,5,Hotel incrível muito bom !!!!,"Foi uma excelente estadia hotel incrível , com quarto bem estruturado limpo cheiroso e organizado cama aconchegante ,ducha quentinha ,delicioso café da manhã ,hotel bem localizado ,foi tudo maravilhoso!!!"
mar. de 2019,4,Bom hotel e relação custo - benefício,"Boa localização, fácil acesso, academia fraca, equipe atenciosa e dedicada. Checkout foi muito rápido. Penso que tem uma boa relação custo-benefício e poderia voltar novamente a me hospedar. A conservação deixa um pouco a desejar."
mar. de 2019,2,Não gostei,"Ontem fiquei hospedada no Quality Paulista e não pretendo voltar. O checkin foi bem demorado e eu estava muito cansada, então, a primeira impressão já não foi boa. Fiquei 30 minutos na recepção até ter o cartão de acesso ao quarto em mãos. Estranhei bastante o atendente ter pedido para eu aguardar porque ele estava procurando um quarto disponível. Eu havia feito a reserva há uma semana e tinha ligado durante o dia para confirmar. Cheguei às 20h20, não logo após o horário normal de saída dos hóspedes anteriores, então, foi uma surpresa ruim saber que não havia um quarto pronto para eu entrar. Na saída também achei pouco prático o checkout. Paguei a diária na entrada e não consumi itens do frigobar, mas mesmo assim, precisei passar meu cartão novamente porque havia uma taxa de R$4,35! que eu deveria pagar. Por que não foi cobrada junto com a diária???? Além das questões administrativas, achei o quarto pouco digno de um padrão 4 estrelas. A TV (pequena) tinha uma imagem chuviscada, as cortinas estavam mofadas e o banheiro muito antigo com um chuveiro bem mediano. Esperava muuuuito mais."
mar. de 2019,5,Tudo ótimo!,"Gostei bastante! A localização é ótima, pertinho de tudo que precisava. Todos foram muito gentis e prestativos. Adorei o mimo do porta retrato que deixaram quando cheguei. Parabéns para toda equipe. O hotel é lindo e quero voltar mais vezes!"
mar. de 2019,3,insatisfeito,Creio que as arrumadeiras deveriam receber um filme ou fotos do Quality de Vitória para ver como deve ser feita a arrumação de um quarto. A manutenção de uma descarga deve ser feita pelo menos com a observação da arruadeira.
mar. de 2019,5,Excelente experiência,"Hotel maravilhoso, café da manhã impecável, conforto do quarto e banheiros (me senti em casa), atendimento da equipe do hotel maravilhoso, super atenciosos! Com certeza indicaria para outras pessoas e retornarei assim que possível!"
mar. de 2019,5,Agradável,"Hospedagem de apenas uma noite, porém muito agradável. Quarto super confortável e limpo. Café da manhã excelente. Ambiente agradável com funcionários atenciosos e educados.  Check-in e check-out rápidos."
mar. de 2019,4,Boa localização,"Excelente atendimento no check in, a mobília do quatro precisa melhor, café da manhã muito bom, cama boa, o banheiro e bem espaçoso embora ainda tenha aquelas banheiras antigas,na recepção possui um espaço de cafezinho com EXCELENTE ATENDIMENTO"
mar. de 2019,4,Muito bom,"Bom hotel. Fomos muito bem recebidas. Atendimento da recepção muito bom. Deve melhorar limpeza da bandeira que deixou a desejar. E informar, quem está tomando café, antes de retirar e finalizar o café."
mar. de 2019,5,Ótima.,"Excelente localização, atendimento e conforto. Fácil acesso à avenida Paulista e a outros locais de turismo da cidade de São Paulo.  Pretendo voltar mais vezes para o Quality para uma estadia maior.Até breve!"
mar. de 2019,4,MUITO BOM,"Tudo ok, do atendimento dos funcionários, ao café da manhã e faxineiras. O banheiro que carece de alguma manutenção nas paredes .Até o pessoal do estacionamento terceirizado são gentis e educados. Acho que é um bom custo-benefício."
mar. de 2019,4,Cumpri o que promete,"O hotel possui um bom atendimento na recepção. Com relação ao quarto, ao menos, eu observei que a limpeza é muito superficial, quem tem alergia a poeira ou algo do tipo, será preciso pedir a limpeza e acompanhar para que seja atendida a sua necessidade. O restaurante do hotel possui um valor absurdo, R$49,00 em um frango com purê de batata, na minha opinião é abusivo! Preço mais baixo do cardápio.  A localização do hotel é ótima, a cerca de 4 minutos de caminhada possui um shopping, qual lhe possibilita almoçar e jantar com preços muito mais justos. Importante ressaltar, que o quarto é bem espaçoso e a cama bem confortável. Conclusão: Um bom hotel, com bom custo benefício, com exceção, claro, do restaurante do mesmo."
mar. de 2019,4,Cordialidade e gentileza,Fui surpreendida logo na rexepcao com tamanha gentileza e atendime to do funcio ario Davi. Me senti eapecial pois ele agilizou tudo antes da minha chegqda para que eu ficasse o minimo possivel na recepção . Um querido . Gostaria que chegasse a ele meu elogio. Voltarei la de ta to que essa atitude fez a diferença. Excelente ser recebida assim...tudo fica melhor.
mar. de 2019,4,Confortável,"Eu gostei muito, fora os pequenos imprevistos que aconteceu no café da manhã, eu ficaria novamente no hotel. Pois, gostei muito da localidade, o espaço é aconchegante e, com certeza eu voltarei e indico a qualquer amigo que queria uma hospedagem em São Paulo."
fev. de 2019,1,Hotel Pratica propaganda enganosa,"Hotel pratica propaganda enganosa, lesando o consumidor, ao oferecer um desconto inexistente. A pesquisa no site indica que COM ou SEM o código de desconto, o valor da diária é o mesmo, ou seja, o desconto não existe (propaganda enganosa). Acionei 3 funcionarios do hotel, tive que mostrar no meu notebook e ""provar"" realizando diversas pesquisas com o ""código de desconto"" e mesmo assim a gerente Priscila não soube me responder o motivo do valor da diária COM desconto ser o mesmo SEM desconto. Pratica abusiva.  Realizei o pagamento total, sem desconto, MESMO tendo feito a reserva utilizando o código de desconto. Inacreditavel e inaceitavel.  A internet é de péssima qualidade, em caso de viagem de negócios voce jamais conseguirá utilizar. É lenta, e precisa se conectar diversas vezes. O funcionário chegou a me dizer que é necessário conectar e desconectar algumas vezes para que funcione."
fev. de 2019,5,Hospedagem à trabalho treinamento TAP,"O hotel é excelente, bem localizado, com quarto bastante espaçoso, café da manhã gostoso e com muita variedade, atendimento ágil, mas os valores da bebinas (água, refrigerante e cappuccino) são muito altos."
fev. de 2019,5,Hotel com ótimo custo beneficio,"Além da localidade ser muito boa, o valor cobrado e o conforto do hotel vale muito a pena. O café da manhã foi ótimo, com muitas variedades. Não comemos no hotel janta ou almoço, mas pelo cardápio tinham bastantes variedades além de ser 24h o atendimento."
fev. de 2019,2,HOTEL DEIXA MUITO A DESEJAR,"Hotel simples para a categoria. Café da manhã muito simples, reposição de alimentos, talheres e pratos horrível.  Quarto com uma televisão extremamente antiga. Cadeiras do quarto antigas e desconfortáveis."
fev. de 2019,3,Precisa melhorar...,"Hotel precisa melhorar na limpeza dos quartos e na reposição dos amenites. Falta colher, serviço do café da manhã regular. Inadmissível não ter um omelete e tapioca incluso no desjejum. Ar condicionado sem funcionar direito nas duas últimas vezes que fui ao hotel. Capacidade em BTUs insuficiente para o tamanho do quarto"
fev. de 2019,4,Ótimo hotel nos Jardins,"Fiquei hospedada no Quality a trabalho e a localização do hotel foi perfeita para os deslocamentos que precisei fazer pela cidade. Ótimo custo beneficio. E preciso ressaltar que a menos de 100m do hotel tem opções maravilhosas de restaurantes, padaria e etc."
fev. de 2019,2,Decepção total !!! Descaso e falta de respeito !!!,"Bem, minha experiência negativa inicio já na chegada. Fiz o check in e fui ao quarto, para minha surpresa um quarto double, simples. No voucher constava que contratei e paguei por uma suite com cama queen, desci e a surpresa é que informaram que provavelmente foi na hora que subiu no sistema e que não haveria disponibilidade desse tipo de quarto. OK....juntei as camas!!! Depois com vontade de beber algo no quarto eis que me deparo com a ausência de copo no quarto. Mais um probleminha. Com os pés descalços andando pelo quarto noto que o chão não esta sujo...esta imundo e grudento.....algo sem noção. Por isso, pensem bem antes de ter a mesma decepção !!!"
fev. de 2019,4,"Hotel de excelente nível, estilo SP altamente executivo.","Maravilhoso hotel, bem localizado, suíte maravilhosa, excelente cama, ducha maravilhosa, ambientação de primeira, ou seja nada a reclamar do quarto, só elogios. O café da manha, também maravilhoso, sortido, muito bem servido, com várias opções. O único ponto negativo é o estacionamento, que é terceirizado, mesmo com o desconto do hospede, ainda é um pouco salgado o pernoite."
fev. de 2019,4,Avaliacao hospedagem em 08/02/2019,"O unico problema que tive com a minha reserva foi ter solicitado um quarto de casal e chegando ao local ter disponivel apenas um quarto com 2 camas de solteiro. No restante, atendimento muito bom, acomodacoes limpas e cafe da manha com uma variedade grande de opcoes. Em geral classifico minha estadia como muito boa."
fev. de 2019,3,Piora no atendimento existente anteriormente.,"A troca de bandeira, de Golden Tulip Paulista Praza para Quality Hotel Paulista traduziu sensível piora nos serviços. Como também o fechamento do restaurante para o almoço traduziu uma Inconveniência para mim e para os demais hospedes habituais do hotel. A redução de pessoal ocorrida neste período de transição afetou seriamente o tempo de atendimento nos serviços, seja de checkin e/ou checkout. Na realidade a nova bandeira não verificou que o hotel possui uma grande clientela antiga e frequente e começou seu processo de gestão igualando os aos clientes esporádicos."
fev. de 2019,3,Hotel bom,"Hotel é bom, pena que no check-in o atendente foi meio grosso no atendimento porém no check-out o outro funcionário e os demais pareciam ser mais solícito. Esqueceram de varrer o quarto pq achei unhas!!"
fev. de 2019,1,Péssimo atendimento,"Desde atribuírem quartos aos hóspedes,que ainda estão por limpar a 1 hora de espera pelo room service(tive que ligar 3 vezes para recepção durante essa hora para saber se valia a pena esperar visto que café da manhã estava incluído ou se pagava para ir comer fora)A pior avaliação é no café da manhã.Tratam clientes com desdém e são de uma antipatia .  Não recomendo e pelo mesmo preço existem outros na zona que prestam serviço muito melhor ."
fev. de 2019,2,"Fui quando era Golden Tulip e amei, agora o Quality deixou muito a desejar","Fui em dezembro, entre os dias 7 até 9, fiquei em um apartamento triplo, a reserva foi feita em julho, chegando lá, o quarto não estava montado. Depois, no dia seguinte, tinham diversos descartáveis no café da manhã, o que é bem diferente do padrão oferecido. Além do cheiro muito forte de mofo no quarto. Acredito que sejam pontuais essas ações por conta da mudança de bandeira, mas fiquei totalmente insatisfeito.  Os pontos fortes a destacar, são alguns colaboradores que fizeram de tudo para marcar a minha estada, apesar de alguns não serem treinados, a hospitalidade deles foi positiva. O café da manhã, mesmo com os itens descartáveis, estava fresco e tinham variedades.  Voltei para SP e não fiquei nele novamente, não sei se voltaria."
jan. de 2019,5,Um hotel muito aconchegante,"Conhecer o Golden Tulip foi uma experiência incrível. Visitei São Paulo a trabalho e pude descansar, após longas horas em pé, na confortável cama do Quarto Standart. O café da manhã era muito bem servido, o que me ajudou a ter energia para o longo dia que teria pela frente.  O Golden Tulip é bem próximo à Paulista, caminhando dá uns 30 minutos, de carro é um pulo."
jan. de 2019,4,ótimo Hotel nos Jardins,"Hotel super bem localizado, próximo de shoppings, restaurantes bons, lojas, confeitarias, docerias, Avenida Paulista. Quarto moderadamente confortável, café da manhã farto e de ótima qualidade, como pouco se vê hoje em dia. Recepção atenciosa.  Não conheci a piscina, mas pareceu ampla e agradável. Banheiro bom. Tive problemas com a falta de cama para 1 criança conforme reserva prévia pelo booking.com, já que não havia cama disponível no hotel, mas o problema foi solucionado pela recepção. Recomendo muito este hotel, mas quem for com criança deve confirmar a existência da cama de criança no quarto."
dez. de 2018,1,Nada de novo,"Pensava que era um hotel novo mas apenas o nome é que é outro. Este era o Tulipa e está exactamente na mesma. Pessoal simpático mas sem qualquer possibilidade de descanso. Demasiado barulho exterior e como dizem que estão em remodelação usam berbequins durante toda a manhã. Piscina mínima à sombra, ginásio mínimo, cortinas velhas e incapazes de escurecer o quarto. Muito fraco."
dez. de 2018,5,Excelente hotel localização privilegiada,Tive um problema com a reserva feita através do hoteurbano que foi rapidamente resolvida pelo staff do hotel. Minha experiencia não poderia ter sido melhor. O que mais me agradou foi o café da manhã farto.
dez. de 2018,1,Degradação,"Este hotel tem sofrido um desgaste em todos os serviços.  Em pleno século XXI, a internet é miserável sem necessidade nenhuma.  Os serviços de room service e a qualidade da comida refletem o ""abandono"" que se tem vindo a agravar."
nov. de 2018,1,Como é possível?,"Estamos nós em 2018 e no pequeno almoço não existem colheres de metal.  Não só vão contra a tendência de querer ajudar o planeta com menos plástico, como é impensável um hotel deste nível não ter colheres.  Provavelmente vou ter que comer a sopa com um garfo ou uma colher de plástico também."
nov. de 2018,5,Hotel Maravilhoso nos Jardins,"Fiquei hospedada no começo de Novembro, e foi tudo maravilhoso!!! Localização excelente. De início no atendimento telefônico em reservas fui muito bem atendida, fizeram um preço muito bom. Ao chegar no hotel fui muito bem recepcionada pelos mensageiros e os recepcionistas, sempre bem sorridentes. No check-in o Anderson, muito simpático e cortes me deu um quarto ótimo, com uma vista muito bonita da cidade. Frigobar sempre bem abastecido, as meninas que repõe são bem ágeis e também muito atenciosas. Limpeza do quarto impecável. Café da manhã do Golden Tulip foi bom, só um detalhe na reposição de pães, fora isso há bastante variedade. No meu check-out fui atendida pela Beatriz, que foi bem prestativa, simpática e com certeza voltarei mais vezes."
