Data da opinião,Nota,Título,Conteúdo
uma avaliação Ontem,5,diversão,"gostei muito da recreação, do tio big, da tia pandinha, do tio sapato, e da tia bambi, gostei muito da limpeza do hotel e achei os zeladores muito educados rafael me ajudou bastante e foi bem educado ao me levar até a piscina"
uma avaliação Ontem,5,Bom atendimento recomendo,"A nossa hospedagem no Hotel Grand Carimã tem sido uma experiência maravilhosa. Além da beleza do Hotel, da sua excelente cozinha, o que torna realmente incrível a hospedagem é a incrível amabilidade, gentileza, educação e disponibilidade de todos os seus funcionários, começando da recepção, restaurantes, limpeza, etc! Sem exceção, eles são muitíssimo educados, sem afetação, e, com amabilidade sincera e espontânea! Encantam e deixam a nossa experiência de hospedagem indescritível! A gente se sente verdadeiramente em casa! Parabéns e obrigada por tudo!"
28 de dez.,5,Se divertimos muito na piscina e no hotel com o nosso amigo Tio Sapato!!,"A melhor estadia que eu e minha família já tivemos, o atendimento ótimo principalmente do Tio Sapato que tirou todas as nossas dúvidas e nos ajudou a se divertir todos os dias, a decoração do hotel ótima e tudo magnífica, adoramos o hotel e com certeza voltaríamos a se hospedar!!"
27 de dez.,5,Final de semana,"Local excelente, próximo às cataratas e Paraguai, destaco o excelente atendimento e carisma do bar. Senhor Afonso é uma figura única de simpatia e pode dar várias dicas da região!!!! Ao visistar o Grand Carima, procurem pelo Afonso no bar 🍸."
27 de dez.,5,Melhor diversão que tivemos esse ano foi com o Tio Sapato ❤️,"Amamos a nossa hospedagem no hotel eu e a minha família adoramos, a decoração linda e impecável, tivemos um ótimo atendimento no hotel e se divertimos muito com o Tio Sapato com ele a diversão é garantida ❤️"
27 de dez.,5,Natal Família Kist no Grand Carima Resort,"Nosso Natal de 2022 foi muito especial pelo carinho, dedicação e preparo de toda equipe do Grand Carima Resort. Superou nossas expectativas!! Todos extremamente gentis, energia maravilhosa, comida excelente, decoração impecável e animação 100% com Tio Sapato e amigos! Sem falar no Show da Ceia de Natal e espetáculo do Tio Fepo imitando o Silvio Santos 👏👏👏👏🎄❤! Estávamos em 6 pessoas mais o pet da família 🐶 que também teve atenção e atendimento VIP. Fechamos o pacote com a agência de viagens Comfort de Cianorte e já liguei agradecendo a indicação 👏👏!"
26 de dez.,5,"Estadia incrível, nossa filha adorou","Essa foi provavelmente a viagem que nossa pequena mais curtiu, graças a animação da equipe de recreação (tias Panda, Bambi, Maravilha, Pipoca e tios Big e Sapato), que são realmente incríveis com as crianças (e com os adultos também). Esperamos reencontra-los em breve!  As instalações do hotel são ótimas, quarto bem aconchegante, banheiro espaçoso, e as refeições deliciosas.  Viemos para o Natal, a ceia e a banda foram muito boas!"
26 de dez.,4,Estrutura melhorou muito,"Hotel após a reforma melhorou muito, destaque para Sr. Afonso do bar que com certeza o melhor atendimento de um colaborador do hotel. Equipe de recreação tio sapato muito bom e prestativo. Acredito que alguns colaboradores precisam saber lidar com os hóspedes principalmente alguns na recepção como também a moça que fica no restaurante, talvez esteja passando por alguma dificuldade. Enfim o hotel como um todo deu um show na ceia de natal e ficamos satisfeitos."
25 de dez.,5,Hospedagem,"Hotel muito bom com ótimos quartos. Atendimento excepcional.  Equipe de recreação divertida e muito atenciosa com as crianças.  Segundo natal que passamos em família no hotel, foi maravilhosos e mágico, super indico!  A passadinha no piano bar é obrigatória, se Afonso prepara drinks maravilhosos!  Super aprovado!"
25 de dez.,5,"Muito bom, gostei muito","Gostei muito, tem muito bom atendimento, a comida é muito boa também. A recreação é muito animada e quero agradecer o tio sapato e a tia pandinha que nos receberam e os pavões são maravilhosos recomendo"
23 de dez.,3,"Um hotel muito grande, com bastante área verde. Ainda podemos ver estruturas do antigo hotel, antes de ser reformado.","A extrutura do hotel é bem grande e uma das coisas que mais gostamos foi Bar do hotel. O atendimento é excepcional, principalmente em relação ao seu Afonso, que nos atendeu com muita gentileza e parceria."
23 de dez.,5,Um dos melhores resorts de foz iguaçu,"Gente,vcs não imaginam tem um barmen sr. Afonso q faz uma caipiiinha e uns drink q não existem, sao mais q maravilhosos, sem contar a sua simpatia.  O pessoal do restaurante LEA, e equipe tratam vc como sua família. É uma sensação de acolhimento muito grande. Somos Italianos e tivemos a sensação de estarmos em nosso país.  Sem contar o sr. Moacir q é o responsável por toda essa organização.  Venham! É mais q ótimo"
23 de dez.,5,BAR,Recomendo as sugestões do Sr. Afonso do bar.  Muito boas! Ficamos muito satisfeitos com o seu atendimento. Margarita excelente e caipirinha de morango ótima. Atendimento de primeira. Parabéns. Se vocês vierem se hospedar aqui não deixem de experimentar os drinks.
23 de dez.,5,Surpresa mais que agradável,"Muito melhor do que imaginava. Espaçoso, muito limpo e agradável. O café da manhã muito farto. O jantar simples, mas bastante razoável. Mas gostaria de destacar a Micaela. Atendimento diferenciado. Muito gentil, atenciosa e simpática. Gostamos muito."
23 de dez.,5,Super atendimento,O atendimento do garçom Éverton foi excelente muito antesioso rapaz esperto inteligente gostei muito do atendimento dele a área da piscina é incrível cerveja gelada porções maravilhosa em uma boa localização o hotel
22 de dez.,5,Muito bom,Gostei dos quartos ambiente limpo piscina gostosa bar super legal e quero agradecer a equipe de recreação que foi muito animada inclusive o tio sapato que me recebeu com um sorriso no rosto e foi muito simpático com a minha família Obrigado continue assim
22 de dez.,5,Atendimento garçom da picina,O garçom da picina Everton tem um ótimo atendimento gostei muito fui bem atendida por ele picina maravilhosa lanches maravilhosa adorei tudo oque estou passando aqui nesses dias ficarei até natal obrigado ao hotel carima
22 de dez.,5,o atendimento do garcon Everton,o atendimento do garcon da piscina Everton foi muito excelente gostei muito do atendimento dele rapaz antesioso rapaz esforçado café da manhã excelente área da piscina e espetacular os atendimento dos rapazes muito bom
22 de dez.,5,Área da piscina,"Gostaria de elogiar o Éverton, funcionário da piscina, que me atendeu muito gentilmente! Foi muito educado e prestativo! Estou só esperando a água de coco que acabou hoje, mas ele me garantiu que amanhã vai ter!!! Obrigada!"
21 de dez.,5,Excelência no quesito atendimento,"Excelente atendimento em todos os setores do resort. Na área da piscina fomos muito bem atendidos pelo garçom Everton, muito atencioso e solicito, além de ser muito caprichoso nos drinks elaborados!!!"
21 de dez.,5,Excelente atendimento e educação,"Excelente atendimento do garçom Everton, educação mil, drinks bem elaborados, e super alto astral! Deveria ser promovido a cargo máximo de atenção ao cliente! É raro encontrar um atendimento tão bom!!"
21 de dez.,5,Excelente atendimento,"Atendimento excelente do garçom Éverton na área da piscina, café da manhã excelente, muitas variedades e de excelente qualidade, ótimos aposentos, hotel com estrutura perfeita, sem reclamações , pretendo voltar novamente!"
21 de dez.,4,Boa opcao em Foz,"Os apartamentos muito bons, optamos por meia pensao foi tiro certo, o jantar excelente especialmente pelo atendimento da Eliane. No ultimo dia da estadia eu achei o hotel excessivamente cheio, especialmente na area das piscinas, porem a equipe por milagre conseguiu manter o serviço. Tambem falta area de sombra nas piscinas. A localizacao é muito boa, pertinho das Cataratas e da fronteira com a Argentina."
19 de dez.,5,Esaquel - Moço Maravilhoso !,"A gente ficou no Grand Carimã e queríamos distinguir o excelente serviço do Esaquel. O atendimento dele foi maravilhoso, sempre muito atencioso, sempre sendo muito gentil ele nos fez sentir à vontade."
18 de dez.,5,"Atendimento hotel resort Gran carima,impecável,sensacional, passamos dias maravilhosos aqui. Até breve","Resort maravilhoso,cerveja gelada,atendimento excelente,quartos aconchegantes,foi tudo nota 10. O rapaz da manutenção/limpeza (Luiz) muito atencioso e prestativo, assim como o garçom do restaurante (Clóvis) com atendimento impecável."
18 de dez.,5,Ótimo atendimento,Atendimento muito bom do Garçom Éverton da piscina. Cerveja e drinks bem gelados.piscina maravilhosa café da manhã ecelente após a reforma o hotel ficou maravilhoso as porcoes são maravilhosas muito obrigado a todos
18 de dez.,5,Um ótimo atendimento,O Garcon da piscina Everton tem um ótimo atendimento rapaz bem prestativo gostei muito da estrutura do hotel pretendo voltar logo para o hotel vim com minha família e está tudo maravilhoso parabéns para o hotel carima
18 de dez.,5,Bom atendimenti,"Atencioso e prestativo o atendimento foi otimo nome dele é Everton, cerveja gelada, satisfatório agradável e muito cordial. Agradedemos o atendimento. Eveton Garçon da piscina no hotel grand carima em foz"
18 de dez.,5,Atendimento,"A equipe do Bar e piscina é composta de excelentes profissionais, na qual destaco o atendente Everton, que foi muito solícito e educado. Toda estrutura do resort está de parabéns, assim como, o maravilhoso café da manhã que é bem diversificado."
18 de dez.,5,Atendimento excelente,"O atendimento de todos os funcionários foi excelente,com todos sendo extremamente amigáveis e gente boa,o Everton,garçom da piscina por exemplo,nos atendeu com muito cuidado e atenção e foi muito carismático.O hotel tem uma atmosfera agradavel e a comida é excepcional."
18 de dez.,5,Atendimento ecelente,Atendimento do garcon Everton é muito ecelente picina maravilhoso hotel top valtaremos com cereteza hotel com muita hospitalidade quartos lindos grandes vim com minha familia e estamos amando o atendimento das pessoas
18 de dez.,5,Atendimento muito bom,Atendimento do garcon everton do bar da picina è elecente gostamos muito do Atendimento dele rapaz educado com otma carisma hotel muito lindo grande resorte maravilho com otmos funcionarios amei o hotel
18 de dez.,5,Atendimento nota mil,Everton Garcon da piscina tivemos um ótimos atendimentos nota 1000 para ele piscina gostosa cerveja gelada gostei muito do atendimento dele voltarei com certeza após a reforma o hotel ficou um espetáculo muito.
17 de dez.,5,Excelente atendimento. Meu elogio vai para o Barman Afonso fez um drink lindo e delicioso para a comemoração do meu aniversário,Apartamento confortável. Buffet maravilhoso com muitas variedades de saladas e sobremesas. Excelente atendimento. Meu elogio vai para o Barman Afonso fez um drink lindo e delicioso para a comemoração do meu aniversário de casamento..
17 de dez.,5,Otimo experiência,"Excelente atendimento do garcon Everton no bar da piscina, ótimo café da manhã, ótimo buffet, quartos excelentes, com certeza voltarei ao grande carima resort e a foz do Iguaçu com seus ótimos atendimento"
17 de dez.,5,Acelente atendimento,Acelente atendimento do garçom Éverton da piscina cerveja gelada café da manhã excelente quartos ótimos o hotel muito excelente após a reforma porções muito deliciosas voltarei com certeza a gran carima Risorte
17 de dez.,5,Equipe prestativa e estrutura nova.,Recém reformado e com uma equipe muito prestativa. O café da manhã muito bem servido com ingredientes de boa qualidade. Roberto foi um excelente anfitrião e o Everton fez um ótimo atendimento enquanto aproveitamos a piscina.
17 de dez.,5,Recreação,"Hotel Muito legal!  Quartos legais, vários espaços a piscina muito grande, comida impecável, a quadra muito legal o café da manhã multas coisas gostodas eu gostei principalmente da recreação em especial a tia nana"
16 de dez.,5,Excelente!!,"Hotel passou por reforma, está excelente. Na área da piscina tivemos um excelente atendimento, ágil  e educado, com o Everton.  Excelente para família, recreação para as crianças. Minha filha de 6 anos está adorando a experiência."
16 de dez.,5,Ótimo atendimento,Everton que faz o atendimento na piscina com atendimento excelente! Ficamos 5 dias e o atendimento em todo o hotel foi top!  Comida boa e piscina muito legal!  Recomendo a cervejas sempre gelada na piscina !
16 de dez.,5,Elogio,"atendimento bacana do garçom everton com agilidade e educação. Ambiente agradável, boa comida, check in antecipado, quartos limpos e espaçosos. Gostamos para passear em família e voltaremos em breve. Mto bacana. Parabéns!"
16 de dez.,5,Elogio,"Excelente atendimento do garçom everton com gentileza e atenção. Cuidado com cliente, paciência, boa comida, bebida gelada, check antecipado. Presteza e agilidade. Mto bacana. Parabéns! Espero vontar logo"
15 de dez.,4,Atendimento,"Éverton nos atendeu muito bem todos os dias que permanecemos no hotel, super prestativo e atencioso.  O hotel é muito cheiroso, muito limpo, piscina de temperatura muito boa, colchões bons, bem localizado ( próximo aos shoppings e ao dutyfree argentino ), adoramos nossa escolha."
13 de dez.,5,Excelente atendimento,"EVERTON GARÇON, TEVE EXCELENTE ATENDIMENTO, SEMPRE PRESTATIVO, A PISCINA BOA E COMIDA EXCELENTE. CAFE COM MUITA VARIEDADE, SUCO EXCELENTE. HOTEL BOA LOCALIZAÇÃO PERTO DE TUDO. CERVEJA GELADA. RECEPCAO PESSOAL MUITO EDUCADOS."
13 de dez.,5,Atendimento do hotel,"Atendimento do garçom Everton fomos muito bem atendidos, realizaram pedido nosso que não estava no cardápio e tava tudo muito delicioso, e a área de lazer para criança é perfeita.  Voltaremos com ctz  Grata"
13 de dez.,4,Excelente Resort,"Excelente resort, com amplo estacionamento, muitos quartos, uma alimentação muito especial. O atendimento foi rápido, atenciosos, não deixando nada a desejar. Valeu muito estar aí com vcs. Recomendo."
10 de dez.,5,Hotel Carimã,"Fui atendido pela Cléo da madrugada, nunca fui tão bem atendido em um hotel. Costumanos ver um péssimo atendimento em hotéis, porém, a Cléo mudou totalmente a minha visão, simplesmente espetacular. Amei minha noite aqui."
10 de dez.,5,Perfeito,Ótimo atendimento adoramos e vamos voltar Cleo e muito atenciosa e Evandro do restaurante muito educado adoramos o hotel tudo ótimo obrigado recepção top tudo de bom adoramos obrigado pela essse momento
10 de dez.,5,Vim para comemorar o aniversário da minha mãe.,"Está sendo uma grande experiência, estamos aproveitando o aniversário da minha mãe, pedido de namoro do meu irmão e aproveitando a família. Colaboradores muitos dedicados e simpáticos. Acredito que será muito melhor, estamos aproveitando muito a piscina, o bar, o quarto e tudo mais. A Cléo e Evandro foram muito especiais para essa experiência ser ainda melhor."
10 de dez.,5,Família,"Os atendes são muito educados e prestativos. O ambiente é limpo, e as áreas de lazer são muito limpas. O atendimento desde a recepção, e em todos os setores do hotel. Me recordo dos atendimento da Cléo e do Evandro."
10 de dez.,5,familia,"Evandro cleonir    atendimento ótimo, parabéns pelo funcionários, estão todos de parabéns  foram bem atenciosos e gentis comigo e com minha família, será sempre um prazer voltar no resort com os ótimos funcionários."
10 de dez.,5,Everton da piscina,Tive um ótimo atendimento do Everton na piscina profissional super atencioso e dedicado e as instalações do hotel sem palavras super aconchegante uma experiência inesquecível no hotel super recomendoo
10 de dez.,5,Everton da piscina,Tive um ótimo atendimento na piscina foi bem atendido pelo Everton um ótimo profissional o hotel super aconchegante com ótimas instalações atendimento de profissional de qualidade super recomendo o local
10 de dez.,3,"Hotel bom, mas com alguns problemas de atendimento","O hotel foi renovado e está em bom estado. Comida muito boa. O atendimento, entretanto, deixa a desejar. Tive um problema no banheiro, pedi manutenção. Ficaram de mandar alguém ver. Não deram nenhum retorno. Depois de horas, liguei de novo, disseram que só viriam no dia seguinte."
10 de dez.,5,Ótimo atendimento,"Ótimo atendimento do garçom Everton, piscina água maravilhosa, café da manhã maravilhoso, cerveja do bar geladinha, hotel em ótima localização perto do acessos ao parques, com ótimas atividades de recreação"
10 de dez.,5,Uma experiência única,"O hotel é ótimo! Os quartos são incríveis, o buffet é maravilhoso e os pavões que circulam por lá são de tirar o fôlego com suas penas. Os tios da recriação foram muito carinhosos e acolhedores com minha irmã mais nova, em especial o tio sapato, ele conseguiu divertir e acolher até mesmo os mais velhos, ele é engraçado e divertido mas também é regrado e sério nos momentos certos, eu adorei! Foi uma experiência única e eu pretendo visitar novamente ano que vem!"
9 de dez.,4,"Atendimento excelente no bar , o garçon Alfonso nota 10 . Tudo certo no hotel e com o café da manha completo e de primei","Atendimento excelente no bar , o garçon Alfonso nota 10 . Tudo certo no hotel e com o café da manha completo e de primeira qualidade . Tudo limpo e organizado .  Quartos renovados e novos , inclussive o pessoal de reservas ( Elis ) foi muito atenciosa em resolver um problema de nossa reserva do grupo familiar ."
8 de dez.,5,Eventos pastores,Quero agradecer pelo atendimento dos funcionários Evandro Lilian Amaral do restaurante pelo atendimento excelente e hotel maravilhoso funcionários muitos educados e simpáticos obrigado por tudo hotel carima
8 de dez.,5,Evento de pastores,Evandro restaurante Lilian restaurante Amaral restaurante fico agradecida pelo atendimento e pela hospedagem tudo maravilhosa todos os funcionários são todos atencioso atem agente com muito carinho e educação
8 de dez.,5,Optimo atendimento do garcon everton,Un otmo atendimento do garcon Everton da picina do bar muito rico la caipiriñas hotel muito lindo otmo atendiendo en la picina gostei muncho la picina muy linda quiero volver mas veses a Brasil amei la atencion
8 de dez.,5,Recreação,A equipe responsável recreação do hotel é muito competente. Agradecemos ao Tio Sapato que fez amizade com as crianças e deixara saudades. Obrigada pelos cuidados com os pequenos. Vocês foram incríveis.
8 de dez.,5,Equipe de Recreação,Parabéns pelo atendimento. Destaque para o querido Tio Sapato da equipe de Recreação. Profissional competente que atendeu muito bem nossos filhos durante o evento. As crianças não irão esquecer das brincadeiras e dos cuidados.
8 de dez.,5,Recomendo,"Gostei do o hotel, gostei dos quartos, gostei da comida, gostei dos tios da recreação e dou parabéns ao tio sapato.  A piscina muito boa, com ótima temperatura. Ótima área de lazer, com várias opções para se divertir."
7 de dez.,5,Equipe de Recreação do Hotel,"Excelente atendimento. Recomendo !  Deixo registrado especialmente a equipe de recreação: Sapato, Bil, Pandinha, Pernilongo , Nanah e Bambi que atenderam meus filhos durante um congresso que foi realizado no hotel. Parabéns! Foi realmente incrível. As crianças amaram!"
7 de dez.,5,Recreação,"O hotel é bonito, os quartos aconchegantes a piscina é muito gostosa  A recreação é a melhor parte os tios são muitos anteciosos e legais  O tio big tia pandinha tio pernilongo tio sapato e especial a tia nanah muito educada e querida"
7 de dez.,5,Recreação tia Nanah,"O hotel é muito legal, tem muitas brincadeiras, o café da manhã é uma delícia  O parquinho legal  Todos os tios são legais tio big tia Pandinha tio sapato tio pernilongo tia bambi  A tia que eu mais gostei foi a tia Nanah"
4 de dez.,5,Atendimento,"Ótimo atendimento do garçom Everton. Muito atencioso e Educado sempre disponível para o atendimento. Bar, piscina e comida muito boa, cerveja geladinha. Os quartos limpos e cheirosos. Recomendo 100%…."
4 de dez.,5,Atendimento Everton Excelente,"Atendimento excelente, perfeito, atencioso. Ótimo funcionário, sempre à disposição.  Piscina perfeita, música, serviços...  Disponibilidade de taças, geladeira, gelo..  Cerveja gelada.  Lugar agradável..."
3 de dez.,5,O Everton do bar,"O Everton do bar da piscina o atendimento dele foi nota mil meu misto quente estava maravilhoso,o hotel é maravilhoso,o bar da piscina é muito aconchegante,e nota mil para o a atendimento agradeço o atendimento do Everton"
3 de dez.,5,Atendimento do Éverton muito bom !!,"Gostei muito do atendimento do Everton da piscina, ambiente agradável, música ao vivo, bons drinks, amei o resort como um todo, boas acomodações, hotel bem localizado, cardápio bem selecionado e a comida muito boa"
3 de dez.,5,Atendimento do Everton é 10,O Everton da piscina é um rapaz mto querido e atencioso. O hotel é maravilhoso 😍 Música sensacional 👏🏻👏🏻 Comida e drinks deliciosos 😋 Dueto feito pela moça da cozinha é incrível 👏🏻👏🏻👏🏻 Nota 1000
2 de dez.,5,Foi legal,"Eu fiz a escalada várias vezes por que eu gostei muito, gostei muito dos recreadores a tia nana é a melhor e a tia pandinha fazem diversas brincadeiras com as crianças festas na piscina ,o tio bia é muito legal"
1 de dez.,5,Ótimo atendimento,Gostaria de parabenizar o hotel pela estrutura e pelo ótimo atendimento muito bom e uma experiência única agradeço a todos os funcionários em especial a funcionária Cleu pelo ótimo atendimento parabéns Cleu.
1 de dez.,5,Excelente atendimento do garçom everton!,"Quando precisarem de um excelente atendimento, não deixem de procurar o garçom Emerson! Hotel excelente, ótima piscina com show ao vivo! Recomendo o frango a passarinho com mojito de verdade! Não deixem de experimentar!"
1 de dez.,5,Excelente atendimento,"Garçom Éverton nos atendeu, muito bem, além do atendimento nos proporcionou, uma ótima caipirinha, nos auxiliando no primeiro dia de estadia, agradecemos o atendimento, e voltaremos mais vezes, muito obrigado."
1 de dez.,5,Ótimo atendimento,"Garçom Everton, nos atendeu super bem, excelente atendimento, música ótima, clima familiar, voltaremos mais vezes, com mais tempo, hoje vamos ficar 5 dias, numa próxima ficaremos, uns 10 dias, muito obrigado pela estadia ."
1 de dez.,5,Fiz dois eventos de imersão para mulheres,"Simplesmente foi maravilhosa a experiência!!! Atendimento de toda a equipe perfeito. Toda a organização solicitada para o evento, foi atendida e a equipe sempre muito disposta a resolver e a contribuir para que tudo estivesse ok.    Recomendo muito!! E sem contar que a estrutura das salas são maravilhosas, eu utilizei a sala com vista para o jardim, o que faz toda a diferença para o evento que eu estava conduzindo, essa possibilidade com a conexão com o verde que o hotel oferece, ficou demais.    Foi contratado, coffee e almoço, tudo maravilhoso!!"
1 de dez.,5,Um ótimo atendimento do garçom Everton,"O garçom da piscina nós ofereceu um ótimo atendimento na área da piscina ,e o hotel realmente tem seu diferencial .  O Evento da abertura do festival das cataratas foi espetacular .agraço os ótimos dias que estou hospedada no Grand Carimã Resort"
nov. de 2022,5,Um ótimo atendente,"O atendente do bar da piscina , Everton , pessoa incrível , super profissional e educado .  É o tipo do funcionário que vale a pena investir . Parabéns pela excelente escolha  Hotel fantástico !  Espaço da piscina onde estou tendo a experiência e suuuuuuper !!!! Parabéns a todos os envolvidos"
nov. de 2022,5,Grande carimã resort,"O atendimento do Everton no bar da piscina do grande carimã resort é maravilhoso, todos os serviços são perfeitos e tudo que precisamos fomos atendidos com toda cordialidade e carisma que ambiente pode proporcionar aos seus clientes"
nov. de 2022,5,Carimã resort o melhor de foz do Iguaçu,"Everton e Dayron muito bom atendimento perfeito no bar da piscina, o pessoal é muito show e os ambientes do grand carimã resort. Quando vier em foz o grand carimã é a sua melhor opção para desfrutar dos melhores momentos"
nov. de 2022,5,Bom atendimento,"O Éverton garçom do bar dá piscina é um execelente atendente a comida é maravilhosa a piscina tb é uma maravilha a água fresquinha gostei muito do hotel excelente localização, e voltarei para Foz do Iguaçu"
nov. de 2022,5,Um ótimo atendimento,O Everton o garçon da piscina ele foi muito atencioso . Obrigada gostei muito do hotel e sua alimentação foi excelente e sua boa localização adorei a comida o suco maravilhoso pode ter certeza.Obrigada
nov. de 2022,5,Bom atendimento do garçom Everton.,"Atendimento excelente do garçom Everton no restaurante da piscina do hotel.  Muito prestativo e educado!  Quem vier para o hotel, não deixe de conhecer essa figura que faz ótimas caipirinhas.    Sucesso amigo!"
nov. de 2022,5,Excelente atendimento.,"O Everton , garçom da piscina fez um atendimento perfeito, muita gentileza e profissionalismo. O Resort é muito lindo, e funcionários maravilhosos. A área da piscina é incrível. E parabéns por ter funcionários maravilhosos, e o Everton super bom atendimento."
nov. de 2022,5,Atendimento madrugada,"Ótimo atendimento na madrugada da Cleo do Room service, que atendeu nosso grupo, na piscina a,super querida e ainda prepara o nosso delicioso café da manhã, obrigada pela atenção de toda a equipe do hotel."
