Data da opinião,Nota,Título,Conteúdo
jan. de 2021,5,Hotel de qualidade uma noite me Brasília,Excelente hotel ótima estadia super confortável otimo café da manhã muito variado quarto confortável e super limpo hiper bem localizado. O atendimento da Fabiana foi espetacular e além disto conseguimos um early Check-in sem custos.
jan. de 2021,5,PERFEITO!,"Passamos o Réveillon de 2020/2021. Desde o atendimento na hora da reserva até o check out foi tudo perfeito, impecável. Funcionários atenciosos e prestativos. Sou celíaca e me atenderam muito bem nas refeições, conhecem bem da segurança alimentar. A ceia estava maravilhosa. Bebidas e comidas de qualidade e muito bem servido. Meus pratos vieram decorados. Tudo lindo!"
jan. de 2021,5,Experiência magnífica em hospedagem!!,"Fiquei hospedado no Windsor Brasília Hotel da Asa Norte, em Brasília, entre os dias 28/12/2020 à 01/01/2021, e só tenho elogios e agradecimentos a fazer.  A começar por todo o comprometimento, dedicação e cuidado do Staff nesse período de pandemia. Total atenção, zelo e cordialidade com o hóspede, desde o Check-in (destaque para o excelente atendimento do gerente Elio), a limpeza impecável das áreas incomuns e disponibilização de álcool gel por todo o hotel. Padrão internacional e de qualidade de rede Windsor durante toda a hospedagem. Apartamento amplo, mobiliário novo e banheiro espaçoso, são alguns dos pontos fortes para quem busca tranquilidade, sem abrir mão de qualidade. Restaurante com excelente variedade no café da manhã, piscina aquecida, sauna a vapor e academia, reforçam a sensação de descanso e momentos de relaxamento. No período de dezembro/2020, e seguindo os protocolos da OMS, as áreas da piscina, sauna e academia estão sendo disponibilizadas mediante agendamento, afim de evitar aglomerações. No restaurante, as mesas estão dispostas mais distantes umas das outras, e luvas descartáveis, além de álcool gel são disponibilizados na hora de servir. Claro, que o uso de máscaras se faz obrigatório nas dependências do hotel, o que gera um clima de mais conforto, cuidado e empatia para com o próximo.  Hotel localizado na asa norte, ao lado do Shopping Conjunto Nacional, e bem no coração de Brasília, no eixo monumental. Vários pontos turísticos bem próximos, e acesso ao Aeroporto Internacional JK a apenas 20 minutos. Tudo isso contou na escolha por esse excelente hotel, em que nada deixou a desejar durante minha estada. Parabéns a toda a equipe Windsor, vocês são geniais. Até uma próxima.    Atenciosamente  Thiago Diniz"
jan. de 2021,5,"Perfeito, ótimo atendimento e confortável","O hotel possui ótimas acomodações, tudo muito novo, a cama e os travesseiros são extremamente confortáveis. Além disso, entramos antes do horário de checkin sem custos porque tinham quartos disponíveis e o café da manha é muito bom!!"
jan. de 2021,5,Espetacular,"Tudo perfeito. Controle e procedimentos contra covid. Café da manhã, limpeza, atendimento, localização, academia, etc. Tudo 10. Minha família ficou muito feliz. Muito bom mesmo. Com certeza voltaremos."
jan. de 2021,4,"Instalações boas, falta detalhe","Nos hospedamos no Hotel para participar da Ceia de Revéillon. Recepção bem equipada com funcionários educados, desde a recepção do veículo até o check-in e check-out. Aposentos bons, mas falta manutenção em detalhes importantes( a descarga do banheiro vazando constante ( toalhas já bem desgastadas para o padrão Windsor). Para a Ceia, acredito que a gerência geral do hotel poderia ter refinado mais o local utilizado para tal fim. Foi nos salões utilizados para convenções, o que evidente gerou uma visão pouco agradável. Como não tem janelas e a pintura é cinza, mais parecia um jantar de negócios. Acredito que a utilização de banners com fotos sobre o tema teria dado um efeito especial ao evento. Talvez até buscar patrocínio pela exposição delas, minimizando o custo. Agora, devo registrar 3 colaboradores, o primeiro da Sra. Natália, que até pensei, fosse a gerente geral do hotel, pela pro-atividade e resolutismo de problemas. Uma pessoa que merece atenção da rede Windsor. Outra é o Sr. Assis, extremamente simpático e eficiente e outro, que infelizmente não guardei o nome, mas comentei com a Sra. Natália, que atento a minha posição na mesa anterior que estava, logo se ofereceu para tentar auxiliar. Um time em campo esses 3.  Portanto, o Windsor Brasília, como outros da Rede, tem predicados positivos(café da manha sempre padrão) e pequenos detalhes que acredito, podem ser resolvidos de forma planejada."
dez. de 2020,1,HOTEL MUITO BOM,"Atendimento muito bom, quartos amplos, hotel muito limpo, café da manhã com toda segurança, wifi muito fraco, porem recompensa com atendimento e dedicação dos colaboradores, adorei super recomendo !!!!"
dez. de 2020,5,Excelente,"Atendimento muito bom. Receptividade boa demais! Ótima localização, café da manhã com muita variedade, limpeza impecável e a Sarah foi ótima nas indicações de passeios! Com certeza retornarei com mais tempo!"
dez. de 2020,5,Hotel novo e requintado,"Hotel novo, requintado e de bom gosto, no Setor Hoteleiro Norte, bem no Centro de Brasília.  Café da manhã bem servido e saboroso.    Durante a pandemia foi me oferecido um late checkout sem custo durante a semana, até as 18hs, o que me deixou muito feliz.    Único porém foi que pedi um quarto de frente, com vista, e fui alocado em um de fundos, sem vista."
dez. de 2020,5,Atendimento Excelente!,"Quero agradecer a Sarah por toda a simpatia e recepção, foi muito atenciosa conosco. Adoramos nossa estadia no hotel e concerteza vamos voltar. Tudo nos conformes da Pandemia, limpinho e organizado. Obrigada"
dez. de 2020,3,Windsor Brasília deixou a desejar,Quarto e banheiro ok. Bons e espaçosos.  Tem q tirar o bidê. Ninguém merece né.  Café da manhã normal. Pedi um omelete mas veio horrível. Suco tb muito fraco.  Ainda no check out me cobraram o q não consumi. Q eu saiba alguém assina qdo consome alguma coisa né. Francamente!
nov. de 2020,5,"Excelente a experiência, atendimento, café da manhã, serviço, localização, ambiente","Excelente localização, estrutura, organização impecável, tudo muito limpo e dentro das normas de segurança da OMS. Além da estrutura, o diferencial é o atendimento, equipe do check-in, segurança, café da manhã, sempre atenciosos, atendimento diferenciado de excelência. Ao chegar no hotel todos os funcionários envolvidos no check in fizeram um ótimo atendimento inclusive nos acompanhando ate a garagem para retirada das bagagens. Durante o café da manhã, atenciosos, atendendo aos pedidos um serviço diferenciado, devido as restrições alimentares da minha esposa, dieta lac free. Sem contar na simpatia, extremamente atenciosos e educados. Só tenho elogios a fazer."
nov. de 2020,5,novo e limpo,"cafá de manhã excelente. hotel todo novinho e cheirando a limpeza. A piscina é daquelas ""piscina conceito"", bonita mas pequena e serve só pra quem vai fazer natação, uma pessoa por vez. mas o ambiente é bem bonito, perto do restaurante. camas grandes, ambiente muito agradável em todos os cômodos."
nov. de 2020,5,Hotel Maravilhoso,"Hotel maravilhoso, bem localizado e com um atendimento de excelência,  ao chegar no hotel todos os funcionários envolvidos no check in fizeram um ótimo atendimento inclusive nos acompanhando ate a garagem para retirada das bagagens.  recomendo ."
nov. de 2020,5,Atenção dos funcionários,"Funcionários muito atenciosos, cuidadosos e em paralelo a limpeza do hotel. neste momento de pandemia estes cuidados são fundamentais para nos dar segurança e aos nossos familiares e colaboradores. Parabéns para toda equipe do hotel Windsor"
nov. de 2020,5,Experiência maravilhosa,"Hotel perfeito, ótima localização, próximo dos pontos turísticos, ao lado de shoppings. Os colaboradores todos muito simpáticos, solícitos e atenciosos. Organização impecável, tudo muito limpo e dentro das normas de segurança da OMS."
out. de 2020,3,Não superou expectativas!,"Atendimento bom, piscina não foi limpa durante nossa estadia, academia pequena com poucas opções, funcionários muito frios, dando a impressão de que não nos queriam ali, faltou informações sobre as opções de cardápio no café da manhã.    Pra salvar:  Quarto limpo e higienizado, banheiro muito limpo e ducha maravilhosa!    De uma forma geral foi bom."
ago. de 2020,4,"Excelente atendimento, alguns detalhes que podem melhorar.","Excelente atendimento, alguns detalhes que podem melhorar. Colaboradores extremamente atenciosos e educados. O hotel é lindo. Só tenho dois pontos a destacar como melhoria: Os lençóis tinham um cheiro beirando a metálico, talvez por causa do tipo de produto na lavagem, mas confesso que me incomodou. É um ponto que pode melhorar. Outra coisa foi ter cabelo no ralo do banheiro quando fui tomar banho. Precisam ter um pouco mais de atenção com o interior dos boxes. No mais, tomei um café da manhã maravilhoso preparado por vocês.  Espero ter colaborado."
ago. de 2020,5,Muito bom,"Uma estadia de um dia para o outro, mas com bastante excelência, segurança e conforto. Com todos os funcionários sendo solícitos e prestativos. Fiz pedido na cozinha também, rápido e muito bem feito. Suite bem aconchegante."
ago. de 2020,5,Otima localizacao e hotel,"O hotel fica de frente a um shopping, facil localizacao para os pontos turisticos. Otiml cafe da manha, eles te servem um cafe da manha completo ou como desejar.Tudo muito limpo, funcionarios atenciosos e solicitos sempre. Otima acomodacao. Somente a Piscina e Sauna nao poderia ser usada devido a pandemia do covid-19. E uma bela vista na cidade do quarto. E respeitando todas as normas da OMS."
ago. de 2020,5,Fui surpreendido!!!!,"é com muita satisfação que venho agradecer a equipe do Windsor Brasília hotel e parabenizá-los pelo excelente serviço a nós oferecidos. Ótimo atendimento qualidade e deliciosas refeições, a simpatia de todos os funcionários. Obrigado"
ago. de 2020,5,EXCELENTE,Nao posso me alongar muito sobre esta avaliaçao apenas posso dizer que fiquei muito satisfeito com a hospedagem nesse hotel eu fiquei hospedado em mais dois hoteis em Brasilia e escolhi este para finalizar a minha passagem por Brasilia.
jul. de 2020,5,Excellent,"Atendimento da equipe, mesmo nas condições atuais/pandemia estão absolutamente dentro dos padrões da OMS, as instalações e limpeza dos quartos e áreas onde permitem a circulação de hóspedes são excelentes!"
jul. de 2020,1,Deselegantes,"Passei por uma situação constragedora, preconceituosa, acharam que não ia pagar o consumo sendo que deixei uma caução de R$ 600,00. Antes de 12:00 sai do hotel e recebi uma ligação da recepção perguntando se eu nao ia fazer o acerto e o check out. Lamentavel. Pior aguardar o retorno da gerencia, fato que nao ocorreu até o momento."
jun. de 2020,2,Fraquinho,"Liguei no departamento de reservas por que a minha intenção era reservar para a unidade da Asa Sul na qual já me hospedei muitas vezes, porem fui informada pela Bruna de que o hotel estava fechado, mas me garantiu que o padrão da asa norte era igual. Me senti ludibriada. A primeira surpresa foi quando ela me informou que teria taxa adicional caso optasse por banheira, não quis porque no Plaza todos tem banheira. Reservei sem pacote. A segunda foi com o atendimento lento e nada simpatico das recepcionistas e ainda escutei do recepcionista Edson que estavam dando preferencia para quem fez pacote por este motivo meu quarto não estava pronto às 14h20. Em comparação ao da Asa sul, este só tem estrutura mas peca muito em atendimento."
jun. de 2020,5,Dia dos namorados,"Foi sem dúvidas a melhor experiência com hotelaria que tive😍  Queria apenas que tivesse um uma rede de hotéis Windsor em todos os meus destinos.  Lugar luxuoso, com atendimento de excelência que torna glamurosa sua viagem/ hospedagem.  Torno pública a minha satisfação com a rede Windsor de hotéis, principalmente a unidade da Asa norte de Brasília, a qual seria injusto caso não fizesse este elogio.  Não tenho palavras para agradecer o excelente fim de semana que tive.  Indicar esta rede de hotelaria a pessoas que não a conhecem é o mínimo que posso fazer por pessoas que buscam passar momentos inesquecíveis ou até mesmo descansar com luxo.  👏🏻👏🏻👏🏻👏🏻👏🏻👏🏻"
jun. de 2020,1,Despreparo total,"Minha noiva e eu decidimos chegar um pouco mais tarde para evitar aglomerações, pessima ideia. Tentamos ligar inumeras vezes para avisar que apesar de não termos chegado ainda podiam subir a garrafa de espumante, não atendiam o telefone e quando atendiam nos pediam para esperar e nos esqueciam na linha. Ao chegar no hotel ficou evidente o porque, apenas um recepcionista e 7 a 9 pessoas na fila. Os telefones tocando e o recepcionista sem poder fazer nada. Após uns minutos de espera perguntamos para ele se não havia ninguem para ajuda-lo e fomos informados que não, pedi para falar com o gerente e fomos informados que a senhora não estava mais no hotel. Tivemos mesmo que esperar. No sabado pela manhã no momento do check out a recepcionista nos informou que a gerente novamente não estava presente. Ao querer reclamar nos foi informado que não há caixa de reclamações no hotel (sugeriram entrar neste site) e não há gerente de recepção."
jun. de 2020,1,Desorganização total,"O dia dos namorados tinha tudo para ser perfeito, a reserva do hotel foi rápida, me ligaram 2x para confirmar os horários do pacote, e surpresa ao chegar lá o fiasco. Fomos chamados rápido pro check in entretanto a recepcionista era muito lenta. Os colegas liberaram até 3 casais enquanto ela ainda nos atendia. Passados os 17minutos de enrolação, ela ainda precisou ligar para alguém e perguntar se já podiamos subir, sendo que chegamos 1 hora depois da arrumação que pedi. Após mais uns minutos de enrolação finalmente subimos, porem parecia que as pétalas haviam sido jogadas ao azar, sem nenhum padrão e não haviam trufas conforme o vídeo promocional, somente umas frutas. O quarto é pequeno e ainda improvisaram uma mesa com uma só cadeira, ao solicitar outra cadeira, já que era noite de casais, mais meia hora de espera. E a banheira que custou mais R$100 não valeu o investimento. Uma pena!"
jun. de 2020,4,"os banheiros podiam ter melhor acabamento, as bancadas são pequenas. Não oferece roupão ou não identifiquei onde estava.","melhor acabamento dos banheiros foi para mim o ponto mais importante, achei o ambiente frio sem charme se comparado ao padrão geral do Hotel, os quartos também podem melhorar, e o café no quarto poderia ser cortesia, principalmente no momento de pandemia."
mai. de 2020,5,"Ótimo hotel, mesmo em tempo de pandemia","Apesar da cidade estar em quarentena a recepção, atendimento das refeições no quarto (jantar e café da manhã), valet e demais serviços funcionaram perfeitamente, todos muito solícitos e com os equipamentos de proteção requeridos. As partes comuns, como restaurantes, piscina, etc. não estavam liberadas para uso."
mai. de 2020,5,"Cortesia, limpeza e segurança esmeradas","Ótimo! A atenção redobrada por causa da Pandemia do COVID 19, não influenciou negativamente sobre a limpeza das acomodações, descrição e segurança. As acomodações estavam ótimas e o aprazível café da manhã servido, pontualmente, no horário marcado, no quarto, permitiu que me deslocasse para os compromissos de forma eficiente."
mai. de 2020,5,Excelente,"Muito Bom! Hotel limpo, organizado, café da manhã de qualidade e muitas variedades. Localização excepcional e vista livre. Neste período de coronavírus, o hotel está tomando todas as precauções necessárias, o que nos deixa a vontade e tranquilos."
abr. de 2020,5,Time nota 10!!!,"Equipe atenciosa, adaptação devido a questão da pandemia muito boa. Tudo adequado e dentro das expectativas. Seguindo os protocolos conforme legislação. Sempre atento a resolver os problemas. Nada a reclamar."
abr. de 2020,5,Perfeito hotel para viagem de negócio,"Excelente! Recomendo este hotel para tanto os quartos confortáveis e harmoniosas, os pratos do room service, a limpeza de quarto e o atendimento em geral . Retornarei no hotel nas minhas próximas viagens para Brasília."
abr. de 2020,5,A gente ficou confortavel e meu senti como em casa,"O Hotèl è bastante elegante, limpo e comodo, tudo certo e as camas e banheiros super, o pessoal bastante amavel e por suposto gentil, isso gaz parte de um serviço, que gera confianza e satifação top demàis"
abr. de 2020,5,MELHOR DO DF!!,"Recomendo imensamente!!! Hospedagem, serviços e localização são excelentes!! Experiência de objeto de valor perdido foi a melhor possível, demonstrado seriedade e respeito com o hóspede. Único óbice é o preço algo elevado."
mar. de 2020,5,Vale a pena!,"Recomendo, muito top. Hotel maravilhoso e recepção exemplar.  Quero parabenizar o GERENTE Leonardo Monteiro é toda a sua equipe! Quarto agradável, café da manhã maravilhoso. E uma vista linda de Brasília."
mar. de 2020,5,CONFORTO E TRANQUILIDADE,"Localização fantástica, no coração do plano piloto muito próximo de 3 shopping centers. Piscina do lobby aquecida, excelente. O quarto é de um tamanho razoável, o banheiro é excelente, a cama super confortável. Gostei muito do lobby de recepção do hotel, tranquilo. A destacar o excelente funcionamento do wi-fi, coisa rara na maioria dos hotéis, mas no windsor foi perfeito"
mar. de 2020,5,Hospedagem excelente !,"Hotel com ótimas instalações, uma equipe excelente ( check-in, mensageiros, serviço de quarto, restaurante ) em um ambiente bem agradável. Já me hospedei por 4 vezes e recomendo as instalações do Windsor Brasilia."
fev. de 2020,5,Ótima experiência em Brasília,"Os funcionários são muito proativos e educados. Tanto o check in quanto o checkout foram realizados com agilidade, o que é muito importante quando se está viajando a negócios.  O café da manhã é muito bom e o quarto bem limpo e confortável."
fev. de 2020,5,Atendimento impecável,O atendimento do hotel é irrepreensível. Instalações compatíveis com o padrão do hotel. Estacionamento com manobrista. Ótimo café da manhã. Um excelente custo/benefício no pacote de final de semana. Limpeza sem nenhum reparo.
fev. de 2020,5,Excelente atendimento,"Quarto com ótima vista,  Restaurante variado,  café manhã excelente,  Funcionários prestativos,  Só não gostei da obrigatoriedade de ter 200 palavras neste item da avaliação  Apartamento conformável;  refeição excelente,  academia adequada,  excelente localização,"
fev. de 2020,4,Confortável,"Hotel bem localizado próximo aos pontos turísticos importantes da cidade e também ao centro. O Café da manhã bom o que poderia ser melhorado é a academia e a área de lazer do hotel, pois chegamos na piscina e as poucas mesas disponíveis estavam ocupadas!"
fev. de 2020,4,Hotel moderno e de classe,"Realmente um dos melhores hotéis de Brasilia. Moderno, bem localizado, pessoal com excelente atendimento, custo benefício excelente, café da manhã muito bom também, super acessível aos apartamentos, muito bom o tamanho do apartamento, apenas um deslize: o uso de bidê em vez da ducha higiênica. Entretanto tem uma excelente vazão da água nos chuveiros e bidê, amenizando o desconforto dessa peça em desuso. Mas, diria que é um hotel maravilhoso. Senti-me muito bem acolhido e instalado."
fev. de 2020,4,Muito boa,"Muito bom, ambiente seguro e agradável. Colaboradores atenciosos.    Acomodações confortáveis.    Atendimento rápido.    Buffet diversificado.    Localização facilita deslocamento na cidade e proximidade de pontos comerciais."
fev. de 2020,5,Samuel Bastos Avalia,"Café da manhã espetacular cama sensacional, vista para o congresso nacional. Equipe fantástica. Ponto fraco pagamento antecipado, política que não me incomoda, mas, sem sentido. De resto tudo é muito bom!"
fev. de 2020,5,ÒTIMA LOCALIZAÇÃO E ATENDIMENTO,"Estadia muito boa desde o check in, jantar, atendimento no quarto e check out rápido. O cardápio do restaurante oferece uma quantidade muito boa de opções, o risoto de cogumelos estava perfeito. Recomendo."
fev. de 2020,5,Excelente serviço e localização,Recomendo o Hotel pois é os quartos são espaçosos e de bom gosto e o serviço na recepcao muito atencioso e rápido. Como o hotel fica ao lado do meu trabalho temos 20% de desconto então o custo / benefício realmente me surpreendeu. O café da manhã bem gostoso inclusive com salmão e suco verde que não encontramos em qualquer hotel.
fev. de 2020,4,Congresso,"Hotel bem localizado, especialmente para quem tem agenda no Congresso Nacional ,  STF e Palácio do Planalto, embora não recomende irem caminhando.  Peguem transporte de aplicativo pois os motoristas de táxi de Brasília dão inúmeras desculpas pra não aceitar cartão de crédito.  Em 3 oportunidades, os 3 motoristas disseram que a máquina do cartão estava com problemas.  Voltando ao hotel, o café da manhã é muito bom, bem variado e boa qualidade.  Atendimento do pessoal da recepção e do café é muito cordial e fazem a gente se sentir bem.  O quarto e banheiro são bons. Precisam melhorar nas toalhas.  Achei a cama um pouco dura.  O custo benefício é ótimo.  Se melhorarem a cama e as toalhas eu daria uma nota maior.  Boa opção em Brasília."
fev. de 2020,5,Melhor Custo x Beneficio de Brasilia,"O Hotel é muito bem localizado, com pessoal muito atencioso e educado. Os quartos são amplos, limpos e confortáveis, assim como o banheiro. Possui cofre, frigobar, secador de cabelos e amenities de boa qualidade. Quarto seguro e silencioso. Cafe da manhã excelente, farto, com alimentos frescos e saudáveis. Recomendo"
fev. de 2020,4,Atendeu as expectativas,"O hotel está bem localizado, próximo aos pontos turísticos da cidade bem como shopping. Os funcionários são bem treinados, o atendimento é ótimo. Os quartos são bem arrumados pelas funcionarias, o café da manhã é bem diversificado. Atendeu realmente as expectativas."
fev. de 2020,5,Hotel - viagem,Excelente localização. Preço justo. Café da manhã ótimo. Atendimento muito bom. Ótimo para família e para viagem de negócio. Estacionamento seguro. Manobristas atenciosos. Apartamento seguro. Academia que atende bem à hospedagem de passagem.
jan. de 2020,4,Muito boa experiência,"Hotel bem localizado , funcionários atenciosos e muito prestativos . Ambiente agradável, boa alimentação e serviços de apoio ao hóspede . Vale a pena conhecer, bom custo x beneficio . Café da manhã com variadas opções de alimentação, fitness center bem equipado ."
jan. de 2020,5,MUITO BOM,Fui em viagem de negócios.  Check-in com atendimento imediato e cortêz. Café da manhã completo e à vontade.  Equipe de trabalho bastante atencisa e solícita.  Fiquei bastante satisfeito. Voltaria com certeza.
jan. de 2020,4,Muito bom,Café da manhã bacana. Vista adorável do quarto. Bem localizado. Recepção bem decorada e segura.  Elevadores modernos. Organizados. Fácil acesso. Acesso rápido ao aeroporto. Confortável e limpo. Fica a dica.
jan. de 2020,5,"Excellent staff, location and features","O hotel é super confortável e o staff super atencioso. Principalmente o recepcionista Pedro. Passei mal e ele assistiu em toda a estada. Obrigada!  Único ponto negativo eh não ter água grátis, só as do frigobar.  Vale o preço pago. Voltarei!"
jan. de 2020,5,excelente hotel,"Excelente acomodações, tudo muito limpo e elegante. Os quartos são agradáveis, espaçosos, com boas camas. O banheiro tem um bom chuveiro. Os funcionários são gentis e prestativos. Recomendo a todos os viajantes"
jan. de 2020,5,Maravilhoso!,"Amei o tempo que passei no hotel. O quarto confortável, a cama excelente e o banheiro tb de alto nível, espaçoso e chuveiro de boa qualidade. Eu procurei um com banheira para poder relaxar e não deixou a desejar.  Super indico! Fui comemorar o aniversário de casamento e fomos super bem recebidos com agradinhos e uma cartinha assinada a punho do pessoal do Staff! Achamos o máximo!  Com certeza voltaremos!"
jan. de 2020,5,Excelente,"Atendimento atencioso e simpático de todos os funcionários, quarto confortável, limpo e com boas roupas de cama, maravilhoso café da manhã com várias opções, incluindo uma mesa de produtos sem glúten e lactose, ótima localização,"
jan. de 2020,5,Maravilhoso,"Hotel bem centralizado, ao lado de um shopping popular, só descer uma escada e já está lá, tem lojas boas envolvidas! A recepção e o staff funcionam perfeitamente! Check in é o check out super rápidos! O hotel é padrão, quarto com ótimo espaço, lavanderia nos atendeu muito bem, serviço de quarto muito bom, café da manhã excelente com muitas variedades! Voltaria com certeza!"
jan. de 2020,5,Maravilha de atendimento e conforto.,Colaboradores felizes e sempre prontos para atender. Limpeza bem feita. Camas gostosas. Restaurante com pratos deliciosos. Café da manhã muito bom. Piscina aquecida. Academia estruturada. Localização ótima.
jan. de 2020,5,Que lugar..,"Que lugar excelente. Localização, acomodações, funcionários, limpeza, atendimento e recepção tudo 10/10. Um destaque para o café da manhã, com muitas variedades e todas elas uma delícia, as que comi é claro é muita comida kk. Com certeza voltaremos!"
