Data da opinião,Nota,Título,Conteúdo
dez. de 2014,4,Ótimo custo benefício,"A localização é privilegiada, bem no centro e próximo a restaurantes e a feira. O hotel é bem em conta para quem se hospeda durante o final de semana. Os quartos são bem limpos e do tamanho ideal. O café da manhã não está incluso no valor da diária, porém pagando-se um valor de R$ 10,00 você pode desfrutar do café da manhã maravilhoso. Ah, vale ressaltar que o ônibus do aeroporto até o centro de BH, fica bem perto do hotel. Voltaria mais vezes."
dez. de 2014,4,ótima relação custo x beneficio,"Se você é um viajante descolado, este hotel é uma ótima opção.  Super bem localizado, quarto pequeno, mas bacana. Apesar de não ter frigobar no quarto, possui na recepção uma loja de conveniência com preços super ok.  O café da manhã é simples, mas possui o necessário (Frutas, suco, paes, frios,....). Lembrando que todo mês tem a promoção ""objeto do mês"" no site, onde ganha-se o café da manhã nos fds.  Atendimento foi super OK.  Recomendo e voltaria com certeza!"
dez. de 2014,1,Não voltarei,"Um dos elevadores passou o dia todo em manutenção.  Atendimento ao cliente deixa muito a desejar. Uma pena, pois o hotel fica em ótima localização.  É a terceira vez que me hospedo neste hotel e o serviço de estacionamento está cada dia pior."
dez. de 2014,5,Excelente custo benefico,"O hotel fica localizado num bairro excelente, perto de bons restaurantes, padarias, banco na esquina, salao de cabelereiro e padaria em frente e uns 4 quarteiroes da feira hippie.E muito barato a diária e bem perto do centro. A recepção tem um bom atendimento, cafe da manha, bom."
dez. de 2014,5,Para quem só quer um lugar para dormir,"Recomendo para aqueles que só precisam dormir em algum lugar. Hotel econômico e simples (sem frigobar).    Ele fica em frente a uma padaria (opção para o café da manhã), perto de parques e Shopping.    O ponto de ônibus é exatamente na frente do hotel."
dez. de 2014,3,Padrão simples Ibis,"A maior qualidade do Ibis é o padrão da cama, quarto, travesseiros e banheiro. Mas cada um trm serviços que são oferecidos ou não. Neste caso, o estacionamento era pago , e não tinha serviço de lavanderia. A localização não era muito ruim, se você esta de carro."
dez. de 2014,3,Acomodações,"O hotel é pequeno para três pessoas. Duas já é apertado. É barato bem localizado. Fica perto do Minascentro, perto de 2 shoppings, do mercado público que é ótimo. Bem próximo a rua de lojas que vendem a atacado."
dez. de 2014,2,Abaixo da Média em Tudo,"Hospedei-me no Ibis Budget por 5 meses consecutivos de 15 em 15 dias 4 dias de cada vez. Acredito que isto me capacita a conhecê-lo em detalhes.De inicio o preço:neste quesito é realmente o mais barato de BH.Quem achar mais barato desconfie.Mas as vantagens terminam por ai.A limpeza é muito ruim.O hotel tem uma recepção com raras exceções ineficiente.O café da manhã é péssimo,e cobrado a parte como tudo no Ibis.Raramente tem cobertores ou travesseiros extras.Os elevadores quase sempre estão com defeito.Como as janelas não abrem quase nada,apenas uma fresta os quartos tem sempre odor de poeira.São pessimamente ,limpos pela arrumadeira que não passa sequer uma vassoura no chão,limitando-se a trocas as toalhas e dar uma ""cara"" no resto.Como se não bastasse existe uma ""máfia"" de taxistas com a camisa vermelha do Ibis que ficam na porta e se vamos a algum lugar não seja longe ou no Aeroporto somos mal tratados.Os itens de alimentação vendidos na recepção tem preços absurdos."
nov. de 2014,4,Quem se hospeda no IBIS já sabe o que encontrar..,"Quem se hospeda na rede IBIS já sabe o que esperar quanto a quarto, preço, café da manhã, etc. O custo/benefício desses hotéis é excelente. Se você procura um hotel barato e com preço justo, a rede IBIS é o seu lugar."
nov. de 2014,4,Típico da rede IBIS,"Hotel típico da rede IBIS, bem localizado, com acesso fácil ao centro da cidade e outros pontos comerciais de grande circulação. Bom para estadias rápidas de negócios ou compras. Os quartos são pequenos porém bem divididos. Sento falta de uma linha direta com a recepção, o que força os hóspedes a descer até o lob pasta resolver pequenos problemas."
nov. de 2014,4,O Melhor na Região Central,"Hotel novo e muito bem localizado, próximo ao centro e à região da Savassi. Hotel típico da rede, com o sistema mais simples de atendimento, parecido com hotéis europeus. Ideal para que está de passagem, ou vai somente dormir mesmo."
nov. de 2014,3,Para viagens curtas,"O hotel é bem estruturado, com um cafe da manha justo pelo valor pago. Entretanto os quartos são ridículos, mal suportam 2 pessoas. A porta do chuveiro é de vidro e da para o quarto, ou seja você não tem privacidade ao tomar banho, já no vaso sanitário não tem tranca, nem janela, parece uma caixa, para quem é claustrofóbico terá problemas."
nov. de 2014,5,Bom hotel,"Bom hotel, prático. Atende às expectativas. Preço justo. Nada a reclamar. Voltaria e recomendo. Reserva pelo site dá desconto. Bem localizado, perto de bares e bons restaurantes. Econômico. Bom para quem quer só dormir."
nov. de 2014,3,Péssimo atendimento,Estive no dia 22 de Novembro hospedado no Ibis BUDGET Afonso Pena em BH e me deparei com um atendimento ruim na recepção não bastando isso fiquei surpreso com a falta de respeito do funcionário do estacionamento o sistema travou e ele batia com o teclado na mesa clientes ali ficaram assustado com o comportamento dele..    Não mais utilizarei o BUDGET Afonso Pena
nov. de 2014,4,Funcional,"O famoso bom, bonito e barato. Extremamente funcional, em se tratando de 1 pessoa. Atendimento muito bom, padrão Ibis. Não tem espaços amplos ou serviços diferenciados, como as outras bandeiras Ibis ou Mercure. Atende bem, para uma estadia rápida e eficaz."
nov. de 2014,5,Bom custo-benefício,"Boa localização, ponto de ônibus próximo, ponto de táxi logo na portaria do hotel. Mercados e Padarias próximas ao hotel.Quartos limpos e organizados diariamente. Atendimento de ótima qualidade, funcionários atenciosos e receptivos em todo tempo."
nov. de 2014,5,EXECELENTE,Muito bom o atendimento e hospedagem. Vale a pena. Local bem centralizado em relação ao centro da mesma com pessoal bem atencioso no solicitado. Somente deixa a desejar a garagem que é muito apertada e demorado na entrega dos veículos ao solicitar o veículo aos manobristas.
nov. de 2014,4,muito bem localizado,"Este hotel fica em uma região ótima, super econômico e muito bom para ir à pé a vários pontos de atração turística de BH como a feira de artesanato do domingo, museus, cafeterias ótimas e bons restaurantes. A região é muito agradável."
nov. de 2014,2,Abaixo das expectativas - hostel,"Me decepcionei: não tiveram consideração com o cliente, com o hospede. Quarto pequeno, não há local pra colocar a mala (por menor que seja) nem pendurar a mochila ou bolsa, há um cubílo com um chuveiro e ou separado com o vaso sanitário, a pia é minuscula dentro do quarto, não dão shampoo nem condicionador, o sabonete é do tamanho de uma moeda de 1 real, não há copo para beber água nem frigobar, falta toalha, enfim, decepção. Já os preços da diária, igual ou superior a de outros hoteis."
nov. de 2014,5,Descanso merecido!,"Localização, limpeza, preço e atendimento excelentes, somente fez falta um frigobar e cofre no apartamento.No início estranhei o tamanho dos apartamentos, pequenos, mas não atrapalhou , me senti confortável."
nov. de 2014,3,Ótima localização,"Localização ótima, porém quarto muito pequeno para 2 pessoas e sem frigobar. O ar condicionado fica ventando diretamente na cama devido ao tamanho do quarto. Da próxima vez ficarei no Ibis normal, não no budget."
nov. de 2014,3,Bom hotel para passagem rápida,O hotel é bom para passagens rápidas. A cama e os travesseiros são bons e o atendimento pela equipe do hotel. O problema é que não tem frigobar nos quartos e sem interfone com a recepção. De modo geral é bom o quarto.
nov. de 2014,5,Ótimo custo beneficio.,"A localização é ótima da pra deixar o carro no hotel e ir de táxi pagando muito pouco , o quarto é pequeno mas o preço também é , o importante é que muito limpo e com atendimento bom ,gostei muito ,recomendo e volto quantas vezes forem necessárias."
nov. de 2014,3,limpo e bem localizado,"O hotel apesar de ser basico, possui uma boa localizacao, e uma estruturas razoavel, o cafe da manha foi um pouco fraco, sem muita opcao, todavia para um hotel classe economica e o bastante, o quarto e bem pequeno com uma pia para lavar o rosto e escovar dentes ao lado da cama, fora do banheiro que apenas possui o chuveiro"
nov. de 2014,5,Maravilhoso,"O hotel é muito bom. Tudo muito limpo, funcionários simpáticos e prestativos, sempre solícitos. Senti necessidade apenas de um frigobar no quarto, mas nada que interfira muito na avaliação. A localização também é ótima. Parabéns."
nov. de 2014,3,Atendimento um pouco fora do padrao,"Ja me hospedei varias vezes em muitos Ibis Budget, mas desta vez notei uma queda na agilidade e cordialidade que costumo encontrar. Como a impressao nao foi so minha, como tambem dos meus amigos, e como aconteceu com 3 funcionarios em apenas uma diária, foi decepcionante. O que diferencia um Ibis Budget de outro é, alem desses 2 quesitos, a localizaçao. Desta vez, so este ultimo é elogiavel."
nov. de 2014,4,Sem surpresas. Tudo pequeno: preço e tamanho!,"O hotel é bem localizado, e os quartos são limpos, roupa de cama e banho higienizadas e de boa qualidade. Chuveiro bom. O tamanho dos quartos, padrão, é reduzidíssimo para duas pessoas. Suficiente para uma ou duas noites, e para viagens nas quais se vai ao hotel apenas para dormir. Recomendo para viagens rápidas e a negócios.  Atendimento simpático e eficiente, preços bem atrativos para final de semana. A dica é reservar pelo site, porque o desconto é excelente! O wifi é bom."
nov. de 2014,5,Padrão e localização,"O Ibis budget Belo Horizonte Afonso Pena oferece duas grandes vantagens para quem vem a Belo Horizonte pela primeira vez: o padrão Ibis de qualidade e relação custo/benefício do mesmo que se mantém em diversas cidades; e a localização na zona sul da capital mineira, próxima aos pontos de acesso para turismo de negócios gastronômico e de entretenimento."
nov. de 2014,4,Ótima localização e custo benefício!,"Excelente atendimento, cortes e rápido! Quarto e roupa de cama muito limpos, bom chuveiro e incontestável localização! É apenas pequeno, mas não é problema para dois dias de hospedagem. O café da manhã custa 12 reais e é suficiente."
nov. de 2014,3,ambiente,"Lugar bom e tranquilo para se hospedar mas quartos pequenos demais, mas fica próximo do grande centro de BH e alguns pontos bastantes conhecidos, como a rua Savassi e o mercado público, os quais tem bares, restaurantes e a cachaça."
nov. de 2014,4,Muito bom para uma estadia curta!,"Hotel muito bem localizado, confortável e com bom custo beneficio. Porém, em função da proposta do hotel, é ideal para estadias curtas já que o quarto é bem pequeno e a quantidade de serviços reduzida.    O hotel é enorme, são muitos quartos, então sempre tinha muita fila na recepção e nos elevadores.No entanto, dormi muito bem e os quartos são muito silenciosos apesar do grande movimento."
nov. de 2014,4,Sou fiel ao Budget Afonso Pena de Belo Horizonte,"Desde a sua inauguraçao frequento esse hotel.  Concordo de tudo de bom que falam dele e discordo dos comentarios que nao sao beneficos a ele. So peço que quando forem usar o taxi que o hotel oferece, tenham bastante cuidado ... Exigem o GPS e deem o endereço certo.  Como vivi em belo Horizonte uns 20 anos acham que podem me enganar. Cuidado com um senhor de idade alto e de tez escura ... Ele tem uma labia daquelas e pode enganar voce demonstrando que nao sabe o local pedido.  Comuniquei o fato ao hotel e eles deixaram claro que os taxis nao tem nada a ver com o hotel.  E qdo for para a Alvares Cabral para pegar o onibus que vai para o aeroporto, nao acredite no taxista que o caminho que vai para o aeroporto esta congestionado... Esse onibus tem uma estrada so para ele e sem congestionamento."
nov. de 2014,3,Bom custo-benefício,"O atendimento foi muito bom e a localização do hotel era perfeita para o que nós prentendíamos. O custo das diárias foi muito bom. Todavia, o quarto que reservamos para 3 pessoas era muito, mas muito pequeno... mal conseguíamos nos mover dentro dele e tinha um incoveniente enorme, a porta do banheiro era de vidro o que nos obrigava a sair do quarto toda vez que alguém ia tomar banho. Fora isso, a estadia foi boa."
nov. de 2014,5,Recepção muito atenciosa,"Ficamos hospedados em dias alternados. Ambiente muito limpo, agradável, serviço de recepção muito bom, pessoal muito agradável e atencioso. O hotel fica em um excelente ponto, próximo dos restaurantes e bares mais badalados de BH. A estadia foi perfeita. Café da manhã com excelente custo benefício."
nov. de 2014,4,Boa estadia,"Bem localizado, com check in e out rápidos, embora não disponha de ""garagem própria"" ( mto suspeito já q o prédio é ao lado e interligado por elevador). O pessoal é atencioso embora não saiba informar nada à respeito do q há ao redor (será q eles chegam e saem de táxi do hotel?, rs)"
nov. de 2014,5,Ótimo custo benéfico,"O hotel está novinho em folha! Tudo muito limpo e o serviço ótimo! Os quartos são dos padrões do Ibis, o diferencial realmente é estado dos mobiliários que estão perfeitos! Possui estacionamento, que é a parte, mas vale muito a pena! A localização é ótima!"
nov. de 2014,4,Agradável,"Gostei desse ibis budget de BH. Organizado, limpo, recepção limpa e tranquila. Funcionários eficientes, educados e super simpáticos.  Quarto com ar condicionado tipo splinter, que funcionam muito bem. Ducha ótima. Sempre limpo e agradável.  Como sempre nesse estilo do Ibis, os canais de TV são poucos de filmes, somente a Universal Channel, que, para mim, é um dos piores, além de você não ter a opção de tirar a legenda, mesmo o filme sendo dublado. Chato isso.  Bem localizado, tem mercados e restaurantes perto. Pois os preços de comidas ou bebidas são caros no hotel."
nov. de 2014,4,Ótima localização - Praticidade,"O hotel fica no centro de Belo Horizonte. Próximo a restaurantes, bares, padarias, Shopping Diamond e, principalmente, do Barro Preto (local onde se concentra várias lojas de roupas e calçados). O quarto é limpo e prático. O banheiro que fica dentro do quarto é todo separado, ou seja, tem o ambiente do vaso sanitário, o do chuveiro e o da pia. Bom custo/benefício. Importante: o café da manhã não está incluído no valor da diária, entretanto, pode-se pagar a parte. Quem não quer pegar um táxi para o aeroporto de Confins, há uma parada, a 300 metros do hotel onde se pega um ônibus que vai direto ao aeroporto."
nov. de 2014,3,Bom,"Hotel bom para ficar na cidade, mas sem ficar muito tempo no hotel... Não tem muitas coisas, para passar o tempo lá... Mas atende bem para passar a noite, final de semana. Atendimento razoável. Preço muito bom."
out. de 2014,5,Um Hotel de escelente no centro de Belo Horizonte,"Fala-se, muito sobre o Hotel que há décadas, faz sucesso principalmente no 31 de Dezembro. Ele é de fácil acesso, pois, encontra-se no centro de Belo Horizonte. Os apartamentos para o nível da rede, são muitos simples. Com o aumento de tantos hotéis que estão sendo construindo em BH, Mas, isto não tem importância, pois, para os turistas, pessoas de negócios o Hotel é bastante confortável.O atendimento é muito bom. O único problema que vejo é o hotel estar no centro da cidade, muito movimentado. Nada mais"
out. de 2014,4,Excelente localização e ótimo preço,"O hotel é muito bom, pela localização e pelos preços das diárias. Os quartos são bastante simples sem muito luxo, contendo apenas o essencial porém com muita qualidade, desde o colchão e lençóis até as toalhas. Vale à pena pela relação custo benefício."
out. de 2014,4,Otimo Localização,"É um hotel simples, mas para quem vai passar pouco tempo é quer gastar pouco é adequado. O hotel é limpo, bem localizado, café da manhã simples, funcionários prestativos. O quarto é pequeno e não indico o anda 20º o sinal da Wi-fi é fraco, tive que mudar de quarto, pois não conseguia conexão. A fila na recepção é sempre grande, devido a quantidade de funcionários não conseguir atender a demanda."
out. de 2014,4,Bom preço e ótima localização,"O hotel oferece tarifa adequada, é limpo, atende a hospedagem de curta duração, e a localização próxima das atrações de Belo Horizonte é sempre um diferencial na minha escolha por um hotel. A rede Íbis sempre me atendeu em minhas viagens."
out. de 2014,4,Muito Bom,"É um hotel para viagem curta. Viagens de negócios. O quarto é pequeno, mas tudo no seu lugar, tudo muito limpo, ótima ducha. TV 32 polegadas. O preço também é muito bom - 189,00.  Além dos 189,00 você ainda tem que pagar 17,00 pela diária do estacionamento e 16,00/ pessoa pelo café."
out. de 2014,3,Localização!,"Trata-se de mais um hotel no padrão Ibis Budget. Quartos pequenos, sem frigobar, sem café da manhã incluso, a não ser que você participe de promoção no facebook. A localização do hotel é fantástica. O hotel é inteiramente novo. Há um problema relacionado à pequena quantidade de elevadores se comparado com o número de quartos, o que, em ""horário de pico"", a depender do andar que estiver, pode implicar em ter que esperar 20 minutos para poder entrar em um elevador vazio."
out. de 2014,3,Atendente despreparado,Atendente Carlos bastante cínico e mal educado no atendimento. E olha que não era nenhuma situação de estresse - foram apenas perguntas simples sobre restaurante na região ou algo para comer no hotel..
out. de 2014,4,Sem surpresas,"Como toda rede Íbis, atendimento padrão, quartos limpos e funcionais, tinha alguns compromissos no centro durante a minha estádios que ficaram facilitados por sua localização, assim como para o aeroporto. Várias opções de restaurantes nos arredores. Se você quer uma estadia funcional e confortável, recomendo."
out. de 2014,4,Bom e acessível,"O hotel é grande, vários quartos, muito limpo e todo novo. Quarto pequeno com o essencial para uma acomodação, cama grande e confortável, roupa de cama branca, televisão, banheiro. Localizado na Savassi, próximo do centro da cidade, da área hospitalar, da praça da liberdade e dos muitos bares da região da savassi. O estacionamento não está incluso no valor da diária, o que deixa a desejar."
out. de 2014,3,Atende mas realmente é o mínimo,"Nunca tinha me hospedado em um ibis Budget. A proposta é válida, um hotel simples, com zero de serviço por um preço baixo. Realmente, você faz o check in o pronto. No quarto não tem telefone, não tem frigobar, e os banheiros possuem o sanitário e chuveiro separados. O lavabo é junto ao quarto. Cama boa e confortável, TV pequena mas atende também. O café da manhã, que se paga a parte também é simples mas funcional. Boa opção para quem chega, dorme e sai no dia seguinte."
out. de 2014,5,Perfeito para se hospedar,"O hotel é perfeito para se hospedar. É um hotel novo, bem localizado, próximo a praça da Liberdade, com ponto de táxi em frente e ponto de ônibus a 3 minutos a pé. Tem um mercado bem pertinho. O quarto é muito bom. A única diferença é que o banheiro é, digamos, dividido. A pia fica no quarto. O box para banho fica só e o sanitário em um outro cômodo, mas nada que seja problema. Não tem frigobar no quarto, porém na recepção tem uma loja de conveniências que vende água, refrigerante, cerveja, salgadinhos, etc. O café da manhã é pago a parte, um valor de RS 11,00 e é muito bom, vale a pena."
out. de 2014,4,Otimo custo beneficio,"Para quem procura um hotel bom e varato , sem muita sofisticacao na cidade de belo horizonte , esse hotel é o ideal, localizado proximo da savassi , da av afonso pena ! Com excekente custo , quartos confortaveis e hotel novissimo, ainda conta com uma loja de conveniencia excelente!!! Recomendo"
out. de 2014,4,Ibis Budget Belo Horizonte,"Bom preço, boa localização. O quarto é pequeno, porém confortável. O café da manhã poderia ser melhor, mas isso não desfaz a qualidade do hotel. Voltando à Belo Horizonte, considero hospedar-me nele, novamente."
out. de 2014,4,CUsto x benefício,"Hotel padrão IBIs, sem muito luxo, mas com o conforto necessário. Preço excelente e localização muito boa. Porém, acho que deveria ter no mínimo água no frigobar. Acordar com sede de madrugada e não ter nada para beber é muito ruim.  Quarto pequeno, mas limpo e confortável."
out. de 2014,4,Melhor custo x benefício,"É um hotel barato por ser da rede ibis, e apresenta uma excelente localização, 10 minutos do BH shopping de carro e fui apé do hotel para feira domingo de manhã... O quarto é pequeno mas muito confortável. E hotel é muito silencioso, o único pesar é ter o estacionamento terceirizado e o café da manhã fraco do ibis por um preço de 17 reais. Mas enfim, vale a pena..."
out. de 2014,5,Qualidade e bom preço,Hotel com excelente custo benefício. Muito bem localizado próximo de bons restaurantes e lojas. Boas acomodações e um café da manhã muito bom. A internet funciona muito bem no quarto. Limpo e confortável. Recomendo.
out. de 2014,4,Preço excelente e acomodação adequada!,"Fiquei hospedada em um final de semana e, apesar de estar lotado, não tive nenhum problema. Quartos limpos e atendimento eficaz! Além do café da manhã muito bom e por um preço justo! Localização excelente e com certeza, me hospedarei novamente!"
out. de 2014,3,Ibis Budget - Afonso Pena,"O Hotel é bem localizado, com fácil acesso pela Avenida Afonso Pena. As instalações são novas e estão bem conservadas, seguindo o padrão IBIS. O custo da diária é bom, mas o valor do café da manhã, não vale o custo benefício.  Como ponto negativo, destaco o atendimento na recepção do hotel: uma verdadeira bagunça com atendimento demorado e funcionários mal treinados."
out. de 2014,5,Adorei,"O hotel é muito bem localizado e limpo. Possui uma equipe atenciosa, eficiente e disponível. O quarto e o banheiro são bem maiores do que nos outros Ibis Budget que conheço. O café da manhã também é bom."
out. de 2014,4,Basico,"É uma versao ainda mais simplificada e barateada do Ibis. Nele só tem o que considera essencial para descansar. Vale a pena pelo preco. Para quem gosta de comer bem, é melhor procurar uma padaria para tomar cafe da manha. Porque ele nao vale muito o custo beneficio, mesmo sendo 16 R$."
out. de 2014,3,Final de semana,"Escolhi o Ibis Afonso Pena por ter uma boa localização, próximo de vários museus, praças... No final de semana o bairro é muito tranquilo, calmo... O quarto estava limpo e era arejado, acho que deveria ter ao menos água no frigobar! De resto, foi tudo tranquilo!"
out. de 2014,3,QHarto Pne (portadores de necessidades especiais),"quando cheguei no hotel, não havia disponível quarto comum. Neste caso, fui direcionada a um para pessoas com necessidades especiais.  Ao entrar achei o lugar espaçoso com apoios suficientes para uma pessoa se locomover com facilidade.  Mas no final, me pergunto se não seria necessário barras para acesso ao banheiro já que havia no local uma rampa de acesso com porta de correr.  Em anexo deixo as fotos sobre o quarto para análise."
out. de 2014,3,"Tirando a invasão do quarto, bom...","Hotel bom, toda estrutura ok. Exceto pela minha equivocada decisão de estender minha estadia, em meia-diária, onde me informei previamente que seria possível. Trabalho com eventos, e fiz meu check-in as 3 da manhã, e sem ter comunicado à recepção, prolonguei meu sono, e fui surpreendido dentro do meu quarto, enquanto dormia por uma funcionária, as 14h, alegando que eu teria que sair por ter vencido o horário. Posteriormente propôs trazer a máquina de cartão, pois se o pagamento não fosse antecipado, eu teria que sair na hora. Achei extremamente inapropriada a invasão. Paguei, tomei meu banho e fiz meu check-out, faltando ainda mais da metade do tempo da minha meia-diária extra."
out. de 2014,5,Excelente opção para viagens a negócio!,"Excelente opção para viagens a negócio. Hotel limpo, excelente atendimento, estacionamento não é caro e com wi-fi. Achei interessante que alguns andares possuem mesa e ferro de passar roupa. Não é preciso pagar nada. Basta ir lá e passar. Recomendo!"
out. de 2014,5,Excelente custo-benefício,"Localização excelente, próxima a rodoviária e acesso aos meios de transporte que levam ao aeroporto, bem como a restaurantes e casas noturnas. Hotel novo e padrão Ibis, não tem como ser surpreendido. O barulho atrapalha caso queira dormir de janela aberta, mas como as mesmas são anti-ruído opte pelo ar condicionado. A diária do estacionamento para a região é excelente R$17."
out. de 2014,5,ibis bh,"como sempre, para quem viaja a trabalho e precisa de um bom lugar para descansar e com preços acessíveis... estou muito satisfeito. reformaram os quartos e ficaram muito bons, não tenho reclamação a fazer. os atendentes tambem melhoraram muito. muito bom..."
out. de 2014,3,Prático e barato,"Hotel cumpre o que promete, nada de luxo, mas um bom preço e bem prático. Para hospedagens rápidas de uma noite fica a dica. Café da manhã bem simples, mas com várias opções ao lado para complementar o mesmo."
