Data da opinião,Nota,Título,Conteúdo
fev. de 2019,3,Bem mediano... é apenas mais um hotel “ok”,"O staff é extremamente educado e gentil; o café da manhã é maravilhoso; quarto espaçoso. A academia é pequena e pouco equipada, mas as esteiras são ótimas!! Porém alguns detalhes comprometem a qualidade da estadia: cama king é daquelas camas emendadas, com colchões desnivelados; o lençol é curto (no meio da noite vc acorda deitado sobre o tecido do colchão porque o lençol embolou - nas laterais e pé da cama); o cobertor é de solteiro; oferecem duas toalhas de banho, enquanto outros hotéis deixam ao menos 4, quando num quarto de casal; um dia deixaram 1 toalha apenas (éramos em 2); sabonete é super cheirosinho, mas é 1 só que vc divide entre box e pia; e o copo que quando fui usar estava sujo, com um fundo seco talvez de coca cola? Isso foi demais... Esse hotel era maravilhoso!! Agora está bom apenas. Pela oferta de hotéis que Brasilia oferece, eu não tenho mais o Windsor como primeira opção - e foi durante muito tempo!!"
fev. de 2019,5,Hotel Excelente,"O hotel é muito bem localizado, perto de tudo. Os quartos são confortáveis, embora não muito grandes. O atendimento é muito atencioso, sobretudo no restaurante, com destaque para os funcionários Alésio, Joelma e Luiz que, no café da manhã, se desdobram para atender a todas as necessidades dos hóspedes. Lá, a gente se sente entre amigos!"
fev. de 2019,5,Excelente.,"Não hospedar time de futebol, lota o hotel, causa aglomerações na portaria, atrai profissionais do sexo, o café da manhã fica muito cheio, o elevador fica lento, os manobristas ficam confussos entre dar atenção aos hospedes e fazer a segurança do hotel."
fev. de 2019,5,Melhor Hotel em Brasília,"Excelentes instalações, atendimento profissional e muito cordial, preço compatível com a qualidade das acomodações. Ótimo café da manhã e restaurante com boas opções de cardápio para as demais refeições. Meu hotel em Brasília."
jan. de 2019,4,Custo benefício ok,"Hotel bonito, quartos limpos, funcionários simpáticos, ótima internet, piscina e sauna ok, porém sem mesa pra jantar duas pessoas, acabamos comendo na cama, e recebemos dois guardanapos com mancha (não necessariamente sujo, mas passou uma má impressão)."
jan. de 2019,5,Cumpriu expectativas,Um hotel corporativo muito bom com tudo o que se pode esperar de um hotel deste padrão. Gostei e recomendo !!Só quero escrever isto mas me obrigam a ter que escrever 200 palavras !!! mas eu não tenho mais nada a comentar
jan. de 2019,1,Decepção total,"Fiquei hospedada na suite 207 no dia 31/12. Esqueci um colar de ouro com pingente, percebi no dia seguinte. Tive que ligar quatro vezes no hotel para conseguir um retorno, que tinham verificado e não tinham encontrado o colar. O hotel é novo, mas precisam de um treinamento e um comprometimento maior da equipe da recepção em relação aos hospedes. Muito triste até hoje por isto. Não recomento"
jan. de 2019,5,Excelente!,"Fomos muito bem recebidos desde a chegada, com Welcome Drink e early Check-in e late Check out (sujeitos a reserva no website Windsor).Excelente cafe da manhã, quarto confortavel, espaçoso o suficiente, com ar condicionado central e black out bom."
jan. de 2019,5,local para se visitar novamente - exepcional,"gostei muito da atenção de todos os empregados, bem como a maneira atenciosa como se reportam a seus hospedes.alimentação desde o café da manha até os pratos solicitados no quarto todos muito bem elaborados."
jan. de 2019,4,Bom hotel,Bom hotel levando-se em consideração o padrão de Brasília. O hotel é bem localizado e o serviço é correto. O café da manhã é em bom padrão para hotéis do tipo. Ele se destaca pois as opções de Brasília são péssimas.
jan. de 2019,5,Excelencia,"Ficamos hospedados de um sábado para domingo, pois na segunda-feira seguinte a chegada do nosso primeiro filho estava marcada pra logo cedo. Não fizemos reserva antes, fomos direto no Balcão, o Rapaz que no atendeu, senão me engano Geraldo, de uma cordialidade incrível, nota 1000 pra ele. ficamos em um quarto com uma vista ótima, utilizamos a piscina que estava aquecida. Em resumo, nossa estada foi ótima. Parabéns a equipe!"
jan. de 2019,5,Hotel muito bom,"O hotel é novo, está localizado na area central de Brasília, em frente ao eixo monumental, perto de shoppings e da torre de TV. O quarto é confortável, banheiro grande, a cama é excelente e o café da manhã variado."
jan. de 2019,4,Bom hotel mas pode melhorar em algumas coisas,"Apesar de não termos visto sujeiras aparentes, encontramos um pé de meia atrás da cortina.Como ficamos num apartamento de canto, o black out não era suficiente para escurecer bem o quarto em função da quantidade de vidros.Nas amenidades, faltou um hidratante.A estrutura do hotel é boa, o tamanho do apartamento é bom, a cama e o chuveiro são muito bons também, o café da manhã também é bom, o atendimento também é ótimo."
jan. de 2019,5,Excelente relação custo x benefício.,Hospedado em um evento da empresa. Sala s excelentes. Infraestrutura adequada. Café da manhã muito bom. Ótima localização e equipe de funcionários cordial e atenta às necessidades dos hóspedes. O ponto alto é a equipe do hotel.
jan. de 2019,5,Ótimo hotel,"Muito bom hotel. Pode melhorar na limpeza dos quartos (por exemplo, o hóspede anterior havia esquecido uma meia (usada) num canto do apartamento e a camareira obviamente não havia limpado adequadamente o chão do quarto, senão teria visto e recolhido a dita cuja) e incluir hidratante nas amenidades oferecidas no banheiro."
jan. de 2019,4,excelente relação custo-benefício,"Muito bom o hotel. Almoçamos no restaurante e a apresentação dos pratos foi fantástica, além de muito saborosos. Sem demora e excelente atendimento dos funcionários. Único ponto negativo: a pia do banheiro estava levemente entupida..."
jan. de 2019,5,"merece 10, mas pecaram no minimo, isso nao devia","fiquei 30 anos, no corpo de bombeiros, ou salva ou tenta salvar, desistir nunca, então inclui o cafezinho na diária que o cliente não sente ok.para vcs nao ´´e nada, ninguem consegue andar com um grao de arroz no sapato, pq incomoda muito, eu fiquei chateado, que bela a arquitetura do hotel, a estrutura fisica, mas qdo entrou o comportamento humano, na hora do acerto faltou o bom senso da recepcionista, ou ela foi orientada para isso, penso que vcs devem reavaliar, garanto que a mao de obra dispensada em preencher o talao, guardar, e encaminhar isso sai caro e perde tempo, vi que tinha algo errado, hoje é (sistema)encaminha direto na despesa, qquer coisa procura a gravaçao e pronto, comprova que foi consumido, de qquer maneira meus parabéns para o hotel,"
jan. de 2019,5,Localização!,"Excelente localização e acesso, quartos confortáveis e limpos, café da manhã maravilhoso e boas opções de room service, boa conexão wifi. Apenas trocaria os travesseiros, que são bem desconfortáveis (mas isso é muito pessoal)."
jan. de 2019,5,Excellent!,"O hotel apresenta ótimo nível de serviços e atendimento.A panorâmica da vista para a parte estrutural do poder em Brasília, excelente.Atendimento dos profissionais, bem treinados.No demais, sem qualquer restrição quanto ao preparo e atendimento."
jan. de 2019,4,Windsor,"O Windsor Brasília Hotel, localizado no Setor Hoteleiro Norte, é uma boa opção para se hospedar em Brasília. Trata-se de um prédio recém construído, belo e com boas instalações físicas e uma boa vista da Esplanada dos Ministérios da Capital República Federativa do Brasil."
jan. de 2019,5,Espetacular,"O quarto é excelente, cama extremamente confortável. Além disso, o café da manhã é ótimo, bem sortido. O atendimento de todos os funcionários foi sensacional e a qualidade dos serviços foi excelente. Voltarei com toda certeza."
jan. de 2019,5,Otima localização,"Foi minha primeira viagem a Brasília, ja tinha uma indicação de um amigo para ficar hospedado neste hotel, ele fica muito bem localizado, na Asa Norte, perto de shoppings, quartos grande e limpos, um atendimento muito bom.Voltaria a me hospedar lá com certeza."
dez. de 2018,5,Excelente,"Hotel localizado no setor hoteleiro, muito bem localizado, os quartos são excelentes, o café da manhã é sensacional (um dos melhores da minha vida), o atendimento é muito gentil. Estivemos com nossa filha bebê, e nossa estadia foi muito boa."
dez. de 2018,5,Excelente!,Nao recebi na nf da minha hospedagem. Gostaria que o hotel disponibilizasse o quanto antes. Quanto ao atendimento não há como descrever a satisfação de estar numa unidade o glamur e a cordialidade de todos os serviços.
dez. de 2018,5,TUDO EM UM HOTEL,"Muito boa os serviços do hotel, qualidade no atendimento, sauna, piscina, localização excelente, preço um pouco caro, porém compensa pela estrutura e qualidade do mesmo.Boa dica para hospedagem na capital"
dez. de 2018,5,Hotel requintado com excelente atendimento,"Hotel esplêndido com funcionários educados e muito solícitos. Restaurante impecável. Piscina térmica maravilhosa e sauna, dois pontos altos desse hotel para quem precisa de descanso e relax. Vista espetacular de Brasília e excelente localização. Recomendo."
dez. de 2018,3,Hotel regular,"Atendimento ruim, maleiro nao levou mala ao quarto e funcionarios nao sao pro ativos.Limpeza do quarto péssima, nada foi limpo, apenas arrumado. Quarto muito bom, otima vista, e muito confortavel. Café esplendido, por isto valeu muito apena a hospedagem."
dez. de 2018,3,Razoável,"Chuveiro vazando muito por cima, molhando o teto.O hamburger deixou a desejar.Enfim, um hotel de boa aparência, mas com problemas simples que comprometem a qualidade do estabelecimento.No mais, é bem localizado."
dez. de 2018,3,Quarto com cheiro de mofo,"Apesar do hotel ser bonito e novo, meu quarto estava com um forte cheiro de mofo. A localização é otima, bem próximo ao Conjunto Nacional e à torre.A cama poderia ter um colchão um pouco melhor, mais macio.Café da manhã bom, compativel com os hoteis da região."
dez. de 2018,4,Muito bom,"Tudo é bom, porém o frigobar do apto é extremamente barulhento.Comida é boa. Café da manhã também. Localização é boa.Tive problema na Recepção pois pedi a NF em nome da empresa, e não fazem o cadastro na hora. Mandam por e-mail para a central no RJ e tive que aguardar. Ainda por cima, emitiram uma NF de despesa particular para a empresa, sendo que pedi que somente aquela despesa (lavanderia) fosse no meu nome. Apesar disso, emitiram a NF contra a empresa."
dez. de 2018,5,Excelente,"Um dos melhores hotéis de Brasília. Extremamente confortável. Café King size. Quarto imenso. Banheiro idem. Tv com canais por assinatura. Wi fi de alta velocidade. Atendimento excelente. Café da manhã de qualidade  Enfim, tudo perfeito."
dez. de 2018,5,Excelente em varios aspectos,Estrutura e acomodações novas e modernas. Atendimento diferenciado e gentil. Café da manhã com muitas variedades e com reposição imediata. Localizado próximo a um Shopping. Ótima opção de hospedagem em Brasília.
dez. de 2018,5,Muito positivo,Muito positivo. Estrutura excelente do hotel. Refeições ótimas. Espaço pra trabalhar excelente. Quarto maravilhoso. Gostei muito e espero viver essa experiência novamente no Windsor. Atendimento dos funcionários muito bomtb
dez. de 2018,4,muito bom,Gostei da hospedagem e da comodidade e boa localização pertinho do shopping conjunto nacional e também tem o shopping Brasília a uns quinze minutos de caminhada.Tudo transcorreu conforme o programado.
dez. de 2018,5,Satisfeito,"Os travesseiros são muito macios. Para mim, poderiam ser mais firmes. O serviço 24h poderia ter mais opções de lanches e refeições. O banheiro poderia ter ducha higiênica ao invés de bidet. Não entendo porque vocês exigem no mínimo 200 caracteres nesse campo. O cliente precisa ter liberdade para expor suas ideias."
dez. de 2018,5,Excelente,"Excelente custo benefício. Apenas um pequeno vazamento da água do chuveiro no chão do banheiro, para fora do box, mas que não foi nenhum transtorno. Na verdade eu deveria ter comunicado o fato à direção do hotel, mas estive tão ocupado com o meu evento, que me esqueci. O Hotel é excelente."
dez. de 2018,5,Ótimo para praticantes de esportes viajando a trabalho.,"É limpo e bem cuidado. Os funcionários são educados, prestativos e simpáticos. Piscina aquecida: ótima para nado esportivo, mas só tem uma raia. Wi-fi funciona bem e o café da manhã é FORMIDÁVEL. No check out constavam cervejas (não bebo) e um jantar que eu não havia consumido. Problema prontamente resolvido pela recepcionista. Recomendo que aumentem o espaço da academia, tive que me alongar no espaço ao lado da sauna."
dez. de 2018,5,ótimo custo-benefício,"hotel muito bom, funcionários atenciosos, quarto confortável, roupa de cama bem macia e de ótima qualidade, localização muito boa. A piscina é aquecida na temperatura ideal, possui toalhas limpas , é ótima , vale a pena um mergulho."
dez. de 2018,5,Ótimos serviços e atendimento,"Hotel novo, bem localizado, funcionários atenciosos, ótimo café da manhã. Vale o quanto custa. Ótima relação custo/beneficío. Quartos são de tamanho muito bom; apenas a bancada de trabalho poderia ser um pouco maior. Nesse ponto, deixa a desejar."
dez. de 2018,5,ÓTIMAS ACOMODAÇÕES,"Estive nesse Hotel a negócios e achei o quarto confortável, com cama king e chuveiro excelentes!  Café da manhã bem completo e saboroso também.  A localização é ótima para quem precisa se deslocar para vários pontos da cidade.  Parabéns a todo o Staff do Hotel que trabalha com competência, profissionalismo, sendo sempre muito solícitos!  Com certeza indico!"
dez. de 2018,5,QUALIDADE DE SERVIÇO EXCELENTE,"Como organizadora de eventos, é muito gratificante quando temos uma equipe tão engajada para que tudo funcione bem.Obrigada pelo profissionalismo de todas as áreas.Realizaremos outros eventos com a certeza de satisfação de todos os participantes.Obrigada Windsor Brasília"
dez. de 2018,5,satisfação absoluta.,"Está dentro dos padrões dos melhores hotéis, não há motivo para reclamação, uma vez que atendeu todas as expectativas esperadas. Pela a terceira vez, estou me hospedando nesse conceituado hotel, espero retornar em breve."
dez. de 2018,4,Os hóspedes são sua razão de existir,"Me senti em casa, sugiro acrescentar uma cadeira a mais na bancada, pois o casal necessitou de trabalhar conjuntamente. A localização é muito boa. e os funcionários acolhedores. Sugiro, também que: As pessoas que se hospedarem neste hotel tenham trasladi incluso para outro hotel da mesma rede, no meu caso o evento era no plaza aza norte e tive que administrar esse quesito."
dez. de 2018,5,Ícone,IR a BSB e não ficar nesta unidade é a mesma coisa que ir a Itália e não ver o PAPA...  Hotel acima da média com atendimento e gastronomia sempre com diferenciais..  Adoro levar amigos para reuniões e café da manhã...
dez. de 2018,5,"Excelente hotel, excelentes serviços","Excelente Hotel, Excelentes Serviços, ótimo atendimento. Limpo, espaçoso. Indico para Férias ou a Negócios... Muito bem localizado... Vale à pena conferir. Muito bom mesmo... Recomendo!!!... Um dos meus preferidos em Brasília..."
dez. de 2018,5,EXCELÊNCIA,"Ficou hospedada neste hotel no mínimo 2 vezes por mês, há anos. Sempre fui muito bem recebida. Gentileza e simpatia de todos o colaboradores. Ambiente silencioso, requintado, limpíssimo, discreto, atendimento rápido, cozinha maravilhosa, café da manhã perfeito."
nov. de 2018,5,"Local que atende plenamente o hóspede!!! Possui amplitude, boas instalações, piscina e salas de convenções.","Quartos amplos e agradáveis, empregados muito atenciosos, bem treinados, restaurante de elevada qualidade, piscina, sala de ginástica e sauna muito boas.. tudo corresponde e agrada, assim como a ótima localização!"
nov. de 2018,5,Excelente,Realmente superou minhas expectativasFácil acesso aos shoppings e outros setores de Brasília. Café da manhã com pessoas super dedicadas e com variedades surpreendentes.Vale a pena se hospedar neste hotel.
nov. de 2018,5,Indicamos sem medo,"O hotel é novo, o atendimento é excelente e o café da manhã é ótimo. A piscina interna aquecida foi um diferencial num fim de semana chuvoso. A gente vê que o atendimento é bom quando há algum problema. No nosso caso, ao chegarmos nos deram, por engano, um apartamento que não havia sido arrumado. No entanto, o problema foi resolvido tão rápido que não afetou em nada a nossa estadia. Indicamos sem medo. Adoramos passar o nosso aniversário de casamento lá."
nov. de 2018,5,Muito satisfeito,"Excelente atendimento por parte de todos os funcionários, boa localização é um café da manhã muito saboroso. O serviço de room service e muito ágil. Check In muito atencioso e rápido. As acomodações são muito confortáveis."
nov. de 2018,5,excelente!,"hotel maravilhoso, moderno, luxuoso e acessível, ótimas acomodações, cafe da manha inigualável, muito bem atendido, raia aquecida, sauna excelente. tudo novinho e aconchegante. ótima recepção e atendimento. parabéns!!!!"
nov. de 2018,5,Muito satisfeita,"Estadia muito agradável. Quarto muito bom, excelente atendimento, café da manhã muito gostoso. Localização muito favorável. Gostamos muito e já indiquei para amigos que irão viajar para Brasília em breve."
nov. de 2018,5,Ótimo,"Um maravilhoso hotel com excelente café da manhã, com funcionários exemplares, com acomodações muito aconchegantes, com vista espetacular. Voltaremos com toda a certeza em uma próxima viagem a Brasília!"
nov. de 2018,4,Boa estadia,"O hotel oferece quartos confortáveis e silenciosos. Equipe prestativa. A academia carece de alguns equipamentos, mas quebra o galho. Café da manhã excelente com diversas opções. Excelente custo-benefício."
nov. de 2018,5,Excelente!,"Pra quem procura conforto, tranquilidade, e segurança.Hotel extremamente novo, limpo, funcionários muito educados e prestativos, cafe da manha muito bom, chuveiros excelentes, piscina aquecida.Recomendo 100%"
nov. de 2018,5,Otima estadia.,"Contratei o pacote romantico, foi tudo como combinado, espumante, hidro, apto... o destaque vai para o atendimento desde a reserva ate o check-out. Cafe da manha fantastico, nada ficou a desejar, estao de parabens."
nov. de 2018,5,Hotel excelente para família,"Fui com minha namorada e dois filhos! A cama super king conseguiu acolher meu filho de 10 anos e colocaram uma cama extra no quarto que mesmo assim ficou com um espaço excelente! O café da manhã e maravilhoso do hotel! Tem uma piscina enorme e academia! O hotel fica no setor hoteleiro da asa norte, bem no coração da cidade! Perto do CASV e embaixada Americana!"
nov. de 2018,5,Brasília nostálgica,"Boas acomodações, café da manhã esplêndido, localização privilegiada , preço salgado, mas custo /benefício aceitável. O pessoal da recepção e do restaurante são agradáveis e gentis. Limpeza dos quartos boa, sistema Wi-Fi atende moreles."
nov. de 2018,5,Grata Surpresa e excelência em serviço.,"Sem recomendações, em termos gerais o hotel me surpreendeu com a qualidade e serviços que presta. ficamos extremamente satisfeitos com o tratamento e os serviços prestados, ótimo café da manhã e academia com uma boa esteira para treinos."
nov. de 2018,4,Funcional e confortável,Poderia melhor a diversificação no breakfast. Sua sala de ginástica é muito modesta.Sua piscina é excelente e sua recepção é acolhedoraO visual de Brasília ou dos hotéis que o circunda é interessante e não infadonha
nov. de 2018,5,Excelente conjunto,"Hotel da rede Windsor, com excelente instalações e de otima localização na Asa Norte, proxima a shoppings, area administrativa de Brasilia e restaurantes. Quartos com mobilias novas e serviço receptivo do staff ."
nov. de 2018,5,"Localização, conforto e qualidade!","Excelente localização, restaurante com grande variedade e qualidade, staff muito bem educado e capacitado e conforto em cada ambiente. Destaque especial ao pessoal do restaurante, muito educados e atenciosos."
nov. de 2018,5,AINDA UMA EXCELENTE OPÇÃO DE HOTEL,Ótima localização; café da manhã variado; hotel novo; sempre quando posso fico nele. Equipe cordial e atenciosa. Os quartos são bem equipados. Os colchões excelentes também. Banheiro espaçoso. Vale a pena experimentar.
nov. de 2018,4,Recomendo,Serviço e acomodações excelentes. Preço de razoável para alto. Os quartos de qualidade superiores possuem um mini escritório separado do quarto que facilita na viagem envolvendo negócios.Recomendo e voltaria a utilizar os serviços.
nov. de 2018,5,"Ótimo hotel, mas não fui eu q paguei","Gostei muito do hotel e do quarto. Eu já havia ficado em algum hotel da Rede Windsor, não lembro se foi o mesmo hotel na Asa Norte. Mas a cama é muito aconchegante, tem mesa e cadeira, frigobar, TV, ar, wi-fi. E o café da manhã é excelente. Recomendo!"
nov. de 2018,5,Melhor Hotel de Brasilia,"Adoro o Hotel!Quase uma vez ao mes estou la a trabalhoFuncionarios mega atenciosos Café da manha perfeito!Cardapio fantastico, para almoço e jantar.Cama ,lencois e travesseiros da melhor qualidade!"
nov. de 2018,5,Excelente atendimento e excelente estrutura ! Recomendo !,"Hotel impecável, ótima estrutura e perfeito atendimento! Nota 10! Super recomendo o Windsor. Gerente recepção e equipe meu agradecimento, por toda a presteza, atenção e carinho no qual organizaram a estadia no período de 02.11 a 04.11."
out. de 2018,5,Fiquei muito satisfeito.,"As instalações são muito boas, elevadores rápidos, infraestrutura e restaurante igualmente bons. Não terei dúvidas ao indicar para amigos e conhecidos. A sua localização é privilegiada -- próximo de shoppings, de bons restaurantes e não tão distante do aeroporto."
out. de 2018,5,Minha hospedagem foi excelente,"O hotel tem um ambiente maravilhoso para se hospedar (fisicamente quanto a sua estrutura e quanto ao atendimento - recursos humanos). Nas próximas viagens pretendo me hospedar novamente neste hotel, que também fica bem localizado."
out. de 2018,4,Hotel Muito Bom - Recomendo com certeza,"Hotel muito bom. Estrutura e atendimento do pessoal excelente. Quarto confortável e muito bom em todos os aspectos. Restaurante muito bom. Limpeza adequada, funcionários receptivos, adequada estrutura para eventos corporativos. Com certeza recomendo."
out. de 2018,5,Perfeito!!!!!,"Tudo muito bom...pessoal atencioso e estrutura top!!!!Café da manhã perfeito, e área coletiva bem estruturada. A unica coisa que tenho um ponto a relatar é sobre o wi-fi... Teve algumas ocilações com o sinal, mas mesmo assim nada que atrapalhasse o andamento do uso."
out. de 2018,4,Boa escolha.,"Boas acomodações com vedação nas janelas para evitar ruídos externos e um amplo banheiro, boa recepção com equipe gentil e prestativa, tem uma academia bacaninha e uma boa piscina para quem gosta de nadar e a equipe de governança é prestativa."
out. de 2018,5,Ótimo,"Excelente hotel! Ótima vista da nossa Brasília linda, comida boa...amei tbm o serviço de quarto. Bom... Não tem muito o que falar. Foi tudo bacana, a minha estadia foi maravilhosa e eu pretendo voltar em breve e esse será o hotel de escolha."
out. de 2018,3,Um bom hotel,"O hotel está novo, os quartos são bons, o banheiro que deixa a desejar um pouco. O café da manhã é muito bom e é bem próximo ao estádio que era nosso objetivo. O maior problema é o acesso para quem vem de carro, muito colado à saída do eixo."
out. de 2018,4,Muito confortável.,"Hotel muito confortável, limpo, café da manhã excelente, restaurante bom, atendimento muito bom, pessoal solícito, quarto muito confortável. O único defeito é não ter ducha higiênica no banheiro, um hotel desse padrão deveria ter."
out. de 2018,5,Atendimento e conforto com preço acessível,"Passei apenas 1noite. Porém chamou a atenção o bom atendimento, conforto da hotelaria de um hotel mais novo. E o preço, bastante acessível.Obs: não avaliei o café da manhã, pois não utilizei esse servico"
out. de 2018,5,Excelente Hotel! Alto padrão! Excelente atendimento!,Excelente Hotel! Alto padrão! Excelente atendimento. Quarto aconchegante e muito limpo. Refeições deliciosas. Café da amanhã com muitas opções de comidas e bebidas. Excelente localização. Apartamento com vista para a explanada.
out. de 2018,5,Excelente hotel,"Localização privilegiada, próximo ao aeroporto tendo o shopping conjunto nacional ao lado, comida espetacular, atendimento com alto padrão, equipe devidamente treinada demonstrando explicitamente preocupação com o bem estar do hóspede, limpeza impecável, simpatia da equipe. Ressalto também que no café da manhã os sucos oferecidos são NATURAIS! Hoje em dia pela minha experiência, muito raro ! Geralmente são sucos industrializados! Parabéns a todos e mantenham o padrão! Recomendo com muita tranquilidade!"
out. de 2018,5,Conforto e excelente serviço.,"Fomos para comemorar o Dia das Crianças e foi tudo uma delícia. Café da manhã muito bem servido, equipe de atendimento impecável. Piscina deliciosa e, por ser coberta em um ambiente climatizado, torna o banho sensacional. Sauna impecável e limpeza como deve ser."
out. de 2018,5,Excelene Hotel,"Muito bom esse hotel. Pessoal muito atencioso. A piscina está aquecida na medida. O café da manhã é destaque. Variedade alimentos. Quarto Silencioso. Tv com um bom som. Senti falta do da entrada USB, mas isso não denigre a imagem do hotel."
