Data da opinião,Nota,Título,Conteúdo
mar. de 2017,2,Tinha tudo pra ser bom...,"Hotel bonito, novo, quartos espaçosos e banheiro bom... parece ótimo né? Pois é, mas o serviço, a atenção e os preços cobrados fazem o hotel não valer a pena. Infelizmente...    Quarto: O quarto em si é ótimo, mas tive o azar de pegar um dia chuvoso em Brasília e descobrir que a vedação externa do prédio estava tão malfeita que começou a drenar pra dentro do quarto pela parte de cima da janela, formando uma cachoeira dentro do quarto.    Liguei pra recepção, o pessoal de manutenção veio, viu o problema e pra resolver colocaram uma toalha no parapeito da janela... ou seja, passei a noite toda ouvindo pingos de água na toalha molhada... por R$450 de diária.    O pessoal é tão desatencioso que ninguém nem me ligou pra perguntar se tinham arrumado o problema... tão simples de agradar...nota zero pro serviço.    Fui almoçar tarde no restaurante, realmente cheguei tarde... mas até aí beleza.    Comi no Buffett pois era a única opção, só tinha eu no restaurante.    As opções não eram tão ruins, mas nada fabuloso, a comida estava velha e custa caro... a conta do buffet + refrigerante ficou em R$99!!!    Sugestão pra A&B, após certo horário baixem o preço... vão ter prejuízo de qualquer forma, é melhor vender mais barato do que jogar fora.    O cafe da manhã é muito bom, varias opções inclusive light e sem glúten. Pra ficar 100% só precisa melhorar a qualidade do cafe servido, mas mesmo assim é muito bom.    Serviço - no check in e checkout não tive problema.  Meu problema foi com a atenção a clientes em várias ocasiões.    Primeiro o problema da goteira... foi muito mal gerenciado.    Segundo com o bar do lobby, não tem ninguém pra atender, se quiser algo eles ligam pra um cara no restaurante, que fica no segundo andar, e o sujeito tem que descer o elevador pra servir café no lobby, sendo que a máquina está no bar do Lobby. Não faz sentido.    A&B, outra dica pra vocês, ou faz sistema self service, e vende as cápsulas na recepção, ou sirvam cafe sem custo, coado mesmo, igual aos hotéis de fora do país. Mas não montem um bar sem funcionário pois é inútil... não gera receita e ainda fica feio.    Veredicto    O hotel tem potencial, mas precisa melhorar muito o serviço, pelo preço cobrado tem centenas de opções em Brasília. Até hotéis mais simples atendem melhor e gerenciam os problemas de forma mais atenciosa com os clientes."
mar. de 2017,5,Excelência em hotelaria!,"Ótima localização,bem próximo do Shopping Conjunto Nacional.  Excelente custo beneficio.Check in e Check out eficientes.  Toda a equipe do hotel trabalha com muito profissionalismo e competência sempre se preocupando com os detalhes.Ficamos no quarto andar com a vista para os edifícios Biarritz e Saint Moritz Quartier. Os detalhes do quarto como o contraste das cores do piso e do banheiro proporcionam um requinte no ambiente sem ficar excessivo.  A qualidade do sono é excelente com cama King size confortável,guarda-roupas com roupão e cofre.Área de trabalho funcional.  Frigobar diversificado,TV a cabo com menu de canais excelente,ar condicionado central silencioso com controle fixo individual.  Internet Wifi ou via cabo gratuito e com excelente velocidade.  Banheiro com amenidades e ducha perfeita.Música ambiente no corredor e elevadores rápidos.  O café da manhã é com ótima qualidade inclusive com uma bancada reservada a quem possui restrição (alergia)a alimentos.  Piscina aquecida ,sala de ginástica e de relaxamento excessivamente bons.  Não poderia deixar de parabenizar à todos do Windsor Brasília Hotel que nos encantaram com seu profissionalismo e visível dedicação em fazer de nossa estadia a melhor possível.  Recomendadíssimo!"
mar. de 2017,5,Excelente,"Passei o Carnaval neste hotel, cafe da manhã excelente, apartamentos confortáveis, academia moderna, piscina aquecida, mas o melhor do hotel são os funcionários que te fazem sentir em casa! Na minha próxima visita a Brasilia ficarei nele."
mar. de 2017,5,Excelente hotel,"Não é a primeira vez que me hospedo neste hotel. Por isso que recomendo. Hotel requintado, uma estrutura muito boa, quarto espaçoso, opções de lazer, academia, piscina. ótima localização, próximo à Shopping, Esplanadas."
mar. de 2017,4,Ótimo Hotel,"Passei três noites no hotel. Hotel muito confortável. Funcionarios da recepção excelentes, estao de parabéns pelo atendimento e presteza na recepção.  Fiquei hospedado no 14 andar corredor todo carpete, porem com cheiro de tapete molhado que nao tinha secado adequadamente deixando um cheiro no corredor ruim.  O quarto em si, muito bom, cama excelente muito grande e confortável. Vista para a praça dos três poderes com a Catedral fantástica.  Frigobar bem equipado, ar condicionado muito bom, armário com roupões de banho.  Banheiro bom, vazão do chuveiro ótimo, agua quente chegava rapido, nao gostei da vazão do ralo do banheiro demorava a escorrer o que deixava o box de banho inundado, mais nada que possa denegrir.  Pedi duas vezes comida via roomservice atendimento sempre dos funcionarios cordiais, comida chegou no tempo adequado, quente e maravilhosa nas duas vezes em que pedi. Nota 10 para a comida do restaurante, quente bem temperada, sensacional.  Café da manha ótimo nao classifico como excelente pois ao meu ver faltou mais frutas tipo uvas, morango, kiwi. Apesar ter na salada de frutas, mais acho que deveria ter a opcao de te-las para nos servirmos delas tb.  Pães, frios,e sucos muito bons.  Suco cê laranja da fruta mesmo o que e ótimo, em muitos hoteis o suco de laranja e aqueles de caixa, horríveis. Suco verde detox ótimo sensacional. Funcionarios do café da manha muito bons educados, excelentes.  Piscina deixa um pouco a desejar pouco acho que prejudica a privacidade de quem a aproveita visto ser ao lado do restaurante.  Enfim, hotel com excelentes funcionarios bem confortável e otima comida.  Retorno com certeza, próxima viagem. Parabéns ."
mar. de 2017,5,Muito confortável,"Esse hotel possui uma ótima estrutura e com boas opções no café da manha.  O quarto é muito bem equipado, inclusive com alguns quartos contando com um escritório separado do quarto, o que facilita trabalhar, caso tenham 2 pessoas hospedadas no quarto."
mar. de 2017,5,Muito bom,"Ótima localização, muito bem conservado e excelente manutenção. Quartos amplos e café da manhã honesto. Mantém o nível da rede . Sala de ginástica bem montada e centro de convenções espaçoso. Preços normais para Brasília."
mar. de 2017,5,Conforto,"O quarto para casal é confortável, elegantemente decorado, banheiro amplo, lugar silencioso. Bem localizado, próximo ao Brasília Shopping. A cozinha é ótima, seja no restaurante, seja no serviço de quarto. Melhor café da manhã de Brasília! Serviço muito atencioso."
mar. de 2017,5,Ótimo atendimento no café da manhã.,"Estive no hotel somente para apreciar o café da manhã. Eu sou fã do atendimento Windsor e como de costume, foi uma ótima experiência.    Meus parabéns, especialmente para os colaboradores Alésio e Márcia, que me atenderam durante a refeição, em uma terça-feira de Carnaval.    Meus cumprimentos à Gerência responsável pelo treinamento de atendimento ao cliente!"
fev. de 2017,5,Perfeito,"Aqui no TripAdvisor esse hotel é o melhor de Brasília, não tenho como confirmar isso, pois não visitei todos os melhores. Mas com certeza é um dos melhores.  Atendimento, limpeza, café-da-manhã, quarto, banheiro, wi-fi... impecáveis!  Só não gostei do sistema de estacionamento. Toda as vezes que eu voltava para o hotel (eu estava de carro), faziam novo vaucher para deixar o carro."
fev. de 2017,5,Maravilhoso !,"O hotel é incrível.    Sinceramente não tenho do que reclamar, o atendimento é impecável, os quartos sáo grandes e limpos, a piscina uma delicia e o café da manha é a melhor parte...rs    Eu super recomendo !"
fev. de 2017,5,Excelente,"Hotel excelente. Novo, bem conservado, os quartos são amplo e confortáveis. Banheiros limpos e bem mantidos o hotel tem uma pequena academia para atividades básicas além de um café da manhã ideal. Atendimento bom e preço justo."
fev. de 2017,4,Passeando em Brasília,"Hotel muito bem localizado, com apartamentos adequados, boa atenção no balcão e entrada.  Café da manhã é ok, com boa variedade.  A cem metros da entrada do hotel fica o primeiro centro comercial da cidade, separando o hotel do marco zero, a estação rodoviária de Brasília.  De alguns apartamentos pôde-se ver o congresso, a catedral...  Ducha muito boa!  Infelizmente no apto 1608 tinha um cheiro ruim no banheiro..."
fev. de 2017,5,Excelência na Prestação de Serviço e Atendimento,"Hotel com uma equipe qualificada, com atendimento excelente em todas as suas esferas. Sou cliente desse hotel, bem como hospedagem bem como a realização de eventos. A excelência vem desde a recepção pelo Geraldo na entrada do Hotel com cordialidade e receptividade aos seus clientes, ao atendimento do Marcelo e Isla, ao fazer o check-in de nossos clientes em um grupo ou individual. As coordenadoras de eventos Amanda e Rosangela, com a pontualidade e direcionamentos das etapas de nossos serviços, nota 1000 para elas e para o Alesio, Edmar e Assis pela organização e disponibilidade. Ao atendimento e qualidade do restaurante e seus funcionários representados pelo Metre Neto e Chef Celio, onde nos traz a tranquilidade e bem estar de poder estar desfrutando de um lugar estruturado e com atendimento diferenciado. So tenho que parabenizar a toda a equipe do Hotel Windsor Brasilia, e que o sucesso de vocês possam ser cada dia maior como a atitude de vocês com seus clientes. PARABENS EQUIPE MARAVILHOSA."
fev. de 2017,4,Excelente hotel,"O Hotel é bem localizado e conta com uma boa estrutura. O saguão é bem estruturado e iluminado, assim como a área do restaurante. Tem uma boa área de convenções e eventos, ideal para treinamentos. A estrutura é compatível com um hotel de negócios."
fev. de 2017,4,Recomendo: Muito Bommmm,"Hotel com muito bom atendimento, ótimo café da café e suas acomodações também são muito boas. Oferece academia com aparelhos em ótimo estado, parecem novos, piscina, sauna etc. Ótima localização.  Hotel que recomendo e quando retornar a Brasilia volto a me hospedar nele com toda certeza."
fev. de 2017,5,Gostei,"Valeu a pena, é bem localizado, limpo, novo.  Tem um ótimo atendimento.  Estacionamento gratuito.  Café da manhã excepcional.  Caso tenha a oportunidade, recomendo quarto com vista para explanada.  A piscina é muito próximo ao restaurante acho que ""mistura"" gente que está relaxando com engravatados gritando ao celular..."
jan. de 2017,1,Decepção,"Fechei um pacote para passar o Reveillon 2016/2017 no hotel Windsor Brasília.  Tivemos boas referências de amigos que já se hospedaram na rede, inclusive amigos do Rio de Janeiro.  Infelizmente tivemos uma péssima experiência.  O hotel e o quarto é excelente. Uma estrutura nova, bem localizada. Vista para a Esplanada dos Ministérios. Recepcionistas atenciosos e o serviço do hotel, até onde precisamos, nos pareceu funcionar muito bem.  O hotel parecia estar bem cheio no dia 31 de dezembro. Piscina lotada e grande movimentação. Até ai tudo bem, era algo previsível e normal.  No nosso pacote incluia check in antecipado, drink de boas vindas e espumante na ceia.  Na hora da ceia, nosso grande arrependimento. Chegamos no restaurante uma 23:20h, já não estava tão cheio. A impressão que tivemos é que várias pessoas haviam jantado antes, principalmente quem estava com crianças.  O restaurante não tinha qualquer ambientação ou decoração. Era como se estivesse funcionando numa noite normal de atendimento no hotel; poderiam ter reduzido as luzes, colocado uma vela na mesa, criado um clima diferente o qual pedia a ocasião.  Mas isso também se releva.  O garçom ofereceu nosso espumante, se mostrou atencioso.  Percebemos então que o jantar não era a la carte e sim com um buffet self service.  Quando fomos nos servir, ficamos aflitos e decepcionados. A comida com péssima aparência, estava nitidamente mal feita ou feita por quem não entende muito de cozinha.  Colocamos no prato duas ou três opções que ali estavam para pelo menos não ficarmos sem jantar.  Realmente o visual da comida se comprovava na degustação. Não conseguimos jantar. A ceia no hotel foi uma decepção. Não fotografamos a comida, porque ficamos constrangidos, mas deveria ter feito, mostrar o que eles chamavam de Bacalhau à Gomes de Sá , Risoto de Zucchine ou Tornedor de filé mignon ao molho de vinho do porto, acompanhado de arroz cremoso com açafrão e batata sauté. Sabe vergonha alheia? foi o que sentimos.  Havíamos convidado outros casais de amigos para estarem conosco ali no hotel; demos graças a Deus por terem tido outra programação que não permitiu que eles estivessem ali conosco.  Decepção também com a Rede Windsor, que permitiu que um evento desses ocorresse em suas dependências.  Não precisa nem entender de cozinha nem frequentar bons restaurante, basta ter um bom paladar e nem precisaria ser exigente, que saberia identificar a péssima qualidade da comida servida naquela ceia.  Não sei se receberam outras reclamações, mas nós não poderíamos deixar passar sem ao menos alertar a Rede Windsor.  Jamais repetiria tal experiência em adquirir um pacote assim.; as dependências do hotel são ótimas, o hotel é novo. Pra fazer um evento de reveillon dessa maneira, trazendo péssima experiência aos clientes, seria melhor nem oferecer esse serviço. Funcione normalmente como qualquer hotel.  Ou se pretendem ofertar esse tipo de serviço, que o faça com excelência, proporcionando um experiência agradável aos hóspedes, nem que pra isso se cobre mais caro.  A impressão que tivemos foi que o hotel pretendia estar cheio, com o máximo de quartos ocupados, e me desculpem a a expressão, mas ofertar a eles uma ceia LIXO, que fosse de baixo custo ao hotel, garantindo um ótimo lucro.  Digo que o retorno nesse caso pode ser desastroso.  Espero ter contribuído de alguma forma para que isso não se repita e que outros casais não tenham essa péssima experiência no futuro.  Ah, e quando fizemos o check in ainda nos ofereceram opção de almoço no dia 01 de janeiro. Imagina? jamais!"
jan. de 2017,5,SATISFAÇÃO GARANTIDA!!!,"Com um sorriso acolhedor fomos recepcionados pelo Sr. Ronilson. Assim fomos recebidos no hotel, parecia que estávamos chegando na casa de velhos amigos, tamanha a simpatia de todos. No café da manhã sobram gentilezas e cordialidade dos funcionários que são impecáveis com suas responsabilidades. No Check-out a nossa vontade era de dar meia-volta e ficar mais alguns dias neste que foi o melhor hotel em que tivemos o prazer de conhecer.  A localização é excelente, ao lado de um shopping e próximo à vários pontos turísticos. Certamente ao viajar novamente iremos verificar se há no local um Windsor!!!"
jan. de 2017,4,Serviço primoroso,"Sempre que vou a Brasília gosto de variar os hotéis onde fico. Pela primeira vez no Windsor, fiquei realmente impressionado com o atendimento primoroso, desde o porteiro que abre a porta do carro, passando pelo check-in (super educados, prestativos e eficientes), mensageiros e equipe do restaurante. Me senti como o duque de Windsor. Contudo, os quartos me pareceram razoáveis e o banheiro tem um cheirinho estranho. Se eu ficaria lá de novo? Realmente fico em dúvida somente em relação ao quarto. Há melhores opções de quarto em Brasília por preços até mais razoáveis."
jan. de 2017,5,Hotel excelente!!!,"Hotel novo, bem localizado, silencioso e com atendimento impecável.  O check in e check out foram rápidos.  O café da manhã é muito bom e variado.  Com certeza, voltaria neste hotel e recomendo a quem visitar Brasília."
jan. de 2017,5,Ótima opção para o reveillon,"Fechamos o pacote premium do hotel para o reveillon e foi uma ótima pedida! Hotel com ótima estrutura (quartos confortaveis, piscina aquecida, sauna, academia, novas instalações), atendimento impecável e comida (ceia no restaurante e café da manhã foram ótimos). No apartamento, com vista para o museu da república, deu para ver os fogos de camarote!    Deixo o meu elogio ao responsável pelo restaurante e sua equipe que nos atenderam super bem! Estávamos em 03 apartamentos."
jan. de 2017,5,Adoramos!,"Foi uma ótima experiência, hotel novinho, staff mais atenciosa do mundo, mesmo sem ter direito colocaram uma cama auxiliar para o nosso filho (nosso pacote não contemplava) emprestaram carregador, foram super atenciosos da recepção ao restaurante. Piscina aquecida gostosa no ambiente coberto, foi um passeio gostoso e num ótimo preço, bom para fugir da rotina em Brasília.  Minha única sugestão, já que os hóspedes insistem em colocar os copos na beirada da piscina, a aquisição de copos, taças etc. de plástico. Com certeza voltaremos!"
jan. de 2017,5,Serviço atencioso.,"Ficamos hospedados na noite de Reveillon e fomos muito bem atendidos.  O check-in foi atencioso, mas no horário em que chegamos o movimento estava intenso e ocorreu uma pequena espera.  Check-out rápido.  O atendimento no restaurante foi muito bom e cordial, tanto no jantar como no café da manhã.  O hotel está como novo.  Recomendo."
jan. de 2017,5,Confortável,"Quarto muito bom, cama confortável e banheiro super espaçoso. Café da manhã excelente e com muita variedade. O atendimento foi maravilhoso, especialmente do Neto, muito gentil e prestativo. Estive hospedada durante o réveillon e recomendo muito para a data. A ceia estava excelente, as mesas reservadas nominalmente. Faço apenas duas ressalvas: a primeira é que no ato da reserva por duas vezes me informaram que a ceia seria à la carte, no entanto, era buffet. O fato não me incomodou de forma alguma, a comida estava ótima e poder se servir de várias opções é realmente muito bom, mas acho importante passar informações corretas aos hóspedes. A segunda ressalva é que uma camareira entrou no quarto quando estávamos lá dentro, bem antes do horário do check out, não havíamos solicitado a limpeza ou afixado o aviso na porta, e estávamos trocando de roupa. Foi um pouco constrangedor. Mas nada que retire a excelente impressão geral em relação ao hotel."
jan. de 2017,5,Excelente hotel,"O Hotel é muito bem localizado, possibilidade de ir a pé ao Shopping Conjunto Nacional (só atravessar a rua) e também ao Shopping Brasília. O quarto é bem amplo e confortável. Tudo novo e limpo. O café da manhã é muito bom. O único ponto negativo é a pouca variedade de pratos a la carte para janta, não compensando jantar no hotel."
jan. de 2017,5,Excelente,"O Windsor realmente me surpreendeu.    Escolhemos o Windsor para passar a noite de réveillon.    Começando pela atenção da gerente Helen Coelho que conduziu minha reserva com excelência.    Chegamos e a recepção extremamente atenciosos e cordiais, nos receberam com um welcome drink.    O Neto, responsável pelo restaurante, foi super atencioso e nos proporcionou ótimas refeições e a ceia do Réveillon estava excelente. Cordial conosco e com nossos filhos de 6 e 8 anos.    Quarto e banheiro são ótimos, ficamos num com varanda, no 12o. Andar, vale a pena. (veja a foto).    Café da manhã tbm muito bom, tem muitas variedades. Tapiocas feitas na hora.    O Hotel está de parabéns, a equipe é maravilhosa.    Sempre voltaremos."
dez. de 2016,5,Boa localização,"Hotel localizado no centro próximo aos shoppings e principais pontos turísticos, de forma que possa fazer vários passeios caminhando.Excelente estrutura de acomodação e café da manhã.Ideeal para viagens a negócios, estacionamento com serviço de manobrista."
dez. de 2016,5,Trabalhar e a noite descansar,"Hotel bem localizado, recepção imponente, quarto confortavel, recepcionistas educados e atenciosos, serviço de quarto pontual, alimentação servida no quarto saborosa, café da manhã diversificado e saboroso, hotel de ótima qualidade e bom gosto, limpo e muito agradavel."
dez. de 2016,5,Hotel tranquilo,"O Windsor é um hotel que foi todo reformado. O diferencial é o café da manhã que tem muitas opções, inclusive quem é intolerante a glúten. Ao lado fica o shopping pátio Brasil e Venâncio que são boas opções de passeio..."
dez. de 2016,5,Escolha que não admite erros.,"Como o título da avaliação sugere, hospedar-se no Windsor Brasília é ter a certeza de que tudo será perfeito.  Trata-se de um hotel muito novo e com acabamento primoroso. Funcionários bem treinados, atenciosos e pró-ativos.  Os quartos são de tamanho pequeno, porém não deixam nada a desejar, são aconchegantes e bem decorados, os banheiros também são excelentes, alguns deles possuem banheira.  O café da manhã é bem completo e a reposição é feita constantemente.  A piscina é pequena mas funcional, trata-se de uma raia (larga) aquecida.  A academia sim, deixa um pouco a desejar, extremamente pequena.  Mas no geral o hotel é excelente, serviços bem prestados etc."
dez. de 2016,3,Esperava mais,"O hotel conta com boa localização, funcionários prestativos, café da manhã bem variado e academia com esteiras super modernas. Quarto tamanho padrão, simples e bem parecido com o de outros hotéis de categoria inferior. O banheiro foi o que realmente não agradou. Apesar de grande, não parece tão limpo, é escuro e nada moderno (com bidê)."
dez. de 2016,5,Hotel clássico,"Hotel clássico, estilo londrino. Quartos confortáveis e camas que lhe proporcionam um verdadeiro descanso. Andar pelos corredores não tão longos do hotel, leva-lhe a uma viagem no tempo, dado o estilo clássico do mesmo.  O café da manhã é algo fantástico, com uma excelente variedade de itens. Seguindo a linha clássica europeia, o café e o leite são servidos nas mesas em bules prateados.  O buffet servido no almoço vale cada centavo. Apresenta um cardápio variado, contendo diversas opções de salada. A variedade de sobremesas é boa, muito embora básica - pudim, tortas de limão, torta alemã, etc...  A academia de ginástica é pequena, mas se vc der sorte de estar sozinho ou com mais uma pessoa, malha bem. A piscina é bastante aquecida e possui uma extensa raia para natação, embora seja estreita. Vc nada com uma só pessoa, no máximo...  Porém, o que me deixou mais encantado foi a educação dos funcionários, principalmente os do restaurante. Tá certo que gostamos de ser bem tratados onde quer que estejamos, mas aquele time do restaurante é sem igual. No primeiro dia, ao chegar para almoçar, em frente à minha mesa comecei a tirar o paletó; apenas comecei, pois imediatamente o mètre aproximou-se por trás e puxou o paletó. E a educação deles não é aquela maquinal, não.... é uma delicadeza que lhe deixa a vontade para até brincar com eles. Sensacional! Gravei apenas o nome da senhora que sempre me servia e fazia questão de buscar meu café: dona Joelma.    Excelente hotel!"
dez. de 2016,4,Hotel bonito,"Hotel é  No centro de Brasília, bem localizado, acesso rápido aos principais monumentos da cidade, café  Da manhã razoável tendo em vista em ser windsor, um  Hotel 5 estrelas,  As quartos  Tem  Camas confortáveis e o  Estacionamento e grátis."
dez. de 2016,5,Excelente,"O quarto é muito confortável. O café da manhã também. A piscina é coberta e é uma ""piscina de raia"". O hotel fica em frente ao Shopping, portanto a infraestrutura de comércio está garantida. Recomendo."
dez. de 2016,5,Novo e organizado,"O fato de ser um hotel novo conta bastante. As acomodações são excelentes. Café da manhã bem servido e pessoal bem atencioso. Recomendo que o viajante escolha este ao invés do Windsor Plaza, pois tem quartos mais baratos e melhores."
dez. de 2016,5,Perfeito!,"Adorei,  Hotel maravilhoso, no check-in muito bem atendida pela Carolina e no meio da noite ao precisar de algumas informações também excelência no atendimento da Aristeia, manobrilhas, garçons, o bar man super prestativos e educados, quarto limpo e bem organizado.  Acústica internar um pouco ruim ficamos no décimo terceiro andar e do apartamento de cima e de baixo dava para escutar qualquer barulho mais grave.  Café da manhã muito gostoso, bem variado, tudo fresco e super bem feito.  Amei, voltaria sem dúvidas."
dez. de 2016,5,"Excelente, mas com ressalvas","Extremamente bem localizado. Muito elegante, prédio novo e bem decorado. Banheiro ótimo. Chuveiro forte. Frigobar grande (cabe até garrafa de 1,5l em pé). Cofre. Atendimento impecável. Café da manhã muito bom, acima da média. Oferecia damascos, castanhas de caju e do Pará. Poderia melhorar em relação aos bolos, pois nenhum tinha gosto de caseiro.O melhorzinho era o bolo de rolo. Quarto silencioso. Academia minúscula, mas ""ok"" se o objetivo for fazer esteira (3 ou 4, não tenho certeza), bicicleta (1) ou elíptico (1). Piscina pequena também, mas ""ok"", porque ninguém usa.  Minhas ressalvas são: colchão regular; quando uma pessoa mexe, a outra sente. O ar condicionado devia estar quebrado, porque não consegui regular. Ligado, virou Pólo Norte, desligado, ficou abafado, muito desagradável.  Tudo perdoável, contrabalanceando os prós. No entanto, pensarei duas vezes antes de me hospedar novamente, pois os travesseiros são insuportáveis, dormi mal por causa deles. Eram macios DEMAIS, a cabeça afundava. E não há outra opção mais alta e firme."
