Data da opinião,Nota,Título,Conteúdo
set. de 2017,5,Hotel luxuoso,"Um primor! Quarto espaçoso e bem decorado. Serviço de quarto impecável. Atendimento gentil pelos empregados.  Banheiro excelente!  Estava participando de um evento e houve um constrangimento no café da manhã comigo. Fui convidado a me retirar sob o argumento de que meu café da manhã seria em outro local....  Quando comunicada, a direção do hotel me encaminhou uma gentil carta de desculpas e me ofereceu, como ""Mimo"" uma garrafa de vinho é uma tábua de frios.  Demonstraram profissionalismo!  Recomento muito!"
set. de 2017,5,Unicidade,"A partir do momento que adentramos o espaço do Tivoli Mofarrej o foco e dedicação genuína de cada membro da sua equipe nos transmite a sensação não só em ser bem vindo, mas de ser protegido, cuidado, mimado.  Mesmo para experientes hôteliers nunca há no Tivoli a sensação de déjà-vu.  Original, profissional, eficiente e cativante.  Parabéns Miguel e sua maravilhosa equipe.  All the best."
set. de 2017,2,Decepção,"O hotel é belo, mas estamos tendo uma experiência horrível, apesar, também, da cordialidade dos atendentes. Nos colocaram num quarto em que o barulho do banho do vizinho era simplesmente um terremoto. Reclamei na recepção e, depois de algum tempo, nos mudaram para outro quarto, mas com o mesmo problema. Após nova reclamação, nova mudança para outra acomodação do mesmo nível, mas sem o problema do banheiro do vizinho. A coroação da decepção veio no dia seguinte. Depois que a atendente nos encantou com a promessa de um café da manhã maravilhoso com uma das mais belas vistas de São Paulo, fui, já com o prato na mão e em frente ao bufett, ""convidado a me retirar"" do local pois o hotel tinha decidido que seria ""mais cômodo"" que eu me alimentasse no restaurante do subsolo num café da manhã improvisado, sem a metade das opções do restaurante principal!!! Fiquei tão constrangido que mal tive iniciativa para contestar o absurdo! Sobrevivamos aos próximos três dias..."
set. de 2017,5,Avaliação,"Muito bem localizado, ótima recepção, quarto super aconchegante, serviço de quarto muito bem realizado!  Hotel muito bem limpo e café da manhã é realizado em um ambiente super agradável!  Indico pra amigos e familiares!"
set. de 2017,5,Geral,Quase todos os quesitos do hotel foram excelentes. O único que ficou aquém dos demais foi o café da manhã. Poucas opções e a qualidade não era tão boa quanto do jantar que pedimos no quarto! Mas ainda sim foi um bom café da manhã.
set. de 2017,5,Serviço impecável,Conceito de Hospitalidade seguido à risca. Incrível experiência.  Seguramente uma das melhores opções em termos de custo benefício e figurará o topo das minhas recomendações em termos de hospedagem que se preocupa com cada detalhe.
set. de 2017,5,Estadia Tivoli SP,"Excelente custo benefício e bem localizado. Serviço com excelência. Quarto amplo e bem divido, mas poderia ter um configuração com duas camas de casal para família com crianças pequenas. Mais opções no café da manhã."
set. de 2017,5,Hotel fantástico,"Hotel perfeito. Recomendo o spa tailandês Anantara e o restaurante Seen. Quando a diária entra em promoção o custo-benefício é ótimo. Os quartos são novos e a localização é perfeita, perto da vários outros restaurantes e bares da região da Paulista."
set. de 2017,4,Noite romântica,"Estive no Tivoli para um passeio romântico a experiência foi muito boa. O hotel é muito charmoso, bem cuidado e tem um ar de sofisticação tanto no lobby quanto nos quartos. Tivemos um problema com a limpeza do quarto que foi resolvido satisfatoriamente pelo atendimento (muito prestativo) do hotel, fazendo uma transferência de quarto, mas que gerou um certo transtorno, por isso optei pela nota muito bom ao invés de excelente por aqui. Ponto alto para o atendimento, que gostaria de frisar, foi muito simpático e prestativo a todo momento. Recomendado com tranquilidade."
set. de 2017,5,Excelente localização,"O Tivoli Mofarrej, é um hotel excelente, super bem localizado, com um bar muito legal e um spa incrivel! Quartos amplos e bastante confortávei, e atendimento de primeira! A academia do hotel tb é muito boa!"
set. de 2017,5,Excelente,"O Hotel fica super bem localizado para quem vai a trabalho ou a turismo. Foi recentemente todo renovado, café da manhã impecável, academia com aparelhos novos. Os quartos são confortáveis. Sempre voltarei!"
set. de 2017,5,Incrível!!,"Tudo impecável!  Desde a entrada ao hotel até o acompanhamento ao quarto, as explicações, o carinho e atenção, ficarão gravadas como uma experiência única é incrível!! Parabéns a todos os envolvidos em tornar nossa estadia simplesmente sensacional! Gratidão"
set. de 2017,4,Um lugar perfeito.,"Excelente atendimento. Equipe atenciosa, ágil e com bastante foco no tratamento com o cliente.    O hotel tem um clima muito bom. Uma energia positiva.    A vista do restaurante é digna de capa de revista.    A decoração capta a harmonia que o hóspede procura."
ago. de 2017,5,Perfeito,"Hotel muito bem localizado, com primorosa decoração. Serviços excelentes e quarto muito confortável, silencioso, roupas de cama e toalhas de ótima qualidade. Fiquei impressionada com o empenho da recepção em proporcionar ao hóspede a melhor estada.  Quando voltar a SP, sempre vou dar preferência ao Tivoli - Mofarrej."
ago. de 2017,5,O hotel que reflete a cidade de São Paulo,"Gosto sempre de visitar novas cidades de forma em que possa conhecer e experimentar a verdadeiro espírito e estilo de vida dos que nela habitam. O Tivoli Mofarrej é um hotel 5 estrelas com todas as vantagens e luxos que um hotel desse padrão oferece, mas que não perde a sua essência paulista ao oferecer aos seus hóspedes, junto com os seus serviços 5 estrelas, uma experiência mais autêntica da cidade onde se hospedam. Em um prédio tradicional de São Paulo, mas com um design interior super moderno, achei o hotel extremamente aconchegante e diferenciado. O quarto onde fiquei hospedada era espaçoso e gostei muito da quantidade e tamanho dos espelhos e das janelas, não somente no quarto mas espalhados por todo o hotel. Achei o restaurante ""Seen"" no último andar do hotel simplesmente imperdível, com uma vista panorâmica da cidade e um ambiente acolhedor mas ao mesmo tempo super badalado, com um bar descolado no centro do restaurante e um DJ tocando a noite. Os drinks e os pratos eram deliciosos e super originais; achei o local a cara da noite paulista. Eu recomendaria este hotel especialmente para estrangeiros, mas também brasileiros, que talvez viajam a São Paulo a negócios mas que estariam interessados em conhecer melhor a cidade, e em grande estilo."
ago. de 2017,5,Um dos bons Hoteis de Sao Paulo,"Excelente localização. Muito bom atendimento. Excelente serviço de bar. Segurança fantastica e um serviço cuidadoso de busca de Taxis. Excelente pequeno almoço, jornais no quarto, e excelente serviço de WI-Fi. Quartos muito confortaveis com maquina de cafe e serviço de bar muito completo. Excelente escolha!!!"
ago. de 2017,5,Experiência única,"O atendimento é o diferencial. Funcionários sempre muito cordiais, solícitos e demonstrando preocupação com a satisfação do hóspede.  As acomodações são excelentes! Linda decoração, janela ampla e uma cama maravilhosa que faz a gente quase perder os compromissos na cidade.  A localização do hotel é ótima e também merece ser ressaltada. Ponto muito importante em uma cidade como São Paulo."
ago. de 2017,4,Excelente localização é ótimo serviço,"Eficiência é a marca desse hotel. Só não levou 5 estrelas porque havia problemas com os elevadores (um deles estava parado) e pelo fato de que, em 2017, ainda cobrarem pelo uso de Internet rápida. Não fui ao Seen, restaurante/bar localizado no 23º andar e com vista de 360º de SP, mas circulei pelo local e vi q atrai jovens, com comida japonesa e DJ."
ago. de 2017,5,Experiencia inesquecível.,"As instalacoes, o atendimento, o servico e a comida sao simplesmente padrao AA. Realmente o servico é personalizado e o atendimento se destaca pela cordialidade dos atendentes, da portaria até a gerencia. Os funcionários sao respeitados e trabalham com satisfacao, dá pra sentir do check in até os restaurants, que proporcionam experiencias únicas."
ago. de 2017,4,Banheiro (box),"O box do quarto 1310 não suporta a água proveniente do chuveiro, deixando o banheiro todo molhado, por vazamento dessa agua. Acredito que isto deva ser verificado. Os tapetes do banheiro ficaram extremamente molhados, sendo necessário solicitar mais tapetes. As camareiras gentilmente me concederam mais pisos, porém a situação é desagradável."
ago. de 2017,5,Maravilhoso,"Este é sem dúvida o melhor hotel de São Paulo. Super bem localizado, quarto super confortável, excelente serviço e decoração impecável! O restante Seen no rooftop é imperdível, porém precisa reservar!"
ago. de 2017,5,Ótima Acomodação em São Paulo,"O Hotel irá lhe surpreender desde a entrada, no Lobby. O ambiente é decorado com cuidado a cada detalhe, de modo que lhe impressiona desde a chegada.  O staff é extremamente ágil e cortês, demonstrando preocupação com a satisfação do hóspede.  Os quartos são amplos, decorados com muito bom gosto, criando um ambiente que lhe proporciona conforto e tranquilidade. As amplas janelas lhe proporcionam uma excelente vista de São Paulo.  A localização merece destaque, pois possibilita fácil acesso via Táxi/Uber e ao Metrô, o que é fundamental no trânsito da capital paulista. Demais, possui diversos serviços a ""walking distance""."
ago. de 2017,5,Ótima experiência,"Quarto excelente, cama muito confortável, café da manhã no último andar com uma bela vista da cidade. Funcionários educados e atenciosos. Me surpreendi com a qualidade da comida do room service. Se for jantar no restaurante SEEN, faça a reserva antes ou vai esperar muito tempo, o local está muito concorrido. O bom é que você pode aguardar no seu quarto."
ago. de 2017,4,Uma ótima opção em São Paulo!,"Localização privilegiada, bom serviços, quando o Must oferece música ao vivo, vale uma visita para um drink e um jantar, atendimento muito bom. Quartos confortáveis. Café da manhã bem servido. O Seen oferece uma experiência que mescla bar, sushibar e restaurante."
ago. de 2017,5,Experiência maravilhosa,"Minha experiência com o Tivoli Mofarrej São Paulo foi simplesmente sensacional. Excelente equipe, excelente arquitetura, excelente localização. Fui muito bem atendida e confesso que superou minhas expectativas. Mistura perfeita de todas as caras de SP e uma vista linda da cidade e da praça. Um hotel refinado e completo. Fica muito difícil querer sair do hotel. Recomendadíssimo!"
ago. de 2017,5,Excelente,"Foi máximo nota 10, eu indicaria para pessoas ficar neste hotel, e maravilhoso, gostoso de ficar, descansar, comida de boa qualidade, estou sem palavras. Parabéns , a unica coisa que me incomodou e a piscina para ela não estar um pouco discreta, eu não me sento a vontade de passar ai debiquíni na frente de tanta gente importante"
ago. de 2017,4,Nem tudo é perfeito...,"Trata-se de um hotel na Alameda Santos, em local onde estacionar o carro se limita a deixá-lo nas mãos dos manobristas do próprio hotel a R$ 60,00 por 12 horas. A entrada é muito bonita com flores e um enorme lustre. Fomos acolhidos por um rapaz que nos orientou parcialmente sobre as condições do evento do qual meu marido participaria. O hotel faz um bloqueio no cartão de crédito (in advance), o que não é nada simpático, principalmente quando se é informado que a devolução pode ocorrer em até uma semana (???). O quarto é grande, confortável, com uma cama king forrada com lençóis de muitos fios, um sofá, um pequeno ""escritório"", frigobar e máquina de nespresso com o valor do café de R$ 10,00 a unidade. O quarto é silencioso e estava limpo. O banheiro tem amenidades e é de bom tamanho. Pedimos um late check out de apenas uma hora, o que não foi concedido. No jantar, no restaurante do lobby, há poucas opções de pratos principais, o atendimento é demorado e inferior ao esperado para este nível de hotel. Considero que a comida foi mediana. Comi um spaghetti bem ao dente com camarões, pastéis - uma porção tem 6 pastéis, sendo 2 de cada sabor: carne, queijo e camarão e sobremesa churros com chocolate e doce de leite (foi a melhor coisa do jantar). O café da manhã é variado com quentes e frios, mas nada excepcional. Wi-fi grátis no quarto e em áreas comuns funcionou bem."
ago. de 2017,5,"O melhor hotel de luxo da ""megatrópole"" São Paulo","A minha (excelente) experiência com o Tivoli Mofarrej começou na reserva, onde fui muito bem atendido, de forma clara e eficaz. À chegada ao hotel fui recebido com muita educação, numa entrada linda e bem organizada, apesar do movimento das várias pessoas (todas bastante elegantes) que circulavam entre os elevadores de acesso aos quartos, as áreas de eventos e o fantástico bar, onde tocava uma talentosa banda de jazz, ao melhor estilo nova iorquino. O check in foi muito eficiente e em poucos minutos estava no meu quarto, uma suíte com uma vista deslumbrante sobre a megatrópole São Paulo, onde não faltavam detalhes de um enorme bom gosto, desde a máquina de Nespresso e completo mini-bar, ao kit de boas vindas do Tivoli. O quarto estava impecável, com uma decoração chic, mas acolhedora. Optei por jantar no SEEN, o restaurante do hotel, que é atualmente um dos mais badalados de São Paulo. A decoração retrô sob o cenário das luzes de São Paulo, com atendentes animados e simpáticos e um bar com espectaculares cokctails e pratos deliciosos (no meu caso optei pelos de carne, inclusive na entrada) são argumentos de sobra para não ter de sair do hotel para uma noite animada, apesar do hotel estar tão bem localizado. Parabéns a toda a equipe do Tivoli Mofarrej pois é, sem dúvida, o melhor e mais completo hotel de luxo de São Paulo!"
ago. de 2017,5,Oasis em Sampa,"Glamour e bom gosto, com simpatia e profissionalismo do staff acima da media. Localização excelente, restaurantes e bar surpreendentes e um SPA de acordo com o Hotel em geral.  Um verdadeiro OASIS em SAMPA"
ago. de 2017,5,Excelente! Estrutura e staff,"Primeiramente preciso elogiar enormemente o staff desse 5stars. Deste a Gerente de MKT, Mariana, ao super educado e prestativo Rafael, do front desk. O Café da manhã do Tivoli é um show à parte; bom demais! Toda equipe é incrivelmente bem educada e disposta a resolver qualquer problema.    Até o momento este foi o melhor hotel 5stars que estivemos em SP."
ago. de 2017,5,Bom e com preço razoável,"O Tivoli é um belo hotel e com um preço que surpreende para seu padrão. Normalmente é utilizado para eventos corporativos. Nos fins de semana o movimento é menor e a tarifa é bem mais em conta. Se não me engano, no andar 24 existe um restaurante espanhol que é incrível. Recomendadíssimo."
ago. de 2017,5,Ótimo Hotel,Com boa localização oferece ótimos serviços e muito conforto. Tem uma vista muito bonita do restaurante no topo do prédio onde é servido o café da manhã. Tem piscina no térreo ao lado do bar com boas opções.
ago. de 2017,4,Destaque para a cama,"O hotel é tradicional, bonito e muito bem localizado. Entretanto, o que mais me agradou foi o conforto da cama e dos travesseiros. Adorei. A área da piscina é bem bonita. O café da manhã e a academia são medianos."
ago. de 2017,2,Não vale quanto pesa,"Hotel muito grande, com hóspedes demais e o serviço descuidado em comparação com o preço pago. A recepção fez um checkin lentíssimo, pouco acolhedor e ainda ficamos presos no elevador. Paguei uma suíte deluxe com vista para o jardim, pedi um check in antecipado, cheguei ao meio-dia e trinta e me me disseram que o quarto não estava pronto. Não deram nem uma posição, não ligaram para a governnança, nada. Não estava pronto e eu que me virasse. Isso não é jeito de tratar um cliente que paga mais de 1000 reais por uma diária"
ago. de 2017,1,Se procura um 5 estrelas fuja desse hotel,"A infraestrutura do hotel é agradável e renovada. Entretanto os pontos positivos acabam por aí, quando se fala de um hotel 5 estrelas esperamos um hotel com um mínimo de serviço prestado ao hóspede, e infelizmente isso não acontece no Tivoli, é inadmissível ele estar fazendo parte da rede LWH, já fiquei em hotéis dessa rede e sempre superaram expectativas.  Os problemas começaram logo no início do checkin, onde fui informado que hotel não tinha disponibilidade cama de casal, sendo que era uma comemoração, logo após muita insistência por um downgrade de quarto ou upgrade, a solução disponibilizada foi juntar duas camas na categoria que havia reservado. Mas infelizmente a roupa de cama colocada nas duas camas não conseguia cobrir o colchão que ficava nitidamente amostrar ( imagina vc ficar num hotel 5 estrelas vendo o colchão do hotel ?). Mas os problemas não acabam aí, ao entrar no banheiro percebi que os shampoo e condicionador estavam usados pelo antigo hóspede, liguei para governança que trocou imediatamente, mas se quer pediu desculpas, somente se justificou que existem muitos quartos no hotel e ficava difícil verificar esse tipo de situação, um absurdo para o nível do hotel. Por fim no dia seguinte nos dirigimos ao café da manhã que estava nitidamente desorganizado e sem qualquer controle, fomos trocados de mesa duas vezes ( isso com nossos objetos já na mesa) pois o garçom havia setado outras pessoas enquanto estávamos nos servido no buffet, e o pior isso ocorreu 2 vezes. O mesmo estava ocorrendo com outros hóspedes, sem contar o acúmulo de pratos, copos e talheres sujos que deixavam nas bandejas espalhadas pelos corredores das mesas.  Peço que vocês verificarem o nível de serviço prestado ao cliente, não tive somente um problema isolado, mas em todo o serviço que precisei dentro hotel fui extremamente mal atendido, desde a recepção, limpeza do quarto e café da manhã. Erros acontecem, mas em todas as esferas do hotel ? Dessa forma não recomendo o hotel."
ago. de 2017,5,Prazer em se hospedar em um excelente hotel,"Apesar de nos hospedarmos por apenas 1dia foi o suficiente para podermos desfrutar do excelente atendimento e acomodações do hotel. Pudemos dois restaurantes que muito nos agradaram, além do café da manhã. Esperamos poder retornar, desta vez com mais tempo, com o objetivo de aproveitar as demais vantagens deste hotel."
ago. de 2017,5,Fantastic hotel!,"English > The Tivoli Hotel is amazing. Beautiful decor and clean interior. Great bar and restaurant on property. The rooms are always comfortable. What I like best is the staff. They are friendly and attentive. So far I would like to mention that Junior Must (Ground Floor Restaurant), Lucas & Heitor (Bar Tenders) are very professional, friendly, courteous and treat the guests very well. Great stay every time I come to Sao Paulo!    Portuguese > O Tivoli Hotel é incrível. Decoração bonita e interior limpo. Ótimo bar e restaurante na propriedade. Os quartos são sempre confortáveis. O que eu mais gosto é da equipe. Eles são amigáveis e atentos. Até agora, eu gostaria de mencionar que o Junior Must (Ground Ground Restuarant), Lucas & Heitor (Bar Tenders) é muito profissional, simpático, cortês e atende os hóspedes muito bem. Excelente estadia toda vez que eu venho a São Paulo!"
ago. de 2017,5,Uma das melhores opções para se hospedar no centro de São Paulo,"Bem localizado (é paralelo à avenida Paulista), perto de tudo... É sempre excelente se hospedar no Tivoli Mofarrej São Paulo, pelo luxo, pelo requinte e pela praticidade que oferece. O hall de entrada já impressiona pela suntuosidade e a recepção sempre é cordial e prestativa. O bar do térreo é cool, com cervejas requintadas e um jazz ao vivo que te convida a entrar e ficar. Os elevadores são impressionantemente rápidos e silenciosos, freando com uma suavidade que parece que têm ABS. Os quartos são espaçosos e maravilhosos (desta vez fiquei no 2002), incluindo uma pequena sala após a cama, uma vista esplendorosa e um banheiro confortável e bem dividido. O wi-fi é muito bom e fica ainda melhor se você tem o cartão de fidelidade do hotel. A área de trabalho também é ampla, ao lado de um frigobar quase completo (tem Red Bull, mas não tem um suco), água Evian, cafeteira Nespresso e muitas bebidas alcóolicas, entre elas cervejas, vinhos, vodkas, whiskeys e até champanhes! E a cama maior que uma king size não dá vontade de sair, de tão gostosa que é. O único porém vai pra tomada 220V do banheiro, onde deixei um celular carregando à noite e, de manhã, ele não tinha carregado nada. Imagino que essa tomada desative quando você desliga todas as luzes do quarto."
ago. de 2017,5,Excelente !,"Me hospedei no Tivoli pela terceira vez e nas três vezes em que estive lá eu só tenho elogios a fazer , hotel muito bonito , muito bem localizado, quartos de tamanho satisfatório e muito limpos e um staff de primeira. Uma grata surpresa que tive , foi que o café da manhã agora é servido no restaurante Seen que fica no vigésimo terceiro andar de onde se tem uma vista incrível da cidade de São Paulo fica, pra quem está pra vir à capital paulista eu indico esse hotel sem sombra de dúvidas !"
ago. de 2017,5,O TÍVOLI DEU UMA MUDANÇA PARA MELHOR. ESTÁ EXCELENTE.,Gostei muito da nova localização do restaurante e do local no mesmo espaço (Cobertura) para se tomar o café da manhã. Boas indicações no menu do Café da Manhã e apetitoso as opções para o jantar. Serviço personalizado.
jul. de 2017,2,Decepcionada,"Quando meu esposo me perguntou onde iríamos ficar em Sp para uma viajem de final de semana escolhi O Tivoli por ver Avaliações pela internet fotos e ouvir muito bem do hotel! Cheguei e realmente achei muito lindo e fiquei muito feliz passei algum tempo fora do hotel e ao retorno alguns fatores me decepcionaram muito não consegui disponibilibilidade no hotel para o jantar pois o restaurante de baixo estava bem lotado e o no 23 andar lindo e muito badalado com uma fila de espera de 2 horas às 10:30 da noite! Tudo bem fui para o quarto usar o serviço de quarto quando descobri que os telefones estavam mudos desci na recepção e fiz a reclamação e a pessoa responsável disse que infelizmente poderiam resolver apenas pela manhã o problema e que se eu quisesse teria que trocar de quarto aquela hora! Ok me chamaram o msg que prontamente me tirou o pedido e chegou rapidamente! Precisava dormir cedo pois acordaria as 5 da manhã para fazer minha corrida mas infelizmente não conseguir dormir pois o hóspede do apto 1509 não nos deixou dormir à noite Inteira com barulhos gemidos e gritos, aTe as 3 da manhã Um horror fiquei muito triste pois durante o período que estive aí pude observar que em alguns momentos existe uma grande procura pelos hóspedes por acompanhantes de luxo! Uma pena por um hotel deste !"
jul. de 2017,5,Seen,"Estivemos lá no sábado e foi tudo excelente ! ! !  Lugar agradável ! ! !  Bebidas, comida, petiscos e aperitivos deliciosos ! !  Musica Maravilhosa com a DJ Ana Serroni ! ! !  Atendimento do Kristoffer impecável ! ! !"
jul. de 2017,5,Excelente,"Além da localização - próximo à Avenida Paulista, o hotel é muito confortável: os quartos são grandes e confortáveis, a vista é linda, o banheiro é amplo, o café da manhã é muito farto e é completo, e o serviço impecável!"
jul. de 2017,5,Noite de Núpcias,"Hotel fantástico para casal! Ficamos na presidencial que é muito espaçosa. A vista é maravilhosa. Recomendo A massagem no Spa é incrível e impecável! Somente o serviço da cozinha é um pouco demorado, mas tudo que pedimos estava muito bom..."
jul. de 2017,4,esta precisando de uma recauchutagem,"Nao foi a primeira vez que fiquei nesse hotel. Gosto da localizaçao e o serviço e excelente. Porem, nesssa ultima estada, achei que esta precisando de um retoques. o carpet do apartamento estava manchado, e a luminaria de pe estava se desconjuntando. Talvez um capricho maior na manutençao, para nao prejudicar um lugar tao agradavel."
jul. de 2017,5,Aconchegante,As instalações do hotel remetem um clima aconchegante e de muito conforto. Bom para repousar. O quarto muito organizado com ótima disposição da mobília. Limpeza sem detalhes. Café da manhã com muitas variedades.
jul. de 2017,5,Excelente,maravilhoso. perfeito. sem ter do que reclamar.  Acredito que vcs sabem cuidar dos seus hóspedes e dar a eles o que precisam em um reunião de negócios acompanhado de uma estadia relaxante e de qualidade
