Data da opinião,Nota,Título,Conteúdo
set. de 2017,4,Final de Semana com 3 no quarto,"Melhor custo benefício. Vale muito a pena se hospedar nesse ibis, a localização é muito boa.  Pontos de melhorias:  1. Poucas tomadas no quarto - poucas mesmo, só 2!  2. Conexão de internet beeeem lenta!  Melhorando isso é imbatível!"
set. de 2017,5,Excelente localização,"Excelente hotel. Localização muito boa, perto de supermercados e lanchonetes. Só não dá para andar a pé a noite. Excelente custo-benefício. Não vale a pena pagar café, pois tem supermercados mesmo em frente que dá para tomar café da manhã mais barato. Muito limpo."
set. de 2017,3,Normal,"Hotel com limpeza ok  Localização ok  Atendimento Staff ok  Não dispõe de Service Room, padrão da rede.  Vale o custo beneficio!  Tive problemas em algum dias a responsável pela limpeza não passou no ap, mas a situação foi reportada há gerencia que resolveu a questão."
set. de 2017,5,Praça da Liberdade,"Linda praça em frente ao palácio da Liberdade, rodeada por prédios renascentistas onde funcionam vários museus. Ótimo local onde os moradores da região aproveitam para fazer caminhada e relaxarem com a família e amigos."
set. de 2017,2,Atendimento precário. Quarto ok para o valor,"O quarto é ok. Sem frigobar e sem telefone. Para o que se propõe o preço é justo. Limpo e com bom isolamento acústico.  O atendimento é amador. Levamos MUITO tempo na fila pra fazermos o checkin, sendo que havia apenas 1 pessoa na minha frente e 3 atendentes no balcão.  Os funcionários são pessimamente treinados, lentos e não sabem priorizar as atividades. Falta clara de gestão."
set. de 2017,3,Razoável,"O quarto realmente é simples, pequeno, sem frigobar e a acústica entre os quartos fica a desejar pois se ouve muito barulho dos quartos próximos. No entanto a cama é boa e possui uma ótima localização."
ago. de 2017,3,Bom,"O hotel atende ao que se propõe. Nada extraordinário. O quarto era bem limpinho, tudo funcionando, lençóis branquinhos, só senti falta de um frigobar, pois não tem. Os funcionários são agradáveis e o café da manhã nada demais."
ago. de 2017,5,Ótima localização,Hotel muito funcional e ótima localização. Dez minutos a pé do Centro e 5 minutos de carro da Savassi.  Preço muito acessível com opção de parcelamento. Quarto amplo para casal. Atendimento rápido. Estacionamento é pago com bom preço para hospede.
ago. de 2017,4,ótimo custo/benefício,"Hotel cumpre com a proposta. Quarto com espaço reduzido, mas com conforto. Café da manhã ótimo e atendimento excelente por todos os funcionários. Voltarei mais vezes com certeza. Recomendo para viagens rápidas!"
ago. de 2017,4,Ótimo atendimento e custo benefício,"Tive uma otima impressao do hotel. Quartos limpos, chuveiro quente, cama confortável e wi-fi muito bom. Ótima localização (mercados, delegacia, bares, farmácias, tudo por perto). O café da manhã é à parte. Simples porém com opções que me satisfizeram. Fui recebida muito bem pelos funcionários, super atenciosos e dispostos a esclarecer todas as dúvidas referentes à hospedagem. Estacionamento ao lado do hotel, pago mas com desconto para hóspedes. Para aqueles que buscam conforto por um bom preço, o Ibis atende perfeitamente."
ago. de 2017,5,Ótimo custo benefício.,"O hotel é uma excelente opção pra quem busca uma cama confortável e preços bastante honestos. Fiquei hospedada durante 4 noites e não tenho reclamações. Ótima localização e limpeza. Atendida pelo Felipe, sempre disposto a ajudar quando precisávamos, voltaria sem sombra de dúvidas."
ago. de 2017,5,Ótima estadia,"Passei 4 dias com 2 amigas e logo quando chegamos o recepcionista Felipe nos explicou sobre a dinâmica do hotel, já que nunca havíamos nos hospedado em um Ibis. Ele nos alocou no maior quarto triplo que super atendeu às nossas necessidades: camas e edredon ótimos, wi-fi muito bom e limpeza diária do banheiro providencial.    Por ser o maior triplo, não tinha o sistema de banheiro europeu, o que foi indiferente para nós. A única observação é para a quantidade de tomadas: apenas 2 para um quarto triplo.    No mais, o Ibis super atendeu à sua proposta de hotel econômico, simples, limpo e com bom atendimento."
ago. de 2017,3,Básico,"Atendimento da recepção é ruim, mais de meia hora para fazer check-in. Apartamentos bem compactos. O café da manhã é simples. Fiz reserva pelo site, na recepção estavam cobrando a mais, ainda bem que tinha o e-mail de confirmação. Preço compatível com o serviço oferecido."
ago. de 2017,4,Cumpre o que promete,"Ele cumpre o que promete: conforto a um preço baixo. Os quartos são pequenos e pouco iluminados, mas bem limpos. O chuveiro é bom e cama confortável. A localização do hotel é excelente. Acredito que poderiam melhorar o check-in (muito demorado, formando longas filas) e o sistema do estacionamento (preencher um contrato para estacionar) também demorado."
ago. de 2017,5,Simples e tranquilo,Fui fazer um concurso lá em Belo Horizonte e foi uma hospedagem tranquila. Localização boa.  Café da manhã simples e sem opção para intolerante a glúten mas no geral é bom.  Se você for levar material para estudar a noite é interessante levar uma luminária pq a iluminação do quarto é baixa.
ago. de 2017,3,Convenção Hinode Giga Fest,"Fomos eu e mais 15 amigos dia 5 para uma convenção da nossa indústria, que aconteceu na Rena Tenis Clube no domingo dia 6 passado.  Foi um mega evento onde mais de 5.000 pessoas se encontraram para, treinamentos, reconhecimentos e premiações.  Fizemos nossa reserva no Ibis Budget e pra nossa surpresa, o hotel ficou completamente lotado pelos participantes do evento e mesmo assim o atendimento foi perfeito.  Hotel limpo e quarto os confortáveis.  O café da manhã, apesar de achar caro R$ 16,00 por pessoa, que pelo oferecido(não serviram presunto e sim apresuntado) ficou dentro da expectativa, mas não me permitiu dar nota melhor.  Contudo, fomos bem recebidos e nosso evento, um extremo sucesso!  Como teremos novos eventos e na mesma cidade, certamente ficarei e indico!"
ago. de 2017,3,Há opções mais em conta,"Primeiro o hotel é lotado mesmo de segunda feira demorei cerca de 15 min só pra conseguir acertar o estacionamento que é pago a parte (19,00 ou 13.30 se você tiver seguro Mapfre ou BB seguro) fiz a reserva pelo site e adicionei dois cafés (meu namorado e eu) da manhã (online é 14.00 cada ou lá na hora 19.00), enfim uma diária, dois cafés e o estacionamento ficou 165.30 temers. A fila para o check in, mesmo de quem já tinha reserva, era a mesma pra todos e enfrentamos uma fila de 40min pro check in, chegamos por volta das 20h30. O quarto é bem simples, mas tem Wi-Fi que funciona bem, ar, TV com alguns canais pagos, na redondeza não tem muita opção de jantar o melhor mesmo é pedir comida ou sair de carro."
ago. de 2017,4,Muito bom custo benefício,"Pra quem quer custo benefício, é uma ótima opção , sem luxo e prático. O quarto é pequeno, mas, confortável!  Check-in bem demorado e não estava muito movimentado na hora que eu cheguei.  O quarto estava limpo. E o chuveiro era ótimo!  O estacionamento é terceirizado, pago a parte, mais muito bem organizado ,valeu a pena!  Excelente localização, pertinho da Savassi, onde tem ótimas opções de lojas, restaurantes, fast foods..."
ago. de 2017,4,Tudo ok. Nada de novo,Pros:  - Preço bom  - Localização  - Wifi funcionando bem    Contras:  - O chuveiro poderia ser melhor.  - Lençóis e toalhas de baixa qualidade  - Cama podia ser mais confortável  - Checkin demorado.  - Paredes finas.
jul. de 2017,4,Falta de higiene na limpeza. Excelente profissionalismo e atendimento de alguns funcionários.,"Já fiquei hospedada algumas vezes, o hotel é muito bem localizado, porém, deixa a desejar na limpeza do quarto, pouquíssimas camareiras competentes, não recomendo para uma estadia longa pois quando passa 1 semana o banheiro começa a ficar sujo e as camareiras sequer entram dentro do box para limpar, a arrumação é literalmente uma arrumação não uma limpeza. Raramente passam a vassoura embaixo da cama. Essas fotos foram tiradas por mim e confirmam o que estou falando. Enfim, isso aconteceu pois fiquei em um andar diferente, no qual não havia ficado antes, algumas camareiras são muito caprichosas(Elaine e Monique). Como faço questão de reclamar também faço questão de elogiar a capacidade, o profissionalismo e boa vontade de alguns funcionários da recepção que sempre resolveram meus problemas com muito cuidado, atenção e educação sendo sempre amáveis e proporcionando um excelente atendimento, uma pena, pois a simpatia do Felipe, Março Túlio, Elaine e Ana Carolina são incomparáveis, ótimos profissionais."
jul. de 2017,4,"Preços bons, no início da semana eles são mais baixos","O hotel é muito bem localizado, próximo a um supermercado, a uma padaria e farmácias. Há uma parada de ônibus em frente ao Hotel para quem não gosta de viajar de carro. O estacionamento é cobrado à parte da diária. o café da manhã é simples, mas satisfatório com três opções de frutas, dois tipos de suco, bolos, pães, iogurte e café. As diárias no início da semana podem ser até 20% mais baratas se forem compradas no aplicativo e 15% se forem pagas na hora se comparadas as diárias no fim de semana.    SUGESTÃO: reserve a sua viagem com antecedência e compre pelo aplicativo da ARCO hoteis."
jul. de 2017,4,Problema de limpeza no quarto,"A limpeza deixou a desejar, pois havia toalha suja em cima da cama na parte de cima e também papel usado, limparam apenas a cama de casal. Então penso que eles devem cuidar melhor da limpeza e inspecionar antes de disponibilizar para o hospede."
jul. de 2017,4,Muito bom custo beneficio.,"Hotel é muito bom para o que se propõe. Tem quartos relativamente confortável . A ideia é ser um hostel melhorado, atendeu muito bem as expectativas. Não aconselho para quem busca conforto e sofisticação.  Quartos limpos, pequenos. Ducha muito boa , lavatório do lado de fora e vaso sanitario separado.  Obs: A EQUIPE PRECISA SER MELHOR TREIANDA, FAZER O CHECKIN FOI UM SUPLICIO, FILA E MAIS DE 1H DE ESPERA PARA FAZER O CHECKIN."
jul. de 2017,4,Bom custo x benefício,"O hotel é bom, assim como os outros Budget Ibis, ou seja, é mais barato e bem localizado, com decoração moderna e bonita, mas com instalações menores, sanitário separado e chuveiro com porta de vidro dando direto pro quarto, com pia fora. Tem espelho grande, ar-condicionado e tv. Porém só não gostei do atendimento, haviam muitas pessoas para fazer o checkin/checkout e duas atendentes, gerando uma fila grande tanto na entrada quanto na saída, pois o hotel estava lotado. Antes de fazer a reserva perguntei se poderia usar o secador de cabelo deles, visto que toda voltagem na rede Ibis é 220v, eles prontamente me responderam por email que sim. No entanto, quando fiz checkin a noite informaram que os secadores estavam todos emprestados, e fiquei sem usar, e o famoso ""tem, mas acabou"", e fui num casamento sem conseguir secar o cabelo. Dentro das dependências do vaso sanitário tinha um cheiro muito forte de cigarro, acredito que o hóspede anterior fumou ali e o cheiro não saiu, eles poderiam tomar mais cuidado na limpeza. O estacionamento é terceirizado ao lado do hotel, por um preço razoável. O hotel tem refeições rápidas congeladas que você pode preparar. Localização muito boa, ou seja, mesmo com todas essas questões, é barato e vale a pena pra quem só for passar a noite e quer estar bem localizado."
jul. de 2017,3,Custo beneficio aprovado!,"O hotel atende a proposta de ser econômico. Atendimento fraco, poucos funcionários mas prestativos qnd solicitados.  Quarto com decoração muito simples e básica com conforto mínimo necessário: uma cama aceitável, TV com poucos canais, ar condicionado e um bom chuveiro em um micro box rsrsrs  Não há frigobar no quarto tampouco telefone mas pedi entrega de comida e recebi sem dificuldades.  Wi fi funcionou perfeitamente!  Não experimentei o café da manhã pq próximo temos boas opções de padarias  Se a proposta for hotel pra banho e dormir esse vale super a pena, caso contrário recomendo buscar algo mais aconchegante e confortável."
jul. de 2017,3,Bom Custo-benefício,"Bom custo benefício, boa localização, se não for ficar mtos dias vale a pena. Café da manhã pago a parte, bem razoável, acabei preferindo comer em padarias da região. Fiquei no quarto com cama de casal e 1 de solteiro, espaço relativamente bom, padrão Ibis."
jul. de 2017,4,A mesma eficiência do grupo com o mesmo preço convidativo,"O Ibis Afonso Pena segue o mesmo padrão dos demais hotéis do grupo espalhado pelo mundo. O hotel está situado em um bairro de ótimo nível com uma localização privilegiada, principalmente para quem está à trabaho. O serviço é eficiente dentro dos preços praticados pela rede. Ótimo custo beneficio."
jul. de 2017,3,Bom,"Até que é bom, preço acessível e não tem absolutamente nenhum luxo. Lavabo do banheiro fica dentro do quarto, vaso e ducha são separados. Cama pequena, porém confortável. Apesar de ser barato se vc for ao Ibis do lado vai se surpreender com a pequena diferença do preço entre um e outro e o aumento da diferença entre os quartos em quesito conforto."
jul. de 2017,5,Ótimo Custo Benefício!,"O hotel é muito bom! Os quartos são limpos, tem ar condicionado, Wi-Fi e uma cama extra pra crianças (no caso eu não usei, mas pra casais com um filho é super bom).    Há um bar no térreo que vende bebidas e algumas comidas (salgadinhos, doces, etc).    A localização é ótima, bem próximo da feira que acontece aos domingos e do bairro Savassi.    No sábado a noite tinham food trucks na porta do hotel, um ambiente bem legal.    Os quartos não tem frigobar, mas pra mim não foi um problema.    Eu voltaria tranquilamente."
jul. de 2017,1,Evite!,"Quarto muito pequeno, mal conservado, aquecimento não funcionou, atendimento por pessoas inexperientes, café da manhã não vale o preço.  Não havia cobertor no quarto.  A localização é ótima. Pelos gastos com o estacionamento e com o café da manhã poderia ter ficado num hotel melhor."
jul. de 2017,4,Estadia sem surpresas,"Se vc conhece o estilo budget pode se hospedar sem medo pois segue o padrão ibis sem surpresas. Não tem toooda a hotelaria de luxo mas o atendimento é eficiente, a equipe extremamente atenciosa, a estrutura super adequada - cama boa, chuveiro ótimo - e a localização é ótima! Enfim volto sem dúvida!"
jul. de 2017,2,"Boa localização, mas muito simples!","O hotel não oferece conforto, não tem toalhas de rosto, as toalhas são ruins e a TV pequena, com poucos canais. O estabelecimento é destinados a viajantes para per noite, para apenas uma noite de sonho. Boa localização e a internet muito rápida."
jul. de 2017,3,Normal!,"Hotel muito bem localizado, padrão da rede Ibis em atendimento e limpeza. Recomendo, contudo acho muito ruim a rede não oferecer toalha de rosto, e ao precisar o hóspede ter que ir até a recepção para pegar, uma outra toalha de banho."
jul. de 2017,3,Bom lugar,"Descansem curtam suas folgas , suas férias, Sua família. Muito sucesso para vocês nas viagens. Invistam no ibis e um ótimo lugar para se hospedar com otimas acomodacoes e um conforto que só lhe propotciona melhores momentos."
jun. de 2017,3,falta de higiene,cabelos (muitos) nos azulejos do box do banheiro. INADMISSÍVEL EM TERMOS DE HIGIENE e qualidade dos serviços. Por sorte a pessoa da recepção procedeu na troca de quarto sem nenhum custo extra. Ao menos a equipe da recepçao pediu desculpas.
jun. de 2017,2,Baixo padrão,"Estadia simples, informal, lencois ok, toalhas de pessima qualidade, café da manhã pago extra e sem qualidade. O tamanho é pequeno e o chuveiro bom, porém, penso que pelo preco pago deveria ser melhor. Acredito que pesquisando melhor existam melhores ofertas custo benefício."
jun. de 2017,3,Padrão IBIS Budget,"O bom do Ibis é que vc encontra exatamente o padrão deles. No budget não seria diferente.  Pra quem não conhece, os quartos são bem pequenos, acústica nem sempre é boa, não tem shampoozinhos e sem café da manhã.."
jun. de 2017,4,Elevadores,"Muitos quartos para poucos elevadores.  Em horário de rush conseguir subir ou descer pode ser uma aventura.    Mesmo já tendo cadastro na rede é necessário perder bastante tempo refazendo o cadastro.    Nunca tem troco para pagar as comidas que ficam no lobby, obrigando o pagando com cartão."
jun. de 2017,3,Padrão IBIS!,"Hotel padrão IBIS, com quarto básico e banheiro estilo europeu (WC separado do chuveiro). O quarto merecia manutenção pois tinha alguns pontos de infiltração/umidade nas paredes próximas à pia. Bom para uma noite.  Boa localização. Atendimento lento na recepção."
jun. de 2017,3,Hotel para viagem de negócios,"Sempre que vou para a BH me hospedo nesse Ibis, o bom da rede é que você não tem surpresas, independente da região eles são praticamente idênticos.    O café da manhã é muito bom e o atendimento ainda precisa melhorar, porém nada critico.    Ponto forte é a localização, o bairro é muito gostoso, perto de restaurantes, mercado e bares."
jun. de 2017,5,Melhor custo benefício,"Ibis Budget é um dos melhores na relação custo benefício. O atendimento é excelente, o check in é realizado de forma rápida e simples, os quartos são bem limpos e a limpeza diária também é muito boa. O check out é facilitado: basta deixar a chave do quarto em uma caixa, sem necessidade de espera por atendimento na recepção. É sempre uma das melhores opções para hospedagens de curto período."
jun. de 2017,3,falta de atenção,"Estive nesse feriado de Corpus Christi por 4 dias hospedada nesse hotel. A localização é boa, o café é satisfatório mas por dois dias foi necessário solicitar um jogo de toalhas para o quarto que eu estava, pois a camareira esqueceu de substituir as que tirou do quarto. Falta de atenção..."
jun. de 2017,3,Barulhos incomodam,"Sabendo da simplicidade e objetividade oferecida como primários do hotel, o serviço de recepção, café da manhã, limpeza e manutenção são ótimos. Ressalto apenas o desconforto dos ""sons"" e ""batidas"" dos quartos vizinhos na madrugada que podem interromper o sono e até mesmo incomodar."
jun. de 2017,3,Excelente para dormir,"O hotel tem uma boa localização. Próximo tem alguns bons restaurantes e um shopping center, o Pátio Savassi. A cama é muito confortável e o banheiro tem uma boa ducha quente. O quarto é pequeno mas cumpre o que promete. A conexão da internet foi um ponto ruim, mas pode ser a localização do quarto (aconselho observar outras avaliações). O café da manhã é simples, mas muito bom."
jun. de 2017,4,Perfeito para viagens rápidas,"Me hospedei por uma noite à trabalho e não tive dificuldades nem no check in nem no check out. Tudo simplificado e rápido. Quarto simples mas confortável. Café da manhã é contratado à parte, mas bem servido."
jun. de 2017,4,Passeio,"Fiquei nesse hotel 1 noite ,foi ótimo recepção muito educada e o hotel e ótimo ,próximo do aeroporto,serviço de quarto e frigobar,sem comentários,fica um pouco distante dos passeios mais vale a pena por que minas e tudo muito lindo!"
jun. de 2017,3,Custo beneficio!!!,"Para passar a noite tem um ótimo custo beneficio!  Quarto pequeno e simples, banheiro apertado e cama superior tipo beliche.  Mas adequado para quem vai passar uma noite ou pouco mais.  Voltaria caso precisasse!  Check in muito demorado foi principal ponto negativo."
jun. de 2017,5,Excelente custo benefício!,"Quarto padrão como todo Ibis. Região com muitos restaurantes e de fácil acesso. Limpo. Estrutura nova. Excelente custo benefício, muito prático para quem vem a trabalho. Atendimento bastante atencioso. Café da manhã bem básico, mas suficiente."
jun. de 2017,5,Satisfeito,"Está de acordo com as minhas necessidades. Acho que pode ter uma opção de frigobar opcional. Menu com informações da região, bares, restaurantes, padarias próximas. É muito boa a localização e o ponto de táxi na portaria facilita muito."
mai. de 2017,5,Válido como todo Budget,"Hotel da Íbis que cobre perfeitamente o que se propõe: quartos simples, para até 3 pessoas, com boa cama e muito útil para quem vai apenas passar a noite. Estacionamento pago a parte (R$19,00 a diária com possibilidade de entrada e saída a qualquer momento) e café da manhã contratado à parte também (R$16,00)."
mai. de 2017,4,Bastante satisfatório,"O hotel é muito bom. Funcionários educados, instalações novas. O que achei como ponto negativo é a voltagem do hotel nos quartos ser 220V, mas eles disponibilizam adaptador para empréstimo por até 2h. Para quem vai a BH a negócios ou para uma estadia rápida, eu recomendo demais."
mai. de 2017,4,Ótimo custo benefício.,"Bom para viagens em que você só vai ao Hotel para dormir,o quarto é bem pequeno,com uma cama de casal e uma de solteiro por cima,quase como uma beliche,banheiro micro, etc. Mas,o quarto é limpo,a cama é boa ,e o preço é bem justo,tem estacionamento pago a parte mais com um preço bem razoável também,e ótima localização."
mai. de 2017,4,"Hotel enxuto, prático.","Para um hotel de baixo orçamento ele atende muito bem, Boa localização. Não há telefone nos quartos, nem kits de shampoos , o café da manhã e a garagem não estão incluídos na diária, próprio do hotel budget."
mai. de 2017,4,Estadia econômica e agradável,"Hotel com ótimo custo benefício, gostaria que existisse essa opção em todas as cidades do Brasil. Bem localizado, ao lado de supermercado e próximo ao centro e região da Savassi em Belo Horizonte. Café da manhã justo por R$16,90. Vale muito a pena!"
mai. de 2017,5,Muito bom!!!,"Muito bom, café da manhã muito gostoso e variado. Problemas para usar meu secador no quarto, a voltagem da tomada não suportava. Poucas tomadas e a porta do banheiro não tinha fechadura. Recepcionistas muito educados."
mai. de 2017,2,HOTEL PARA ESTUDANTE COM MUITO POUCA EXIGENCIA!!!,"O Ibis Budget embora pertença a rede Ibis tem uma proposta que é completamente distinta (eu particularmente não conhecia, por isso me hospedei no hotel), ou seja, é um hotel onde os aptos tem 11 m2 nao tem telefone, frigobar, secador, ferro de passar um por andar, ou seja, nao oferece absolutamente nada. E ai você pergunta sobre os preços, são um pouco mais baratos que os demais, porem nao justifica o desconforto. A TV (de 14 polegadas) a cabo conta literalmente com meia dúzia de canais e nada mais, o pessoal do hotel, recepção e outros ficam muito a desejar em relação ao atendimento oferecido, simpatia e por ai vai. Nao tem restaurante e o estacionamento é pago. A internet é horrível. Resumo: Hotel para quem tem pouca ou nenhuma exigencia. Nao recomendo e tão pouco voltaria!!"
mai. de 2017,4,"Ibis, meu local de descanso em BH","Segunda vez que volto a BH e novamente hospedei-me no Ibis. Tal qual a primeira hospedagem, o padrão continua, atendimento muito bom, mesmo estando cheio, pois percebi que tem muitos eventos e congressos por lá. A unica ressalva é para o café da manhã, poderia ser melhor, mas não tira o gosto e caso tenha oportunidade de voltar a Minas, voltarei ao IBIS com certeza."
mai. de 2017,3,Razoável,"Hotel estava com capacidade máxima de ocupação e o serviço ficou prejudicado. Não conseguimos travesseiros e nos cederam apenas um cobertor por apartamento. Para subir nos elevadores havia fila. O café da manhã não serve nenhuma opção quente. Apesar disso, a higiene e atendimento foram dentro das expectativas."
mai. de 2017,1,Decepcionante em todos os sentidos,"Fui para um congresso e já estava incluso este hotel, para começar a história eles marcaram check-in as 14horas e os quartos não estavam limpos, criou-se uma fila enorme e como chegamos as 16 horas e o congresso começava as 17:30 não conseguimos fazer o check in pois os quartos NÃO ESTAVAM LIMPOS AINDA. Conseguimos fazer check in as 23horas quando voltamos depois de ter deixado nossos pertences em quartos de amigos ainda com pessoas da recepção pouco receptivas. Ficamos em quarto triplo onde a camareira não arrumava a cama de cima (pois é uma de casal embaixo e outra de solteiro em cima). Hotel sem estrutura alguma, sem secador, transformador para todo mundo . E adaptador de tomadas eram apenas vendidos, poucos elevadores para o número de pessoas, enfim total decepção."
mai. de 2017,4,Um hotel que cumpre a proposta,"Esse hotel cumpre bem a proposta da rede a qual pertence, tem um quarto básico, porém confortável e limpo a um preço justo. Tanto estacionamento quanto o café da manhã são pagos a parte. A localização é muito boa dentro de Bh"
mai. de 2017,4,AGRADÁVEL,"Excelente localização, sempre busco conforto e qualidade no atendimento e quartos.  Apenas gostaria de acrescentar que a cama (beliche) não foi arrumada nos dias que me hospedei em Abril no período de 28/04 à 01/05."
mai. de 2017,5,Satisfeita,Excelente custo x benefício  Ótima localização.  Limpeza  Atendimento de qualidade  Funcionários simpáticos  Variedade na geladeira e balcão do térreo  Roupa de cama e banho limpas  Quarto silencioso  Vista bonita
