Data da opinião,Nota,Título,Conteúdo
mar. de 2015,4,Muito lindo,"O hotel é maravilhoso, achei a localização ótima, pois amo sossego, e como o hotel fornece transporte ate a vila então foi perfeito, sei que todo mundo reclama do transporte eu particularmente achei ótimo contando que qdo se decide em visitar morro a idéia é se desapegar pois la td é muito rustico de difícil acesso eu achei a ""Jabiraca"" segundo meu filho ""jabivaca"" que atende bem os hospedes, o que acho q a prefeitura deveria deixar o caminho mais bonito, com coqueiros, no caminho VC vê a pobreza de morro, mas isso não é culpa do hotel, o sinal da internet nao é dos melhores, mas quem se preocupa com isso se em frente ao hotel se forma uma vista maravilhosa mas verifique a tabua da mare antes de marcar a viagem pois com mare alta não é a mesma beleza da maré baixa, o que faltou muito foi atividades pra criança e para adultos também, já que o hotel tem funcionários pra isso que fica la, só não entendo porque não acontece, de tanto alguns hospedes reclamar foi feito algumas coisas mas poderia melhorar, a alimentação também é boa, o cafe da manha bom, os preços são caros assim como quase td em morro, mas achei compatível com os preços da vila, a única coisa que me chateou foi a questão que o hotel não possui uma copa pra mamãe, ai pedi na cozinha um copo de leite toda noite para meu filho, no ultimo dia o chefe da cozinha deu uma bronca no funcionário e me cobrou 7,00 o copo de leite copinho de 200ml, acho que o hotel poderia sim cobrar mas um preço justo, agora não tem copa e ainda cobra 7 o copo, muito chateada por isso, mas deixando isso de lado o hotel é lindo e pra mim o melhor de morro, mas falta treinamento para os funcionários , que são muito atenciosos e simpáticos"
mar. de 2015,4,Tranquilidade,"Gostei muito desse resort, o lugar é lindo,comida boa mas um pouco cara, acho que não vale a pena pegar com meia pensão, fiquei muito na dúvida sobre isso mas acho que economizei um pouco ao optar apenas com café, pois pude jantar algumas vezes no centro, e me custou bem menos que jantar no hotel. A praia é maravilhosa, tem piscinas naturais bem em frente muito boas para fazer mergulho com snorkel, a piscina do hotel também é muito boa e limpa. O único ponto fraco é a distancia, realmente bem longe de tudo, impossível ir a pé para a segunda ou quarta praia, tentamos ir até a praia do encanto mas desistimos depois de uma hora de caminhada, mas vc pode alugar bicicletas no próprio hotel.A noite não há absolutamente nada pra fazer no resort, acho que deveria haver alguma opção lá mesmo, como uma música ao vivo pra distrair. No geral gostei muito."
mar. de 2015,3,Precisa melhorar a atenção aos hóspedes.,"A estrutura do Resort é muito boa, mas o atendimento deixa muito a desejar. Equipe de colaboradores muito perdida, com pouca disponibilidade/vontade para dar dar informações. A impressão que nós ficamos é que a equipe não está preparada para algo que saia do comum, ou seja, do trivial do dia a dia deles. Por exemplo: eu questionei que peixe era servido na porção e ninguém soube me responder, mas também não demonstraram interesse em tentar descobrir. Tive problemas com a localização do meu quarto, já que era afastado da área do restaurante, piscinas, etc e eu tenho problemas no joelho e solicitei alteração, a primeira resposta foi NÃO. Entrei em contato com meu agente de viagens pedindo ajuda e ele me afirmou que o gerente iria me procurar, com urgência, para conversarmos e verificarmos o que era possível fazer... fiquei 6 dias por lá, fui embora e não fui procurada por ninguém. São pequenas coisas, mas que fazem cair o conceito do local. O transporte para a Vila é feito num ônibus em péssimas condições, inclusive sem janelas, mas funciona com pontualidade e os motoristas são muito gentis e educados. Pense num local para descansar ou fazer passeios por Morro, já que não há opções de recreação dentro do Resort. As opções de refeições não são muito variadas e os pratos vem pouca comigo. Vale a pena conhecer, mas tem muito que melhorar."
mar. de 2015,4,Pé na areia,"Acomodações muito boas, amenities Natura, excelente café da manhã, com tapiocas feitas na hora, piscina muito boa, ambiente agradável, jardins bem cuidados limpeza do resort muito boa.Peca no onibus para transporte dos hóspedes ( apesar de ser o hotel com maior quantidade de horários ) o ônibus é muito ruim com janelas quebradas inclusive, não há variedade de petiscos ou refeições e o atendimento na área da piscina deixa a desejar, sentimos falta de atividades de recreação e interatividade com os hóspedes,apesar de não estarmos com crianças verificamos que não houve nenhum tipo de recreação com as que estavam com outras famílias."
mar. de 2015,5,Férias tranquila,"O local é ideal para quem está a procura de paz e tranquilidade. As acomodações são muito boas, a piscina com bar molhado é bacana, e a equipe do hotel faz toda a diferença, pois está sempre disposta e faz de tudo para atender bem aos hóspedes. Os bangalôs são bem espaçosos e não se houve barulho a noite. As piscinas naturais que se formam na quarta praia são um espetáculo à parte e o hotel organiza caminhadas que são monitoradas pelo Ronaldo e pelo André que são pessoas extremamente atenciosas. O café da manhã e o restaurante são muito bons. Vale a pena se hospedar no Patachocas."
mar. de 2015,4,"Não é, na verdade, um resort.","Apesar do nome, não se trata na verdade de um resort. Fica em frente à praia, porém distante dos restaurantes e barzinhos. Os funcionários são simpáticos e receptivos, cama e travesseiros confortáveis. Tem uma piscina deliciosa. E a comida do restaurante é muito boa, mas carinha. No apartamento, os chuveiros são elétricos, o que me incomodou. Havia alguns bichinhos no quarto, como aranhas, moscas, pernilongos, mas eles já deixam um baygon em cada quarto. Café da manhã razoável, mas demoram a repor as coisas que vão acabando."
mar. de 2015,1,Afastado de Tudo!,"Não recomendo se hospedar nesse Eco resort a não ser que vc prefira ficar afastado de tudo e sem comunicação via Internet. Sinal da wifi deles é péssima. Para vc ir nos pontos principais de Morro (a vilinha, segunda e terceira praia) ficará dependente de um ônibus velho com horários restritos  tanto na ida quanto para volta. O que me salvou é que me hospedei apenas 1 dia  para conhecer, depois fui para segunda praia, melhor  localizacao! Patachocas já foi bom..."
mar. de 2015,5,"Fantástico, perfeito","Estou realmente encantado com o hotel e a praia em frente. Simplesmente perfeito, com atendimento excelente, boa comida com preços justos, várias opções de lazer, com bicicletas, stand up, caiaque, mergulho livre em frente ao resort. Melhor que outros resorts que já fui. Vale a pena tanto para casais novos ( tranporte gratuito para o centro) como para famílias com crianças e adolescentes."
mar. de 2015,4,Maravilhoso!!!,"Amei o hotel, localização perfeita, na quarta praia, linda, mar calmo, praia mais privativa por ser distante da vila e não ser de tão fácil acesso para todos. Possui ônibus particular com horários estabelecidos de ida e volta para a vila, pontual. Acho que deveriam personalizar o ônibus, com a logo da pousada, e dar uma leve reformada.  O hotel é lindo, super bem cuidado, com opções de lazer gratuitas, quadra de tênis, piscina, campo de futebol e pagas, aluguel de bike, stand-up, caiaque, cavalos, etc. Ficamos hospedados no bangalô luxo, cama excelente, travesseiros, banheiro ok.  A comida não é das melhores, dá pra satisfazer o apeite, mas sem gracinha, sem cuidado no preparo, mas isso creio ser exclusivo de morro de são paulo, não gostei de nenhum dos restaurantes recomendados na cidade.  Tive um problema na piscina que não foi solucionado, um hóspede sem educação, colocou seu celular num soundflow (aquelas caixinhas de som que propagam o volume da música), e todo mundo era obrigado a ficar ouvindo o que ele queria, sendo que tem a música ambiente da pousada que chega até a piscina, pedi a um garçom pra falar com ele pra desligar, o garçom sumiu e não voltou, depois falei com o gerente, o gerente pediu a outro garçom, o garçom falou com o hóspede, ele simplesmente, riu, abaixou o volume, mas não desligou, e na hora que o garçom saiu de perto e ele aumentou de novo, o garçom viu que ele não tinha desligado e não falou mais nada, agora imagina se todo hóspede leva seu soundflow e cada um coloca um tipo de música? Dou a sugestão de colocar um aviso proibindo qualquer tipo de música particular em áreas comunitárias, para evitar certas situações, já que nem todos tiveram educação e também nasceram sem bom senso. Quer ouvir sua música, leva um fone...  Outro item a ser estudado, não tem garçom para quem fica nas espreguiçadeiras na praia, se precisa de algo do cardápio tem que ficar indo e voltando pra pedir, buscar e depois levar de volta pq ninguém recolhe..por esses dois probleminhas a pousada não foi excelente, apenas por isso."
fev. de 2015,5,Excelente!!!,"Apesar da viagem para morro São Paulo de quase 3 horas num barco, o local vale muito a pena.  Cidade é muito boa, o lugar é um paraíso.  Hotel tem ônibus para levar e trazer dá para cidade até tarde da noite!"
fev. de 2015,5,Sensacional,"Hotel localizado na 4 praia, melhor praia de Morro. Eu considero como o Caribe Brasileiro. Um privilégio poder estar hospedado la. de frente para aquele mar verde claro e areias claras. A area externa da piscina e muito agradável, para famílias ou casais que querem tranquilidade . Comida deliciosa que deixou saudade, feitos por chefe gabaritado. Tratamento Vip pelos funcionários que fazem de tudo para agradar o hóspede."
fev. de 2015,4,Vale a localização!,"Fui com meu marido no período de carnaval e ficamos hospedados por 7dias no bangalô. A localização do resort e perfeita para quem busca tranquilidade e contato com a natureza. Acomodações e o serviço de limpeza são excelentes, porém o ar condicionado que deixou a desejar. O ecoresort conta com o serviço de transporte até a vila, em diferentes horários, o veiculo e muito velho e sujo, o que não condiz com o padrão. Pagamos meia pensão, estávamos satisfeitos com o buffet até comermos algo estragado e pegarmos uma gastroenterite, que nos deixou no quarto passando mal por 2 dias. Por esses motivos talvez voltaríamos."
fev. de 2015,3,"bom mas precisa melhorar o translado pra quem vai de carro, pois não permite ir de carro próprio na ilha.","Fomos de carro e pegamos lancha rápida até Valença, descobrimos que não pode transitar na ilha depois que compramos o pacote.As instalações do ecoresort são otimas, fiquei no bangalô, o único problema foi a falta de bufet na hora de jantar ou almoçar, compramos o pacote com meia pensão e pensávamos que teriam o serviço, mas venderam poucos pacotes e eles resolveram servir a la carte, ou seja , vc faz o pedido dos pratos, eles demoravam uma eternidade pra servir nossa mesa de cinco pessoas, os pratos eram sugeridos pelo chef e mesmo assim demoravam mais de uma hora pra servir.Outro ponto que precisa melhorar é a praia com poucos quiosques e cadeiras, precisa investir mais no conforto e explorar mais o banco de areia que forma uma prainha mas para chegar lá não tem um caminho seguro os corais machucam os pés. No geral foi bom, outro ponto é o ônibus pra ir até a vila onde tem restaurantes, muito ruim e em péssimo estado, precisa melhorar os serviços no restaurante e vender mais pacotes meia pensão pra que o turista fique mais no resort, minha sugestão servir bufet por quilo de otima qualidade e com preços em conta, dai não precisa ir pra vila no ônibus."
fev. de 2015,5,Ótima escolha,"Perfeito para descansar e relaxar. Pé na areia, piscina maravilhosa, atendimento gentil e acomodações amplas. Localizado na 4a praia, que é uma das mais tranquilas, o que nos garantiu ótima privacidade.  É oferecido transporte diário, em diferentes horários, do hotel para o centro. Apenas sugiro melhoras nesse veículo, que está um pouco velho.  Na maré baixa formam-se psicinas naturais perto do hotel, belíssimas!"
fev. de 2015,5,Tranquilidade junto a natureza.,"Ótimas acomodações, local sossegado, bom para quem curte o silencio a natureza. Aliado ao conforto e boa comida. Como é um local de natureza, cuidar apenas de levar o repelente.Boas caminhadas podem ser feitas. Percorri todas as praias a pé. Andar de bicicleta também é uma boa pedida. Vale a pena também um passeio de lancha pelas praias."
fev. de 2015,5,Muito bommm,"Hotel exelente, confortável , gostei muito , super indicoooo . Passei a minha lua de mel lá, e o resort é completo tem de tudo, comida gostosa, piscina enorme, area de lazer, os quartos limpos, arejado . So senti falta da sky kkkkkk"
fev. de 2015,5,Maravilhoso,"Resort maravilhoso, bem equipado, quartos amplos e muito confortáveis, café da manhã delicioso e atendimento bom. Linda vista de frente para a praia com águas calmas. Serviço de transporte super eficiente para fazer visitas ao centrinho. Super recomendo e voltaria com certeza!!"
fev. de 2015,4,"Paisagem maravilhosa, mas hotel precisa melhorar a administração!","A quarta praia onde está inserido o hotel Patachocas é simplesmente maravilhosa! Mar com águas calmas, cristalinas, praticamente sem onda! Areias brancas e limpas. Praia particular, onde estão praticamente os hóspedes do hotel. Quartos bons, com varanda. Ao entardecer muitos pernilongos (deixamos sempre o quarto fechado). Toalhas finas e gastas. Falta organização na arrumação dos quartos ( meu quarto ficou um dia sem ser arrumado, apesar dos milhares de pedidos meus). Internet gratuita (pega bem). Piscina grande e sempre limpa. Café da manhã farto, com muita variedade, tapioca e omeletes feitos na hora. Muito longe do agito de morro de São Paulo. Um ônibus (muuuuuiiito velho!) faz o transfer gratuitamente para a vila, com horários pré-definidos. Almoço somente a la carte e sem muitas opções, com preço bastante salgado. Jantar com buffet sem muita variedade a sessenta reais por pessoa. No restaurante existem duas mesas de sinuca. Não existe equipe de recreação e atividades definidas. Ronaldo e Cris, que salvaram meus filhos do marasmo, incentivam os jovens e crianças mais velhas com algumas atividades (futebol, vôlei, passeio na praia). Nada para fazer a noite! Pedi para mudar para um quarto mais próximo da piscina e o recepcionista me disse que o hotel estava lotado, fato que pude comprovar ser mentira,conversando com os funcionários. Em pleno janeiro (temporada) o hotel estava somente com metade dos quartos ocupados. Uma pena! Local para descansar, lindo, com infraestrutura para ser um resort excelente, mas.........a administração está matando o hotel."
fev. de 2015,4,Perfeito...,"Lugar super agradável e bonito.Praia limpa e tranquila, funcionários super agradáveis e atenciosos. Café da manhã farto e saboroso. No geral uma maravilha. Localização boa, tudo muito bom... Super indico, quem conheceu, não arrependeu."
jan. de 2015,4,Excelente resort numa charmosa ilha baiana!,Ficamos uma semana hospedados neste belo resort muito bem cuidado com um quarto bem amplo e aconchegante. Uma piscina muito gostosa numa praia praticamente particular. Um ótimo café da manhã. O atendimento na piscina deixa um pouco a desejar e o ônibus do transfer para a vila poderia ser mais novo e confortável.
jan. de 2015,4,Lugar lindo e aconchegante!,"Estive agora em janeiro no Patachocas, o lugar é muito lindo e bem cuidado. Os quartos tem bom tamanho, a internet era boa pelo menos no meu quarto. O banheiro apesar de um pouco velho, não deixou à desejar. A área social é boa, porém pode melhorar. O resort apesar de receber muitas famílias com crianças não possui uma baby copa, que me fez muita falta, Ao anoitecer não tinha diversão, principalmente para os pequenos porque não havia playground acessível à noite, nem mesmo uma brinquedoteca que hoje até em lanchonete você encontra, e na TV à cabo só tinha um canal infantil ""Discovery Kids"". A praia é linda, tranquila e você não sente muita necessidade de ir à vila, quer desfrutar daquele paraíso o máximo que pode. O hotel tem um ônibus com horários definidos, que levam e buscam os hospedes da segunda praia (que dá acesso à vila). Com as pequenas ressalvas acima, recomendo muito esse resort."
jan. de 2015,5,Excelente hotel / resort em Morro de São Paulo,"Localização em local muito agradável e calmo, com fácil acesso a todos os pontos de interesse em Morro de São Paulo.  A Infraestrutura do hotel é muito boa e a equipe de atendimento muito atenciosa e eficaz.  A piscina e a praia do hotel são excelentes. A praia é praticamente exclusiva para os hospedes e na maré baixa surgem os corais e bancos de areias, deixando a paisagem ainda mais bonita.  Recomendo o passeio de barco em torno da ilha e visita a Boipeba."
jan. de 2015,4,Muita paz e tranquilidade,"Muito trabalhoso para chegar mas vale a pena ! Atendimento muito Bom ! O quarto Bangalô estava com o ar Condicionado ligado nos esperando ! Piscina excelente !  Comida caseira de boa qualidade. Praia com água morna, delícia ! Vale a pena a estadia! Longe da Vila ."
jan. de 2015,4,Local ideal para descansar,"O local é maravilhoso, além do mar com água quentinha,uma piscina maravilhosa , área verde perfeita para caminhadas , local sossegado, quarto espaçoso. Para os mais aventureiros da pra ir caminhando até o centro pela beira da praia, mas durante o dia. A noite melhor usar o transporte do hotel, não é dos melhores e não tem muitos horários mas nada que seja o fim do mundo. Um problema são as moscas no restaurante, acredito que já tenham resolvido essa situação , pois era uma reclamação constante nos sites. Com certeza voltarei, até mesmo pq peguei dias nublados e aquele lugar com sol deve ser melhor ainda."
jan. de 2015,4,Local ideal para relaxar e descansar,"O hotel oferece quartos e bangalôs numa área com muitos coqueiros, na beira da Quarta Praia, loge da agitação. Os bangalôs são bem bonitinhos, têm varandinha com rede, o quarto é amplo, mas o banheiro poderia ser mais limpo, havia limo nos azulejos. Tem um restaurante razoável para os padrões de Morro de São Paulo, onde os restaurantes são bem simples. A piscina é bem bonita, bem limpa. O café da manhã é bem servido, a tapioca feita na hora é uma boa pedida. O jantar é buffet com variedades de saladas, pratos quente e sobremesas, bebidas a parte. Não tinham muitas variedades de cervejas e a carta de vinhos é bem simples. Os funcionários são atenciosos, muito simpáticos. A praia é excelente, limpa, a cor da água bem bonita, super tranquila. Vale a pena alugar a bicicleta e ir conhecer os arredores. Se não quiser comer no hotel, tem algumas opções para almoçar, como o Neno ou caminhar ou pedalar até o Pimenta Rosa ou Piscina, cerca de 2,5 Km. O hotel disponibiliza um ônibus para ir ao centro, isso é muito bom, pois o táxi custa R$ 30,00 para ir e mais R$ 30,00 para voltar. Passamos o reveillon, a ceia estava muito boa, com muitas variedades de frutos do mar e teve uma queima de fogos bem legal! Recomendo para passar dias relaxando e descansando."
jan. de 2015,5,Tudo de ótima qualidade,"Praia linda, piscina deliciosa, Resort maravilhoso! Vale muito a pena. Amei! Os quartos bangalô são muito espaçosos, a cama é muito confortável, o banheiro muito bom. Sempre tudo muito limpinho. Os funcionários são muito educados e atenciosos. A comida é muito boa."
jan. de 2015,5,Ótimo para familia,"Localizado na melhor praia do Morro de São Paulo, quarta praia, o hotel tem bangalôs simples adequados para praia.  O hotel é muito Muito arborizado e rigorosamente limpo.  Prefira os bangalôs que ficam mais próximos ao restaurante, piscina e praia, um pouco mais caro, mas vale muito a pena.  A piscina é ótima e muito limpa com um bar na piscina.  Funcionários são muito simpáticos e muito bem treinados.  Comida muito boa e com menu para crianças.  Aconselho para bebês, solicitar um prato no almoço e pedir para guardar para janta, a fim de manter a rotina.  As atividades para adultos são coordenadas pelo Ronaldo, muito simpático e prestativo. Não deixe de fazer stand up.  A praia é quase deserta, não fosse por um bar a cerca de 200m e pelos barcos que vem das outras praias, mas não param em frente ao hotel.  Há muitos pernilongos que ignoram os repelentes de ambiente. É legal comprar um veneno na vila e jogar a tarde quando for para praia ou piscina.    Pontos que podem melhorar:  A cama é antiga e poderia melhorar, assim como o colchão e travesseiros.  As atividades são bem satisfatórias para adultos, mas poderiam ser mais intensas e organizadas para crianças maiores (a minha tem 1 ano e 5 meses e não se encaixa).  O ponto fraco real está na limpeza da praia. Está realmente suja e acredito que os principais culpados sejam a falta de educação ambiental de moradores e turistas e a falta de limpeza pela prefeitura e até pelo próprio hotel, que é parte interessada. Postarei sobre o assunto em morro de São Paulo com fotos."
jan. de 2015,4,Pequeno paraíso!,"O hotel está fora da bagunça das primeiras praias e de frente para as piscinas da quarta praia. Quem busca descanso e sossego encontra. O hotel disponibiliza transporte para a vila, mas cansa um pouco o vai e vem. O restaurante é ótimo (moqueca muito boa) e o serviço também. Definitivamente uma boa opção para curtir de tudo no morro!"
jan. de 2015,3,"Boa, mas pode melhorar.","Vi muitas avaliações qualificando como o melhor hotel de Morro..Bom, vou pontuar os positivos e negativos.    A tranquilidade da pousada e a limpeza é o melhor que pode oferecer. A equipe também é muito boa...tentam te servir da melhor forma possível.  Mas para ser ""RESORT"", ainda há muito o que melhorar.    A primeira sugestão é o restaurante.Por ser muito longe da vila e ter apenas ônibus (ou trator)que transporta os hospedes de hora em hora..deveria ter mais opções de comida, e funcionar até pelo menos as 23:00. Um dia fui dormir com fome, pois liguei as 22:35, o restaurante não funcionava (sem a menor possibilidade e o próximo ônibus para a vila era as meia noite.    O outro ponto negativo já foi mencionado: O transporte para vila. Pelo preço das tarifas e pelo titulo de ""resort"", deveriam oferecer um minimo de conforto no transporte. Ônibus muito velho, sem vidros (o jeito é ir tomando poeira, areia e etc..) quando não era transportados por trator que dispensa comentários.    As atividades recreativas da pousada (apesar da equipe se esforçar muito), são fracas. Em geral os hospedes que se organizam entre si para fazer alguma coisa...    A praia da pousada, quando a maré está baixa, é inviável p/ banho pela quantidade de coral.    Acredito que para quem vai com criança, sem intenção de ir p/ vila ou com rotina de dormir bem cedo, é interessante de hospedar.    Eu não voltaria."
jan. de 2015,5,Muito bom !,"Resort muito bom, ficamos em 2012 e atendeu as expectativas !  Local excelente, só é longe da Vilinha, mas tem bastante horário de ônibus pra levar e trazer. Valeu a pena, a praia da frente é muito boa e o serviço é top ! Café muito bom e a piscina nem se fala, a mais bonita que eu já vi !"
jan. de 2015,5,Excelente! O melhor de Morro de SP!,"O Patachocas é simplesmente o melhor hotel e mais bem localizado de Morro de São Paulo. Em plena tranquilidade da quarta praia, ele tem uma excelente infra estrutura. Quartos espaçosos e super limpos, piscina tranquila e ótimos petiscos. O jantar é relativamente simples pelo preço, mas a comida é de boa qualidade!"
dez. de 2014,5,Excelente!,"O hotel é um dos melhores da ilha... Os quartos dos bagalôs de luxo são bem espaçosos e confortáveis.. A piscina sempre limpa e funcionários bem atenciosos.  Acomodado na 4ª praia da ilha, pra mim, a melhor para tomar banho por conta dos corais, fica afastado da badalação, porém o resort disponibiliza um ônibus que faz o transporte hotel/vila praticamente o tempo todo.  Pra quem quer sossego é uma das melhores opções..."
dez. de 2014,5,excelente,"Ele é bem distante da badalação, mas para quem procura relaxar com conforto é ideal,  a Piscina é maravilhosa e o mar transparente com as piscinas naturais bem na frente. Os baianos são excelentes anfitriões. quero voltar la de novo"
dez. de 2014,4,Conforto e Tranquilidade,"O hotel fica na 4ª praia de Morro de São Paulo! O local para banho é ótimo...o mar límpido e águas calmas.  Por ficar distante da badalação da Vila, o hotel dispõe de ônibus que leva os hóspedes para a Vila e da Vila para o hotel em horários estabelecidos (meia em meia hora e em alguns horários de hora em hora).    O café da manhã é diversificado e delicioso. No momento da reserva tem a opção de contratar a meia pensão (café da manhã e jantar)...o preço é de R$ 70,00 por pessoa e por dia.  Para quem contrata a meia pensão o jantar tem entrada, prato principal e sobremesa.    Almoço e jantar (para quem não tem meia pensão) podem ser feitos no hotel...o cardápio é diversificado porém os preços são elevados (assim como a maioria dos restaurantes de Morro de São Paulo).    Para mim, o ponto negativo foi a internet...simplesmente não funciona!    O hotel é indicado para quem quer tranquilidade e para quem tem crianças pois o mar fica em frente ao hotel e a piscina é excelente."
