Data da opinião,Nota,Título,Conteúdo
set. de 2015,3,Bom,"Hotel bom para negocios, a qualidade dos quartos também é muito boa, com caracteristicas muito tranquilas com conforto e qualidade do service geral não restando muitos problemas! Equipe simpatica e agradavel, as vezes o atendimento se enrola e demora um pouco."
set. de 2015,4,Muito Bom.,"Hospedagem agradável, voltaria me hospedar e indicaria a um amigo.  Não tenho nenhuma reclamação, apenas elogios qto ao atendimento e as dependências do hotel.  A única coisa ruim é que pra preencher a pesquisa tem que fazer uma avaliação com no mínimo 200 caracteres, relatando tudo o que já foi relatado na pesquisa."
set. de 2015,3,Diária cara,"Cardápio do restaurante sem muitas opções, e quando pede para alterar algo não pode ser feito, sem flexibilidade.  Quarto bom, porém necessita de alguns reparos e manutenções  Localização muito boa, para deslocamento.  Gostei da localização, Devido ao custo de diária poderia ter uma academia mais moderna, com aparelhos bons."
set. de 2015,4,Calil,"No geral foi muito bem, o hotel é bem localizado e os quartos são amplos, o pessoal é prestativo e bem educado.  Estive hospedado em função de trabalho, mas gostei do hotel e certamente ficaria numa outra ocasião, porém a diária é um pouco acima da minha capacidade."
set. de 2015,4,Excelente localização para o propósito da viagem,"Fomos a Goiania para participar da corrida de rua 15K New Balance. O shopping para retirada do kit de corrida, bem como a arena de largada e chegada ficavam a poucos metros do hotel. Como a corrida começava as 7h, solicitamos que o café da manhã fosse servido às 6h e fomos gentilmente atendidos. Tivemos um problema com o ar condicionado no quarto e em poucas horas efetuaram a troca de apartamento."
set. de 2015,3,Art quebrado e egnoraram meu pedido,"Não gostei do atendimento, no check in avisei q meu ar estava com o ar condicionado quebrado. Depois de 9h quando volto do trabalho o equipamento ainda estava com defeito e a temperatura da cidade devia estar berando 30 graus.  Tive q esperar 1h30 para arrumarem outro quarto e quando me mudaram era um quarto de fumante...    Grande Hotel"
set. de 2015,5,excelente,"excelente o hotel e espero poder hospedar-me mais vezes lá. a piscina poderia ter água aquecida, e os hóspedes ficariam muito mais tempo naquela área, pedindo mais serviços ao bar. mudanças poderiam ser feitas na recepção também, para se evitar longas filas."
set. de 2015,5,Ótimo!,"O hotel é ótimo, bem localizado, o quarto é amplo, limpo e bem distribuído, a cama é confortável, a internet possui boa velocidade, o atendimento é bom, apesar de estar em rua movimentada, não há ruídos no interior do hotel."
set. de 2015,4,Ótimo hotel,"Hotel muito bom para quem vai rapidamente a Goiania, um pouco afastado do centro. Preço bom e café da manha incluído, excelente. Quartos amplos, porém fiquei virada para a rua e isso trouxe um pouco de barulho durante o dia. Vantagem que está localizado bem próximo ao shopping"
set. de 2015,5,Muito bom!,"Hotel maravilhoso, excelente opção em Goiânia.  Sempre passamos por Goiânia nos hospedamos neste hotel e super recomendamos.  Café da manhã saboroso!  Quartos super confortáveis e limpos!  Atendimento muito bom!  Super bem localizado, fica em frente ao shopping."
set. de 2015,3,"Boa localização, atendimento ruim","Atendimento ruim da recepção, sem iniciativa e/ou interesse em atender o hóspede. Bem localizado, fácil acesso a hipermercados, shopping e ao centro da cidade. Pelo valor da hospedagem, categoria e status do hotel esperava melhor atendimento."
set. de 2015,2,Razoável,"Estrutura do Hotel muito boa mas os quartos deixam a desejar.  Fui acomodado em um quarto em que o ar-condicionado não funcionava. após reclamar me transferiram para um outro quarto que o ar-condicionado estava com vazamento, molhando todo carpete do quarto. Como não tinham mais quartos disponiveis, tive que permanecer no mesmo.  Atendimento do check-in pessimo.  Café da manhã bom."
set. de 2015,3,Razoável!,"O hotel tem otima localizaçao para quem quer resolver as coisas proximo ao Flamboyant Shopping e um bom café da manha, o hall é bem decorado, mas os quartos sao antigos, com ar-condicionado barulhento e a roupa de cama velha. Peca também, um pouco pela higiene e organizaçao, o cesto (cheio) de toalhas sujas ficava na porta do meu quarto, sem recolhilmento. Tem pisina, mas nao tem bar, ou atendimento na piscina."
set. de 2015,4,Satisfatoria,ColAbores da recepcao sem iniciativa e má vontade em solucionar problemas porem o restante do hotel foi excelente...faltou tomadas no quarto tambem... A localizacao excelente em frente ao shopping....
set. de 2015,2,Já foi melhor...,Poltrona do quarto quebrado... Ducha do banheiro com aspecto sujo e quebrada... metais enferrujados... Serviço de quarto sofrível 1 hora e meia para entregar o lanche... Enfim.. precisam melhorar ... Pelo preço poderiam ser bem melhores....
set. de 2015,4,Muito bom!,"Hotel muito bem localizado, quartos e ambientes bem decorados, piscina, café da manhã perfeito! Só achei o checkin demorado, pois chegamos às 21h super cansados e ficamos esperando cerca de 30 minutos para localizarem nossa reserva. O quarto que nos colocaram não funcionava o ar condicionado, mas nos trocaram de quarto após a reclamação. Para quem gosta de conforto e pode gastar um pouco mais, aqui é perfeito!"
set. de 2015,5,Confortável e bem localizado,"Excelente hotel. Quarto e instalações muito confortáveis. Restaurante ótimo, tanto para o café da manhã quanto para o jantar. O ambiente da piscina é ótimo para descarregar as energias de um dia de trabalho.  Localizado em frente ao shopping mais popular da cidade.  Recomendo com certeza."
set. de 2015,5,Excelente.,"Fomos muito bem atendidos em todos os sentidos.Atendimento desde o momento da nossa chegada, localização, refeições e limpeza do quarto.A internet funcionou muito bem. O café da manhã talvez poderia ser um pouco mais completo mas estava muito bom."
set. de 2015,4,Boa,"O Hotel ficou com uma área de recepção muito legal após as reformas, deixando a área de recepção com design moderno. O café da manhã poderia ser melhor com mais opções de frutas. A velocidade da internet pode melhorar."
set. de 2015,4,Atendimento exemplar,"Fiquei satisfeito e recomendo.  A localização facilita o descolamento e lazer, proximo de parques, em frente ao Shoppping Flamboyant.  Tem boa estrutura de piscina, bar e restaurante. Atendimento exemplar."
set. de 2015,3,Hotel apenas regular...,"Limpeza dos quartos ruim - pia entupida durante toda estada - 3 dias;  Cofre nao funcionava;  Tx servico eh opcional em Goiania, entretanto a recepcao tentou cobra-la sem me avisar dizendo que era ISS.."
set. de 2015,3,"Boa localização e comida, porém serviços deixam a desejar","Muito boa localização e comida, porém pecam em quesitos básicos, por exemplo: Área da piscina-Em dias movimentados se você chegar a tarde encontrará todas as mesas com toalhas, pratos e talheres que foram utilizados durante a manhã e não foram recolhidos e não têm toalhas limpas por falta de reposição. Fitness Center: Muitos equipamentos danificados que não funcionam. Limpeza do quarto: Se você deixar cair algum papel (""lixo"") no canto do quarto ele vai ficar ali por muitos dias se você mesmo não limpar e também acontece de limparem seu quarto e não reporem toalhas de banho ou kit da lavanderia. Recepção: Se precisar de algo peça com bastante antecedência, pois as solicitações demoram a ser atendidas e às vezes são esquecidas... quando for fazer o check in vão solicitar pagamento ou autorização de pagamento no seu cartão de crédito, porém mesmo você autorizando o pagamento ainda vão te cobrar antes dos seus gastos superarem o valor já autorizado. Quartos: Se for precisar de mais de uma cama no guardo lhe será oferecido um sofá-cama, se você aceitar se prepare para dormir no chão, impossível dormir no sofá-cama. No entanto as camas são boas."
set. de 2015,3,Regular,"Hotel mal cuidado. No domingo com o hotel cheio faltou praticamente tudo no café. desde pratos até comida e bebida. sofá do quarto rasgado, rachaduras nos quartos, demora da comida no restaurante. reservamos um quarto e nos deram outro. Check in extremamente demorado."
set. de 2015,2,O serviço decaiu muito,"Restaurante abriu com atraso todos os dias, para o almoço e o jantar. O garçom não sabia usar o sacarrolhas para abrir o vinho. O frigobar não foi reabastecido, apesar dos pedidos. As toalhas de banho estavam com manchas."
set. de 2015,1,Péssima experiência,"Quartos velhos, cama desconfortável, banheiro sujo, ar condicionado não funciona. Não indico a ninguém a hospedagem. Pessoas que viajam a negócios precisam de conforto, comida boa e ambientes limpos. Super insatisfeit"
set. de 2015,3,media,tv sem funionar!  uma pena hotel deste porte .. uma questão de manutenção.. ou algo assim.. avisei recepção e nada feito... sei que e uma rede! porem digo existe opções .. apenas uma questão de avaliar melhor..
set. de 2015,4,Bom,"Para quem está de passagem o hotel é uma boa escolha, está bem localizado, possui uma área de piscina muito agradável.    O quarto é espaçoso e bem arejado, mas o baneiro e a janela são um pouco pequenos."
set. de 2015,3,Estrutura não condiz com a qualificação,"Escolhi o hotel pela localização e foi o único ponto positivo. Próximo ao shopping Flamboyant e ao supermercado Wallmart. O quarto é grande mas precisa ser reformado. Banheiro com péssimo aspecto. Não condiz com a qualificação do hotel. Já fiquei hospedada no outro hotel da rede (comfort), cuja categoria é inferior, mas a estrutura é muito melhor do que este."
set. de 2015,4,Boa opção,"Hotel perto do maior shopping da cidade e com acesso fácil para toda a cidade. Wi-fi bastante razoável e o tamanho do quarto é muito bom. O café da manhã é bastante bem servido, com uma grande variedade de itens."
set. de 2015,4,HOSPEDAGEM,"Hotel bem localizado, quartos confortaveis.  O café da manha é razoavel.  O restaurante possui bons pratos, no entanto tem um shopping em frente, com isso os preços do hotel passa a ser muito alto.  A limpeza deixa a desejar; o atendimento é falho e fraco."
set. de 2015,2,Fraco,"O hotel tem um serviço fraco, os funcionários são mal educados, com algumas exceções. Tem uma estrutura boa e está bem localizado, contudo, os quartos estão impregnados com um cheiro ruim e não é permitido receber qualquer tipo de visita, único hotel que já vi tal situação. Em frente ao hotel tem um shopping e um Outback, e nos arredores tem o Carrefour, Walmart e outros hipermercados. O café da manhã sempre estava incompleto, tinha que esperar um tempo para reposicao, quando havia. Não recomendo."
set. de 2015,4,Passeio,"Ótima localização,em frente ao Flamboyant,atendimento no check-in muito lento,mais de 30 minutos.Na chegada ao apto.,por sorte do hotel, assim que entrei ouvi um barulho no banheiro e vi um vazamento de água da ducha higiênica alagando todo o piso,eu mesmo fechei o registro e avisei via telefone para a recepção,enviaram uma pessoa da limpeza para secar o piso mas não enviaram ninguém da manutenção para resolver o problema,ou seja,não foi meu caso, mas se precisasse usar a ducha não seria possível."
set. de 2015,4,"Perto, bom e razoável","Hotel razoável, nem muito nem pouco. Café da manhã fraco. Área de lazer muito boa. A rede wi-fi é muito boa. Há segurança para os carros. Mas existem quartos com carpete, que por mais limpos que sejam, aparentam sujeira."
set. de 2015,5,Excelente,Gostei muito de ficar hospedada no hotel. A qualidade dos quartos é excelente. O café da manhã é muito bom e o atendimento também é excelente. As salas de evento são bem equipadas e confortáveis. Eu recomendo!
ago. de 2015,3,Check out,"Atendimento ruim na recepção . Demorado. O atendente estava quase ""morrendo "". Quarto com limpeza ruim. Sempre fiquei neste hotel mas nunca passei por isso,. Ou eles reformulam os quartos e colocam funcionários com pelo menos sorriso no rosto ou estarão sujeitos a ...."
ago. de 2015,3,Hospedagem,No checkin fique esperando de 15 a 20 minutos para ser atendido porque o hotel só tinha uma atendente.  No checkout a atendente só pediu para eu passar o cartão e não me explicou como seria a notas fiscais.
ago. de 2015,5,Quartos super confortáveis,"ótima localização, ótimo café da manhã, quartos confortáveis e espaçosos com boa mesa de trabalho. Bom ar condicionado. Bom espaço de academia, ótimas esteiras, porém o equipamento de musculação estava desmontado."
ago. de 2015,4,Excelente custo benefício.,Boa localização e estrutura. Café da manhã com muitas variedades e excelente apresentação. Instalações limpas e organizadas. Atende muito bem a demanda de um hotel executivo. Recomendo a todos que utilizam o hotel como dormitório.
ago. de 2015,4,Excelente Localização!,"O Hotel tem quartos amplos e confortáveis, fica em frente a um dos principais shoppings de Goiânia, próximo ao parque Flamboyant e ao estadio Serra Dourado, atendimento da equipe é muito bom e o serviço de quarto tem um bom custo beneficio."
ago. de 2015,4,agradável estadia,excelente localização  ótimo restaurante  quarto espaçoso e confortável  check out precisa ter mais atendentes pois fiquei numa fila de mais de 15 minutos  área comum bem agradável  café da manhã bem servido
ago. de 2015,3,Deficiencia na Manutencao,"O quarto 416, onde me hospedei, necessita reparos para que o conforto seja restaurado para quem lá se hospede!  Como já ressaltei em um box anterior, o ar condicionado sem as aletas de direcionamento de fluxo de ar atrapalha quem esta deitado, a torneira do banheiro frouxa não ajuda e a poça de agua oriunda de vazamento da ducha higiênica nos faz molhar a roupa e os pés..."
ago. de 2015,1,Muito ruim,"Muito ruim péssimo atendimento. Quarto insatisfatório, barulho e mosquitos. Houve um e engano na reserva da agência e a capacidade de resolução dos funcionários foi inexistente. Atendimento não receptivo."
ago. de 2015,3,Razoavel,"Bem localizado, porém cafe da manha muito muito fraco, sem: frutas, caputino, chocolate, apenas 2 tipos de bolo e muito seco. A cama excelente, mas muito barulho no corredor, sofa do quarto com muito pó."
ago. de 2015,5,excelente,"A minha avaliação é a melhor possível,todos os funcionários tem um excelente atendimento,proatuvidade e carisma .  Muito bom trabalho e espero ter uma nova oportunidade de estar novamente com vocês numa nova ocasião,espero semprr que precisar receber o mesmo atendimento .  Parabéns à todos os funcionários desde recepção até a cozinha onde capricharam nas refeições."
ago. de 2015,3,Confortável porém atendimento péssimo,"Me hospedei em um final de semana no hotel e infelizmente tiver algumas experiências desagradáveis e poucas boas. As ruins primeiro: No momento do check in o recepcionista diz que há 15% de taxas ( 10% de serviço e 5 % de impostos ), até ai tudo bem mas ele insistiu a todo momento em pagarmos os 10% na hora sendo que há um aviso na parede dizendo que os 10% são opcionais ). Alegou que os 10% é o que determina o valor do seu salário. Disse que iria pagar somente no check out e acabei me dando muito bem. A academia estava em péssimo estado de conservação, com aparelhos sem manutenção e limpeza péssima. No café da manhã as cadeiras estavam todas sujas de comida e quando avisei o atendente nada foi feito. O quarto apesar de ser não fumante estava com um cheiro fortíssimo de cigarro. Agora o mais desagradável foi a ironia do mesmo recepcionista que me atendeu no check in quando disse que não iria pagar os 10%, foi irônico ao dizer que eu sempre tenho a razão.  Quanto ao café da manhã ele é muito bom com muitas variedades e qualidades.  RECOMENDAÇÃO: NÃO PAGUEM OS 10% DE SERVIÇO NO CHECK IN, deixem para pagar no check out, pois se não gostarem do serviço não são obrigados a pagar. É inadmissível um estabelecimento cobrar pela taxa de serviço sem antes ter prestado o serviço."
ago. de 2015,4,Hotel Bom,"Não gostei tbm do cheiro de cigarro nos quartos, apesar de ser um hotel onde é proibido fumar. É so isso que eu tenho para falar, nada mais, isso é muito chato, da próxima vez não preencho mais......."
ago. de 2015,1,Desagradavel experiência,Nos cobraram tarifa diferente e absurdamente mais cara da informada para reserva. O apartamento 313 nao tinha qq luxo que justificasse. Ao contrario: faltava uma mesa e tinha uma luminaria pendurada onde esbarravamos.
ago. de 2015,3,"Hotel honesto, ótima localização","Hotel próx. a mercado, shopping e parque. Conservaçao de carpetes ruim, sem lanhouse, internet instável, poucos funcionários no restaurante e check-in, serviço demorado, piscina limpa só no fim de semana.."
ago. de 2015,3,Praticidade,Cardápio de room serviço muito limitado. Comida deixa a desejar. hotel distante do centro. Em frente ao shopping Flamboyant.  Equipe atenciosa. Quartos com problemas técnicos de ar televisão que atrapal
ago. de 2015,5,Diferenciado,"Um estilo simples onde sentimos em casa, um conforto absoluto.  A acomodação dos quartos são excelentes, assim como os serviços prestados.  Sua localização facilita o acesso a vários pontos da cidade e fácil saída para rodovias."
ago. de 2015,5,Muito bom,"excelente localização, limpeza do apartamento muito boa, custo benefício dentro da média...equipe muito atenciosa e prestativa.  Hotel ficou com outra aparência após a reforma, mais claro e espaçoso .."
ago. de 2015,3,"Satisfatorio, mas não repito","bem a localização do hotel é ótima, mas o atendimento da recepção deixa a desejar, o quarto esta em bom estado, o café da manha bem sortido e bom o pessoal da cozinha muito atento para atender, achei que o pessoal da recepção precisa de um pouco mais de pratica e experiencia para o cargo que ocupam, metade não esta preparada.        o atendimento foi razoavel"
ago. de 2015,3,Não foi uma boa experiência !!!,"A localização do hotel foi adequada as nossas necessidades, a infraestrutura fisíca é boa mas o atendimento da recepção é confuso, demorado e por vezes meio esnobe, mas todos os outros colaboradores são ótimos. Ficamos com um apartamento no segundo andar (uma classe intermediária , conforme nos informaram) porém durante a madrugada o ar-condicionado começou instalados muito desagradáveis, informamos a recepção e foi uma pessoa olhar o ar-condicionado e apesar de muito atencioso não é nada agradável ter um estranho em seu quarto durante a madrugada . Como o hotel estava cheio apenas nos trocaram de apartamento para um no primeiro andar (próprio para portadores de necessidades especiais) barulhento e ao meu ver de uma categoria inferior e na hora do checkout além de enfrentar uma fila por só ter uma pessoa na recepção e vários hospedes saindo , não nos pediram desculpas e nem devolveram nenhum valor."
ago. de 2015,4,viagem de negócio ... realização de evento no Comfort Suites Flambyant,"Viagem negócio. Minha empresa realizou evento. Local excelente., Funcionários, destaque Nathany (eventos).  quanto a estrutura eventos: data show deu problema os dos dias do treinamento. Melhorar a qualidade. Melhorar a iluminação da sala de treinamento.  Falta de cinzeiros nas áreas permitidas para fumantes.  Melhorar limpeza área comum e dos dormitórios. Meu dormitório estava digamos, com cheiro ruim. Estou acostumada a hospedar e realizar eventos somente em hoteis da Rede Atlantica, notoriamente GO INN MANAUS, que nos quesitos que mencionei nesta avaliação são excelentes e a categoria GO INN é inferior ao Cofort SUITES."
ago. de 2015,3,pesquisa,"Regular, tive problemas com faturamento ainda não resolvido, foi cobrado um valor indevido ou faltou entregar algum cupom fiscal, valor de R$ 44,00. Também acho os travesseiros muito baixos, apesar de terem 4 todos são baixos."
ago. de 2015,4,Hospedagem,"Muito bom em todos sentidos, Atendimento, quarto, cama e banheiro, Café da manhã, bom, com muitas opções.  A localização é ótima, além de ser um local bom fica ao lado do Shopping Flamboyant.  Hotel que com certeza fico hospedado novamente."
ago. de 2015,4,SATISFAT[ORIA,"Satisfeito, porém com todas as qualidades boas oferecidas acredito que um pequeno detalhe mas importante possa ser reavaliado:    Chuveiro ! este tipo de chuveiro é muito ruim !  Acredito que com investimento em um melhor produto irá proporcionar maior qualidade e satisfação aos hospedes."
ago. de 2015,5,Avaliação do hotel,"Muito bom este hotel, recomendaria para outras pessoas e breve hospedarei ai novamente pois tem uma boa localização e boa refeição, e também é uma cidade boa onde tem aeroporto e o acesso é fácil com táxi"
ago. de 2015,2,Inferno na torre,"Experiência desagradável para quem precisava do suporte do hotel. Não resolveram o problema do banho, os funcionários foram atenciosos, mas não resolveram. A gerente muito atenciosa ofereceu até cortesia para se desculpar dos problemas. O telefone da recepção (*1) não atende na recepção, provavelmente por falta de funcionário nos horários de pico."
ago. de 2015,2,Péssima Gerencia,"Me colocaram em um quarto para fumantes, sendo que não sou, o quarto fedia, era horrível, solicitei que fosse colocado em um quarto para não fumantes e a gerente disse que não haviam quartos livres dentro do tipo de quarto contratado. Em resumo, eu que viajo muito e estou acostumado com o bom tratamento que os hotéis proporcionam me senti irritado com o tratamento do Flamboyang Goiania."
ago. de 2015,1,Hotel precisando de uma reforma urgente,O hotel precisa ser reformado. O quarto está velho e sujo. A cama e travesseiros de péssima qualidade. A recepção no domingo do dia dos pais ao meio dia tinha uma pessoa para fazer checkin e checkout. Falta de respeito.
ago. de 2015,4,Excelente!!!,"Otima localização em frente ao Shopping Flamboyant e a diversos restaurantes, o hotel é novo, limpo e confortável!! O restaurante Baru é impecável possui excelente cardápio. Indico muito o hotel que preza pelo bom atendimento!!!"
ago. de 2015,1,Péssimo,"Não tive sorte ,fui com os filhos não arrumaram as camas nem o sofá não tinha nada arrumado no quarto foi uma decepção,nos ofereceram para mudar de quarto as 22 40 todos cansados eu não quis pois não era a solução foi prometido na próxima vez uma diária de cortesia tem não quiz pois a solução era arrumar o quarto como em todo hotel do mundo fico Na rede no USA na Europa e nunca tivemos algum problema pedi para falar com a gerente Sr Mariana não estava a gerente de plantão SrManuela não podia atender só com muito incidência da minha esposa ela resolvêu atender e não sabia do assunto pois na leu o livro de ocorrências isso não é padrão da rede .foi um descaso total da Sr que titula se Gerente de plantão Manuela eu só queria o quarto arrumado pois paguei para ter o serviço do qual eu não tive ,o que me deixou bravo foi o descaso da equipe em resolver problema no dia sequinte não queria cortesias nem mimo ."
ago. de 2015,5,Excelente hospedagem,"Hotel com funcionários preparados, pós reforma quartos excelentes, limpeza, cama, banheiros muito bons. Restaurante excelente espaço com uma ótima variedade no café da manha. Estacionamento fácil manobra."
ago. de 2015,5,Concilio entre trabalho e diversão,"O Hotel Confort Flamboyant em Goiânia conseguiu aliar a praticidade e agilidade necessárias a um hóspede que está no local a trabalho, ao melhor de um hotel que está disponível para diversão. As instalações são impecáveis, com quartos amplos, conservados e muito limpos, piscina muito agradável, área de ginastica completa e uma equipe de atendimento extremamente prestativa e atenciosa. Recomendo!"
ago. de 2015,5,Ótima,"Adorei o hotel, a recepção, o conforto, atendimento. Super indico esse hotel.  Está bem localizado, com shopping próximo dentre outras coisas. A equipe está de parabéns por ser tão atenciosa. Obrigada!"
ago. de 2015,2,ficou a desejar,"muito cara a diaria em relação a outro hoteis, não só do Brasil mas de outros paises. O atendente não fez questão nenhuma de atender a nossa solicitação, e ficamos perto do fitness e que era barulhento"
ago. de 2015,3,"Hotel confortável, mas o atendimento um pouco confuso.","Escolhemos o hotel por sua localização, perto de shoopings e do estádio Serra Dourada, pois estávamos em Goiânia para assistir um jogo. O hotel é bem confortavel com quartos espaçosos, mas o atendimento deixa muito a desejar para um hotel desta categoria. Tivemos problemas com o ar condicionado do quarto, houve uma demora para resolver o problema e nos trasferir de quarto e no check out tivemos que esperar em um fila pois havia apenas um recepcionista para vários hóspedes que estavam sainda na mesma hora. Mas tenho que eleogiar o café da manhã e a estrutura do hotel."
ago. de 2015,3,4 estrelas com serviço de 2,"Custo beneficio ruim para um 4 estrelas. Serviço de quarto, restaurante e limpeza regular. Check-out não ofereceu ajuda com bagagens, nem mesmo quando estava organizando o carro na porta da recepção ."
ago. de 2015,5,O mais excelente de Goiânia,Excelente. Depois da reforma da recepção o ambiente ficou mais harmonioso. O Hotel está agora mais com a cara de um Resort. A qualidade e detalhes do Room Service impressionam. Está cada vez melhor. Parabéns. Fiquei hospedado em anos anteriores e notei a grata evolução.
