Data da opinião,Nota,Título,Conteúdo
out. de 2021,5,Ótimo hotel,"Hotel está novo, recentemente reformado, com algumas áreas em término de reforma. Maior até até que imaginei pelas fotos. Quartos grandes para ficar com família. Café da manhã muito gostoso, bastante variado. Jantar também muito bom. Funcionários gentis. Única coisa que incomodou, foi a música alta até as 23 horas ( embora uma parte dos hóspedes estava aproveitando a agitação) . Passado o período de maior movimento, o hotel é bem tranquilo no restante da semana."
out. de 2021,3,"Hotel reformado, mas pode melhorar","O hotel passou uma reforma e ao menos por foto ficou bem melhor. A piscina é muito boa, e tem uma jacuzzi legal.    Ficamos na suíte, e quanto ao quarto, acredito que falta privacidade na área do banheiro, pois o vidro é transparente.    O restaurante também precisa melhorar, não gostamos da comida na janta e por favor pegar cereal com colher, ao invés daqueles tubos, não dá né?    Uma coisa chata que achei que nunca vi em outro hotel é, as ""ameaças"" no menu no quarto, por exemplo ""se danificar toalha, vai ter que pagar, não pode fazer isso, aquilo"" parece que estão fazendo um favor de deixar nos hospedar ali.    Interessante que já fui a outro hotel da rede e não tem isso.    Acústica do quarto não boa, ouvia muito barulho, pensava que tinha crianças gritando no corredor mas na verdade estavam na sala de jogos (que era longe)."
out. de 2021,5,Hotel muito bom!!,"O hotel tem uma ótima infraestrutura, ótima limpeza e atendimento dos funcionários, em especial a Yeni Rosana, que é um amor! Fiquei 12 diárias e com certeza voltarei! Me senti em casa! Café da manhã muito gostoso!"
set. de 2021,5,Férias,"Hotel maravilhoso mas o diferencial é o tratamento dos funcionários principalmente do Restaurante Elvis muito eficiente seu cardápio divino, Zeli sensacional super gente boa, ilton e o Marcos maravilhosos.  Todos de parabéns nota 10 pra todos vcs"
set. de 2021,5,Férias,Perfeito! Instalações confortável!  Cozinheiro Elvis comida top.. super simpático veio na mesa ensinar um prato maravilhoso!  Marcos .. Ivan.... E a maravilhosa Zeli que nos atendeu maravilhosamente... me senti em casa.    Gratidão !!!
set. de 2021,5,Excelente,"O hotel Grand Carimã é maravilhoso. O quarto está tudo novo e sem falar que a cama é muito gostoso e macio. O Wi-Fi sem reclamações só elogio, dos 7 dias que fiquei lá funcionou perfeitamente e com uma excelente qualidade. O café da manhã é maravilhoso com bastante variedades e tudo muito gostoso e fresco. Gostaria de agradecer o Esaquel pela sua simpatia e pela sua educação. E gostaria de agradecer o pessoal da recepção que sempre foram gentil e educados comigo, gostaria de agradecer em especial também o turno da noite, em que moço meio loiro foi bem gentil comigo, eu acabei esquecendo nome dele, mesmo ele falando ( deveria ter anotado como fiz com o moço do café da manhã)  A estrutura das piscina é maravilhoso, eu recomendo aproveitar esse lugar. O serviço da piscina é muito bom também.  E gostaria de agradecer o gerente por ter sido gentil e educado também.  E gostaria de agradecer o pessoal da limpeza que sempre deixou meu quarto limpo e bem arrumado todos os dias em que estive hospedado lá."
set. de 2021,5,"Grata surpresa , não procurem outra hospedagem !","Aqui sim acertamos na hospedagem !Após longa pesquisa optamos por esse 4 estrelas de ótimo custo beneficio . O grand Carima Resort é um hotel histórico em foz, presidentes e celebridades já se hospedaram la , hoje ele esta totalmente reformado ganhou ate um ar de modernidade e trouxe um certo requinte a ele .Aqui tudo é amplo e isso é ótimo principalmente para quem vai em família , quartos gigantes, com varanda , o nosso foi com vista para a maravilhosa piscina , na recepção tem um piano bar onde o hospede pode interagir com o instrumento , assim alguém que sabe tocar passa e faz um show para nos , presenciamos isso e foi incrível. Sala de jogos com tudo novinho , academia perfeita , hidro aquecida ,cafe da manha com um suco verde maravilhoso,só deixo a sugestão de incluir preparo de tapiocas , na verdade não reparei se tinha ,mas no geral o café da manhã é bem variado e com itens de qualidade , nos optamos pela opção meia pensão já que íamos sair bastante e retornar a noite e foi uma ótima pedida , nada melhor do que passear pelas cataratas e outros pontos turísticos e retornar para jantar no Hotel , apreciamos bastante o jantar a massa estava ótima, e o atendimento também bem solicito .Conhecemos o gerente comercial do hotel o Basileu ! Que grata surpresa ele representa o Carimã com perfeição , pedimos para que ele contasse para nos um pouco da história do Resort , foi incrível ,percebemos o quanto ele ama poder falar sobre e o carinho que tem também em receber os hóspedes ,agora compreendo porque o Grand Carimã tem hóspedes que o frequentam a anos e não trocam , sentimos fazer parte de sua história de alguma forma .Tambem quero ressaltar o trabalho do marketing no instagram com a Bruna , começamos a nos encantar pelo Carimã através das imagens vistas lá, parabens . Muito bom poder estar próximo do aeroporto e dos principais passeios , amamos a localização também vimos uma agencia de turismo dentro do hotel que facilita fazer passeios , e passa todas as informações .estou em São paulo e já estou com saudades até dos pavões que passeavam pelo Resort ! Se você vai com crianças reserve um tempo para curtir o hotel , a uma equipe de lazer preparada com atividades o dia todo , onde os pequenos se divertem muito , bacana fazer um roteiro porque ha muita coisa para fazer em Foz mas reservem um tempo para sentir como é se hospedar no Carimã , curtir cada pedacinho antes de voltar !E se sobrar tempo não deixem de visitar o shopping super perto do Carimã , Ate breve !"
set. de 2021,5,me supreendeu,"gostei da limpeza do atendimento das acomodações. Aas refeições bem apresentaveis. Os funcionarios cortes e profissionais, e principalmente a qualidade da alimentação desde o cafe da manha ate o jantar."
set. de 2021,5,Hotel atendeu as expectativas.,"Hotel Grand Carimã atendeu todas as expectativas: localização,limpeza impecável, bom café da manhã, restaurante e piscina. Recomendo, preço justo e atendimento de qualidade.  Certamente eu voltaria a me hospedar.  Sugestão de melhoria: Atentar para a limpeza da hidro, estava bem suja quando fomos usar."
set. de 2021,5,Expetacular!,"O hotel foi todo renovado recentemente, então tudo é novinho e espaçoso. Adorei o atendimento, a comida, a equipe de recreação da Tia Baby, o conforto dos quartos (destaque para as janelas anti- ruídos que faz toda a diferença). A limpeza também merece destaque. Ótimo custo benefício, valeu muito a pena ter incluído o jantar no pacote. Além de tudo isso, o hotel é super bem localizado. O único ponto a ser melhorado é que a piscina não é aquecida. A fica fica gelada demais (inclusive da piscina infantil), mesmo nos dias mais quentes. Nas jacuzzi a água é quente, mas a disputa é grande. Ainda assim, voltarei com certeza!"
set. de 2021,5,Atendimento muito bom,"Em especial os atendentes/ Garçons - ILAN, GEAN, MARCOS, VIVIANE e ZELI  são muito atenciosos e simpáticos! Nós indicamos o hotel ele tem um custo benefício muito bom! Ótimo café da manhã!  É bem limpo e organizado!"
set. de 2021,5,Inesquecível,"Foi incrível passar esses dias nesse resort. Sem contar a limpeza que é impecável. Parabéns a todo time e em especial para a Vivi, Zeli, Jean e o Ilan, que são excelentes no atendimento e recepção. Apaixonada por tudo.  Desde o check-in até o check-out foi sensacional.  A um abraço ao tio pernilongo que foi responsável pela recreação com a minha filha que foi demais."
set. de 2021,5,Passeio,"Maravilhoso,o resort é perfeito.Limpeza incrível,e o atendimento dos profissionais sem palavras,de tão maravilhoso.  Indicarai seu pensar ,para vir visitar o hotel,a amigos e parentes,Quero voltar logo se Deus quiser."
set. de 2021,4,Bom custo/benefício,"O hotel é bem aconchegante, nos proporcionou uma boa experiência. A localização é muito boa, fica localizado na Avenida das Cataratas. O hotel está em reforma, acredito que daqui a algum tempo estará melhor ainda. O quarto onde fui alocada era muito confortável e espaçoso, com uma decoração de bom gosto. Ainda contava com uma varanda, com vista para o jardim. Tudo funcionou perfeitamente, dentro dos conformes, televisão, ar condicionado, frigobar. Banheiro também com bastante espaço, balcão enorme pra acomodar os seus produtos de higiene tranquilamente. Café da manhã era uma delícia, com uma rica variedade de tudo. Diversas opções de pães, salgados, doces, frutas, sucos, iogurtes, entre outros. Tudo bem fresquinho e muito gostoso.  O staff deixou um pouco a desejar. Alguns funcionários são ríspidos e não sabem lidar com o público de forma educada. Área externa super agradável, com piscina e restaurante.  O hotel é muito grande, a depender do quarto em que você fique, precisa caminhar muito para chegar ao elevador ou escada. Se torna cansativo percorrer grandes distâncias ao longo do dia.  Resumindo: o hotel é bom, mas há pontos que precisam ser melhorados."
set. de 2021,3,Categoria Mediana,"O Hotel é bonito, espaçoso, todo reformado e dispões de um bom atendimento de recepção.  Ao chegar no quarto (Grand suíte) encontramos uma cafeteira de cápsulas com algumas opções de bebida e achamos um mimo bem bacana, mas para usá-la, não tinha instrução e era uma marca que não conhecíamos então acabamos estragando dois cafés até aprender a utilizá-la :( posteriormente soubemos que não era uma cortesia e o mesmo aconteceu com o kit de higiene dental que estava na bancada do banheiro, era de qualidade bem inferior e usamos só enquanto não comprávamos a pasta de dente, depois a surpresa, idem...era cobrado. Foi uma frustração não pelo valor a ter que pagar mas pela impressão que ficou, já que esse tipo de cortesia é bem comum especialmente em quartos de categoria superior e em geral tudo o que está à venda fica bem sinalizado.    Serviço de quarto RUIM, arrumavam e não trocavam as toalhas e nem faziam reposição de sabonete, shampoo e sais de banho... precisávamos ficar ligando para solicitar diariamente... isso nos aborrecia bastante depois de um dia cansativo de passeio. Chuveiro do tipo integrado ao quarto, sem privacidade, no meu caso eu não gosto.    Lotação máxima. Acabou a água quente e academia tem 3 equipamentos de aeróbico e 3 de musculação quando parecia ter tranquilamente mais de 200 pessoas hospedadas, sem considerar as crianças.  Refeições razoáveis.  Voltado para família com crianças.  Não satisfez a expectativa."
set. de 2021,1,Hotel péssimo,"Hotel horrível. Apartamento com péssima limpeza, resto de sujeiras de hóspedes anteriores, toalhas ruins, lençol com furo, amenidades péssimas, não tem como chamar esse hotel de grand resort. Além disso, saímos de manhã, passamos o dia todo fora, avisei a própria camareira para limpar nosso apartamento, chegamos às 19:00 e não tinham limpado. Hotel péssimo, não indico para ninguem"
set. de 2021,5,Experiência Cultural,Conhecer o Grand Carimã é fazer um tour histórico de parte de Foz; Hotel 🏨 imponente por sua própria natureza e um ícone em término de retrofit para a cidade.  Excelente localização e de fácil acesso. Apenas 07 minutos do Aeroporto e a 1.8km do Catuaí Shopping.
set. de 2021,5,Excelente hotel!,"Excelente experiência! Superou total as nossas expectativas. Funcionários muito educados e super solícitos em atender todos os nossos pedidos. Piscina excelente, academia simples mas atende bem e restaurantes maravilhosos. Destaque para os funcionários Gean, Jaqueline e Zeli que ajudaram a contribuir para que nossa estádia fosse excelente. Parabéns por tudo!"
ago. de 2021,5,Atendimento excelente,"Agradeço a todos os colaboradores do Grand Carima, durante a minha estadia foi muíto bem atendida em especial o meu agradecimento aos colaboradores, Zeli, Rosana, Ilan, Gean e Viviane.    Local de Boa estrutura e atendimento de qualidade."
ago. de 2021,5,Muito bom,"O hotel é lindo,grande e de excelente qualidade.Sobre a parte de recreaçao tanto para crianças quanto adulto nao sei falar pois fiquei muito pouco la durante o dia.Mas ele é de altissima qualidade e boa localizaçao."
ago. de 2021,4,Diversão frustrada,"Fiz um reserva neste hotel do dia 15/08 a 17/08 de 2021 com intuito de garantir diversão para o meu filho de 08 anos . O hotel em seu site informa que ""A criançada não tem tempo de ficar parada aqui no Resort e adultos não ficam de fora! São atividades durante todo o dia com a equipe de recreação mais animada do Brasil! Kids Club e playground para os pequenos, que recebem a atenção da nossa equipe para se conectar em um mundo de diversão"" . Como minha estadia começou no domingo, aproveitamos para conhecer a estrutura do hotel e claro, pensamos em reservar o dia seguinte para a diversão do meu filho. No dia seguinte acordamos animados e para nossa surpresa não havia atividades na segunda feira dia 16/08 e fomos informados que toda equipe estaria de folga e então questionei sobre a proposta de diversão visualizada no site e ainda perguntei como um resort daquele porte poderia ficar sem diversão para crianças sendo que o hotel conta com tirolesa, escalada e monitores que acompanham as crianças, e a resposta foi que todos estariam de folga .Meu filho ficou bastante triste e ainda tentei ver com o pessoal do resort se poderiam atender ,uma vez que queria proporcionar uma experiência única e me disseram que iam ver e me dariam a resposta o que não aconteceu. Portanto , sugiro que antes de se hospedar com intuito de dar diversão para sua família confirme as atividades que são oferecidas para não terem o desprazer de ter seu filho ou filhos decepcionados. No mais ,o resort é muito bonito e oferece boa condição de limpeza . O café da manha é razoável ,pois condiz com o preço da estadia que ao meu ver não é caro. Tem boa localização e excelente estrutura ."
ago. de 2021,5,Elogio,"Quero elogiar grandemente ao resort que nos acolheu e hospedou com excelência e extrema qualidade e elogiar, recomendar e agradecer o garçom Marcos que nos atendeu com extrema qualidade e eficiência! Muito obrigado."
ago. de 2021,5,Foz dos Sonhos,O Hotel Grand Resort Carimã é excelente. Funcionários educados e prestativos. Tudo higienizando. Refeições maravilhosas. Café da manhã excelente. Vale a pena conhecer. Voltarei outras vozes. As Cataratas é um Bálsamo pra Alma.
ago. de 2021,5,Lua de Mel,"Perfeita recepção e hospedagem! Lugar top. O restaurante e o bar da piscina são excelentes! Os funcionários são super atenciosos. Os guardas do estacionamento são show. Lugar lindo, reformado recente, tudo novo e aconchegante."
ago. de 2021,5,Tudo perfeito,Amei pasar final de semana no hotel quartos maravilhoso refeição deliciosas tudo impecável  Sobre o atendimento perfeito atendente muito amáveis prestativos tratan nós com carinho eu amei parabéns a toda equipe irei voltar .  Gratidão
ago. de 2021,5,Estadia de uma semana,"Hotel grande, com quartos espaçosos e bom atendimento, bastante trabquilo e confortável. Recém reformado, tem aspecto de novo e a área de lazer agrada com jacuzzi, piscina, academia e salão de jogos. Agradeço ao funcionário ""pernilongo"" por ser meu rival no ping pong!!!"
jul. de 2021,5,Ótimo hotel. Só falta piscina aquecida.,"Ótimo hotel. Só falta piscina aquecida. Todos os funcionários excelentes, educados prestativos e muitos atenciosos. Marco, Yeni, Rosana, Ésaquiel, José, Alexandre, Illan, Jea, Zeli, Elizane. Quarto acochegante. Achei localização ótima, longe te tudo, muito sossegado, porém perto dos parques e Aeroporto."
jul. de 2021,4,Recreação maravilhosa!,"Minha filha de 6 anos amou a recreação, ela se divertiu bastante na semana que ficamos hospedadas no hotel! Os tios são muito cuidadosos e atenciosos com as crianças! Parabéns para os tios; Pop, Baby, Quaty, Jota, Relâmpago e Trakinas!"
jul. de 2021,5,Foz do Iguaçu Hotel Gran Carimã Resort,"Atendimento impecável, limpeza impecável, alimentação excelente, ótima localização.  Excelente acomodação para família.  Esquecemos um par de tênis, e o hotel na pessoa da Sra. Mariane e através da equipe do hotel, localizaram e nos enviaram o tênis.  Recomendo!!!"
jul. de 2021,5,"Hotel Reformado, quartos espaçosos, funcionários super cordiais !!!","Hotel excelente, familiar , extremamente limpo e organizado, quartos espaçosos , camas confortáveis, chuveiro maravilhoso, piscina grande e toda a area do hotel muito gostosa, funcionários muito educados fazem tudo para agradar os hospedes, café da manhã variado e bem saboroso!  Localização muito boa ! na frete do hotel pista de caminhada mt legal, fica perto do Shopping uns 10 a 15 min a pé."
jul. de 2021,5,Meu aniversário,"Ótimo café da manhã no quarto, recreadores exelentes (tia Pop, Tia Baby ,tio J , e tio Pernilongo , tia traquinas ) .  Adorei o hotel fui muito bem tratado pelos ( atendentes, recreadores etc...) . Resumido adorei."
jul. de 2021,5,Hotel maravilhoso para famílias,"Hotel fantástico e que superou nossas expectativas.    Passamos o fim de semana, o hotel é amplo, bastante espaço verde e áreas amplas. Muita opção para as crianças brincarem e aqui deixo um parabéns à parte para a equipe de recreação, que cuida das crianças e ainda proporciona atividades para a família.    O atendimento dos funcionários, extremamente cordiais e solícitos.  Quartos amplos, arejados e confortáveis.    Banheiro bom e com ducha boa, nada de ficar sofrendo em busca da água. O jato do chuveiro é forte e bom.    Café da manhã com boas opções e o jantar que é oferecido no hotel - por um valor a parte da diária - tem opções para todos os gostos.    A única ressalva é no atendimento do bar da piscina, há poucos funcionários disponíveis e com isso os pedidos demoravam bastante para chegar. Mas, ainda assim, o atendimento dos funcionários compensava a demora."
jul. de 2021,5,Excelente hotel,"Hotel muito bom, excelente atendimento, pessoal da recepção muito atencioso... Agradecimento especial aos tios da recreação Baby, Pop, Trakinas, Pernilongo, Jota e Quaty, nossa filha já está com saudades!!  Foi muito bom!!"
jul. de 2021,3,Ótima localização,"Ótima localização, próximo do aeroporto e Cataratas do Iguaçu. Quarto limpo, amplo, aconchegante e confortável. Piscina com acessibilidade para cadeirantes. Estacionamento amplo com segurança bem controlada e organizada. Café da manhã e jantar bem básico, bem pouca variedade (achei que deixou a desejar). Check out bem demorado, com apenas uma atendente na recepção."
jul. de 2021,5,Resort Grand Carimã,"Maravilhoso Resort , pegamos meia pensão e valeu muito a pena , Resort Familiar ou para qualquer ocasião . Comidas Maravilhosas, voltaria sempre para este Resort . Lugar com Monitores para crianças . Enfim lugar com tudo até alomoco a lá carte que não é caro , vale mais a pena do que comer em Restaurante fora . Recomendo com Nota 1000 ( MIL)"
jul. de 2021,4,Férias,"Ambiente agradável, sempre bem receptivos.Vale destacar a equipe de colaboradores sempre atenciosos em especial as camareiras Elisane(sempre muito carinhosa) e Jussara.No restaurante sempre muito bem servidos sempre tbm com carinho da Yeni, Jean, e dos demais .Ambiente com espaço privilegiado tornando a estadia satisfatória."
jul. de 2021,5,"Hotel Incrível, Funcionários nota 10!","Fiz uma viagem comemorando aniversário de casamento com minha esposa e precisei de alguns serviços extras no quarto o qual fui perfeitamente muito bem atendido pela funcionária Mariane nos dias antecedentes à chegada e durante nossa estadia.  A estrutura do hotel é impecável, o serviço de quarto é maravilhoso, o café da manhã é completíssimo e os funcionários num modo geral são muito bem capacitados e solícitos.  Gostamos e curtimos exatamente tudo, vale muito a pena selecionar um lugar aconchegante e que fica evidenciado por todos os hóspedes.  Recomendo à todos que vierem a Foz do Iguaçu pra qualquer tipo de ocasião."
jul. de 2021,5,Primeira viagem a Foz,"Limpeza impecável, a Marta que preparou nosso quarto.  Café da manhã e jantar espetacular, com várias opções e com um excelente atendimento em especial do Ilan e Marcos...  Funcionários em geral muito solícitos...meu check-out seria meio dia, mas meu voo final da tarde, permitiram que eu ficasse no quarto até as 17 horas sem custo algum!!  Com certeza voltarei, primeira vez em Foz e melhor escolha no hotel!!"
jul. de 2021,5,Excelente estadia!,"Ótima experiência no resort, equipe extremamente receptiva e cordial. Quartos e todas as demais dependências muito limpas e seguindo todos os protocolos de segurança. Ficamos muito felizes em saber que o Hotel é Petfriendly, pretendemos voltar com a nossa cachorrinha. Queremos deixar registrado nosso agradecimento a Sra Elizane que cuidou com muito carinho de nosso quarto. Hotel todo está de parabéns!"
jul. de 2021,5,ÓTIMA ESTRUTURA E ATENDIMENTO EXCELENTE,"Apesar de estar em reforma, toda estrutura é muito boa.  Aquecedores no bar da piscina seriam ótimos no período da noite, que esfria bastante.  Toda a equipe é muito atenciosa.  O restaurante é excelente."
jul. de 2021,5,Limpeza nos quartos e atenção da equipe de limpeza,"Gostaria de deixar nosso elogio a limpeza e atenção da equipe da limpeza , em especial a funcionaria Elizane que foi atenciosa e educada , atendendo sempre da melhor forma  Muito obrigado Carimã pela experiência única"
jul. de 2021,5,Muito bom,"As crianças se divertiram muito com os tios Pernilongo, Quati e Traquinas ❤️  Café da manhã muito bom. Tem até o biscoito de Percy Jackson 😁 queremos a receita!  Amaram a tirolesa, foi a atração preferida."
jul. de 2021,5,Excelente,"Maravilhoso! Ótima localização, sem contar a excelente equipe! Jean, Ilan, zeli e pernilongo foram excelentes. Aliás, toda a equipe. Muito obrigado mesmo!! Muito próximo de shopping, aeroporto, cataratas, parque das aves, dream Park, excelente!"
jul. de 2021,5,"Ótimo hotel, Equipe muito cordial",Gostamos muito de nossa estadia.  Os funcionários são excelentes.  Café da manhã muito bom.  Jantar com muitas opções.  Quartos novos e bem limpos.  Bem localizado.  Preço justo.  Com certeza voltaremos em uma próxima oportunidade
jul. de 2021,5,Excelente atendimento,"Hotel com excelente atendimento. Boas acomodações e localização privilegiada para visitar Foz do Iguaçu. Ótimo café da manhã. O atendimento dos colaboradores é incrível, sempre dispostos a ajudar e orientar."
jun. de 2021,2,Experiência dia dos namorados,"Primeiramente cabe ressaltar que a estrutura do hotel está linda e aconchegante, o cardápio do jantar e do café da manhã foram excepcionais.    O que, infelizmente, estragou a nossa estadia foi um ocorrido na madrugada de sábado para domingo (12/06 p/ 13/06). Após o jantar, por volta das 22:30 eu e meu namorado voltamos para o quarto descansar, pois no domingo teríamos que levantar cedo para o checkout devido a outros compromissos. As 23:30 começamos a ouvir barulhos altos de conversa e risadas, meu namorado saiu e viu que haviam hóspedes no hall perto do quarto que ficamos, momento em que ligou na recepção e pediu ao atendente Jonathan que solicitasse silêncio aos hóspedes, pois estava atrapalhando nosso sono. Infelizmente, nesse primeiro momento a situação não foi resolvida, precisei ligar novamente na recepção as 00:30 e pedir para falar com o gerente responsável no momento, o recepcionista Luiz passou o meu recado e dentro de alguns minutos o gerente (não me recordo o nome) me retornou no quarto esclarecendo que estavam cientes do barulho e que a equipe já estaria passando em todos os corredores solicitando aos hóspedes que se dirigissem a outro local para conversar ou para seus respectivos quartos. Dentro de alguns minutos, a situação foi resolvida.    Ocorre que, exatamente as 2:30 da manhã nós acordamos com conversas e risadas altas novamente, meu namorado saiu do quarto e tinha um grupo de hóspedes conversando no corredor, infelizmente ele precisou chamar atenção dos hóspedes e pedir que se retirassem dali, pois estávamos dormindo, eles então nos atenderam.    Não sei se o quarto que ficamos não era estratégico ou se essa situação é recorrente, só sei que infelizmente esse episódio acabou com nosso final de semana, pois não dormimos direito, acordei com dor de cabeça e meu namorado (que trabalhou no outro dia) levantou extremamente cansado.    Eu entendo que precisamos contar com o bom senso dos hóspedes, mas entendo também que é responsabilidade do Hotel garantir que a estadia de todos seja adequada e isso inclui controlar os barulhos perto dos quartos.    Como sugestão, deixo a melhoria da acústica dos quartos e a intensificação do controle de barulho nos corredores, principalmente durante a madrugada!    E sinto muito não termos tido uma boa experiência, pois as expectativas foram altas quando compramos o pacote."
