Data da opinião,Nota,Título,Conteúdo
set. de 2019,5,Melhor Atendimento! Melhor Hotel!,"Já estive em alguns excelentes hotéis pelo mundo mas nenhum na minha opiniao consegue se equiparar ao Tivoli Mofarrej, que de uma forma exclusiva proporciona muito conforto e sofisticação, ao mesmo tempo que trata o hospede com afago e aconchego. O atendimento é tão atencioso que te faz sentir em casa, como se estivesse entre amigos. Melhor café da manhã do mundo! A ducha e as camas são um evento à parte. Localização excelente."
set. de 2019,5,INCRÍVEL. Não existe em SP nenhum hotel tão completo.,"Se hospedar no Tivoli Mofarrej é mais do que hospedagem, é uma experiencia conjunta de conforto, bem estar e requinte, tudo isso com o diferencial de um atendimento excepcional e individualizado. Localização excelente. Quartos lindos e amplos. Cama super confortável e lençóis ultra macios. Chuveiro potente e que atinge a temperatura ideal em instantes. Tanto o lobby quanto corredores e quartos, sempre com aquele aroma suave e agradável. O café da manhã merece uma avaliação a parte por ser nada menos que incrível (e completo). O atendimento igualmente merece avaliação a parte, chegamos tarde da noite e saímos nas primeiras horas da manhã. Em ambos os momentos tanto a recepção quanto o Guest Service estavam a postos e prontos a atender. Devido ao horário da saída, tiveram o cuidado/gentileza de providenciar o café da manha ""to-go"" e com isso, me fidelizou!"
set. de 2019,5,Excelência na experiência Tivoli Mofarrej,"Estivemos no Tivoli SP Mofarrej em setembro de 2019 e não há palavras para descrever sobre a excelência que experimentamos. Além da localização que permite mobilidade, fica bem próximo à Av. Paulista. Atendimento - em todos os setores, cordialidade de TODOS os funcionários, espaço das acomodações (quartos e banheiros), limpeza do ambientes, impecáveis. O café da manhã servido em andar mais alto que permite uma linda vista de SP, faz com que o dia já comece bem! Além, claro, da diversidade e frescor das opções oferecidas e mais, customizadas! (Minha irmã pediu uma adaptação ao latte que foi prontamente atendida). Enfim, certamente irei voltar! Super recomendado!"
set. de 2019,5,Perfeição no atendimento,"Um ícone paulistano que se destaca não só pelas suas instalações ( quarto ótimo com cama divina e lençóis sensacionais), localização excelente , elegância clássica com pitada de glamour paulistano mas também se importa no atendimento individualizado de seu cliente. E todos nós gostamos de nos sentir especiais. Destaque para o bar no 23 andar - Seen - que se transforma numa elegante sala de café da manhã ( aliás delicioso ) com vista para a cidade. Excelente."
set. de 2019,5,Super Charmoso e Confortável,"O local é encantador, os funcionários são muito educado e solicito, a cama do quarto é um sonho, queria ter podido passar mais tempo aproveitando tudo o que o hotel oferece, O café da manhã é maravilhoso"
set. de 2019,5,Seen Restaurante,"Excelente restaurante, comida otima e destaque para o garçom Kristoffer, super atencioso e deu otimas dicas para o jantar. Fiquei hospedada no hotel em abril e não ha nada para reclamar. Tudo maravilhoso!!! Minha 2a vez no SEEN e venho novamente"
set. de 2019,3,Alojamento Mediano,O hotel deverá considerar em remodelar os quartos e instalações sanitárias por estarem já desactualizados e com desgaste considerável. A localização é excelente. A piscina deverá ter a água melhor tratada.
set. de 2019,5,Aniversário de Casamento,Nossa noite foi inesquecível! Perfeita! Tudo do jeito que escolhi e meu marido amou! Amamos. Escolhi este hotel porque pra nós é importante reviver em lugares especiais momentos inesquecíveis. Espero voltar em breve.
set. de 2019,5,Excelente atendimento,Equipe muito bem preparada para te recepcionar. Refeição saborosa e ambiente aconchegante. Quero agradecer ao atendimento do Adailton que nos atendeu com excelência no bar próximo a piscina. Colaborador muito educado e prestativo. Voltarei com certeza.
set. de 2019,4,"Serviços ótimos, funcionários cordiais.","Exelente funcionarios e servicos na recepção e restaurantes. Poucas tomadas no quarto, e entendo que caro pelo tamanho. SPA muito bom, profissionais exelentes e serviços de alta qualidade. Localização ótima!"
set. de 2019,5,Casamento Renata e Raphael,"Nós da Mafê Pacini Eventos, gostaríamos de deixar registrado um super elogio à Renata Rubino. Profissional dedicada, experiente, educada e que foi fundamental para que esse casamento fosse inesquecível e impecável.  E claro que à todos os profissionais do Hotel Tivoli São Paulo Mofarrej por toda hospitalidade durante o evento."
set. de 2019,5,Excelente opção de espaço para eventos em São Paulo!,"No início do mês estive no hotel para um evento de apresentação dos espaços para eventos e fiquei impressionada com a versatilidade do hotel, espaço incrível,serviço e atendimento sensacional!!! Fui super bem recebida pelo porteiro mais gente boa que já vi :) José Luiz da Rocha, muito simpático e divertido. O bar do hotel é impecável e os drinks são perfeitos! Vou voltar com certeza. Obrigada a todo o Time Tivoli Mofarrej SP."
set. de 2019,5,O mais aconchegante e perfeito de SP,"Este hotel tem minha atenção pelo atendimento pelos quartos super aconchegantes onde você se sente bem como se estivesse em casa , opções de restaurante na cobertura e no lobby academia bem montada funcionarios muito bem treinados e super educados recomendo muito"
set. de 2019,5,Ótima experiência:),"Fiz meu dia da noiva no Tivolli e fui atendida pelo Villian Chagas, em todo processo de reserva. Atendimento incrível. Quanto ao hotel, café da manhã e atendimento desde a equipe da segurança até a equipe do cleaner e da recepção. Energia incrível. Coisas que a gente tem no brasil :). Gratidão a toda equipe e a experiencia que tivemos."
set. de 2019,5,Melhor hotel de Sao Paulo,"Localizacao perfeita. Quarto e cama sensacionais. Hotel.lindo demais. O cafe da manha e indescritivel e a vista entao, a melhor de Sao Paulo. Equipe sempre muito atenciosa. Servico e pratos do restaurante sao nota 10."
set. de 2019,5,"Hotel moderno com ambiente totalmente sofisticado e agradável com uma equipe proativa, simpática e cordial.","O quarto dispensa comentários de tão aconchegante e espaçoso, muito confortável. Tive o privilégio de conhecer uma parte da Equipe através dos gerentes comerciais Ederes e Leonardo, que são super acessíveis e simpáticos. A coordenadora de eventos Jacqueline me recebeu muito bem e mostrou todos os espaços do hotel e como funciona os eventos e a recepção do funcionário Henrique foi maravilhosa. E como prêmio ainda conheci a Diretora Milena que é um doce de pessoa e ama o que faz, por isso o hotel tem muito sucesso e é o melhor de São Paulo."
set. de 2019,5,Excelente para eventos!,"Realizamos mais uma edição de um evento pela empresa nas dependências do hotel, a infraestrutura é ótima e como sempre a equipe de banquetes, eventos e segurança foram fundamentais para o sucesso do nosso evento.  Agradeço a todos que trabalharam diretamente e indiretamente para que tudo ocorresse dentro do esperado nos cinco dias de evento. Agradeço em especial à Thabata, Amanda, Rafael, Paulo, Inácio, Peterson, Pelé, Rodrigues, Marcelo, Gentil e Márcinho por todo cuidado e atenção."
set. de 2019,5,Um dos melhores de SP,"Excelente hotel, muito confortável, elegante, limpo e atendimento nota 10! Já ficamos algumas vezes, porém da última vez fui em comemoração de aniversário, assim que chegamos, fui presenteado com um bolinho e um cartão desejando feliz aniversário! Já tinha ficado anteriormente a negócios em um quarto simples, porém dessa vez resolvemos ficar em um quarto top, que simplesmente foi espetacular! Tirando o imprevisto, que estava em obra na suíte ao lado e gerando barulhos logo cedo, mas que para compensar no checkout para mais uma surpresa, nos cobraram o quarto simples, sem se quer reclamarmos, apenas alertamos que estava com barulhos de obra! Vale a experiência, uma vista deslumbrante de SP e o atendimento é nota mil."
set. de 2019,5,Hotel fantástico,"Realizei um evento no Hotel Tivoli para um cliente internacional.  Tive a todo instante acolhimento da equipe do hotel e pronto atendimento em minhas demandas de última hora.  A presteza e educação dos funcionários e de impressionar qualquer pessoa, basicamente toda a equipe deles é bilíngue e realmente preparados para melhor servir.  O hotel é lindo, os funcionários preparados, a comida é fantástica a localização é ótima e não há como não se apaixonar pelo tratamento recebido.  Parabéns pelo padrão nota 1000"
set. de 2019,5,Excelente experiência,Infraestrutura e design maravilhosos. Funcionários muito educados e solícitos.  Limpeza impecável do quarto.  Café da manhã no último andar com uma vista incrível para cidade.  Buffett do café impecável e com várias opções de comida e bebida.
set. de 2019,5,ATENDIMENTO MAGNÍFICO,"Fernando Moreira, responsável pelo setor de reservas foi simplesmente magnífico em seu atendimento proporcionando a melhor experiência que tive nesse mesmo Hotel. Atencioso, dedicado e competente. Indico certamente. Parabéns à conduta, respeito e disposição pronta para atendimento. Muito prestativo, ágil, receptivo e seguro das condutas. Fiquei extremamente satisfeito!"
set. de 2019,5,Extremamente profissionais!,"Tive o prazer de apresentar esse hotel para o evento anual do nosso cliente. Com muito conhecimento, os profissionais envolvidos foram prontamente dedicados em entender o processo, as necessidade pontuais e gerais e facilmente a melhor maneira de trabalhar em equipe onde todos os envolvidos sejam beneficiados na negociação. Profissionais interessados e claros em suas condutas, postura facilitadora e educada, visão geral do processo de eventos com soluções saudáveis para as necessidades do mesmo. Entrega perfeita e de alta qualidade.  Agradeço imensamente e certamente terei uma enorme satisfação em poder trabalhar com eles novamente."
set. de 2019,5,Equipe nota mil!!!!,"Pelo terceiro ano consecutivo realizo meus evento no Tivolli e cada ano tenho mais certeza que escolhi o Hotel mais incrível e que continuarei fazendo meus eventos lá por muitos anos! A equipe é atenciosa, rápida,resolutiva,facilitadora,a gastronomia incrivel como sempre,enfim meus eventos não seriam os mesmos se fossem em outro lugar!!!! Em especial gostaria de agradecer imensamente o Sr Rafael Purcino que nos deu uma atenção especial o tempo inteiro não deixando dúvidas de que vcs realmente formam uma equipe nota mil!!!! Sucesso sempre!!!"
ago. de 2019,5,Atendimento online para reservas,"O atendimento de Vilian Chagas foi excelente. As respostas foram claras, rápidas, de modo simpático, sem deixar de ser, em momento algum, profissional. Muito satisfeita e ansiosa para chegar o dia da minha estadia(13/09/2019) e disfrutar da experiência!"
ago. de 2019,5,Equipe de eventos impecáveis!!,"Fazer eventos no Tivoli é ter a grata certeza de contar com uma equipe fenomenal, prestativa, ágil e carinhosa que vai abraçar totalmente a ideia e conceito do evento. Sim, eles são incríveis, fazem todo o esforço para que o evento seja único (e conseguem com maestria!!). E já são 7 edições do LEDforum realizadas no Tivoli!!  Além do atendimento primoroso, desde a porta do hotel, vale destacar que é muito claro que o ambiente de trabalho é bastante agradável e que a comunicação interna funciona perfeitamente.  Agradeço imensamente e parabenizo o trabalho brilhante da Cristiane Alves (Coordenação de Eventos), da equipe de Banquetes (Mayara, Milena, Inácio, Rafael, Petterson, Marcelo, Pelé, Rodrigues), Segurança (Alan, Renato, Robson, Adailton, entre outros), Cozinha (Cláudio e Mixeu), Limpeza (Nataly, Helena, Mauro, Kariane, Robério), equipe de Manutenção, bombeiros e gerência geral.  Com certeza estou esquecendo de mencionar nomes, por isso peço desculpas. Mas agradeço toda a plena dedicação, não só durante o evento, mas em todo o período pré-produção, transformando ideias em realidade bem-sucedida."
ago. de 2019,5,Otimo atendimento!,"Fiz a reserva con o Sr. Vilian Chagas, que me atendeu muito bem. Extrema educação e conhecimentos do hotel! Extrema rapidez ao responder meus e-mails, sempre muito cordial e pronto para resolver os problemas!"
ago. de 2019,5,Atendimento,"Excelente o atendimento funcionário Vilian Chagas, atencioso, prestativo, preparado e muito educado.  Funcionários como esse agregam demais para excelência da empresa.  Ansiosa pela minha estadia.  Obrigada!"
ago. de 2019,5,ÓTIMO HOTEL PARA EVENTOS,"Toda a equipe do hotel é muito solicita e atenciosa para atender as demandas do contratante, inclusive para solicitações de última hora.  Ótimo hotel para eventos que necessitam de espaço para stands/feira.  Café da manhã excelente e restaurante fantástico para jantares corporativos.  Conforto e sofisticação para os palestrantes e participantes."
ago. de 2019,5,Hotel incrível,"Esse magnífico hotel além de ficar próximo a avenida mais famosa do Brasil. Tem uma equipe de ponta preparada, para receber seus hóspedes, sempre bem educados e recepitivos além de um restaurante e bar com uma vista incrível."
ago. de 2019,5,noite de nupcias,"Passei minha noite de nupcias la. Ao entrarmos no quarto, fomos recebidos com mimos no quarto como um mini naked cake de chocolate que estava incrivel e champagne. O quarto e as instalações são otimas. O cafe da manhã que é servido no mesmo local que a noite é o Seen é incrivel, pela vista e pela comida. Quem tiver oportunidade, é imperdivel"
ago. de 2019,5,Elogio,"Quero elogiar todo o empenho do profissional VILIAN CHAGAS, Auxiliar de reservas / reservations auxiliary do Tivoli - Mofarrej. Tive um problema para efetuar um pagamento na sexta-feira, cujo financeiro já tinha ido embora, e o mesmo me deu todo o auxilio necessário, me deu alternativas para garantia de pagamento, sem que houvesse o risco de um pagto em duplicidade, até que pudéssemos conferir no dia útil seguinte, garantindo a estadia dos hóspedes conforme reserva.  Gostaria de elogiar também A ISABELA RODRIGUES, da controladoria/ account department, já que rapidamente conseguiu confirmar o pagamento, eliminando qualquer problema.  Obrigada a todos!"
ago. de 2019,5,Ótima experiência Pet ♥️,"Miaaaau!!!  Fui a trabalho no Hotel e tive uma ótima espeeiencia. Lindo hotel, com humanos muito simpáticos e cheios de amor!  Nosso quarto tinha uma vista linda, iluminação linda, super espaçoso, com carpete quentinho e macio.  Ganhei também um kit pet, uma cama para pets super confortável, comedouro e água mineral.  Adoramos o serviço da noite que a humana entregou a previsão do tempo, água e chocolates!  A área da piscina é linda, cheia de verdes e passarinhos!!  Super recomendo! O hotel e incrível, atendimento de mil estrelas!! Com certeza quero voltar! ♥️♥️♥️"
ago. de 2019,5,Hotel espetacular!,Equipe fantástica! A alguns anos fazemos o evento da empresa no Tivoli e só tenho elogios á fazer. Todos são muito atenciosos e prestativos. Estão sempre atentos aos detalhes. A comida é excelente e o hotel muito confortável.
ago. de 2019,5,Hotel Fantastico!,"O estabelecimento é fantastico. O quartos são otimos, a area comum tambem.  Destaco o antendimento dos funcionarios que são muito atenciosos. Principalmente ao VILIAN CHAGAS que desde o inicio do meu contato foi muito prestativo e me ajudou sempre que necessário.  Recomendo para todos!"
ago. de 2019,5,Evento da Empresa no Hotel.,"Só tenho coisas boas para escrever, a equipe de eventos é maravilhosa...todos super atenciosos, educados e prestativos! Apesar de terem acontecido 2 eventos simultaneamente deram conta, inclusive me atenderam com itens extras fora do contrato. Um agradecimento especial para a Mayara Azevedo, Thabata Bertho e Inácio."
ago. de 2019,5,Reserva com o Vilian,"Minha experiência de reserva no Tivoli Moffarej com o Vilian foi maravilhosa! Ele respondeu super rápido e com uma super eficiência. Adorei :)))    Ele ainda foi flexível e teve paciência comigo e todas as alterações que precisei fazer, me ajudando com cada uma de minhas dúvidas."
ago. de 2019,5,Sensacional,"Tudo perfeito. A comida do Restaurante Seen é maravilhosa. Deixo uma atencao especial para a garconete Carime do restaurante que é extremamente agradavel e resolutiva. Quanto ao hotel, limpeza, atençao e cordialidade dos funcionarios, refeicoes.. tudo perfeito"
ago. de 2019,5,Melhor atendimento possível.,"Atendimento excelente, pessoas muito especiais atendendo tals como a Isabel da reposição do frigobar, Júnior e Sidnei da recepção, Sidnei do Must, mensageiros atenciosos como o Arley e o Ricardo. Sem palavras para agradecer Thiago e G jesse da R1, Inácio e Peterson."
ago. de 2019,5,"Usamos o Hotel pela terceria vez para eventos, e avaliação é 10 em tudo","Hotel super bem localizado , serviço de A&B magnifico, sala de eventos espetacular , equipe super atenciosos, parceiros, organizados, comprometidos com o bem estar do cliente.  O serviço de spa não tem igual na região.  Restaurante com um toque diferente e aconchegante."
ago. de 2019,5,Esplendido,"Alem de lindo visualmente, é super limpo, requintado, funcionarios super atenciosos e educados.  O melhor hotel de SP para viagens a negocios!  No quarto sao disponibilizados todo kit para higiene, frigobar etc."
ago. de 2019,5,Atendimento TOP!,"Liguei para o hotel para realizar uma reserva para o dia dos pais e o auxiliar de reservas Vilian Chagas foi extremamente atencioso e prestativo.  Por ser uma data especial para nós, nos colocou em um quarto com banheira e vista para o parque. Além disso, deixou o berço da nossa filha tudo preparado com cobertores e uma banheira para banho.  Café da manhã muito bom e atendimento com excelência! Adoramos! Voltaremos com certeza!"
ago. de 2019,4,O lugar,"O hotel, possui ótimas acomodações, alem de está bem localizado. O hotel está próximo à avenida Paulista. O atendimento também é bastante diferenciado, com um café da manhã com bastante variedades. Recomendo, tanto para quem vai fazer negócios, ou para turismo em Sampa."
ago. de 2019,5,Reserva dia da Noiva!,"Fiz a reserva de uma suíte standard no Tivoli um ano antes do meu casamento. Próxima a data, entrei em contato com hotel para confirmar a reserva e solicitar um upgrade. O Vilian Chagas foi super atencioso e prestativo! Me ajudou com o upgrade e mandou fotos da suíte para que eu ficasse tranquila.  Ótimo atendimento, muito satisfeita!    Iasmin"
ago. de 2019,4,Excelente se não fosse o serviço de manobristas,"Exatamente, o pecado da excelência para esse local ficou no primeiro contato: os manobristas.    Não só são pilotos de rallye, como também devolvem seu carro esfolado. E, obviamente, o usuário somente vai ver depois, dada a pressa é “muvuca “ de carros que fazem na frente quando da saída, aonde fica nervoso o “empurra “ para sair. Aí, depois, o usuário, já longe, ou noutro dia, vai constatar os esfolados, ou riscos...Essa é a parte ruim.    De resto, tudo de bom, elegante, charmoso, bonito, fino, despojado, moderno, atenciosamente atenciosos e muito corteses.    Um lugar excelente, se não fosse descobrir depois que o primeiro contato faz a ruim primeira impressão vir à tona."
ago. de 2019,5,Ótimo Hotel,"Hotel muito bom, mas o café da manhã é um pouco simples pela qualidade do hotel. Os quartos são ótimos, limpos e espaçosos. O banheiro é muito gostoso com uma ótima banheira e a vista do quarto para o parque é maravilhosa, Nem parecia São Paulo."
jul. de 2019,5,Serviço de Reserva,"Reservei o Hotel para passar meu dia noiva e noite de nupcias. Fui super bem atendida pela equipe de reservas, principalmente pelo Vilian.  Todos atenciosos e dispostos a te oferecer a melhor experiência"
jul. de 2019,5,Viagem em família,"O hotel apresenta alta qualidade dos serviços, conforto, alimentação e espaço físico.  Grande experiência de jantar no restaurante Must com jazz ao vivo e pedi um prime rib que estava muito bom. Recomendo"
jul. de 2019,5,Orçamento e visita para noite de núpcias e dia da noiva,Atendimento excelente!!!!! Desde o momento do primeiro contato até o fechamento foi nos dado máxima atenção e comprometimento!! Indico 100% o serviço e o hotel Tivoli Mofarrej ! Está sendo e será uma experiência incrível ! Obrigado!
jul. de 2019,5,Atendimento Vilian Chagas,"Eu fechei um pacote para o dia da noiva, e eu amei o atendimento do Vilian, super prestativo e atencioso, um atendimento espetacular e o hotel é muito bontio e fui muito bem atendida, foi tudo muito bom. Adorei!"
jul. de 2019,5,Pré atendimento,"Ainda não me hospedei no hotel, mas já reservei.  Tive um excelente pré atendimento e talvez esse detalhe tenha sido um dos motivos pelo qual escolhi o hotel.    Obrigada Vilian Chagas (auxiliar de reservas)."
jul. de 2019,5,Must Bar,"O cuidado com o cliente começa já na recepção do cliente na entrada do bar. Atendimento excelente dos garçons Sidney e Adailton. Coquetéis muito bem executados (dica do boulevardier, excepcional). Comida muito saborosa (sugiro de entrada a bruschetta de figo com presunto cru, como lanche o Croque Madame e a Mousse de chocolate de sobremesa).  Parabéns."
jul. de 2019,5,Ótimo hotel para eventos!,"Estive recentemente em um evento no Tivoli, o Conecta São Paulo. Amei as instalações do hotel, a localização excelente e a cordialidade dos atendentes. Nunca fiquei hospedada, então não posso avaliar quanto a isso. Mas se você está buscando um local diferenciado para a realização do seu evento, eu super recomendo!"
jul. de 2019,5,"Melhor hotel, maravilhosa equipe","Já faz uns meses que estou frequentando o Tivoli Mofarrej, começando pela central de reservas Bruno que sempre me atende e sempre muito solícito, pois quando vc vira cliente vc espera que seja tratado deferente e lá desde a primeira estadia vc já eh tratado diferente Bruno sempre tentando o melhor preço na linda suite que eu e meu esposo adoramos ficar, na recepção são sempre atenciosos na dose certa, tem a Denise que eh uma fofa com a gente, a Tathiane TB sempre muito educadas, tem o Henrique TB que sempre com carinho separa a suíte que temos costume de ficar, na recepção tem mais 2 pessoas não me recordo o nome agora mas volto aqui pois faço questão de citar eles numa próxima avaliação. E por último e não menos importante as meninas da mordomia, não sei oq seria das minhas surpresas e mimos que temos nos quartos se não fossem elas Andreia que sempre me ajuda nas minhas loucas, além de muito acolhedora faz TD com muito prazer.  Não pensem 2 x pra ficar nesse hotel já sou apaixonada."
jul. de 2019,5,Comemoração especial,"Atendimento excepcional! Cuidado, atenção e carinho com o hóspede!  Precisei reservar um quarto pra uma comemoração de aniversário e fui muito bem atendido pela equipe do Tivoli.  Agradecimento especial para Vilian Chagas que foi extremamente atencioso e prestativo."
jul. de 2019,5,Atendimento funcionário Vilian,"Fui atendida pelo Villian para realizar a reserva do meu dia da noiva.  Ele foi super atencioso, esclareceu todas as minhas dúvidas e me auxiliou com todos os detalhes!    Excelente atendimento e funcionário super solicito!"
jul. de 2019,5,Service by the pool,"Inicialmente, gostaríamos de cumprimentar Adailton do Must Bar pelo excelente serviço - educado e com uma energia leve, nos deixou super confortáveis, extremamente bêbados e bem alimentados.    Único ponto que deixou a desejar da estadia foi a porção de batatas fritas do room service. Abre seu apetite mas não te satisfaz, aproximadamente 60gr de batata.    Com certeza voltaríamos, mas pediríamos porção dupla de batata. Talvez tripla."
jul. de 2019,5,Evento realizado com sucesso!,"Toda equipe do hotel, extremamente atenciosa e eficiente. Nossa comunicação foi muito eficaz através do grupo de whatsapp que criamos e tudo ocorreu da melhor forma possível. Hotel e equipe sensacionais para realização de qualquer tipo de evento."
jul. de 2019,5,Perfect,Top location. Amazing rooms and reception services. Very good breakfast. Wonderful gym. Recepcionistas educados e prestativos. Local mto luxuoso e chique. Lugares comuns e quartos mto limpos e organizados
jul. de 2019,5,Niver Casamento,"Experiência maravilhosa no Tivoli Mofarrej  Atendimento espetacular !!! Fábio da recepção tornou nossa hospedagem mais especial ainda , nos mandando um lindo bolo  Hotel lindo e charmoso  Café da manhã maravilhoso  Restaurante Seen excelente atendimento e pratos deliciosos  Pede um LIFFEY no bar do restaurante"
jul. de 2019,5,Muito bom,"Apesar de erros pontuais na minha hospedagem dessa vez, Tivoli continua sendo meu hotel preferido em SP. Excelente localização, confortável, decoração e ambiente do café da manhã maravilhoso. Ótima academia!"
jul. de 2019,5,Fantástico...,"Realizamos no hotel 06 eventos da Copa América 2019 entre Junho e Julho e foi tudo sensacional.. Atendimento excelente e impecável, quero agradecer a todos os coordenadores de A/B, Banquete (Rafael, Petterson e Inacio), Segurança (Paulo Batista e Alan) e Limpeza, todo o staff sempre atenciosos..."
