Data da opinião,Nota,Título,Conteúdo
jan. de 2018,5,Opção justa,"O café da manhã é muito bom, os funcionários são prestativos e educados, principalmente no bar. No armário do quarto há cheiro de mofo (limparam melhor depois que pedi) e o piso da área da piscina é escorregadio. A localização é ótima. O estacionamento é pequeno para o tamanho do hotel. Não gostei muito de usar a pulseira de identificação. Tive impressão que não prestam muita atenção nisso. Eu voltaria a me hospedar."
jan. de 2018,5,"RECOMENDO, OTIMO HOTEL.","Hotel excelente, com funcionários atenciosos e eficientes e muito bem localizado. Ótima piscina, ótima área de lazer e ambiente muito agradável m musica ao vivo todas as noites. Vale muito a pena se hospedar no Brisa da praia. Parabéns a toda equipe."
jan. de 2018,2,Pelo preço deixou muito a desejar.,"Pelo o preço devia ser melhor, vi na maioria dos quartos que as tvs são de tubo,no meu quarto era de plasma mais chiava o tempo todo,imagem horrível.Nunca fui em um hotel com tantos funcionários mal humanados, não se via um sorriso no rosto deles.Fiquei neste hotel mais por causa do toboágua por causa do meu filho, e o toboágua só funciona 1 hora por dia.o Hotel é bem mais bonito nas fotos do que ao vivo.Na lanchonete vc só passa raiva, vc aperta 1 botão para chamar o atendente para pedir um refrigerante, demora uns 20 minutos, vc aperta 10 vezes e nada deles virem.Achei muito desorganizado.Meu filho quebrou um copo no quarto implorei varias vezes para irem limparem ou que me desse uma vassoura e pá que eu mesmo limpava para a gente não se cortar depois de muito tempo a tende foi com a cara mais feia do mundo e ainda deixou caco de vidro pelos os cantos.O hotel fala que tem muita coisa tipo,ofurô ,massagem,Squash mais td isso é pago a parte. No dia 01,01 não sei se o hotel tinha mais gente mais na hora do café foi um caos,lotado não tinha lugar para sentar, as 10 hrs quando acaba o cafe tinha mais de 50 pessoas na fila esperando para tomar cafe,quando o gerente do restaurante mandou retirar td,um absurdo, muitos hospedes reclamando.Não recomendo, a unica coisa boa do hotel é que é enfrente a barraca toa a toa."
jan. de 2018,5,Recomendo,"Ótimo atendimento,excelentes instalações e localização. Área de lazer muito agradável e organizada e com música ao vivo a noite. Ambiente limpo e confortável. Acesso fácil ao centro da cidade e a outras praias."
jan. de 2018,1,Avaliando,"Péssimo!!!!  Na recepção povo mau educado,  Quartos c fedor de mofo, ar condicionado pinga dentro do quarto.  A limpeza dos quartos tbem horríveis as camareiras nem passão pano no chão.  Roupas de cama e toalhas encardidas e com mau cheiro.  banheiros sujo e encardidos.  Café da manhã, bem poucas variedades.  Enfim não indico p/ ninguém."
dez. de 2017,3,Nada de especial,"Estive por 1 semana no Natal 2017 com minha família! Hotel bem localizado, ficamos no apto 413, bem amplo, arejado, frente jardim (localização tranquila), limpeza e troca de toalhas diárias, nada a reclamar.  Quanto ao café da manhã deixa MUITO a desejar. Não há variedade, 1 semana repetindo as mesmas opções, pães e bolos ressecados (qdo questionei disseram que resseca devido à luz do expositor), demora na reposição dos alimentos e utensílios(pratos,talheres), funcionários nada solícitos.  Academia impossível usar, literalmente uma sauna, Não há ventiladores nem ar condicionado e devido ao clima muito quente fica difícil permanecer ali dentro por 10 minutos...  Disponibilizam apenas 1 cartão (chave) para acesso ao apto. Vc acaba ficando o tempo todo procurando quem está com a chave para conseguir entrar no apto ( fazia caminhada pela manhã e qdo retornava precisava ficar andando atrás do meu esposo para pegar chave, isso qdo um estava no banho e o outro tinha que ficar no corredor esperando) visto que saímos de férias e queremos comodidade, nesse quesito não facilitam em nada...  Não me hospedaria novamente.  Uma pena, pois a estrutura é muito boa."
dez. de 2017,4,Hotel muito bom!!!,"Estive hospedado com minha família no início de dezembro/2017, todos gostamos do hotel. Quartos limpos, atendimento muito bom, sempre fomos tratados com educação e alegria por todos funcionários, sem exceção; comida boa e com preço dentro dos padrões da cidade. Retornaríamos com certeza."
dez. de 2017,1,"Apartamento sem ar condicionado e sem telefone. Para cobrar do hóspede o hotel é bom, já para prestar serviço é péssimo.","Nota zero no apartamento. Por falta de ar condicionado e falta de telefone. Demora no atendimento no bar da piscina. Uma funcionária sem educação na recepção. Gerente despreparado. Pois os ar condicionados não prestam e os funcionários fazem o concerto e não resolve nada. O hóspede tem que sair do seu apartamento e ir na recepção pois o telefone dos apartamentos não funcionam. Sem contar dos banhos gelados, muitos funcionários sem educação. Gerente muito sem educação e sem preparo nenhum para lidar com pessoas."
dez. de 2017,4,Bom custo-benefício,"A localização do hotel é muito boa. Em frente ao Complexo Tôa Tôa, próximo a um posto de combustível que tem conveniência e farmácia. As instalações são boas, limpas e os quartos espaçosos com varanda. Um problema para quem vai com crianças é o espaço entre as grades da varanda. Muito grandes, podendo até mesmo passar um adulto entre elas. Senti falta de uma mesinha com cadeiras. Mantive a porta do quarto fechada para evitar acidentes. Outro problema, que julgo ser o mais grave, é o piso da piscina. Extremamente liso. Eu mesma presenciei vários escorregões e tombos, inclusive da minha bebê de 1 ano, no dia da chegada, e ficamos apreensivos o resto da semana. Existe um tapete anti-derrapante somente ao lado da escada que leva ao escorregados - sapo. Café da manhã é bom, tem várias opções de frutas, tapiocas, etc. Quanto ao atendimento, achei todos os funcionários bem ""secos"", tratamento básico, não fazem questão de agradar. O restaurante é bom, tem opção de vários pratos e lanches e pizzas. Música ao vivo todos os dias após às 18 horas, o que agrada bastante quem não vai sair para as festas noturnas. Resumindo, se você quer um hotel básico, bem localizado e com bom custo-benefício, é a escolha ideal."
dez. de 2017,2,Ótimos para cobrar péssimos para prestar o serviço,"Primeiramente n façam reserva c cartão de crédito, logo após a reserva ter sido realizada o cartão foi clonado no checkin não aceitaram apresentação do cartão novo e tivermos que pagar novamente a hospedagem que já estava paga, sob o argumento que de o financeiro n localizou o pagamento, ar condicionado n funcionava, serviço restaurante só p pedir mais de 40 min de espera."
dez. de 2017,4,Bom custo benefício,"Nos hospedamos por 7 dias neste hotel e tivemos uma experiência agradável.    É verdade que as acomodações precisam de algumas melhorias, mas o hotel é bem limpo, o café da manhã é muito gostoso e farto, além das ótimas opções do cardápio do bar da piscina para almoço/ janta ou lanche.    A localização é excelente, pois fica atrás da barraca Toa Toa e os ônibus para o centro passam na porta. Também é muito fácil conseguir dividir taxi na porta para ir ao centro a um preço bem acessível (5 reais por pessoa). Há um mercado a cerca de 1km do hotel e um posto com boa conveniência para comprar água e guloseimas a 200m do hotel.    Deixo nosso elogio aos funcionários Gabriel da recepção, além das Elianes do bar/restaurante. Muito simpáticos e prestativos.    No geral, vale a pena e tem bom custo benefício."
dez. de 2017,5,Ótima opção para família,"Hotel com boa infraestrutura, bom café da manha, excelente atendimento e vista para o mar. Equipado com parquinho e piscina infantil, além de academia e restaurante.  Uma ótima opção para quem viaja em família."
dez. de 2017,5,"LINDO O HOTEL ,MUITO BOM PARA PASSAR UMAS FERIAS","Um dos lugares marcantes que ja fiz , porto seguro foi um lugar top de se passar as ferias ainda mais num Hotel desses ..., bom atendimento, excelentes quartos e um cardápio incrivel, nao tem como nao resistir a um lugar desses... partiu porto seguro? heheh hotel ja sabem né BRISA DA PRAIA"
dez. de 2017,5,maravilhoso,"otimo hotel, localização perfeita.  amei o atendimento, o café muito bom... os quartos arejados e limpos.  vale a pena... otimo custo beneficio... pra quem esta indo a lazer, otima escolha.  o jantar estava delicioso... o atendimento da piscina, otimo tbm."
dez. de 2017,4,Ótimo Hotel,"O hotel é muito bom, com localização privilegiada, em frente ao complexo toa toa. Piscina muito boa, com toboaguas, inclusive com espaço para crianças. Possui uma quadra poliesportiva e área kids. Limpeza dos quartos muito boa, com arrumadeiras passando todo dia. Musica ao vivo à beira da piscina todos os dia, a partir das 18:00, muito bom. Funcionários bem atenciosos. Os pontos negativos ficam por conta da agua da piscina ser meio salobra, provavelmente por ser oriunda de poço artesiano; pra quem decida almoçar, jantar ou comer um petisco, os preços do restaurante são um pouco alto; e um pequeno defeito no ar condicionado do quarto, que após algumas horas de funcionamento apresentava um barulho muito alto, o que pode ser facilmente consertado. O charme do hotel fica por conta de um gato persa, super dócil e lindo, que fica desfilando pelo hall. Enfim, super recomendo."
dez. de 2017,5,Férias,"Um dos melhores hotéis que já me hospedei em Porto.Quarto mt confortável!  Atendimento excelente de todos os funcionários. E comida deliciosa!  Estão de parabéns! Sem falar na localização que está próximo ao centro (de carro) e das praias,tudo de bom! ..."
dez. de 2017,3,Bom,"Hotel com boa estrutura porém o atendimento deixou a desejar. Eu e meu marido estivemos hospedados no brisa, foi uma boa experiência no geral, mas passamos por um acontecimento desagradável. Não pedimos a limpeza do quarto, pois o hotel deixa bem claro que não se responsabiliza por objetos 'perdidos', então no primeiro dia vimos que nosso quarto havia sido limpo, no segundo dia esquecemos de deixar o cartão (chave) na porta e entraram no nosso quarto com a gnt dentro, mas tudo bem a culpa foi nossa pois não colocamos o cartão p trancar a porta, mas após isso interfonamos para a recepção apenas para registrar que não queríamos a limpeza no nosso quarto e para a nossa surpresa, 5 minutos depois a camareira retornou para nos dizer que a culpa foi nossa, e que ela tinha levado uma bronca por nossa culpa. Eu nunca vi isso na minha vida, eu e meu marido levamos na brincadeira dizendo q pagamos p levar bronca, mas foi bem desagradável da parte do hotel permitir isso."
dez. de 2017,1,Péssimo atendimento,"Fiquei hospedada no hotel brisa da praia e assim que entramos no quarto sentimos cheiro forte de mofo no quarto. Mas deixamos isso de lado e tentamos aproveitar a estadia. No hotel, tem a copa baby, onde tem um microondas e utensílios para lavar mamadeira, etc. fui lá para esquentar a comidinha da minha bebe e pedi um pratinho, para esquentar melhor. A moça foi arranjar o prato pra mim, mas logo depois disse que não seria possível. Falei com o recepcionista e ele disse que lá na copa baby só se podia esquentar leite. Nada de comida. Questionei dizendo que minha bebe já come, e que precisaria esquentar a comida dela. Porém, ele não cedeu, aí então falei com o gerente, que na hora achou um absurdo e quando estava quase nos liberando, saiu dizendo que precisaria ver com a outra gerente. Logo depois, voltou dizendo que só se pode esquentar a comida que já é do hotel. Qualquer comida de fora, não pode. Achei um absurdo! Íamos almoçar no hotel eu e meu marido, mas depois dessa má vontade, fomos almoçar em outro local! Hotel até bonzinho se você ignora o cheiro de mofo no quarto, mas mal atendimento não tem como aguentar! Brisa da praia hotel nunca mais!"
dez. de 2017,5,Excelente Hotel,"Hotel a beira mar, facil localizaçao e locomoçao para as praias. Em frente a um dos mais badalados locais de Porto Seguro (Tô à Toa). Pessoal de atendimento super atenciosos, estacionamento, comida excelente, lazer e acomodacoes tudo limpinho....  Sempre escolho como opçao em Porto Seguro..."
dez. de 2017,1,Passeio,"Não gostei!!!pois o quarto tinha mal cheiro o banheiro enchia de água, os pés da gente ficava todo cobrido de água. Reclamei para o gerente o qual eu achei muito mal educado e ele não resolveu nada.  Muito barulhento não dava para dormir...  Enfim não gostei."
dez. de 2017,4,Otimo custo benefício,"Hotel antigo, como já sabia. Porém muito limpo, staffs atenciosos, praia Boa, café da manhã delicioso.    Hotel para quem não quer gastar muito e ter atendimento normal.    Acho que vale a pena! Gostei muito."
nov. de 2017,5,Ferias maravilhosas.,"Tudo maravilhoso. Desde a infraestrutura, funcionários, cito exemplos como as camareiras atenciosas, a recepção cordial , os garçons dedicados em atender da melhor maneira as delicias de seu restaurante, o gerente comercial Daniel Costa , pessoa incrível e extremamente profissional dedicado, e atento as melhorias do Hotel.  Só recomendo!! os passeios são imperdíveis, como a praia Coroa Vermelhas, Trancoso, o lindíssimo Arraial Dajuda, entre outros...curtam qdo forem!!  Muito obrigada. Muita energia boa pra todos Nós. Ate breve...."
nov. de 2017,5,ÓTIMO ...,"Ficamos hospedados entre os dias 19/11/17 a 24/11/17 ...    Hotel muito bem cuidado, atendimento satisfatório, quarto amplo, cama confortável, ducha com boa saída de água e aquecimento, apto com uma pequena área privativa, ótimo armário para guardar as roupas, área de lazer ótima (piscina, quadra de futebol, sauna, sinuca, outros), cardápio para consumo extra com inúmeras opções e preços justos, possibilitando parcelamento no check-out. Tem uma piscina infantil muito boa para as crianças se divertirem.    Café da manhã bem variado, com frutas frescas, sucos, bolos, pães, doces, ademais, e que atendeu perfeitamente nossas necessidades.    Música ao vivo todos os finais da tarde/noite para alegrar o ambiente e propiciar um relaxamento agradável na área social.    De frente para o Toa/Toa e cerca de uns 800 metros do AxeMoi .. Dá para fazer tudo caminhando curtindo cada momento do passeio.    Solicitamos o serviço de lavanderia e fomos muito bem atendidos pela coordenadora, que nos apoiou com muita educação, presteza e agilidade.    Não utilizei wifi e não sei como é a qualidade/velocidade da conexão.    Negativo: O split do apartamento 143 não refrigera totalmente a área do quarto e a torneira do banheiro ficava pingando sem parar, mesmo forçando o torque.    Definitivamente isso não desqualifica minha pontuação, pois, também não fizemos o pedido para manutenção e com certeza voltaria novamente a me hospedar no hotel numa próxima viagem a Porto Seguro/BA."
nov. de 2017,5,Viajem incrível e pra fechar hotel maravilhoso...,"Viajamos em 14 pessoas e todos nós adoramos este hotel. Tudo maravilhoso... ótimo atendimento, excelentes acomodações, comida muito gostosa, boa localização... pretendemos voltar. Já estamos com saudades."
nov. de 2017,5,Passeio em Porto Seguro,"Passeando com as amigas em Porto Seguro, escolhemos esse hotel para nos hospedar, pela facilidade de ir a praia e pela estrutura que tem.  Piscina para criança e adulto e pessoa para recreação.  Hotel na frente da barraca de praia TOA A TOA, o que facilita muito o deslicamento, e 10 minutos da passarela do alcool."
nov. de 2017,5,Excelente para a família!,"Hotel perfeito para vir com família e crianças! Piscina infantil, brinquedos, animadora e área de lazer! Os quartos são espaçosos! O bar da piscina oferece atendimento até a noite e música ao vivo. Gostoso de ficar a noite! Para adultos há spa, ofurô, sauna, academia e quadra. A localização é versátil: perto das barracas Toa Toa e Axe Moi, não é muito longe nem do centro e nem da Praia da Coroa Vermelha. Recomendo!"
nov. de 2017,2,Muito decepcionados.,"Vamos lá, para dar início a está avaliação, agradeço ao Sr. Cosme, ele é o responsável pela manutenção que todos os dias ia fazer o ar condicionado do quarto funcionar no tranco. Especialmente gentil conosco. Tivemos que mudar de quarto 3 vezes, o primeiro cheirava esgoto, o segundo o ar condicionado não funcionava direito, parava na madrugada quente. O terceiro cheirava mofo, com muita infiltração na parede e problemas no telefone. Sem contar o frigobar que descongelou sozinho e tinha água por todo chão. Gabriel, Rafael e Carlos da recepção, muito obrigada pela educação e atenção. Já o Bruno, gerente da recepção...não foi nada solícito quando reclamamos do quarto, mau nos olhou e pediu pra procurá-lo no dia seguinte (passar a noite sem ar condicionado né). Mas graças aos meninos da manutenção que intercederam por nós, a troca foi feita. Porém só dá pra elogiar a limpeza do quarto, que disfarça o cheiro de mofo. A localização é Boa, mas as acomodações deixam muito a desejar. O pior hotel que já na hospedamos, lamentavelmente."
nov. de 2017,3,Localização Deficitária. Em frente a praia ruim para banho,"Bem, a nossa experiência não foi da melhores no Brisa. Ao fazermos o check in, nos colocaram em um quarto no qual a janela da sacada dava direto em uma parede. Pasmem! Solicitamos uma mudança de quarto com toda educação. Fomos transferidos para um quarto razoável (pior e menor que o anterior), o qual tinha uma porta de acesso para o quarto vizinho. Não se podia nem respirar com profundidade que os vizinhos de quarto ouvia. Imaginem outro barulhos de um casal!! No quarto tinha agua razoavelmente morna dificilmente quente. Nosso voo era as 18:30h pedimos uma dilatação da estadia a qual foi negada. Tudo bem. Queriam nos cobrar 180,00 reais por um período de 4 horas. Tivemos que deixar o quarto. O responsável que nos atendeu para negar o pedido, que atende pelo nome de Gustavo, se não me engano, tinha em seu rosto um expressão nada amigável e com uma facilidade incrível para dizer um não. Paciência ele deve estar de saco cheio com aquela correria toda. Entendo. Não se enganem com a localização - próximo ao infernal To a Toa, o qual recebe milhares de ônibus de turismo e a praia em frente ao hotel não possui estrutura nenhuma, ou seja, se quiser pegar uma praia tem que se deslocar para outra localização."
nov. de 2017,4,É a segunda vez que me hospedei nesse hotel.,"Desta vez o quarto deixou muito a desejar, porque já me hospedei outra vez e o quarto era bem melhor.Fora o cheiro de esgoto que vinha da sacada, portanto a minha sacada ficou os 7 dias fechada e também como dava pro hall do hotel quem passava via meu quarto.Fiquei muito desapontada com isso.Agora o cafe da manhã, não tenho do que reclamar, muito bom.Também em relação há recreação, deixou bastante à desejar, porque ano passado cada dia era uma coisa diferente e dessa vezfoi sempre a mesma coisa, música ao vivo e com um rapaz bem desanimado, tudo bem que ele foi o ano passado também, mas foi só um dia, agora dessa vez foi todos os dias ele."
nov. de 2017,5,Conhecendo Porto Seguro,"Hotel com quarto amplo, restaurante próprio, comida boa, todas as noites com música ao vivo, café da manhã excelente, fica em frente ao Toa Toa. Funcionários cordiais, bom atendimento, silencioso. Recomendo o hotel!"
nov. de 2017,4,Gostei muito,"Ótima localização, acomodações excelentes, boa área de lazer, ótimo atendimento, boa comida com preço razoável, serviço de massagens excelente. Só o wifi deixa um pouco a desejar, mas no geral gostei muito mesmo."
nov. de 2017,5,Ótima estrutura e localização,"Excelente area de lazer, ótimo atendimento, café da manha variado, ótima comida e com preço bom, quartos aconchegantes, e ainda tem os serviços extra de massagem e ofurô!  Só a academia que tem poucos aparelhos, mas usamos pouco tbm.  Adoramos!"
nov. de 2017,1,Não recomendo,"Não recomendo  Toalhas e roupas de camas velhas e encardidas . Quartos velhos , colchões mole e com buraco . Agua do chuveiro não esquentou alguns dias.  Box do banheiro baixo , precisa se abaixar para entrar no chuveiro  Ar condicionado não responde aos comandos .  A televisão é fixa na parede , quem dorme na cama secundária não consegue assistir .  Só fornecem um cartão da porta independente de quantidade de hóspedes no quarto esse mesmo cartão é usado para consumo , então se você estiver em duas pessoas e uma ficar no quarto usando energia a outra não consegue consumir no hotel.  Café da manhã não possui talheres suficientes para todos os hóspedes . Tapioca é limitada a 2 por pessoa ( e nunca tinha ninguém para atender ) .  Atendimento dos funcionários da piscina bom , mas o pedido demora muitooo . Em um jantar levamos mais de uma hora para pedir , e mais uma hora e meia para o prato chegar .  Carta de vinhos improvisado , sem descrição . Cobram rolha e o atendente teve dificuldades para abrir a garrafa.  Também cobram para uso do frigobar.  Cofre não possuía fechadura .  Internet horrível , dificilmente consegue conectar e quando consegue ela logo cai .  Pizza horrível , pedi frango com catupiry e veio frango com queijo mozarela em fatias por cima.  Hotel tomado por excursão CVC. E também recebe voos cancelados ( mesmo não tendo estrutura ).  Não recomendo , achei que havia feito um bom negócio pela descrição do hotel , mas a mesma não corresponde ."
nov. de 2017,5,agradecιмenтo,"goѕтarιa de agradecer o вoм aтendιмenтo qυe oвтιve na cнegada do нoтel pelo colaвorador вrυno da recepção, o carιnнo eѕpecιal e aтenção da garçoneтe aleѕѕandra e o garçoм paυlo poιѕ aмвoѕ ғoraм мυιтo ѕolcιтoѕ."
nov. de 2017,5,Excelente,"O lugar é incrível, próximo da cidade, uma estrutura muito boa, os quartos muito aconchegante, excelente café da manhã, os empregados sempre bem humorados e prestes a te servir. o preço foi muito bom. Simplesmente adorei."
nov. de 2017,4,Hotel Brisa da Praia,"Reservamos 3 quartos duplos com varanda. No primeiro momento nos colocaram no 1 andar, com uma varanda virada para um muro pintado de verde, com cerca elétrica e escrito Perigo. ""Pirei"" , reclamei na hora, e o gerente atencioso nos colocou no 2 andar, sendo que o terceiro quarto, só no dia seguinte. Cafe da manha muito bom, tem tapioca, musica ao vivo na piscina todos os dias. Boa estrutura. As toalhas merecem e precisam ser renovadas. ficamos 8 dias. Equipe atenciosa. Local em frente a barraca To a Toa."
nov. de 2017,5,Aconchegante,"Lugar incrível, bem enfrente ao mar, somente atravessar uma avenida, café da manhã ótimo, perfeito para viagens em família, amigos e casais, crianças ficam encantadas com os clientes fixos chumbinho, frajola..."
nov. de 2017,3,Razoável se tiver tempo pesquise mais!!,"Hotel possui uma boa infra-estrutura, externa como piscinas e área de Lazer.O café da manhã é muito bom, quartos sempre são limpos, internet é péssima, praticamente não funciona, a tv do meu quarto não estava em boa condições, a comida é caríssima somente a la carte, cobram pelo uso do frigobar, só disponibilizam um cartão-chave independente da quantidade de hospedes no quarto. O atendimento no bar é meio discriminatório, algumas vezes desisti de ser atendida.Hotel tem uma boa localização porém por ficar frente a BR na avenida Beira Mar e muito complicado atravessar para ir a praia pois não oferece faixa de pedestre como demais hotéis na mesma avenida."
nov. de 2017,1,"Não recomendo, propaganda enganosa. Leia a descrição!!!","Primeiro. Vende serviços de café da manhã incluso nos pacotes dos sites. Falso! Valor cobrado por hóspede R$25,00 . Entrega apenas uma chave da porta, independente do número de hóspedes no quarto. 10% obrigatório de serviço de garçons. R$20,00 pelo uso do frigobar do quarto, se deixar produtos que vc compra fora do hotel, obrigando assim o consumo do hotel. Sendo que na venda do site é incluso no valor da diária. Ou seja, se paga ruas vezes para o uso do frigobar do hotel. Se solicitar limpeza do quarto. Cobra se uma taxa, pela limpeza. Sem contar que solicitei parcelamento, que foi autorizado pelo hotel, conforme email do vendedor, mas tive que pagar no débito, se quisesse me hospedar. Como não podia ficar na rua com uma pessoa com necessidades especiais, paguei!!! Absurdo, abusivo, propaganda enganosa. Só me restou tomar providências. Me senti lesado! Cuidado!!!  Tenho tudo que assinei no hotel, e email do vendedor, sobre informações relatadas aqui."
