Data da opinião,Nota,Título,Conteúdo
mai. de 2017,3,Meio antigo,"O atrativo deste hotel é o saguão, com gostoso café e ambiente familiar. Há também com bom café da manhã e um restaurante com boas opções.  No entanto o quarto tem decoração já meio antiquada e o banheiro pequeno deixa mesmo a desejar...A varando do quarto é só para constar, muito pequena."
mai. de 2017,2,Hotel Golden Tulip Jardins,"O hotel não fica muito bem localizado, se comparado a outros que fiquei na mesma região (não tem muitas opções que gosto por perto) . O Check in foi tranquilo e realizado por um profissional competente. O quarto é espaçoso e possui uma varandinha, porém o mesmo tinha aspecto de velho, devido ao estado do piso e das paredes (bem sujas). Acredito que na descrição do quarto na internet constava que o mesmo possuía um sofá, mas o meu não tinha. Assim como, a descrição da cama como de casal, no entanto, a minha eram duas de solteiros juntas. O local do banho é perigoso e quase me acidentei, é uma banheira com piso liso, escorregadio e com declive. A torneira da pia estava com vazamento. O café da manhã foi uma das piores experiências que tive em hotéis.. Muito confuso, a reposição das opções era lenta e falha - faltava constantemente vários itens, como talhares, pratos, queijo, entre outros. Café estava frio. O Sr Airton é um profissional muito mal educado, faltando com respeito comigo e com meus colegas. Ríspido e grosseiro em suas respostas e atitudes, deixou-nos falando sozinho por diversas vezes, não conseguindo nem manter o olhar durante um simples diálogo e não nos entregou a omelete solicitada. Fiz questão de deixar registrado aqui tal fato, pois pessoas assim, infelizmente não deveriam lidar com o atendimento ao público. Por esse ocorrido, não volto mais a me hospedar nesse hotel."
mai. de 2017,4,Muito bom!,"Ótimo hotel, excelente atendimento dos funcionários. Ótima localização e estrutura, quartos grandes e espaçosos. Não pude contar com a academia pois estava em reforma, o que não foi avisado no momento da reserva, gerando insatisfação pois foi um dos quesitos do hotel para que eu o reservasse. Outro ponto negativo é que todas as tomadas do quarto são de dois pinos e não possuem na recepção adaptadores desse tipo. Tive que comprar para usar o computador no quarto. Mas, tirando estes pontos indico o hotel."
mai. de 2017,4,Boa opção no Jardins,"O quarto é confortável. A localização é boa para quem quer tranquilidade. Da para ir a pé para o Ibirapuera e para a Av Paulista. Minha reclamação fica para o check-in, pois o hotel não tinha quarto disponível as 14hs e tivemos que esperar 30 minutos."
mai. de 2017,4,Muito bom!,"Hotel muito bom, bem localizado, atendimento atencioso. Tivemos problema, somente em um dos dias, com o café da manhã, devido a um evento que acontecia no hotel. Esqueceram do café dos hóspedes! Falta de planejamento. Uma pena!"
mai. de 2017,3,Normal,"Essa foi a segunda vez que me hospedei nesse hotel e ja havia solicitado que me disponibilizassem um quarto nos andares superiores para que não houvesse tanto barulho. Fiquei no 19 andar como pedido. Entretanto, todo dia cedo ( nem bem 8h )o servico de limpeza de quartos ja se iniciava nos quartos ao lado com muito barulho ( arrastar de moveis, coisas caindo , conversas ). Ou seja, sai com meu noivo fugindo do stress do dia a dia e querendo sair da rotina de acordar cedo, mas não consegui. Quanto ao café da manha, senti que o numero de variedades diminuiu . Quanto à qualidade dos quartos , higiene e localização não tenho o que reclamar."
mai. de 2017,1,Prostituicao local,"O hotel é de primeira inpressao com um hall bonito porém os quartos são sujos , debaixo da cama imundo, e a noite toda tem gente tendo relações sexuais em vários quartos! Funcionários perdidos, enfim troquei de hotel ! Pedimos cobertor umas 3 vezes o serviço de quarto não funciona! Péssimo hotel! Vá para o Mercure pinheiros mesmos preços!"
abr. de 2017,1,FUJA desse hotel! Péssimo!,"Quarto 802:  Pia entupida; descarga não funciona; cama terrível, a lombar vai afundando e provoca muita dor; travesseiros catastróficos, formando bolas e afundando a cabeça ao centro; um único cobertor, liguei 3 vezes para pedir outro e estou até agora esperando; quase morri de frio durante a noite, acordei doente. O hotel se assemelha a um MOTEL, casais transando gritando e batendo na parede madrugada a fora. Limpeza caótica, tudo muito sujo e encardido. Café da manhã básico. NUNCA MAIS. NAO VÁ!"
abr. de 2017,5,Recomendo,"Hotel com excelente atendimento. Todos os funcionários são extremamente atenciosos.  Bem localizado, fácil acesso e com ótimo restaurante.  O funcionário Nelson dá dicas inclusive de vinhos.  Recomendo. Pretendo voltar."
abr. de 2017,4,Bem bom,"Hotel bem esperto, bem localizado e perto de tudo. Quarto perfeito e amplo. Café da manhã muito gostoso, o restaurante é bem aconchegante. Atendimento bem cordial. Tudo bem novo, limpo e bem decorado. Vale o custo beneficio!"
abr. de 2017,5,Bom custo beneficio,"perto de tudo, café da manha muito bom, quartos ok. atendimento de primeira do pessoal da recepção. sala de convenções muito boa tambem. barzinho no lobby super bem atendido e com boa variedade de cervejas."
abr. de 2017,3,"Hotel confortável, bom café da manhã, porém muito barulho vindo dos outros quartos.","Achei o quarto confortável, boas camas e travesseiros, reclamação apenas sobre o cobertor, que não era antialérgico.    Sobre o café da manhã, é bastante farto e variado, pães e bolos muito gostosos, muitas frutas. Crítica apenas ao suco de laranja, que parecia artificial.    O maior defeito é o barulho. Não há qualquer isolamento de som nos quartos; o barulho vindo dos outros quartos incomodou muito durante a noite, tanto do apartamento de cima quanto dos do mesmo andar."
abr. de 2017,5,Excelente localização e café da manhã,"Quarto amplo e bastante aconchegante, excelente café da manhã e bastante variado, excelente atendimento e localização perfeita, perto da famosa Rua Oscar Freire onde se encontram as melhores lojas de griffe e excelente restaurantes."
abr. de 2017,4,Ótima opção nos Jardins.,"Quartos com tamanho bom, colchão e roupa de cama ótimos. Cafe da manhã muito bom, variado. Bem localizado. Gostei muito de tudo. Voltarei com certeza. Sem contar que foi um dos poucos lugares com opção de quarto triplo."
abr. de 2017,4,Correto,"Quartos perfeitos, atendimento idem, café da manhã dentro do esperado é ótima localização no coração do jardins!! A partir dele é possível em 5,6 quadras, ter acesso a avenida paulista, Oscar freire e diversos restaurantes de qualidade."
abr. de 2017,5,"Golden Tulip Jardins, excelente com atendimento impecável.","Excelente hotel, tranquilo, limpo, mudança diária de roupa de cama e banho, elevadores confortáveis e funcionais, serviço de alimentação bom, funcionários simpáticos e eficientes, muito bem localizado na aérea nobre de São Paulo. Só deixou a desejar o wi fi free. funciona mal."
abr. de 2017,5,Tudo de bom,"Depois de uma feira cansativa no Anhembi e um transito caótico nada melhor que a maravilhosa Z. Sul, descendo a Av. Paulista bem localizado e com um ótimo e pratico atendimento acomodações para se sentir em casa."
abr. de 2017,4,Muito bom.,"Os cómodos são bons, quartos espaçosos. O restaurante é bom, o café da manhã excelente, cardapio variado, mas o atendimento é lento tanto no hotel quanto no restaurante. O atendimento pode melhorar muito."
abr. de 2017,5,Hotel perto de tudo,"Esse hotel é maravilhoso! Fica no bairro jardins. Perto da Avenida Paulista. E do lado dele tem restaurantes maravilhosos, inclusive farmácia! Todas as minhas refeições foram feitas nesses restaurantes! Táxi tem sempre na porta! O quarto é o melhor, super confortável e seguro pra nós mulheres que as vezes precisamos viajar sozinhas! O banheiro possui uma banheira maravilhosa, não hesitei em usá-la, super limpinha! O café da manhã é ótimo! Com certeza irei me hospedar novamente nesse hotel!"
abr. de 2017,5,Excelente Hotel,"Hotel com excelente atendimento, quartos grandes pelo estilo de hotel, recepção com profissionais muito atenciosos. Café da manhã excelente . O estacionamento ao lado e conjugado com o hotel facilita bastante."
mar. de 2017,2,Decepcionada,"Fiquei bastante decepcionada com o serviço deste hotel que julgo não seguir a linha de atendimento dos demais hotéis da rede. Fiz uma reserva para dois dias, exclusivamente para poder descansar durante 3 horas antes de uma reunião, e enviei e-mail avisando que chegaria apenas pela manhã. Qual foi minha surpresa quando fui informada que meu quarto havia sido disponibilizado para um tripulante cujo vôo havia sido cancelado. Fui acomodada com meu marido em um quarto triplo e tivemos que mudar depois. Fiquei muito decepcionada com o descaso com o cliente."
mar. de 2017,4,"Bom, merece aperfeiçoamento","Hotel bom, limpo, acessível. Porém necessita melhorar conforto das camas e travesseiros. Banheiro com bolor e vazamento. Café manhã bom, mas hoje 21.03.17 estava muito confuso, chegou um grupo grande da TAP e ficou caótico. Recomendo. Se puderem ficar no da Alameda Santos fica ao lado do metro. Nesse aqui tem que andar ladeira acima 8 quadras."
mar. de 2017,5,Excelente hotel,"Ótima localização.  Fomos sempre bem atendidos pelos recepcionistas e demais funcionários da recepção. Elevadores sempre disponíveis e rápidos. Todos os ambientes de uso comum bem iluminados e limpos.  Quarto espaçoso, limpo e cheiroso, com móveis úteis. Ar-condicionado, televisão, frigobar e cofre disponíveis e funcionando. Banheiro muito bom, conta com secador e banheira. Roupas de cama e de banho limpas e de qualidade.  Ótimo local para o café, que é bem servido: além das opções da mesa do buffet, ainda era possível pedir mais alguns pratos preparados na hora.  WI-FI grátis em todos os ambientes.  Pedi um later checkout e me permitiram mais 3 horas para a saída."
mar. de 2017,3,Norma... academia precisando de reformas!,"Localização ótima! Porém academia do hotel muito ruim... sem ar condicionado, esteira quebradas, equipamentos velhos e sem funcionamento, muitooo diferente das fotos mencionadas no site. Quando cheguei no hotel, havia um sabonete usado na banheira.. café da manhã bom, fazem tapioca e omelete na hora. Ótima localização!"
mar. de 2017,3,RECEPCIONISTAS MAU TREINADOS,"O Hotel é muito bem localizado, inclusive foi determinante para essa reserva, os quartos são grandes, mas mobiliário antigo, necessitando de uma reforma. o Cafe da Manha é razoável, porem na chegada o atendimento dos recepcionistas, homens, um por nome de Vicente, foi péssimo, extremamente, mau humorado e ainda cobrou a reserva que já estava paga, no cartão, uma cliente havia reservado por um aplicativo e não havia pago antes, o sobrenome era ""parecido"" e ele cobrou da nossa companheira de quarto.outro erro foi a cobrança de hospede adicional no quarto, quando a reserva havia sido realizada apto duplo, ele ainda foi grosso e mau humorado comigo e com uma amiga que estava em outro apartamento, estávamos em um grupo em 06 apartamentos e solicitamos que 01 apto ficasse disponível ate as 17:00h, para guardarmos as bagagens, só foi permitido com a cobrança de 1/2 diária, mesmo com os erros deles, não fizeram menos questão de nos oferecer como cortesia para remediar um pouco. Enfim, a experiencia nao foi boa, pessoal da recepção muito enrolados e mau humorados, pensarei 2x antes de reservar novamente."
mar. de 2017,5,Praticidade e conforto,Hotel confortável e bem localizado. Quarto espaçoso e agradável. Armário com espaço para colocar malas e pendurar roupas. Ótimo buffet de café da manhã. Boa opção para se acomodar por poucos dias. Recomendo!!!!
fev. de 2017,4,Boa localizacao,"O hotel é muito bem localizado, tem uma equipe Cortez, possui um bom café da manhã. Os quartos são amplos e não são barulhentos. Pontos a melhorar - academia está sempre com uma esteira em manutenção, o ar dos quartos não são potentes, já fiquei em diversos quartos e sempre parecem não funcionar muito bem. Localização ideal, para passear ou trabalhar, bons restaurantes nas imediações."
fev. de 2017,3,Reserva,"Hotel bem localizado, excelente café da manhã, ótimo atendimento. Tudo muito bom  até a reserva do quarto que era com cama de casal e não tinha disponivel.  A reserva foi feito com cama de casal, foi confirmada e na hora não tinha.  Um alerta, existe a possibilidade de escorregar ao entrar no box devido ao desível no fundo da banheira."
fev. de 2017,5,"Excelente localização, acomodação é delicioso café da manhã","A localização deste eh excelente, fica perto de ótimos restaurantes e da Oscar Freire.  As acomodações são ótimas, o quarto é limpo, confortável, móveis novos, quarto arejado e bem  Iluminado. Ficamos no 19° andar.  O café da manhã é delicioso! Várias opções de frutas, pães, omeletes, e Cafe. Tem opções para quem tem alergia a lactose e glúten."
fev. de 2017,3,normal,Boa localização. Bom atendimento. O quarto que inicialmente me disponibilizaram eram duas camas de solteiro e o ar condicionado não estava funcionando adequadamente. Pedi para me transferirem para um quarto com cama de casal (indisponível) mas me transferiram para um cujo ar condicionado funcionava. As condições do segundo quarto estavam melhores que o primeiro - sofácom melhor aspecto e pouco mais espaçoso.  Internet wi-fi paga nos quartos (???). Hoje em dia ainda se cobra pela internet?
jan. de 2017,5,Atendimento nota 10!,O atendimento do Golden Tulip da Alameda Lorena é nota 10 pela educação e por seus profissionais buscarem fazer o hospede se sentir em casa. Café da manhã excelente. Quartos espaçosos e limpos. Cama macia. Ótima localização. Ótimo custo benefício para a região.
jan. de 2017,5,Ótimo,"Ótimo , não tenho o que reclamar. Ótima localização, ótimo quarto, recepção totalmente compromissada, ótimo café da manhã, vários elevadores para melhor atender, ótima comida, ótima localização, pertinho da avenida paulista, excelente."
jan. de 2017,4,Bom custo beneficio,"Gosto do hotel pelo excelente custo benefício. Um dos melhores na região do jardins. Não é aquele hotel incrível, nem muito novo, mas os quartos estão conservados, serviço é bom. Bem coerente com a categoria do hotel. Achei que o café da manhã deixa um pouco a desejar."
jan. de 2017,3,A foto não diz a realidade,"O hotel está velho, parece decadente, o quarto também é antigo, o hotel no geral precisa de uma boa reforma, tem hotéis no mesmo valor de melhor qualidade e mais novo, a localização é boa para quem vai trabalhar na região do jardins ou paulista."
jan. de 2017,5,Boa Localização,"Ponto forte é a Localização, fica muito bem situado, próximo a Restaurantes e centros empresariais. O Restaurante é bom, o café da manha muito bom! Bem silencioso. Possui uma internet rápida, um ambiente limpo e agradável."
jan. de 2017,5,Muito bom para não dizer ótimo,"Estive no Golden Tulip situado na Alameda Santos, 85. Fui muito bem atendida na recepção pela Srta. Beatriz. Porém assim que cheguei não fui ajudada por nenhum carregador. Quem me ajudou com as malas foram os manobristas dos carros. Muito desagradável. O hotel é muito bonito, café da manhã muito bom. Quarto grande contendo uma mini sala, escritório é uma cozinha. O frigobar... Achei pobre. Colchões altos, roupa de cama limpissima. Não gostei dos mimos oferecidos. Achei sujeira na banheira por falta de limpeza mesmo, falta um pouco de sabão em pó e água sanitária. Toalhas limpas e brancas. Segurança muito boa. Resumindo o hotel se encontra numa ótima localização, atrás da casa das rosas um lugar muito gostoso de caminhar e ao atravessar a Av. Paulista você vai direto ao Shopping Pat Paulista que é Demais. Se você vem do interior, de outros estados e países, uma boa é ir visitar os shopping dos chineses e fazer umas comprinhas baratinhas. Resumindo o Hotel é um 4 estrelas e merece respeito, vou me hospedar nele novamente."
jan. de 2017,4,Boa localização,"Hotel é bom, mas não foge muito de um hotel padrão, tipo IBIS!  O atendimento é excelente e a localização é impecável, no coração da gastronomia!  Oferece pouco a mais que os hotéis econômicos, mas a localização faz toda a diferença!"
jan. de 2017,3,Bem localizado!,"Hotel com boa localização, bom atendimento na recepção e quarto, porém os quartos necessitam de reforma, ar-condicionado não resfria.  Café da manhã tumultuado com espera de mesas, muito barulho e mau atendimento."
dez. de 2016,3,Informações erradas!,"O hotel é bem localizado, o café da manhã é bom e o quarto espaçoso. O único problema é o estacionamento. Por telefone fomos informados pelo hotel que havia a cobrança de uma tarifa de R$15 para hóspedes do hotel. Mas na hora da saída o estacionamento cobrou uma diária de R$35 alegando não ter nenhum tipo de relação com o hotel (apesar do estacionamento ser no subsolo do hotel)."
dez. de 2016,3,Esperava mais,"Hotel bem localizado, mas durante minha estadia com reformas na rua que segundo pessoas na região se prolonga há tempos. O quarto é bom, o serviço também. Entretanto, fiz minha reserva pelo Booking.com e escolhi porque tinha estacionamento incluso na diária, o que não era verdade. Todos os dias quando ia retirar o carro, tinha que ficar dando explicações para não pagar a mais e com funcionários desconfiados. Fora isso, café da manhã bom e serviço adequado."
dez. de 2016,5,Atendimento nota 10!,"Muito bom hotel, tanto para viagens a negócio ou mesmo a lazer lazer, por exemplo para uma família que deseja passar um final de semana em sampa.  Ótimos quartos, bom café da manhã, excelente localização.  Além de um excelente atendimento, na recepção tem um atendente Sr Alexandre, uma verdadeiro exemplo de atenção e simpatia, além de sua hospitalidade e sorrido fácil. E quando fores solicitar o serviço de quarto (lanches, jantar, etc), será sempre muito atendido pelo meu xara, o Sr Alex."
dez. de 2016,4,"muito bom, bem localizado","hotel muito bom, quarto limpo e amplo, muito bem localizado, perto da av paulista.  staff muito bem preparado e solicito, cafe da manha sem grandes extravagancias mas bem servido.  ponto de taxi na porta do hotel, facilitando o transporte."
dez. de 2016,4,Muito bom,"Hotel muito bem localizado, próximo de vários restaurantes e pontos de interesse. Quartos amplos e limpos. Bom café da manhã. Funcionários atenciosos. Só tenho uma reclamação, achei o valor dos itens do frigobar alto, paguei R$ 6,50 em uma garrafinha de água mineral.  De todo modo, voltaria e indico com certeza."
dez. de 2016,4,Bom custo benefício. Péssimo Room Service,"Hotel com instalações antigas mas bem preservado. Quarto amplo com varanda, limpo e confortável. Café da manhã variado. Ponto fraco: café e leite só na máquina. Bem localizado. Possui piscina e academia. Péssimo room service. Solicitei um omelete bem cozido (27,50). Depois de 40 min recebi um ovo CRU por dentro e queimado por fora. E veio frio!! Não comi, reclamei e fui cobrada mesmo assim... horrivel"
dez. de 2016,4,Trabalho,"Ótima localização, boas acomodações e staff atencioso.  Wifi de boa qualidade.  Café da manhã com boas variedades.  Ótimos restaurantes próximos sendo possível ir a pé.  Academia atende as expectativas.  Preço muito bom para o que oferece."
dez. de 2016,4,Localização excelente.,"Ótima localização. Utilizei o hotel para ir ao evento do UFC no Ginásio do Ibirapuera. Dá pra ir a pé. Os quartos são amplos e a internet é boa. O estacionamento é excelente e com manobrista. O ponto fraco do hotel é o bar. Fecha cedo e não se pode pedir bebida alcoólica após as 22,30 hs, nem no serviço de quarto. Isso é lamentável. O café da manhã é excelente."
nov. de 2016,5,Hotel perfeito.,"Fiquei nesse hotel e tive uma experiência maravilhosa. Fui a lazer para conhecer um pouco mais de São Paulo. Foi muito rápido o atendimento de recepção tanto na entrada quanto na saída. Quarto super confortável, limpo, amplo e silencioso. Café da manhã muito bom, alimentos frescos e de primeira. Reparei que o hotel é super perfumado, lá do passeio da para sentir o aroma que vem de dentro. Funcionários éticos e super educados. Amei tudoooooo. Indico com muita certeza, e sou exigente com escolha de hotéis."
nov. de 2016,5,Excelente experiência!,"Lugar gostoso, confortável, aconchegante! Os quartos estavam limpos e arrumados. No frigobar tinha várias coisas gostosas (apesar de os preços serem um pouco salgadinhos). Ficamos em um quarto com três camas de solteiro, bem espaçoso."
nov. de 2016,3,Atende ao solicitado,"Apartamentos muito simples, com limpeza razoável, uma vez que foram encontrados tufos de cabelo no quarto em que estive hospedado. Camas com colchoes antigos. Restaurante com atendimento razoável. Quase na totalidade dos hospedes são funcionários de companhias aéreas."
nov. de 2016,4,Convivência e conforto,"Boa opção, quarto amplo, bem iluminado, com bom espaço de trabalho. O hotel também tem ótima localização, restaurantes muito bons por perto e fácil acesso a vários bons locais em São Paulo. O café da manhã é bom e a comida do hotel, precisei fazer uma refeição, é boa."
nov. de 2016,5,Perfeita,"Quarto super espaçoso e muito confortável. A localização é perfeita, ao lado de excelentes restaurantes, um quarteirão de uma das melhores padarias 24hs de São Paulo e próximo ao Metro da Paulista. Cafe da manhã delicioso."
nov. de 2016,4,Voltarei novamente,"Além da limpeza e do conforto, os funcionários se mostraram bem simpáticos, o café da manhã era variado, atendendo todos os gostos.  Chamou especialmente a minha atenção o aroma agradável quando adentrávamos o hotel todos os dias, dando mais ainda a impressão de asseio do lugar."
nov. de 2016,4,otima localização nos Jardins,"Hotel confortável, quartos limpos, e bem decorados, café da manhã muito bom com bastante variedades, ótimos custo beneficio em promoções de final de semana. serviço bom, e com uma boa vista para a região dos Jardins"
nov. de 2016,4,Excelente Localização / A Very Nice Localization,"Muito bem localizado, quartos amplos, limpos, café da manhã variado, atendimento bom e wifi rápido. O check out poderia ser um pouquinho mais rápido, mas é um padrão do Brasil ainda.  Very nice localization, huge and clean rooms, assorted breakfast, good service and fast internet connection. Check out could be a little faster, but unfortunately it's a Brazilian pattern."
nov. de 2016,4,Hotel bem localizado e bom no aspecto geral,"Hotel tem cafe razoavel mas compensa pelo conforto. A localizacao e muito boa tem farmacia, mercado,restaurantes por perto. Esta localizado em area nobre em Sao Paulo e silenciosa.o atendimento dos funcionarios e boa, a limpesa poderia ser melhor do quarto, o quarto e bem arrejado e bate sol a tarde."
nov. de 2016,4,Agradável acomodação,"Hotel confortável, ótima localização, próximo á Avenida Paulista, pode-se ir á pé. Restaurantes próximos. Quarto e banheiro espaçosos e arejado. WI FI disponível sem custos extras. Bom atendimento. E bom café da manhã, opção de omelete e tapioca feitos na hora bem como há disponíveis alguns produtos para consumo ás pessoas com intolerância à lactose. Apenas um ponto negativo: na última noite não havia água quente o que tornou o banho não muito agradável pq o clima já estava ameno, mas acredito que pelo perfil do hotel não seja algo de rotina."
out. de 2016,4,Ótima experiência,"Hotel com ótima localização, pode-se deslocar fácil para toda a cidade, de carro, ônibus, metro e a pé!!! Lojas, serviços, bares e restaurantes próximos para todos os gostos. Equipe cordial, atendimento de primeira!!!"
out. de 2016,5,Carnaval,Gente esse hotel é tudo de bom que eu possa recomendar.  Os quartos são arejados e agradáveis com assoalhos .  Muito próximo a Av Paulista e de uma série de cinemas e da casa das 🌹  Eu volto no próximo carnaval com certeza.👍👍👍👍👍
out. de 2016,3,Bom,"Esperava mais, fomos surpreendidos com atendimento equivocado da recepcionista em dizer que Nossa diárias teria terminado sendo que tinha mais uma e bloqueou nossas chaves impedindo entrar quarto , mas limpo, café da manhã delicioso é ótima localização"
