Data da opinião,Nota,Título,Conteúdo
out. de 2016,2,Falta estrutura e organização,"Up grade na estadia??? Meu quarto era cama de casal e virou de viúvo, tinha evento no hotel e com isso Hóspedes sem mesa para o café da manhã ! Quantidade de comida café da manha deixou a desejar com itens faltando. Drink cortesia maior burocracia para entregar. Internet nos quartos péssimo o sinal"
out. de 2016,5,Hotel excelente!,"Me hospedei à trabalho e tudo ocorreu conforme planejado, o hotel fica bem localizado e os colaboradores prestam um bom atendimento. A acomodação é ótima e confortável. Eu voltaria outras vezes, com toda certeza."
out. de 2016,3,Barata,Ser acordado por uma barata andando em voce. Em um hotel acabou com minha estadia.Mas nao reclamei para a atendente para nao prejudicar o hotel. Acredito que falta realizar tratamentos contra insetos.
out. de 2016,4,Ótimo Hotel,Me hospedei a trabalho e tudo transcorreu de ótima forma.  Boa velocidade de internet.  Ambiente sempre muito limpo.  Bom atendimento dos colaboradores.  Ótima localização.  Voltaria outras vezes e recomendaria o hotel a amigos e parceiros de trabalho.
out. de 2016,4,Satisfatório,"Melhorar a qualidade da comida oferecida através do cardápio. Solicitei durante minha estadia algumas refeições no período noturno e não teve condições de ser ingeridas. (Lanche, batata frita e sopa de canja)"
out. de 2016,4,"Muito bom, mas pode melhorar","O Hotel é muito bom, ótima localização e muito bonito, porém peca em alguns detalhes que poderiam deixá-lo excelente... a piscina estava muito suja, quartos não tem isolamento muito bom e faz muito barulho e café da manhã com muita variedade, porém o pão de queijo, pão francês e omelete não estavam bons..."
out. de 2016,3,Muito caro pelo que oferece,"Ótima localização, porem falta manutenção na piscina, pois estava muito suja, e café da manha fraco. Atendimento razoável, tirando o check-in que foi muito lento. O quarto estava com um cheiro um pouco forte, acredito que seja por causa do carpete."
out. de 2016,4,Um hotel que vale a pena...,"Um hotel em Goiânia que apresenta um diferencial significativo de qualidade no trato com seus clientes; além da localização, do conforto dos quartos, do café da manhã e da estrutura... Vale a pena conhecer!"
out. de 2016,4,Tranquilidade,"Hotel muito bem localizado, porém muito rigoroso no horário do check in. 14 horas em ponto. 2 funcionários na recepção, um em treinamento, muito demorado.  Café da manhã sem a opção que sempre encontro nos outros hotéis, omeletes, tapiocas, qualquer coisa que pudesse ser feita na hora. Um aparelho único de misto quente, formando fila dos hóspedes para fazer. Eu desisti."
out. de 2016,5,Excelente estadia.,"Só tenho elogios. Minha estadia foi excelente, assim como já havia sido em outra oportunidade. É um estabelecimento ao qual pretendo retornar e que sempre recomendarei a amigos. A localização privilegiada do hotel é uma facilidade adicional para quem necessita movimentar-se pela cidade."
out. de 2016,4,Qualidade do hotel,"Muito bom, quartos com bastante espaço, mesa para escritório, tv com batante canais de acesso, limpeza muito boa, local sem muito barulho, facilidade de acesso ao shopping, estacionamento com segurança."
out. de 2016,3,Tabapuã,"A localização é o forte do hotel que embora tenha o padrão da rede, não tem na manutenção um ponto forte. Artigos de banheiro insuficientes, luzes com defeito, e infiltrações no box e na parede do banheiro. TV a cabo de baixa resolução e internet de muito baixa velocidade."
out. de 2016,3,DE OLHO NA MADRUGADA,"O Hotel e excelente, porem o excesso de barulho ocasionado pelos hospedes na madrugada, me deixou decepcionado... acho que deveriam ter uma fiscalização maior nos corredores do hotel... principalmente quando houver muitos hospedes... Espero que este fato nao ocorra constantemente.  É uma critica construtiva... pois de uma maneira geral o hotel e muito bom."
out. de 2016,4,Muito Bom,"O hotel está bem localizado, as instalações são ótimas, o atendimento da equipe é bem atencioso, o café bem sortido, os quartos bem amplos, banheiro bom, tem um bom estacionamento, facilidade na chegada e na saída."
out. de 2016,3,Deixou a desejar,"Um hotel muito bem localizado, mas os quartos são antigos, o hotel estava em reformas e eles não interrogaram os andares envolvidos. Poucas pessoas para fazer check in e check-out o que gerou filas e sempre no atendimento. O café da manhã é bem completo e as áreas comuns como restaurante, hall de entrada e piscina São muito bons. Com uma Boa reforma e reforço na quantidade de pessoas para atender ficaria ótimo."
out. de 2016,4,atendimento muito bom,"Atendimento muito cordial , quarto confortável, travesseiros um pouco macios demais para meu gosto, ótima localização, esqueci alguns objetos pessoais no quarto mas não sei qual a politica do hotel quanto a isso. sou hospede frequente,vou tirar a dúvida em breve"
out. de 2016,4,Funcionários exemplo,"Tive o prazer de retornar a Goiania por motivo de trabalho e melhor ainda foi me hospedar no Confort!!! Estou a três semanas no hotel e gostaria de deixar aqui meus elogios a Camareira Emilia, que faz seu trabalho com excelência e esta sendo de um carinho impar comigo!! Ao Joao que tem o dom de ser gentil e atencioso com qualquer solicitação e a Tatiele que esta sempre preocupada em atender meus pedidos e sempre me auxilia em tudo que eu preciso!!! Meu carinho super especial aos três funcionários do hotel!!! Certamente eles fazem a diferença, e por esse motivo sempre darei preferencia ao hotel sempre que estiver em Goiania!!!!"
out. de 2016,4,Muito bom,"Atendimento do pessoal excelente, quarto amplo, confortável, chuveiro excelente, tv a cabo com os canais mais desejados, estacionamento e café da manhã ótimos e inclusos. Localização ótima, em fente ao shopping Flamboyant e ao lado do extra e carrefour. Outback em frente. Ressalva quanto ao barulho nas suites do térreo, ao lado da piscina, sofá cama para criança, do quarto 109, muito ruim."
out. de 2016,5,Otima Qualidade,"Qualidade no atendimento, ótima infraestrutura, ótima localização, limpeza, equipe esta de parabéns!!! Os colaboradores do comfort sempre educados uniformizados, receptividade e alta qualidade, indico este hotel"
out. de 2016,4,Bom hotel,"Passei a virada do ano neste hotel, gostei bastante, além do mais oferecem uma festa de réveillon muito boa e badalada. Impossível não mencionar também a localização privilegiada perto de shopping e dos melhores restaurantes da cidade."
out. de 2016,3,Comfort Goiania,"Hotel com boa localização. Relativamente próximo do aeroporto, cerca de 15 minutos de carro, e em frente ao melhor shopping de Goiania (Flamboyant). Fica em frente ao Outback com otimas opções de almoço ou jantar."
out. de 2016,5,Trabalho,"Limpo, bem arrumado e ótimo atendimento. Bem localizado, em frente ao Shopping Flamboyant e próximo do Estádio Serra Dourada. Boa infra estrutura, área de lazer, piscina. Ótimo para quem está a passeio ou a trabalho."
out. de 2016,3,"Manutenção deficiente, excelente localização","Excelente localização, de frente a um shopping, supermercados, boa infraestrutura local.  Sono prejudicado, pois como faltava a aleta do ar condicionado, não pude ligar o mesmo já que o ar frio era direcionado para a cama. Outro ponto, o secador de cabelos não funcionava."
out. de 2016,5,Muito bom!,"Excelente hotel. Muito bem localizado, super recomendo.  Piscina limpa e bonita. Funcionários prestativos e simpáticos. Não tem serviço de manobrista, mas isso não foi problema. Quarto limpo e arrumado"
out. de 2016,4,Atendimento do pessoal do café da manha perfeito.,"Gostaria muito que o pessoal de limpeza quando encontrasse algo no quarto, devido a esquecimento dos hospedes ligasse informando. Exemplo minha esposa esqueceu um carregador do celular LG G3 branco e até agora nenhum contato. Meu Marcos L. Silva fiquei hospedado de 26/9 a 10/10."
out. de 2016,5,Ambiente agradável,"Excelente hotel, recepção atenciosa, café da manhã e restaurante deliciosos (tem um ceviche de tilápia fresquinha e cervejas especiais goianas - Colombina) com preços bastante acessíveis! Ótimo custo benefício, área de lazer com piscina enorme, academia, sauna. Adoramos a estadia e queremos voltar por mais tempo! Tem um Outback e shopping Flamboyant bem em frente."
out. de 2016,2,Estou dormindo no chão.,"O serviço do hotel é muito bom. No check-in expliquei que precisava de uma cama extra. Fui prontamente atendido. No quarto então ficou a cama de casal, um sofá-cama e a cama extra. A cama de casa e a cama extra são muito confortáveis. O problema é o sofá-cama que vem com um colchão de apenas 4cm de espessura. Dá para sentir as barras de ferro nas costas. Não tive coragem de deixar um filho meu dormir ali. Pensei até em ligar na recepção e pedir outra solução, mas com as crianças já dormindo, acabei desistindo. A solução encontrada foi deixar as crianças dormindo na cama de casal, minha esposa na cama extra e eu resolvi colocar o colchão no chão para poder dormir sem precisar sentir a grade e as barras de ferro nas costas. Sinceramente, o hotel é muito bom, limpo, organizado, ótimos atendentes e de boa localização. Mas a experiência surreal de ter que dormir no chao, nem merece mais comentários..."
out. de 2016,4,Muito bom,"Nesse hotel o lazer é em primeiro lugar , tem várias áreas de lazer como a sala da entrada a acadêmica e a piscina o atendimento é Muito bom. Tem o café da manhã que é muito bom mas não tem almoço mas podemos pedir variados lanchaes enclusos no cardápio no quarto é um hotel ótimo para vir com a família."
out. de 2016,3,Bom,"Hotel com estrutura antiga...Academia sem ar condicionado, carpete nos corredores dos andares, barulhento, elevadores antigos...  Café da manhã bom, quarto espaçoso...boa localização em frente ao shopping, mercados..."
out. de 2016,5,Perfeito,"Estive cinco dias Hospedada e Adorei a Cama do hotel, o quarto, a paisagem, limpeza, atendimento e o melhor café da manhã dos hoteís aqui da região,Perfeito muito Caprichado com muitas Opções, em fim Retornarei sempre."
out. de 2016,5,Excelente.,"Ótima opção de estadia em Goiânia, quarto confortável e muito espaçoso.  Localização imbatível, em frente ao shopping Flamboyant. Hotel dispõe de toda estrutura como academia, piscina e ótimo restaurante."
out. de 2016,4,Do lado do Flamboyant,"Para quem quer ficar perto do flamboyant, é a melhor escolha. Quarto espaçoso. Só o café da manhã que não tem muitas opções fitness. Se tomar antes do checkin é cobrado por fora. A equipe do hotel é bem treinada."
out. de 2016,3,"Para ir a trabalho, ok","Assim, nada de especial. Bem localizado, quarto limpo, mas nada de incrível também. Café da manhã bom. Não passaria as minhas férias nele, mas para negócios é bom. Mas é dentro do que espero para ser mediano."
out. de 2016,4,Avaliação,"Ótima localização, em frente shopping(somente atravessar a avenida). Atendimento muito bom, quartos amplos e acomodações muito boa. Restaurante também muito bom . Área de piscina também boa. Recomendo"
out. de 2016,4,Hospedagem,Excelente atendimento pela recepção.  Café da manhã bom.  Quarto necessitam de reforma. Ar condicionado demorou a resfriar.  Mas foi no todo muita boa a hospedagem no Confort Suítes Flamboyant'mmnmmmmmmmmm
out. de 2016,4,Boa estadia.,"Boa estadia. Hotel bem localizado, em frente ao Shopping Flamboyant. Com boa piscina e café da manhã variado. Bom hotel para viagens a lazer ou negócios. Quartos confortáveis e amplos. Limpeza geral. Os corredores dos quartos merecem uma pintura nova e a troca do sistema de iluminação."
out. de 2016,4,Muito Bom,"Ótima Localização, Café da manhã de alta qualidade, muito confortável, limpo, organizado.  Todos os funcionários muito educados e atenciosos.  Espaços dos quartos não deixa a desejar, o restaurante é um dos melhores."
out. de 2016,5,Muito bom hotel. Recomendo! O atendimento muito prestativo e comida do restaurante muito saborosa,"Recomendo! Ótimo atendimento com time muito prestativo. Estacionamento no local. Quartos muito confortáveis, sem barulho. Serviço de quarto muito bom. A piscina muito boa, com temperatura agradável e temperatura boa da agua"
out. de 2016,4,"Atendimento, restaurantes, academia, sauna e quartas ótimos","Pessoal meu nome é Marcos, fiquei hospedado no Comfort por 15 dias, e algo que percebi que o atendimento dos funcionários são tem igual, são muito prestativos, sempre preocupados em fazer se sentir bem. No restaurante, que inclusive aceita pessoas não hospedadas, conta o coordenador Tiago e demais colaboradores, como Deisiane, Acasio, Kleidson, que não sabem o que fazem para agradarem os hospedes.  O hotel simplestemente, é muito bom, com excelente localização, e para mim tem melhor café da manhã com variedade de salgados e doces, e sucos detox maravilhosos."
out. de 2016,4,muito bom.,"excelente localização, perto de shopping, perto de mercado, bairro bom. Limpeza e conforto perfeitos. Areá de piscina boa, só achei a academia meio caída, já vi hoteis com diárias parecidas e academias mais completas."
out. de 2016,3,Compliance reserva,"hotel reservou quarto com cama de casal, no entanto não havia essa opção no ato do check in. Sendo assim fui direcionado para um quarto com cama de solteiro. Como a reserva é feita pela empresa, fiquei sem opção e me hospedei nesse hotel."
out. de 2016,5,Muito confortável,"Um hotel simples com tudo o que você precisa! Muito confortável e com atendimento excelente. Tive problemas com uma nota fiscal e eles se propuseram a me ajudar, mesmo dois dias depois de ter voltado. Estou indicando para amigos!!"
out. de 2016,5,Boa experiência!!!,"Hotel de boa localização, funcionários atenciosos e educados. Excelente qualidade do café da manhã. Quarto limpo e aconchegante. Na próxima vez em Goiânia ficarei novamente neste hotel e recomendarei a amigos."
out. de 2016,5,Super indico,"Foi minha segunda hospedagem nesse hotel e, nas duas, só tive boas impressões. Gosto da localização (em frente a um posto de gasolina, shopping, outback e mc donalds), do tamanho dos quartos, silêncio no hotel, atendimento da recepção, café da manhã e room service."
out. de 2016,5,Excelente localização Flamboyant,"Hotel novo, muito bonito, quarto amplo, bem localizado, próximo ao Shopping Flamboyant. A conexão da Internet nos quartos deixa um pouco a desejar, mas não chega a comprometer a estadia.  Equipe educadíssima e ágil tanto no check-in quanto no check-out."
out. de 2016,5,excelente,"muito boa localizacao, literalmente ao lado do shopping e de comercio e a menos de 400m da BR153 que vai para o aeroporto. Outback, shopping, Mc Donalds entre outros lugares para se visitar. Alem do que Goiania tem Taxis muito baratos entao vale a pena demais (alem de Uber hehe)"
out. de 2016,2,Péssima estadia,"Saímos com uma péssima impressão do Hotel, nosso check in foi chocante, o preço não combina com os serviços oferecidos.  Meu jantar estava horrível, uma decepção.  As toalhas encardidas, tive nojo.  Não quero comentar mais."
out. de 2016,3,Custo beneficio diminuindo,"Custo beneficio diminuindo pois a manutenção dos quartos deixando a desejar. Limpeza do carpete dos corredores não acontece. No meu quarto tinha a pia quebrada/ rachada, e outros pequenos detalhes onde se percebia a falta de cuidado geral."
out. de 2016,4,Satisfatória,O hotel está passando por reformas. Há paredes com tinta soltando. O ruido da avenida próxima nao chega a incomodar más a noite atrapalha o sono. O preço não condiizquierda com o estado do quartos. O ponto forte é a localização.
set. de 2016,3,falta de comprometimento no FEED BACK de problemas relatados,"independentemente em tomar as devidas providencias na solucionar do ponto de luz que não funciona na academia, sugiro que possam reaver a iluminação da academia, pois o ambiente e muito escuro.  Das 3 esteiras, a velha não funciona e das 2 novas, uma esta patinando sua esteira. Manutenção fácil e simples."
set. de 2016,5,avaliação do hotel Confort flamboyant,"Fui bem recebido e tudo superou minhas expectativas. A Internet estava Boa, café da manhã também. Fui bem atendido na hora do check in. O quarto foi muito bem limpo, e tive uma janta muito deliciosa. Tudo ok!"
set. de 2016,4,"Hotel bem localizado, com estrutura e atendimento muito bons.","Recomendo este hotel e voltaria a me hospedar lá. Tem estrutura boa para reuniões de empresas, com excelente atendimento e opções de lazer, como a piscina. Boa academia. Café da manhã bem diversificado."
set. de 2016,4,Hotel Goiânia,"Estadia muito agradável, café da manhã, e drink cortesia excelentes, porém o que deixou a desejar foi o ar-condionado do quarto, que não possuía a opção de controlar a direção da rajada de vento, sendo somente para cima da cama, com isso durante a noite, fui obrigado a ligar e desligar o aparelho por diversas vezes. Uma pena."
set. de 2016,4,Otimo hotel,"Pontos fortes: atendimento, cordialidade dos empregados, hotel novo, limpeza, localização. Hospedei-me algumas vezes e na ultima vez tive apenas 1 contratempo: a descarga do banheiro nao funcionou. Outro problema foi o cheiro de cigarro no quarto. Isso me incomodou na chegafs"
set. de 2016,3,Hotel,atendimento e limpeza impecáveis! A localização é ótima por um lado por ser em frente ao shopping e ao parque flamboyant mas por outro tive dificuldades para dormir por ser em frente à avenida barulhenta que chega na cidade. Único ponto negativo!
set. de 2016,5,EXCELENTE,"quarto bastante amplo, e com um isolamento acústico bom. Cama bem aconchegante e com roupa apropriada, super cheirosa. A única coisa que senti falta no café da manhã, foi não ter bebidas lácteas, como iogurtes e similares e geléias diet."
set. de 2016,4,Comfort em Family,"Um excelente hotel, perfeito para proporcionar uma experiência urbana com uma gama de possibilidade gastronômicas e comerciais. A dica que eu deixaria sobre o hotel, é cobrir a parte de estacionamentos e incluir tapioca no café da manhã."
set. de 2016,4,Muito bom !!,"Nada a acrescentar ,localização muito boa ,café da manhã com muitas variedades ,frutas,pães ,bolos,etc.  Atendimento de funcionários tanto na recepção quanto no restaurantes muito bom. Quarto amplo ,cama confortável ."
set. de 2016,4,Muito bom!!!,"Hotel bastante completo e bem localizado! Estrutura muito boa, com profissionais bem treinados. É um excelente hotel para executivos e família. Quarto amplo, instalações bem feitas, no geral muito bom."
set. de 2016,4,Hotel muito bom,Estive no hotel e para negócios e família se mostrou muito bom e aconchegante dentro do esperado para o hotel sem demais problemas! Numa próxima oportunidade ficarei novamente hospedado com vocês!!!!!
set. de 2016,5,Um hotel de qualidade em todos os aspectos!,"Gostei muito do hotel, excelente consideradido a limpeza, o atendimento, conforto, localização, o prédio. Considero que o café da manhã poderia ser melhor, uma vez que o hotel apresenta características para isso!"
set. de 2016,4,Viagem a negocios,"O hotel é bem localizado, próximo ao centro comercial. Oferece um bom café da manhã. Quartos amplos, boa higiene e limpeza. O atendimento pelos funcionários é excelente, muito simpáticos e atenciosos em prestar informações."
set. de 2016,1,Péssima estadia,"Tivemos um problema durante o check in, causado pela recepção do hotel, que não foi resolvido, e tratado com extrema má vontade pela equipe mal treinada e mal educada do hotel. Não recomendo, s nunca mais pretendo colocar meus pés lá"
set. de 2016,4,Muito Bom,"Hotel em excelente localização e que garante um bom conforto e atendimento. Correspondeu às expectativas... Não tive tempo de aproveitar piscina e parte fitness, mas pelo que vi, ótima qualidade. Recomendo"
set. de 2016,4,Excelente opção,"O hotel tem uma localização excelente! O serviço é bom e os preços dos alimentos é razoável.  A internet é ruim. Pra quem precisa trabalhar, não dá pra contar com a conexão.  Quarto limpo e confortável."
set. de 2016,3,Agradável!,"Minha estadia neste hotel foi muito agradável,em todos os sentidos,desde o check-in até o check-out pela rapidez e atenção como td foi conduzido pelos funcionários .  A suíte confort e limpa ,arejada e o colchão é muito bom,adorei!!!!  Passei a tarde na piscina ,muito limpa por sinal esta é minha area predileta!!!  O café da manhã é bem servido !  a localização é exelente ,é só atravessar a rua e vc estará dentro do maior Shopping de Goiânia(Flamboyant shopping center)a onde tem os melhores restaurantes da cidades além de grandes lojas .  Ah! O estacionamento é espaçoso e de facil acesso a recepção!"
set. de 2016,4,Ótima estada!,"Estada muito boa! O CS normalmente atende bem as minhas expectativas. Sugiro para quem viaja com crianças, pelo conforto do quarto e área da piscina. Na minha opinião, podiam revitalizar a brinquedoteca que já funcionou no passado.  No mais, agradeço o carinho e o tratamento preferencial que a Anne me deu."
set. de 2016,3,Hospedagem,"Hotel antigo, com muitos carpetes nos corredores e no quarto.  Atendimento no Check in muito bom e prestativo.  Achei o valor da diária elevado.  Chuveiro razoável.  Academia com esteiras boas.  Em frente ao Shopping Flamboyant."
set. de 2016,3,Ok,Poderia ser melhor. Quarto com odor de cigarro forte e atendente do meu check out me atendeu de uma maneira pessima. Não sabia responder as perguntas e me deu uma NF para o meu consume diferente do que eu consumi... não estavap preparado para fazer isso.
set. de 2016,5,Muito bom,Adorei a estadia. Excelente localização. Pertinho do Shopping. A Area de lazer é excelente para relaxar. Só não gostei da conexão de wi-fi que não funcionava de jeito nenhum. Tirando isso tudo muito bom.
set. de 2016,4,Muito bom,"Um hotel com fácil acesso, onde os colaboradores estão sempre com um sorriso no rosto, simpáticos e atenciosos.  Ótimo café da manhã, o restaurante também apresenta boas opções para as refeições, com bom preço e um atendimento perfeito, procurem o Tiago, que alem de boas opções de pratos, poderá sugerir bons passeios em Goiânia.  Atendimento perfeito também na piscina e na recepção do hotel.  Na saída, esquecemos algumas coisas no quarto e prontamente nos atenderam e despacharam para o no nosso endereço residencial.  Não tivemos problemas e acho que esse é o objetivo, principalmente quando viajamos com a família.  Muito agradável a nossa estadia neste hotel."
set. de 2016,4,Acomchegante,"recomendo, ótima localização proximo ao shopping, ao centro e a rodovia, quartos imensos bem limpos, piscina gigante, café da manhã variado, boa conexão de internete e wifi.  Funcionários educados e prestativos."
set. de 2016,2,Meia boca,"Atendimento muito devagar, pouco conhecimento dos atendentes sobre a cidade e rigidez nas orientações...  Quartos demoravam a ser limpados, televisão mal informada e de difícil sistema de informativo...."
set. de 2016,4,"Boa estrutura, ótimos atendentes.","Ótima localização em frente ao Shop Flamboyant, funcionários atenciosos, quartos gigantes, com carpete bem limpos. vista para piscina ou para o Shop.  Próximo a rodovia e ao centro, ponto de taxi praticamente no estacionamento. Recomendo à todos!"
set. de 2016,3,Precisa melhorar,"Precisa melhorar a limpeza dos box do chuveiro que está cheio de mofo e causa má impressão e também a lavagem das toalhas de banho que se apresentam muito encardidas.  Tem mancha no sofá e em vários lugares do carpete, o que causa má impressão."
set. de 2016,5,Excelente,Muito bem localizado e excelente atendimento de todo o pessoal. a proximidade do shopping center tambem colabora muito para recomendar este hotel a outros viajantes. Limpeza e cuidado com os detalhes fazem a diferença.
set. de 2016,3,Hotel bom,Bem localizado e com área de lazer boa. O custo da diária é relativamente alto e com café da manhã muito bom. A piscina do hotel é grande e limpa. O quarto possui cama confortável e canais de TV variados.
set. de 2016,4,Confortável e bem localizado,"Muito bom estar próximo a um excelente shopping center, com restaurantes incríveis e muitas lojas. O estacionamento do hotel é muito bom. A cama é confortável e os preços de frigobar e serviço de quarto não são caros."
set. de 2016,3,"Bom hotel, porém necessita reforma.",O hotel está muito bem localizado. As instalações já estão antigas e o valor da diária não se justifica apenas pela sua excelente localização. O café da manhã é bom. Os funcionários nem sempre estão prontos a atende-lo.
set. de 2016,4,Café bom,"Hotel agradável, boa limpeza, área de piscina muito bonita e café da manhã caprichado. Vim por congresso, mas recomendo a passeio também. Para mim, só peca no carpete do quarto e chaves (cartão) que dizem estar em fase de adaptação."
set. de 2016,5,Adequado e confortável,"Bom hotel. Adequado para o meu caso, que foi a trabalho. Creio que para turismo também atende bem. Quanto ao custo benefício, não posso avaliar adequadamente, pois não desembolsei verba de hospedagem, foi tudo pela empresa."
