Data da opinião,Nota,Título,Conteúdo
jan. de 2022,5,Conforto,"Hotel gigante, muito bem estruturado, quarto limpo e confortável.  Passou por uma reforma a pouco tempo e ficou tudo muito ótimo! Café da manhã maravilhoso!  A área da piscina, recreação para as crianças sensacional.  O hotel fica muito bem localizado para quem quer curtir as cataratas, parque dos passáramos, Argentina e outros.  Enfim, super indicamos."
jan. de 2022,4,Otimos Dias.,"Estive no hotel pela quarta vez ,minha primeira experiência foi a 20 anos atrás em lua de mel foi òtimo meu primeiro hotel nesse padrão.Agora com as reformas o hotel ficou 10 .a piscina ,os quartos ,a aréa do hotel,café da manhâ. tudo ótimo,tudo muito agradável.Funcionários super educados ,vou deixar um abraço ao Valdir garson do restaurante super atenciosso.Agora enquanto a alimentação devia ser mais barata ,muitas pessoas saem para almoçar e jantar no shoping que fica mais em conta.Outro ponto negativo pedimos água para a janta e nos foi negado.A hoteis como o itá termas resort nos é oferecido água saborizada na messa tanto para almoço como para a janta.Como estava de férias não vamos complicar manda vir uma coca cola a 9,00 reias .No mais super indico assim que puder retornar a foz com certeza ficaria no carimâ."
jan. de 2022,4,Hospedagem muito boa.,"A localização do Hotel é privilegiada. As habitações possuem boas acomodações, o pessoal do atendimento é muito cordial, piscina muito boa, atendimento nota 9,00. Poderia melhorar no quesito alimentação."
jan. de 2022,5,Uma experiência única com G.Carimã,Uma grata surpresa a minha estadia neste hotel. União de tradição histórica na cidade com modernização e excelência na ponta para o cliente. Combinação de natureza e urbanização. Prestadores de serviço bastante capacitados e guiados pela missão da empresa.
jan. de 2022,5,Semana perfeita,"Estive num encontro de turma com quase duzentos participantes, incluindo familiares, e tudo correu perfeitamente. Bom quarto, bom restaurante, boa área de piscina e serviço eficiente e gentil. AS instalações em geral são amplas e agradáveis, bastante claras e arejadas."
jan. de 2022,4,"Boa, em dias de grande vulto.","Eu e minha namorada entramos em um domingo e saímos na quarta-feira, é um quarto excelente, acomodações, decoração e piscina, mas o atendimento algumas vezes deixou a desejar, acredito que pq eram dias de pequena circulação de hospedes, não somos perfeitos, mas ficamos um pouco chateados com atendimento na recepção, fizeram esperar muito após o check-in, fizemos o check-in e aguardamos sentados no sofá, estávamos cansados e após cerca de 15min esperando e os recepcionistas nos olhando (2), resolvi se levantar e ir propor para que nós mesmo levássemos as malas que já estavam no carrinho, nesse momento que viram que eu propus levar, resolveram chamar alguém para levar e veio em menos de 20 segundos, achei um pouco de falta de respeito, não sei por causa da nossa vestimenta humilde ou é costume do Resort... Durante toda estádia visualizamos que alguns funcionários, mais especificamente garçons no restaurante andavam com a cara fechada e nos atendiam sem muita empatia, dando a ideia que estávamos atrapalhando por estarmos ali, enfim, gostamos sim do Resort mas acho que o atendimento é distinto de pessoas que são bem mais vestidas do que as pessoas que andam de shorts da naike, chinelo da aberdacrombie e ragada da pulman, agraço por lerem, levando por lado esportivo essa avaliação mas acho sim que deve melhorar o atendimento, a estrutura é ótima mas cerca de 20% dos funcionários devem cuidar com a forma de se expressar, obrigado!"
jan. de 2022,4,Muito bom,"Gostamos bastante dos dias que passamos aí, mais tive uma experiência negativa a respeito da loja de biquínis ela me atendeu mais ou menos da primeira vez, qnd retornei me atendeu super mal. Sei q não tem nada a ver com os funcionários do hotel acredito eu mais isso me marcou pois me senti muito mal com o atendimento dessa senhora."
jan. de 2022,5,Adorei a estadia no hotel.,"Além de excelente estrutura, ampla e confortável, o restaurante é ótimo, tem grande variedade. O atendimento é impecável. Meus filhos adoraram a área externa, especialmente os pavões. Voltaremos em breve."
jan. de 2022,2,Acertos sem valor,"Como eu tinha uma criança a mais, coloquei uma das crianças como adulto. Liguei e acertei tudo antes da viagem. Lá chegando, pediram desculpas que não poderia ser daquela forma. Tive de pagar a diferença de mais um hóspede.  Pena, pois o restante do hotel é muito confortável."
jan. de 2022,5,Ótima experiência!,"Os funcionários são muito atenciosos! Ficamos uma semana neste hotel e fomos muito bem atendidos desde nossa chegada até o momento de nossa partida. O café da manhã é bem servido, tudo muito bom e de qualidade. Jantamos algumas vezes no restaurante do hotel. A comida é muito boa e as sobremesas são maravilhosas. O espaço da piscina é agradável e passamos ótimas manhãs por ali. Recomendo muito este hotel."
jan. de 2022,3,Os garçom de piscina e restaurante precisam de treinamento.,"Os garçom de piscina e restaurante precisam de treinamento. A comida é razoável podendo melhorar a qualidade quanto ao sabor. Deveria investir mais em brinquedos infantis, pois havia famílias com crianças na faixa de 5 a 12 anos"
jan. de 2022,5,"Resort totalmente reformado, enorme e com ótimo atendimento!","Gostei muito do Resort Carimã, quarto bem confortável e todas as refeições sempre com muitas opções. Foi uma viagem rápida mas consegui aproveitar bastante. Os responsáveis pelos passeios sempre muito pontuais e solicitos. Quero muito voltar :)"
jan. de 2022,5,Fim de semana top,"Foi muito bom, tudo muito bom. As refeições são maravilhosas, sobremesas, café da manhã perfeitos. Os quartos são perfeitos para nossa família com 4 pessoas. Uma sugestão: só achei que precisaria de mais piscinas, tendo em vista o período de pandemia, mais espaços como esses seria o ideal. Mas o que tem já é muito bom."
jan. de 2022,4,Estadia no Feriado,"O hotel é realmente muito bom, as instalações são recém reformadas. Quartos são amplos e organizados, a parte da piscina é ampla, e tem muitas opções. Funcionários prestativos e atenciosos. A comida do restaurante é diversificada e muito boa também. Valores das bebidas um pouco elevados, mas há shopping próximo que dá pra economizar com isso. Em geral, recomendo e voltaria ao hotel."
jan. de 2022,5,Férias em Foz,"Ótimo hotel . Gostamos bastante da estrutura externa ,piscina . Optamos por meia pensão que facilitou bastante e as refeições eram bem variadas. Nos hospedamos na ala térrea do hotel ,achei essa ala bem charmosa ,manteve um pouco mais as características originais do antigo hotel Carimã apesar de toda reformada ."
jan. de 2022,4,lugar aconchegante,"Boa relação custo beneficio. Bom atendimento, boas refeições. Musica ao vivo a beira da piscina. Vale a pena conhecer. Bons monitores para as crianças, muitas atividades para os pequenos. Vale a pena conhecer."
jan. de 2022,5,O melhor Natal em família,"O melhor Natal em família, um ótimo hotel com excelente equipe de colaboradores. Ótimas refeições bem preparadas. Equipe de cuidados infantis perfeita (para crianças maiores). Espaço da piscina e área externas super limpas impecáveis. Recomendo de olhos fechados, principalmente se vcs tiverem filhos."
jan. de 2022,5,MARAVILHOSO,"Adoramos o hotel. Comida Boa. Recpçao ótima. área kids ótimo. Sala de jogos, poderia melhorar um pouco. Area da piscina maravilhosa e atendentes maravilhosos.  apenas um problema na hora de Jantar, quando o hotel esta cheio, pouco atedtente para varias pessoas."
jan. de 2022,5,Amei cada detalhe!,"Amei tudo, foi uma ótima hospedagem! Quartos ótimos e limpos, comida boa, lazer bom, piscina ótima …tudo perfeito ! Já estou com saudades desse local ! Amei cada detalhe, o hotel é extremamente grande !"
jan. de 2022,4,Ótimo lugar,"Bom atendimento, todos colaboradores são muito prestativos  Ótimo jantar e Ótimo café da manhã.  Hotel grande para chegar aos quartos  Haja caminhada,  Piscina ótima  Perto do shopping e da Argentina  Lugar top"
jan. de 2022,5,Ideal para famílias,"Passei a virada do ano. A festa foi incrível, impecável. Desde a organização, música boa, comida excelente. Parabéns, o hotel mostrou respeito pelos seus hóspedes e o nosso dinheiro. Recomendo a hospedagem foi excelente"
jan. de 2022,2,SEM ESTRUTURA PARA SER RESORT,"atendimento péssimo em nossa estadia, comida na área de lazer levava horas para chegar, faltava garçom para atender e despreparo total do hotel com atividades recreativas. Para quem procura uma experiência de resort não recomendo. Os quartos e a comida servida a noite são o único ponto de elogio"
jan. de 2022,4,Bom hotel,"O hotel é ótimo! Com boas melhorias tem grandes chances de se tornar um dos melhores de Foz do Iguaçu. Estrutura boa, ampla, que está sendo reformada. Café da manhã bom; jantar também bom. Passamos o natal e a ceia foi impecável (comentários que digam o contrário devem ser desconsiderados), con comida ótima e limpeza a todo momento nesse período de pandemia. Seria necessário construir outra piscina, o hotel tem uma capacidade enorme e a piscina não é tão grande. O piso da piscina deve ser trocado imediatamente, é liso e ao longo do dia parece encardido. Funcionários prestativos. Ar condicionado, camas, travesseiros, banheiros, todos bons. Com melhorias tem chances de ser um bom resort."
jan. de 2022,5,CUSTO/BENEFICIO,"Ótimo custo beneficio, para melhorar colocaria mais algumas áreas de lazer e pratica de atividades esportivas/recreação. Recomendo principalmente para família, estrutura, quartos e restaurante muito bons."
jan. de 2022,5,Muito bom!!,"Quarto limpo, chuveiro excelente, café da manhã maravilhoso, garçom muito atencioso, piscina maravilhosa (onde mais ficamos), minhas filhas adoraram. O hotel fica numa ótima localização. Com certeza voltaremos."
jan. de 2022,5,Ótima estadia,"Ótima estrutura do hotel, quarto confortável, café da manhã com bastante variedades estacionamento amplo, piscina grande e limpa. A localização do hotel é muito boa, tranquilidade e segurança e próximo aos principais pontos turísticos."
jan. de 2022,4,o Nome condiz com o Resort Grand ..,"Imponente, imenso aptos espaçosos e diferente uns dos outros, andando por seus imensos corredores sempre uma surpresa antiga ou moderna , é acolhedor.. , aréa de lazer perfeita, e com os pavões passeando próximo aos hospedes é algo magico.."
jan. de 2022,2,Falta cuidado com a alimentação dos Celíacos,"Antes de me hospedar entrei em contato com a equipe do hotel e informei que precisava de alteração da alimentação no café da manhã durante minha estadia já que sou celíaca e intolerante a lactose. A princípio parecia tudo certo, confirmei na semana e fui informada que já estava tudo organizado e minha alimentação seria feita fora da cozinha do hotel.  Ao chegar no primeiro café notei que nada estava certo, conversei com uma moça que me perguntou quem foi avisado, mas iria ver se tinha alguma opção de café. Me forneceram uma tapioca e um bolo de aveia que provavelmente estava com contaminação cruzada já que precisei marcar consulta com meu gastro logo após a viagem devido aos problemas ocorridos após a ingestão do mesmo.  Nos demais dias tive que me prevenir e comprar café fora já que não tinha como confiar na equipe do hotel.  Não recomendo alimentação de celíacos nas dependências do hotel pois o cuidado é zero!  Instalações boas, os demais serviços foram bem prestados."
jan. de 2022,5,Viagem 10,"Localização bacana, perto das Cataratas, o quarto estava novo e era muito espaçoso, a comida excelente (café da manhã e jantar, sempre com muitas variedades) e o atendimento dos funcionários excelente. E a festa de réveillon foi impecável!"
jan. de 2022,4,Muito bom Resort,"Ótimo atendimento, comida boa, recreação top, boa localização, quartos limpos e bons. Necessita de mais áreas verdes para caminhadas e aumentar a área da piscina.Iria novamente viajar para o resort. Obrigada."
jan. de 2022,4,avaliação,"Achei bom em linhas gerais. Contudo preços das atividades de recreação um pouco alto. A piscina é boa, mas água poderia ser melhor. As refeições foram excelentes. Preços internos no geral poderiam ser melhores, visto que já somos hospedes."
jan. de 2022,5,Estadia Surpreendente,"Eu e minha família ficamos surpresos com as instalações do Hotel, com o bom atendimento dos funcionários, com as atrações oferecidas aos hospedes, e com a comida. A minha única crítica é com a piscina que em alguns momentos ficou pequena em virtude do grande número de hóspedes. No geral Indicaremos o Hotel a outras pessoas."
jan. de 2022,5,Excelente hotel!,"Instalações modernas e com extremo bom gosto e qualidade. Funcionários muito bem treinados e prestativos. Restaurante com boa diversidade, qualidade, boa programação de eventos para as refeições. Área de lazer ampla, bem estruturada e equipada."
jan. de 2022,5,Muito bom!,Hotel muito bom! Fiquei muito feliz lá! Ótimo para passeio em família!  Recreação gentil! Atividades divertidas! Todos da família ficaram muito satisfeitos com o hotel e noite de réveillon foi sensacional!
jan. de 2022,4,Recreação,"Os tios estão de parabéns, muito atenciosos e divertidos, as crianças adoraram as atividades e brincadeiras , principalmente na piscina e oficina de slime .  Como sugestão poderia separar as crianças por idade ."
jan. de 2022,4,Boa,"Algumas coisas , ainda falta para melhorar, pois entendo que estão em reforma , aglomeração nas refeições , e água nos chuveiros muinto fraca , e a arrumação dos quartos muinto demorada , do resto estava tudo bom"
jan. de 2022,5,Passeio em família,"Lugar super confortável para descansar com a família com várias opções de entretenimento, piscina linda e agradável!! Refeições deliciosas, destaque para café da manhã completo e saboroso!!!! Vamos voltar sempre 😊"
jan. de 2022,5,Lugar que me deu memorias incríveis!!,"Comida e ambientes deliciosos! Muito aconchegante o local, tanto a parte interna como os quartos e acomodações, quanto a externa com piscina e area de lazer. Atendimento incrivel tanto para crianças quanto para adultos!! Suuper recomendo hehe"
jan. de 2022,4,"Lugar maravilhoso, precisa apenas de uma melhora nos serviços","Pontos positivos:  - quartos grandes e recém reformados com banheiros grandes também.  - paisagismo muito bonito mesmo.  - possui vários locais de lazer.  - é afastado do centro mas nada tão longe, além de ser caminho para pontos turísticos.  - serviço de quarto bom e solícito;    Os pontos negativos foram:  -Internet no quarto com problema a partir do segundo dia, ficamos muito chateados que o problema não foi solucionado durante os três dias de estadia e tivemos que usar 4G do celular para rotear para o notebook, e lá quase não tem sinal 4G também. Nossa viagem foi a trabalho, o que foi péssimo nesse ponto. Acabamos literalmente perdendo dinheiro durante a estadia por esse problema. Não buscaram nos trocar de quarto nem nada, só ""reiniciar a rede"" e nada mais.  - Café da manhã com poucas opções para um resort, o restaurante é enorme e com várias ilhas mas muita comida repetida e poucas opções para a categoria do hotel. Pão de queijo duro nos dois dias que tentei comer.    O lugar é realmente lindo, eu voltaria sim, mas sem esperar um café da manhã de resort e sem que fosse uma viagem de trabalho. Para lazer está ótimo. No fim de semana tem várias atividades para todas as idades e é diversão garantida."
jan. de 2022,4,"Ótimo hotel, estrutura e serviço","Um ótimo hotel para passar tempo com a familia e amigos.  Localização próxima as cataratas e lugares turísticos, estrutura completa com piscinas salas de jogos e academia.  Refeições e serviço foram muito bons, um dos melhores pudins de leite que já esperimentei.  Altamente recomendado!"
jan. de 2022,3,.,"Hotel todo reformado, com uma estrutura boa e a recreação muito boa com os tios super atenciosos. Os tios estão de parabéns! Minha filha adorou! O que achei que deixou a desejar foi o serviço do hotel, buffet não muito preparado para crianças e o cardápio a La Carte com pouco as opções e nada que pedimos estava bom e o hambúrguer estava péssimo!"
jan. de 2022,4,Algumas melhorias,"O hotel está muito bem estruturado, reformado. O apartamento muito bom, bem limpinho.  A questão do jantar creio que pode melhorar a diversidade.  Banheiros sociais estavam bem sujos, tive que pedir algumas vezes para ser limpado."
jan. de 2022,4,Um Resort com potencial,"Estivemos hospedados em família no natal de 2021 (8 diárias).    Os quartos são bons, com tamanho suficiente para 4 pessoas. As camas são macias e ducha com boa pressão.    O acesso ao quarto passava-se por um corredor que, infelizmente, cheirava esgoto desagradando a sensação olfativa do local.    O desejum era feito com um belo café da manhã, com variedades repletas de pães, bolos, frutas, além de um suco detox espetacular!!!!    O jantar (optamos pelo pacote meia pensão) foi simplesmente sensacional. Literalmente, a cada noite, era servido um banquete temático aos hóspedes de muita qualidade e fartura. As sobremesas eram de uma tentação irresistível !!!    A piscina é ampla e gostosa, mas o calor (perto de 40 c) e a falta de sombras naturais faziam do espaço um local pouco atrativo para permanecer nas horas mais quentes do dia.    Ainda, poderia haver música e brincadeiras corriqueiras para adultos no local, o que somente ocorriam esporadicamente.    Existe tirolesa, campo de futebol e a turma da recreação foi boa, mas poderia haver mais atividades de recreação abrangendo adultos e crianças (o que não aconteceu de maneira habitual).    Em relação a Central de Reservas, fica meu agradecimento ao atendimento profissional, amável e sempre cordial da colaboradora Mari, pessoa que fizemos questão de agradecer pessoalmente pelos serviços prestados, quando estivemos no hotel.    Enfim, acredito que o antigo e histórico Hotel Carimã está repaginando sua história e, com certeza, possui um potencial bastante grande para se tornar um dos melhores Resorts do Brasil.    Ah, por fim, na recepção ou no espaço do restaurante, deixar sempre um cafezinho fresco disponível aos hóspedes, não seria nada mau."
jan. de 2022,5,Ok,"Hotel bem localizado, ótima recreação para as crianças e café da manhã bem satisfatório!  A Cleó foi muita solicita e prestativa levou gelatina para minha no quarto.  Quero voltar com certeza em breve!  Grata"
jan. de 2022,3,Piscina e hidromassagem,"O Hotel em geral é muito bom, mas a piscina e hidromassagem não está proporcional ao tamanho do hotel. Estavam sempre muito lotadas.  Na hidro havia um aviso para permanência máxima de 30 min, mas não tinha ninguém fiscalizando.  O horário de início de utilização da piscina também inicia muito tarde, eu e meu esposo acordamos cedo para aproveitar a piscina, pensando encontrar ela mais vazia, mas estavam efetuando a limpeza."
jan. de 2022,5,LUGAR EXCELENTE,"Fomos muito bem atendidos, atendimento nota 10 para todos os atendentes e garçons, ficamos realmente a vontade como se estivéssemos em casa, esse lugar é perfeito! Super recomendo, quartos lindos e camas cheirosas café da manhã impecável, com certeza vamos voltar com a família."
jan. de 2022,5,muito bom,muito bom sempre que for a Belo Horizonte quero ficar hospedado neste hotel  NA PRÓXIMA VEZ COLOCAR NUMERO PARA FACILITAR A RESPOSTA  Nenhum cliente gosta de perder muito tempo fazendo avaliações tem que ser objetivas as perguntas e rápida
jan. de 2022,5,Atendimento dos garçons da Piscina - Luiz Carlos e dos mensageiros,"Excelente Estadia, nos surpreendeu. As refeições boas e balanceadas, o Festa de ano novo tudo muito lindo e gostoso.  Observação apenas para os horários do jantar, pois sempre tinham filas, talvez uma sugestão seria aumentar o numero de pistas para servir."
jan. de 2022,5,Melhor Resort de Foz do Iguaçu,"passamos nossas férias de dezembro np resort carimã e adoramos como fomos recepcionados, o ambiente, a comida, o atendimento.....recomendamos a todos que pretendem visitar a cidade e que procuram um lugar agradável e de extrema qualidade, esperemos em breve poder voltar!!!"
jan. de 2022,5,Perfeito,É a nossa segunda vez no Carimã. Acomodação muito confortável e café da manhã muito variado e organizado! Funcionários muito atenciosos e prestativos. Certamente voltarei! É o melhor custo benefício!!!
jan. de 2022,4,Exelencia em atendimento,"Da reserva ate e final da estadia fomos muito bem atendidos. Roberto Rodrigues MUITO BOM... Elis Cristina Caceres Spindler MUITO ATENCIOSA TAMBEM. a Ceia de Natal, estava maravilhosa. Comida excelente.. Limpeza do quarto muito boa.. ( melhorar limpeza do banheiro ). Area da piscina otima. Recreadores muito bons. Tia pacoca , tio Mosquiro e Tia NATA...ATE BREVE XENTI... a....em agosto de 2021 fiz um evento com amigas e foi otimo o atendimento com todas nós. Parabens Grand Carima..."
jan. de 2022,5,Ótimo lugar para descansar com a família,"Hotel fica a mais ou menos 1 km do shopping catuaí;  Ótimo atendimento de todos os funcionários;  Quarto confortável com móveis novos, TV a cabo, ar condicionado;  Tudo muito limpo e organizado;  Área de lazer com parquinho para crianças.  Equipe de recreação para divertir as crianças.  A temperatura da água da piscina é muito agradável tanto para os adultos quanto para as crianças.  Café da manhã e jantar deliciosos num local muito limpo e aconchegante.  Área de lazer espaçosa e com muita área verde.  Piscina com bar e local com banheira de hidromassagem. A comida do bar é muito boa.  Na véspera de Natal o hotel ofereceu um jantar especial com ceia e música que encantou a todos.  Enfim, nossa experiência foi muito boa e com certeza voltaremos no futuro."
jan. de 2022,5,Hotel está Incrível,"Hotel está lindo com a reforma, quartos sensacionais, café da manhã maravilhoso muita variedade, piscina e hidromassagem tbm...atendimento de recepção, limpeza, garçons todos muito prestativos. Já nos hospedamos 02 vezes e voltaremos com certeza!"
jan. de 2022,4,BOA ESCOLHA Natal e Réveillon muito agradável,"Hotel muito bom funcionários muito simpáticos e prestativos., Vale destacar a atenção e carinho do pessoal do restaurante destacando o maitre , do administrador e da Yeni .Sempre muito atenciosos com minha mãe cadeirante.  Ponto negativo fica por conta de hóspedes sem educação que não eram repreendidos mas ,no finalzinho da hospedagem percebi que estavam cobrando uso de máscara e luvas para ter acesso ao buffet.  Espero tb uma fiscalização na piscina impedindo uso de taças, copos dentro d'agua.  Nota mil pra recreação. Super Indico e,com certeza retornarei."
jan. de 2022,3,Férias,"O hotel foi revitalizado com quartos modernos e confortáveis, mas tivemos problemas com a falta de água quente no banheiro e cheiro forte de esgoto. Café da manhã farto e gostoso, área da piscina boa, funcionários educados e prestativos e taxistas bem treinados e confiáveis. No período que estivemos no hotel, ficou a impressão que estava com uma taxa de ocupação alta, não tendo funcionários suficientes para uma bom atendimento no restaurante e piscina. Jantar ruim e lazer do hotel muito fraco.  A3 Iguaçu turismo nos atendeu muito bem. PARABÉNS!"
jan. de 2022,4,satisfação,"Bom dia    Fomos para este hotel para comemorar 38 anos de casado e adoramos o hotel muito confortavel, funcionarios muito atenciosos e bem localizado, muito bom mesmo.  Com certeza na nossa proxima viagem a foz do iguaçu este sera nossa prioridade em hospedagem e ja indiquei a um filho e a esposa que vão agora em fevereiro para foz."
