Data da opinião,Nota,Título,Conteúdo
jul. de 2019,5,Muito relaxante!,"Com crianças elas conseguem se divertir, ficamos 8 dias, mas fica meio monótono, falta entretenimento para não ficar repetitivo.    Restaurante com cardápio bem limitado, apesar da comida e atendimento serem muito bons!    Recomendo para menos dias."
jul. de 2019,5,Ferias perfeitas em família,"O hotel patachocas foi um delicioso refúgio durante os 10 dias de estadia.  Quartos espaçosos,  Banheiros também.  A proximidade da praia que é linda de  Morrer. Você vai a pé para as piscinas .  Os tios da recreação são muito cuidadosos e encantadores as  Crianças pediram  Pra brincar todos os dias.    As comidas  Do restaurante eu amei comi super  Bem , não passei mal (sou Celíaca e alérgica  A Proteína do leite) comi super bem.  O  Prato família vem bem farto! Excelente.  Comi umas 20 calcinhas de siri , sempre muito deliciosa.    Vale programar para vir  Nesse lugar encantador"
jul. de 2019,5,Hotel Maravilhoso!,"Estive no Patachocas acompanhada do meu marido. Hotel maravilhoso com quartos confortáveis, comida excelente e com preço razoável, funcionários muito prestativos e amáveis. Localizado a 4km da Vila de Morro de São Paulo, ideal para quem quer descansar."
jul. de 2019,5,Hotel maravilhoso,"Estivemos no hotel de 23 a 29 de junho com nossos filhos Pedro e Luiza. A experiência com o hotel foi muito boa! A praia é ótima, a melhor de Morro de São Paulo, os quartos são muito bons, muito bem limpos e arrumados pela camareira Paula, muito boa e atenciosa!  A comida do hotel nos surpreendeu! Tempero e qualidade dos pratos nota 10, exceto pela Lula empanada, achei que não vale a pena...Café da manhã então...maravilhoso...  Todos os funcionários do hotel São bem atenciosos e educados, principalmente os recreadores...Cida e demais da equipe estão de parabéns!  A única coisa que mudaria no hotel é a falta de atração a noite...apesar da comida boa, o restaurante é desanimado...no único dia que teria show em nossa estadia, o mesmo não foi realizado e não souberam explicar o motivo.    Quero voltar ao Patachocas na maré baixa ."
jul. de 2019,5,Otimo hotel para viagem em familia,"Excelente hotel. Ótimas instalações. Tudo novo, limpo e de bom gosto. Atendimento cordial. Café da manhã excelente! Recomendado para que deseja viajar em familia com qualidade e tranquilidade. O melhor de Morro de São Paulo!"
jul. de 2019,5,Muito bom!,"Excelente resort! Local aprazível, praia linda com piscinas naturais, comida de qualidade e variada, funcionários atenciosos. Recomendo tanto para ir com a familia , bem como em casal.Com certeza voltarei."
jul. de 2019,4,"Lugar paradisíaco, muito calmo e ótimo para descansar e relaxar com vistas excelentes.","Lugar paradisíaco, muito calmo e ótimo para descansar e relaxar com vistas excelentes.  Mas fica dois pontos negativos: O primeiro deles é o preço. Tudo é muito caro, bem típico do Brasil que adora tirar proveito de quando tem algo bom a oferecer e você tem que pagar muito caro por uma coisa totalmente desnecessária. Segundo é a falta de ondas nas praias, mas isso já é uma particularidade minha, que gosta de onda."
jun. de 2019,5,Experiência incrível!,"As fotos não não conseguem demonstrar o quão maravilhoso é esse lugar! Deixei o Patachocas triste, não queria ir embora!!! É perfeito! Sublime! Quando for a Morro, fique no patachocas! A quarta praia é mais linda!!! E o Resort é deslumbrante!"
jun. de 2019,5,Excelente Hotel,"Hotel com estrutura maravilhosa, varias atividades ao longo do dia, quartos muito limpos e café da manhã excepcional (inclusive com opções para quem tem intolerância à lactose).    O transporte para vila que o hotel oferece é super pontual, embora as condições do ônibus não sejam as melhores.    Atendimento de qualidade, todos foram muito simpáticos e atenciosos conosco."
jun. de 2019,5,Dias maravilhosos,"Nossa o que dizer desse maravilhoso hotel , passei dias tão especias, o atendimento de todos os funcionários, sempre sorridentes ,a piscina e linda , grande , limpa , a praia em frente é incrível, parece mais uma piscina natural ! As comidas são deliciosas e os preços são justos , eu e meu marido amamos o lugar!"
jun. de 2019,5,Boa opção para crianças! Viagem em família!,"Grande área verde. A quantidade de equipamentos infantis poderia ser maior, porém dentre as opções de morro ainda é a melhor opção. O restaurante é excelente, pratos bem servidos e com o preço justo. Achei melhor do que as opções da vila. O atendimento da piscina e praia poderia ser um pouco melhor. O café da manhã é excepcional! No geral toda a família gostou! Recomendo!"
jun. de 2019,5,Férias com crianças,"O hotel é uma excelente opção para passar as férias com crianças. O ambiente é muito tranquilo, tem uma boa piscina e uma equipe de recreação bem animada. O quarto é enorme, limpo e confortável. O café da manhã é muito bom e bem diversificado. Os funcionário são bem atenciosos. Não é perto da região central de Morro mas tem um ônibus que faz esse transporte gratuitamente. Gostamos bastante do lugar."
jun. de 2019,5,Nota 1000,"Lugar sensacional, um verdadeiro paraíso, meus filhos amarram e me pedem para voltar, estou me programando para voltar, café da manhã delicioso e muitas opções. Os meus filhos nem queriam sair do hotel, praia maravilhosa e caminhava todos os dias na paz."
jun. de 2019,5,Paraíso!,"Hotel maravilhoso em todos os quesitos, estrutura ótima para crianças, principalmente as recreações. A praia é perfeita e a piscina é muito boa! Café da manhã bem completo e todas as refeições do hotel são muito saborosas e com valor justo. Os quartos são bem arejados e limpos, camas confortáveis. Funcionários muito atenciosos e cordiais. O ônibus disponível para ida e volta a vila é muito útil, facilita bastante para os hóspedes. Ficamos muito satisfeitos com nossa escolha de hotel, adoramos o Patachocas!!!"
jun. de 2019,5,Paraíso,"Pousada maravilhosa, de frente pra praia com uma piscina deliciosa, o quarto do apto e o bangalô são amplos, bem iluminados e limpos, os funcionários são super educados e simpáticos, o lugar é lindo, na minha opinião um pedaço do Paraíso."
jun. de 2019,5,Patachocas sensacional,"Estive com minha esposa e minha filha de 6 anos durante 10 dias no Patachocas de Morro de São Paulo. O resort nos surpreendeu em tudo. Localização excelente, praia fora da confusão, maravilhosa. Hospitalidade ótima, programação legal para crianças e para adultos. Usamos um chalet confortável e silencioso. Tem transporte de hora em hora para a vila sem custo.  Recomento demais! Vamos voltar com certeza."
jun. de 2019,5,Tranquilidade!,Resort muito bom em estrutura e atendimento. Muito tranquilo e perfeito para descanso.  Infelizmente somente a comida do hotel deixou um pouco a desejar. Talvez as escolhas dos pratos não tenham sido tão certas! Mas muito bem recomendado.
jun. de 2019,5,LUGAR INCRÍVEL,"Foi incrível a nossa viajem a morro e ao Patachocas, lugar incrivelmente lindo e exuberante, o quarto super espaçoso e limpo, a piscina perto do mar é um espetáculo, o café da manhã muito bom com várias opções e a comida é muito saborosa. Super indico!"
jun. de 2019,5,Viagem perfeita!,"O hotel é maravilhoso para quem deseja uma estadia tranquila, de qualidade e perfeita para descanso. O atendimento é excepcional, a comida do restaurante é TOP, tanto que nem queria ir até a segunda praia para comer. A pizza e a moqueca de peixe são fenomenais. A limpeza e cuidados com todas as áreas do hotel são impecáveis. Todos os funcionários são extremamente cordiais e atenciosos. Para quem é muito dependente de wi-fi, pode se chatear com o sinal de internet, que cai com muita frequência, mas isso não me incomodou. A quarta praia é perfeita, a melhor de todas na minha opinião. O hotel oferece atendimento VIP e a praia fica praticamente dedicada para os hóspedes, com água em temperatura perfeita, limpa e calma como piscina. Em resumo, adorei a minha estadia e quero muito retornar."
jun. de 2019,5,"hotel perfeito, se tiver criança pode levar, mas Morro de Sao Paulo ta um lixo...curta o hotel que vai ser melhor","hotel super confortavel, distante 5 km do centro mas muito melhor que ficar no meio dos gringos e muvuca.. idela para lua de mel ou casal com crianças... amei. bangalo super confortavel, limpeza impecavel, cozinha maravilhosa, educação dos funcionarios,"
mai. de 2019,4,Boas instalações,"Quartos confortáveis, todos contam com varanda e rede. Café da manhã farto e variado. Piscina aquecida que fica aberta 24 horas. Serviço de piscina e praia. Funcionários simpáticos. Senti falta de áreas de convivência pelas dependências do hotel. A área verde é muito bonita, porém não temos onde sentar para aproveitar a paz do lugar. Seria legal ter “pufs” ou sofás espalhados por essas áreas. Se quiser ficar fora do quarto a noite, somente é possível sentar na área da piscina ou no restaurante. O transfer do hotel para a vila (Segunda Praia) é eficiente. Destaque para a Quarta Praia onde o Patachocas está localizado. Praia plana, rasa, cristalina, sem ondas e em maio quase particular. Ideal para crianças, idosos e quem quer curtir paz e sossego."
mai. de 2019,5,Viagem inesquecível,"Hotel maravilhoso, muito bem cuidado, com quartos confortáveis e limpos, comida muito boa, piscina muito boa, muitas opções de atividades para adultos e crianças, praia perfeita (linda, água quente e transparente, boa pra nadar com snorkel) e atendimento excelente! Não vejo a hora de voltar!"
mai. de 2019,4,Sossego,"Hotel resort familiar, praia de águas claras e quentes, atendimento impecável na praia e na piscina, você pode escolher um quarto próximo a piscina, tudo de bom, café da manhã bem regional e sortido, chegando em Morro vá até o receptivo dos hotéis na segunda praia e embarque no transfer próprio do hotel, ou pegue um táxi 40,00"
mai. de 2019,5,Excelente hotel,"Paraíso para famílias e casais que procuram sossego! Quarto do apartamento super espaçosos, camas muito confortáveis, peca só nos travesseiros e toalhas de banho, que poderiam ser mais grossos. Café da manhã simplesmente fabuloso, com uma parte separada de produtos sem lactose. Funcionários sempre muito solicitos e gentis! Praia exclusiva na frente do hotel com poucas ondas, uma delicia! Piscina sempre muito limpa e agradável! Programações de atividades para adultos e crianças todos os dias no hotel, alem de recepção que fecha pra vc passeios externos sem estresse! Refeições do hotel a preço justo, bem servidos, que não te deixa nem ter vontade de sair do hotel! Voltaremos sempre que pudermos!"
mai. de 2019,5,Maravilhoso,"Passei três dias neste hotel e fiquei encantada com o atendimento. Gostei muito desta acomodação, tudo muito limpo, café da manhã impecável, piscina sem defeitos. O hotel fica um poço distante da vila mas tem seus atrativos, a beleza desse lugar é fascinante. O hotel fica em frente à quarta praia e está é ótima para banho, na maré baixa forma-se piscinas naturais."
mai. de 2019,4,Excelente!,"Fiquei hospedada com meu marido e filha em um chalé, atendimento excelente, quarto amplo e camas super confortáveis. Tudo muito limpo, exceto a piscina que nos últimos dias, quando mais movimentado tinha cabelos, pedaços de unha... Café da manhã bom e variado. A comida do restaurante é muito boa e a preço justo. Tive a falta de sorte de achar um fio cabelo na manga e uma larva no arroz, motivo pelo qual não posso dar 5 estrelas para o hotel. O pessoal da recreação infantil também está de parabéns.  A localização é privilegiada para quem quer sossego e a praia em frente é linda e calma."
mai. de 2019,3,Hotel bom pra quem procura tranquilidade,"Gostamos bastante do hotel, local bem tranquilo, era o descanso que queríamos. A praia em frente é a coisa mais linda!! Acho que ela e a quinta praia são as mais bonitas e tranquilas.  Ok o quarto de modo geral, o atendimento dos funcionários do bar e do restaurante, foi excelente, todos muito simpáticos, os pedidos não demoravam pra chegar. Comida muito gostosa e preço dentro da média.  Conhecemos um casal de amigos que estava com uma criança, disseram que todo dia o hotel trocava o kit kids para banho, e que tinha até buchinha em formato de bicho. Achei demais, nunca soube de kit para crianças em hotéis.    A distância entre hotel x vila é relativamente grande mas vale a pena. Basta se atentar aos horários de transfer oferecido pelo hotel. Caso contrário por 40,00 o taxi te leva até a praia 2. Um absurdo esse valor se compararmos que do aeroporto em Salvador até Mercado Modelo paguei 54,00.    Sugiro comprarem água no centro e levar para o frigobar, sai 1,00 cada garrafinha, no hotel é muito caro, 4,00 cada.    Pontos de atenção:  - no ato da reserva informei ao hotel que era nossa viagem de lua de mel. Esperava ao menos um cisne de toalha em cima da cama. Nada aconteceu.  - pedi na recepção que informassem a camareira pra burrifar o aromatizador após a limpeza no nosso quarto. Nada aconteceu.  - funcionários da recepção salvou um, pena que não guardei o nome dele. Os demais parecem que não fazem questão da sua presença e de suas solicitações.  - transfer oferecido pelo hotel é MUITO precário. Não tem necessidade de oferecer o transporte com um ônibus, que é grande, que fica mais difícil a locomoção, caindo aos pedaços com pneu careca. O motorista é ponta firme, acostumado com os atolamentos quase que diários, ao menos em abril choveu todas as noites.  -piscina a noite precisa de uma iluminação, ao menos por segurança já que podemos nadar a qualquer hora.  - impossível usar o banheiro da piscina, estava alagado  - o apto 620 precisa de manutenção, a janela balcão precisa do puxador para fechar e o box vaza água durante o banho."
abr. de 2019,5,Excelente estrutura,"Estrutura, atendimento e quartos excelentes. Indico para que quer descansar, muitas atrações para criança e boa praia para banho. O quarto que peguei foi apartamento, ele é grande e espaçoso, muito confortável."
abr. de 2019,5,Aconchegante,"Patachocas um Resort muito bem estruturado em Morro de São Paulo, piscinas ótimas ,alimentação muito variada ,bons preços e tem aquelas redinhas frente mar que fazem toda a diferença .os quartos são muito confortáveis."
abr. de 2019,5,O melhor atendimento no paraiso !!!,"Melhor atendimento que já tivemos! Todos os funcionários te cumprimentam e sempre sorridentes. Ponto alto do atendimento é do restaurante. Sensaciona!!! Comida maravilhosa e com preço muito mais justo do que o cobrado em Morro. O lugar, um paraíso!"
abr. de 2019,5,Resort no paraíso,"Muito bem cuidado, localização primorosa e atendimento excelente. Um pouco longe de  morro, mas tem transporte regular a cada 30 min. Praia em frente é maravilhosa. Bom ponto também para fazer passeios de carro, barco ou charrete para Garapua, Boipeba e Morere."
abr. de 2019,5,Sem dúvidas um dos melhores hotéis que já fiquei com a minha família.,"Um hotel que com toda certeza, superou as minhas expectativas. Sempre tive vontade de conhecer Morro de São Paulo, tenho 2 filhos com idade entre 1 e 5 anos. O percusso para chegar é realmente muito difícil, e com duas crianças a dificuldade é dobrada. Mas, assim que cheguei no hotel, fui muito bem recebida com a minha família, funcionários atenciosos e sempre prontos a ajudar. Não levei carrinho de bebê, pois, seria muito difícil para transportar, mas o hotel prontamente dispôs um para o meu filho. O quarto sempre muito limpo e um berço arrumado com muito capricho, continha até um kit (com travesseiro infantil e um cobertor). Sempre viajo com meus filhos, então preciso de um local com estrutura para eles, o Patachocas possui uma equipe de recreação Fantástica, com atividades educativas e muito bem elaboradas, sem contar o carisma e a paciência que eles têm com as crianças. O Hotel tb possui um restaurante com cardápio diversificado, pratos elaborados e com um sabor maravilhoso. A praia do Hotel é linda, e o hóspedes podem usar a estrutura que o Hotel oferece, cadeiras, guarda sol, além de brinquedos de praia para as crianças que ficam a disposição. Realmente um lugar maravilhoso, para curtir com a família, super recomendo para casais com filhos!!!"
abr. de 2019,5,Surpresa,"Estou aqui com a minha família e além de toda a receptividade desde a chegada no hotel, hoje fomos surpreendidos com um carinho do hotel. Foi deixado no quarto um OVO de Páscoa e a alegria da minha filha foi tanta ao vê-lo que só abrilhantou a nossa estadia, fechando com chave de ouro nossa semana santa.  Aos organizadores da pousada, nossa gratidão por terem nos acolhido tão bem, voltaremos mais vezes."
abr. de 2019,5,Uma outra maravilhas de Morro de São Paulo,"Sem dúvidas o hotel mais bem recebido que já hospedei. Um pedaço do paraíso na terra, só de lembrar que estou de volta na minha cidade a saudades de Morro aumenta e ainda mais desse pedacinho de paraíso chamado Hotel Patachocas.  De uma forma geral clima agradável refeições maravilhosa, bebidas e petiscos preparados com toda o cuidado e apresentação. Flexibilidade no horário das refeições foi possível almoçar ás 16:00 horas com uma comidinha fresca.  Ficamos em 2 apartamentos ambos com perfeita conservação e aquela atenção em todos os detalhes. Áreas em comum limpas conservadas. Piscina maravilhosa, praia da frente quase que exclusiva com piscinas naturais na maré baixa, água morna uma delícia para relaxar. Todas as informações solicitadas foram de pronto respondidas, os funcionários com uma educação ímpar fiquei impressionado. Clima ideal para casais com crianças. O hotel oferece transporte para a praia 2, único detalhe é para o público mais jovem que goste de festa é que o último transporte é as 00:00 depois é somente taxi.  No resumo, paz, tranquilidade, conforto, comodidade, uma excelente comida (preços ótimos comparado com os restaurantes do centro). Quer enterrar na areia todo o stress esse é o seu destino certo.  Amei Morro de São Paulo se eu tiver um dia uma chance de voltar, me hospedei novamente no Patachocas. Neste caso no custo benefício nenhum outro hotel pode oferecer o que eles me ofereceram."
abr. de 2019,4,Férias,"O hotel é excelente, atendimento maravilhoso e infraestrutura excelente.  Apenas a cama do quarto não é boa, quando chegamos tinha um buraco no cochão, trocaram tudo e mesmo assim a cama não foi confortável.  É o único ponto de melhoria que tenho sobre o local.  Outro ponto apenas como atenção é o incentivo que o resort da ao uso de charretes, mesmo não sendo um serviço oferecido pelo resort eles indicam e inclusive publicam no stories do Instagram.  Cavalos ficam o dia todo carregando pessoas, sem infraestrutura, água e comida para eles. São escravizados pelo turismo!  A praia mais bonita está na frente do hotel com piscinas naturais e uma ótima infraestrutura do hotel!"
abr. de 2019,5,Patachocas experience,"Melhores férias que tivemos! O hotel patachocas é incrível!! Lindo demais, ótimo para crianças!! Esperamos voltar mto em breve! A Praia do hotel e ótima para nadar, sem ondas e com piscinas naturais lindíssimas!!!"
abr. de 2019,5,Perfeito,"Nossa hospedagem no patachocas foi perfeita, hotel de paisagem deslumbrante, acomodações limpas e organizadas, funcionários prestativos e simpáticos, e um restaurante muito bom, o meu parabéns especial vai para as meninas e meninos do lazer, excepcionais! Espero voltar em breve!"
abr. de 2019,5,Excelente acomodação! Vou voltar,"Acomodação e serviços de primeira.  Pessoal atencioso, a recepção foi calorosa, o café-da-manhã e demais pratos são de primeira.  A praia é um show a parte, parece uma picina, Lugr romântico, excelente para passar uma temporada a dois."
abr. de 2019,3,Ótima localização porém com muitas famílias,"Realmente o forte do hotel é a localização, a quarta praia é ótima para quem quer aproveitar a natureza da ilha. No demais o hotel é OK, por se tratar de um hotel muito voltado para famílias vc consegue perceber a falta de atenção com aquele “detalhe especial”, por exemplo apresentação das comidas no café, decoração dos quartos, etc. Sem contar os animadores infantis berrando no microfone já de manhã. Se vc for fazer uma viagem sem crianças tenha isso em mente, fuja da confusão e caminhe pela quarta praia. Pelo preço que paguei com desconto do Zarpo foi “justo” não pagaria o preço mais elevado que aparecia em outros buscadores."
abr. de 2019,3,UM BOM TRÊS ESTRELAS,"Áreas sociais muito conservadas, faltando uma academia com aparelhos aeróbicos.  Quartos relativamente confortáveis, porém com muita mosca (o hotel providenciou uma dedetização), sem mesinha e cadeira, ar condicionado fraco para o tamanho do quarto e o calor.  Localização não é boa. Muito isolado, longe de tudo  O ônibus que serve os hóspedes até a vila não agrada, é muito velho, sem conservação (bancos quebrados) e sujo. Motoristas atenciosos e pontualidade escelente.  A pulseira de identificação é muito desconfortável."
abr. de 2019,5,Amei esse hotel! Quero morar lá!,"Perfeito! Me senti como se tivesse me mudado pra lá! Toda hora chamava de ""casa""!  A piscina é ótima, o acesso a praia é maravilhoso, a praia é um paraíso...  Tudo perfeito!  O quarto é perfeito também! Enorme, muito espaçoso, cheiroso e limpo!  Só a televisão que é pequena, mas quem vai pra hotel pra assistir tv né."
mar. de 2019,5,Maravilhoso,"Ficamos 9 dias no hotel e estava ótimo, paisagismo, café da manhã bem sortido e saboroso, atendimento cordial, quarto novo e sempre bem limpo, restaurante com pratos deliciosos! Ponto fraco achei o meio de transporte para a vila, ônibus sujo e velho, porém sempre pontual!"
mar. de 2019,4,"Não é um Resort, mas foi uma boa experiência!","Período: 6 diárias    Pontos positivos:  - paisagismo maravilhoso  - quartos (não ficamos em bangalô) espaçosos, limpos, com ótimo ar condicionado, excelente iluminação, ampla varanda  - funcionários receptivos, animados, simpáticos e educados  - localização privilegiada (apesar de longe do centro), em frente a uma praia maravilhosa, vazia, limpa, com um mar exuberante  - ótima estrutura na praia, com espreguiçadeiras de madeira e colchonetes de qualidade  - linda e ampla área de lazer, muito boa  - fornece transporte gratuito para o centro da ilha, com horários variados  - excelente para famílias com crianças principalmente  - Café da manhã bom, não excelente (deixo aqui meu agradecimento especial ao funcionário “Nilton” responsável por fazer as tapiocas/omeletes pelo excelente atendimento, serviço e simpatia)  - Piscina grande e limpa  - ótimo serviço no bar    Pontos negativos:  - É um resort, porém nível básico! Precisa aprimorar para agradar como resort!  - Possui entretenimento para os hóspedes, porém são poucas opções, poucos horários, baixa intensidade e envolvimento.  - Possui apenas 1 procedimento de estética (massagem) que custa caro e precisa ser pago em dinheiro. A agenda da massagista não tem ligação com a recepção, então para agendar e saber a disponibilidade, precisamos ficar atrás da profissional para nos informar.  - Café da manhã precisa de alguém full time fazendo manutenção devido à quantidade absurda de moscas, e talvez melhorar de “bom” para “excepcional” igual a resorts. Melhor a disposição e escolha das frutas, possuir opções mais saudáveis, sem glúten e açúcar.  - Piscina possui uma área bem no centro não utilizada e sem acabamento, faz com que perca espaço e deixe feio  - Piscina não tem iluminação à noite, o que considero além de estética algo essencial para segurança, lembrando que possuí partes rasas e escada interna  - Não visualizei salva vidas na área da piscina e na praia  - Não visualizei a presença do gerente durante os 6 dias  - Serviço de garçons na área da piscina e na praia demorado devido à escassez de funcionários  - Roupa de cama a desejar no conforto para um resort  - Wi-Fi desconecta o tempo todo e não funciona na praia    Agradeço muito ao Patachocas pela ótima experiência, são apenas melhorias/ críticas construtivas."
mar. de 2019,5,Excelente,"Excepcional!  Café da manhã excelente, bem diversificado, o restaurante tbm servem variados tipos de comida deliciosas, atendimento de bar na piscina muito bom, limpeza em geral e principalmente dos apartamentos sem igual, tudo muito limpo e muuuuuito cheiroso. Todos os funcionários muito simpáticos e atenciosos. Minha experiência foi melhor do que imaginei, voltarei em breve com certeza!"
