Data da opinião,Nota,Título,Conteúdo
jun. de 2022,5,Dia dos namorados,"Excelente restaurante, com um ambiente muito agradável, a comida muito saborosa, tanto nos pratos quentes, como com as carnes. E as sobremesas é pra fazer a pessoa sair do regime 😁, e o atendimento dos garçons é fantástica. O garçom Afonso está de parabéns."
jun. de 2022,5,Elogio,"Tudo é ótimo, são impecáveis. Atenção especial ao garçom AFONSO....cavalheiro, amável, competente, correto, impecável ....não esqueçam, garçom Afonso A localizaçãoéótima, arrumadeira sãoexcelentes, impecaveis."
jun. de 2022,5,Gran Carimã - descanso,"Hotel é muito grande, as áreas de lazer e descaso são maravilhosos. Tem um jacuzzi e sauna perfeito, estavam sempre vazios. Quanto a limpeza e manutenção, sempre tem funcionário conferindo e fazendo os ajustes devidos. Os funcionários são muito educados e solícitos. Voltaria várias vezes."
jun. de 2022,5,Lua de mel em Foz,"Atendimento excelente,com certeza voltaremos, agradeço Sr Clóvis e ao Henrique.  Uma equipe de primeira , simpática,e eficiente,lugar lindo amplo,além disso conta com um piano de cauda lindo ao qual meu marido pode me dedicar uma linda canção"
jun. de 2022,5,Experiência boa,"Equipe show! Especialmente para a Cléo do restaurante!!! Muito prestativa e atenciosa!!! A experiência em Foz de vários hotéis que conhecemos, vale a pena!! Principalmente para quem é de foz, a questão de custo benefício este bem acessível!"
jun. de 2022,5,Top,Adoramos. Cléo preparou café da manhã as 06:00 pra nós pois tínhamos voo as 07:20. Parabéns Cléo e hotel. Hotel reformado e tudo novinho. Café da manhã top. Valeu muito a pena. Vamos retornar mais vezes. Aproveitar a estrutura do hotel por completa.
jun. de 2022,5,Explendido,Tivemos uma convenção de negócios da empresa Centro del Agro S.A. fomos excelentemente atendidos en todos os aspectos. Super recomendado. Curtos limpos e organizados. Salão de eventos amplo. Restaurante com variadas comidas e muito boas. E uma sala de jogos para se divertir com os amigos. Muito top
jun. de 2022,5,Convenção,"Excelente atendimento, apartamentos bem limpos, sala de convenção muito espaçosa, banheiros limpos, excelente serviço de Buffet, com muito bom atendimento de parte dos garçons, amplo estacionamento….."
mai. de 2022,5,Local apropriado para receber grandes eventos,"Bem localizado, proximo a pontos turísticos. Bons serviços. Quartos limpos. Restaurante servem com qualidade e fartura.  Nesse local foi realizada um Convenção de Lions Clubes com mais de 300 participantes, tendo vários salões, podendo separar partes dos eventos. Tudo em uma área isolada do hotel, para o grupo participante."
mai. de 2022,5,Fim de semana perfeito,"Um ótimo hotel para descansar. Atendimento ótimo e boa comida, ambiente bonito e tranquilo. Um obrigado especial aos atendentes dos bares e ao Afonso, que nos atendeu no jantar do último dia. Com certeza voltarei"
mai. de 2022,5,Negocio,"Muito boa a estadia. Tudo 100%, dentre eles, citar o garçom Afonso pelo ótimo atendimento. Sempre dispostos os funcionários, simpatia e desenvoltura para desempenhar sua tarefas. As instalações perfeitas"
mai. de 2022,5,Recreadores Tios e Tias,"Os recreadores são muito legais eu amei brincar com vocês.vocês são incríveis parabéns o jeito de lidar com as crianças .    Para,tia pandinha,tia tata,tio Big,tio sete e tio pernilongo.  Um beijo da Valentina,até as próximas férias.AMAMOS VOCÊS.."
mai. de 2022,5,Avaliação de colaboradores,"Avalio as colaboradoras Simone e Cleo como ótimas atendentes e também a recepção por parte da direção foi ótima, sem contar a estrutura que nos foi disponibilizada que não tenho dúvidas foi excelente e todos os nossos convidados ficaram encantados."
mai. de 2022,5,Lua de mel,Perfeito! Ficamos na suite com banheira de hidromassagem! Perfeita! Ampla! Muito limpa! Comida maravilhosa! Atendimento espetacular! Desde a recepção! Até o restaurante! Serviço de quarto! Super recomendo!
mai. de 2022,5,Conversão werbran,"Atendimento excelente, funcionários educados e prestativos, ambiente agradável, limpo e organizado , muito lindo, espaço Kids muito bom e atividades de recreação para crianças super organizado.  Parabéns a todos !"
mai. de 2022,5,Werbran,Estive no evento da werbran atendimento top  Nota mil para todos os colaboradores  Em especial para o Clóvis  Comida excelente todos de PARABÉNS muito bem organizado já sei a onde vamos ficar nas nossas férias
mai. de 2022,5,"Acolhedor, lindo, enorme, relaxante. E tem Sopa Paraguaia🥰","Hotel lindo, chuveiro renovador de energias, jacuzzi relaxante dormiria lá com o som dá água se não tivesse chegado duas hóspedes tagarelas rsrs. E um carinho enorme pelas funcionárias Luciana B que teve muita paciência comigo no agendamento, Iene e Lilian muito atenciosas e alegres comigo, a Cléo me trouxe até a mesa una sopa paraguaia, só porque amo, experimentem! Meu filho amou o monitor Tio Mosquito que percebeu o que ele gostava de brincar e brincou muitooo. Voltarei em novembro"
mai. de 2022,5,Evento werbran,"Estive no evento da werbran estava TD muitonorganiy. E bem animado chop bom. Vendedores bem preparado s e sem aquele impurroterrapia  Estaremos na próxima com certeza, pq gostei do hotel e da alimentação"
mai. de 2022,4,Expo Farma,"Em nossa estadia tivemos um excelente atendimento dos colaboradores. A comida muito boa, o quarto amplo e a ducha do banheiro com ótima vazão d’água. No entanto, não dei nota máxima porque a Wi-Fi fica descontando o tempo todo."
mai. de 2022,5,Feira de Negócios Expofarma,"Excelente atendimento e acomodações, comida boa, ambiente agradável. Só não vou dar 5 estrelas por que o Wi-Fi fica desconectando e precisa conectar a todo momento, mas de resto tudo ótimo. Recomendo!"
mai. de 2022,5,Negócios,"Tudo perfeito. Evento maravilhoso e ainda perfeito graças a estrutura do hotel Gran Carumâ. Faço um especial agradecimento a equipe do hotel, em especial ao Sr. Afonso, Fran, Gilson e Clóvis com a atenção e cordialidade dos mesmos. Parabéns ao Hotel"
mai. de 2022,5,Negócios,"Parabéns a direção do hotel. Limpeza, organização e equipe nota 10. Um parabéns em especial ao Sr. Afonso, pela disposição e educação. Tenho certeza que o evento da Werbran foi perfeito por ter a organização do hotel como suporte. Só uma crítica construtiva, a água para banho no final da noite poderia ser mais quente. Não sei se é em todos os quarto ou ala. Estava no apartamento 2306 e infelizmente não esquentava muito, lembrando que somente no final da noite."
mai. de 2022,5,Negocios,"Excelente hotel, equipe maravilhosa, muito educados e atenciosos, quartos perfeitamente limpos e arejados, pena que não pudemos usar a piscina, porque estava muito frio, mas não fez falta, pois tudo está ótimo. E um obrigado especial para o Sr. Afonso, uma pessoa incrível, e extremamente atencioso...muito obrigado a família a Grand Karimam Resourt"
mai. de 2022,5,Negócio,"Ótimo atendimento, limpeza e espaço, café da manha maravilhoso. A comida muita boa, adoramos. Sr Afonso excelente atendimento.  Banheiro espaçoso e limpo  Cobertas limpas e confortáveis  Somente a piscina não pudemos usar, pois estava muito frio quando viemos."
mai. de 2022,5,Avaliação,"Excelente hotel, tudo maravilhoso… deixando também uma avaliação para o Sr Afonso, atendimento excelente, tudo que precisamos ele estava a disposição para nos atender, vamos voltar sempre que der 👏🏼👏🏼"
mai. de 2022,5,Avaliação,"Hospedagem muito boa, atendimento impecável. Ficamos durante tres dias e nos atenderam com muita atenção, parabéns aos envolvidos voltaremos sempre que possivel    Obs: O senhor afonso, garçom da cozinha, é um fofo, muito atencioso."
mai. de 2022,5,Grand Carimã,"Instalações perfeitas, atendentes bem capacitados, super gentis. Limpeza impecável, em especial aos trabalhos da Elizane, que faz tudo com muito carinho nota 1000. Recomendamos a todos que procuram qualidade e preço justo."
mai. de 2022,5,Excelente nossa experiência,"Hotel com ótima localização, o café da manhã possui bastante variedade, a cama muito confortável e o chuveiro é muito bom mesmo, tudo muito limpo, local tranquilo e agradável.  A comida é maravilhosa, tenho só elogios para o nosso garçom Clóvis, super simpático, educado e solicito.  Gostamos muito da estadia!  Super recomendo ."
mai. de 2022,5,Excelente hotel,"Hotel muito aconchegante, muito bonito. Tudo bastante organizado. O quarto é muito bom e banheiro com tudo limpinho.  Servem um ótimo café da manhã e fomos atendidos perfeitamente pelo Edilson. Excelente funcionário!! Esperamos voltar em breve!"
mai. de 2022,5,"Apartamento muito bom, atendimento ótimo, principalmente do Sr. Afonso que nos atendeu no restaurante!","Nota 10, estão de parabéns, ambiente bem família! Recomendo dms, quartos aconchegantes, espaço de jogos, tudo muito agradável, atendimento excelente, principalmente do Sr. Afonso que nos atendeu no restaurante!"
mai. de 2022,5,Excelente,"Excelente estrutura, café da manhã muito bom, quartos aconchegantes e bar completo. Recebi também um excelente atendimento da Fran Costa no restaurante e do Luiz no Bar que faz uma caipirinha muito boa. Os preços são justos e te permitem aproveitar ao máximo a estrutura do hotel. Parabéns pela qualidade, estrutura e atendimento."
mai. de 2022,5,Hotel Carimã,"Hotel ótimo !  Atendimento excelente!  Garçons sempre muito atenciosos!  Comida boa !  Pensão completa café, almoço,jantar !  Área de lazer Bom,  Recriação para crianças ótimo !  E seu Afonso ""garçon muito simpático"" nota 10"
mai. de 2022,5,Hotel,"Tudo maravilhoso, atendimento impecável. Muito solícitos todos os atendentes, quarto amplo. Ducha boa, comida deliciosa, garçons simpáticos e prestativos. Principalmente o Sr Afonso. Que nos atendeu muito bem"
mai. de 2022,5,Hotel geral,"Maravilhosa hospedagem, atendimento nota 1000. Comida deliciosa. Todos muito prestativo, além da cozinha baby que oferece td que um bb necessita, da água quentinha até leite em pó, tudo muito bem higienizado."
mai. de 2022,5,Atendimento humano e honesto,"Fiz uma reserva na data equivocada e fui fazer o check-in uma semana antes da reserva.    Gentis, entenderam meu erro e aceitaram fazer uma nova reserva, no momento, com o mesmo valor da outra.    Depois que voltei para casa, solicitei o cancelamento da reserva errada com a operadora de viagens, o hotel liberou e tudo foi resolvido.    Fora isso, a estrutura do hotel é nova: recepção, quarto, área externa, piscina...  O café da manhã de dia das mães foi ótimo, com direito a um músico tocando sax ao vivo.    Recomendo!"
mai. de 2022,5,Em reforma,"Pegamos um ótimo quarto, o pessoal da recepção nos ajudou com um acréscimo de uma pessoa no quarto, nos cobrando proporcionalmente, forem muito justos e atenciosos. Um obrigado especial para a Cleó, no restaurante do café da manhã, que foi muito prestativa, nos atendendo com excelência. O hotel, agora reformado está ótimo! Só precisa melhorar a área de jacuzzi, pois 2 jacuzzis para um hotel daquele tamanho é ridículo…. E fica sempre cheio e com a água suja."
mai. de 2022,4,Boa experiência,"Bom café da manhã e demais refeições disponíveis. Excelente atendimento do garçom Sr Afonso. Nota 4 no geral. No dia 1 de maio, dia do trabalhador, o café da manhã foi uma excelente e encantadora supresa. Só deixou um pouco a desejar quanto a limpeza do quarto"
mai. de 2022,5,Avaliação,Excelente atendimento em ambos setores.  Quarto excelente!  Restaurante excelente!  Acomodações excelente!  Garçons excelente atendimento e recepção!  Estacionamento excelente!  Excelente variedade de comidas nas refeições
mai. de 2022,5,Passeio em Foz do Iguaçu,Grato pelo atendimento e organização das acomodações. Higiene admiravel.  Espero voltar outras veses. Hoje tomamos um ótimo  Café da manhã.  Todos os funcionários e atendentes foram muito simpáticos e agradáveis. Isso faz com que agente queira voltar novamente.
mai. de 2022,5,Aniversário de casamento,"Estivemos hospedados neste hotel para comemorar o aniversário de casamento. E foi maravilhoso! Agradeço o atendimento pelo whatsapp, pois foram muito atenciosos e prestativos - reservamos bem próximo à data, mas fui mto bem atendida.  No hotel, tivemos a experiência do pacote ""lua de mel"", com jantar e café da manhã no quarto. Fomos muito bem atendidos, destaco a atenção do Afonso e do Jean, que foram impecáveis.  O hotel está lindo, reformado... Tudo mto limpo e organizado.  A decoração do quarto ficou linda! Valeu super a pena o investimento!  Refeições muito saborosas e diversificadas."
mai. de 2022,5,Melhor do fiz,Maio 4 hotel muito bom apartamento ótimo limpeza boa café tope no jantar tivemos o excelente atendimento do Sr Afonso super atencioso recomend topehotel perto do centro Argentina aeroporto tudo fácil e rápido super RE comendo
mai. de 2022,5,Muito bom,"Gostei muito , atendimento muito bom, comida sensacional . Lugar maravilhoso, vale a pena se ospedar. Sr Afonso tope mil apartamentos super limpo recomenndo hoteso. l maravilhoso super recomendo não usamos a piscina ta muito friu"
mai. de 2022,5,Viagem amigos,Excelente atendimento dos funcionários e otima comida.  Quarto bem limpo e organizado.  Café da manhã top.  Jantar vale super a pena.  Lugar lindo e limpo.  Ao solicitar atendimento na recepção fomos muito bem atendidos e de forma rápida.
mai. de 2022,5,Foz festa,"Atendimento do seu Afonso é espetacular.  Pessoal muito cordial, limpeza excelente, tudo muito organizado, estacionamento seguro, café da manhã muito bom, só achei o buffet do jantar fraco. No mais sem reclamações."
abr. de 2022,5,Lua de mel,"Fomos muito bem atendidos ao chegar ..  a recepção nos atendeu com excelência com  As malas .. nos auxílio com senha Wi-Fi.. Os quartos foram arrumados no momento que pedimos .,  No café da manhã todos os funcionários sem excessão atenderam muito bem nossos desejos ..  Nos sentimos acolhidos .. e ainda vamos desfrutar de mais opções no hotel"
abr. de 2022,5,Local incrível para um experiência extraordinária,"Eu já vim uma vez e estou aqui novamente.    Eu acho muito bom esse Hotel.    Hoje conheci no café da manhã o Sr Afonso, que é um senhor muito simpático que trabalha atendendo diretamente as pessoas, recolhendo as mesas e tudo mais, conheci também a Sra Yeni, a Maître do café da manhã, que pessoa incrível, nos atendeu de forma espetacular.    Super indico… quer uma dica? Peça uma tapioca que é maravilhosa!"
abr. de 2022,5,Muito bom,"O hotel é lindo arborizado com um ótimo espaço para crianças, os quartos limpos e bem aconchegante, interessante ser perto da Argentina pois fizemos muitos passeios por lá, além do serviço o café da manhã excelente o Sr, Afonso muito simpático e prestativo assim como o Luís do bar da piscina que nos atendeu muito bem"
abr. de 2022,5,Avaliação,"Estive participando de uma imersão de Business. Mas o que encontrei aqui que superou minhas expectativas foi a infraestrutura e a educação, empatia e cordialidade da equipe do hotel. Quanto carinho ❤ recebi. Ressalto o atendimento excepcional da Lilian e Yeni, que nos atenderam tão magnificamente no restaurante.  Me senti em casa. Foi maravilhoso. Parto com vontade de ficar. 🥰"
abr. de 2022,5,Ótimo!!,"Fácil localização, tudo muito agradável. Limpeza impecável das acomodações pela Kamilla, jantar muito agradável e ótimo atendimento do Sr Cloves, Sra Zeli e Fran. Hotel amplo e espaçoso. Equipe de turismo muito atenciosa e prestativa."
abr. de 2022,5,"Um dos melhores hotéis que eu já me hospedei na vida, tudo muito organizado, fui bem atendido e me senti em casa","O atendimento foi show, hotel top ainda mais a galera que trabalha aqui que foi super educada e prestativa, queria agradecer a Iene, zeli, vivi , romilo , marcos , Afonso , Franci , Elvis , gean e Lilian eles são incríveis e eu fiz uma amizade muito legal com eles.    O hotel não deixou nada a desejar nós viemos a um curso e tudo foi muito bem feito, o coffee break é top e recomendo demaisssss.    Nunca vi um hotel com tanta gente legal e que é muito profissional, amei tudo"
abr. de 2022,5,MAESTRIA EMPRESARIAL,Tudo foi excelente.  Destaque especial para cordialidade a atenção do Sr Afonso/Eventos e equipe de restaurante.  Os cardápios foram adequados.  A limpeza também adequada.  Localização fácil e acessível.  PARABÉNS
abr. de 2022,5,Vim para um evento e fui muito bem atendido,"Vim participar de um evento de 6 dias e fui muito bem atendido pela equipe do hotel, com destaque pro Afonso, garçom que nos atendeu no restaurante e além do ótimo serviço, foi muito simpático e pró-ativo"
abr. de 2022,4,Bom hotel,"É um hotel grande, o quarto é bem limpo, roupa de cama gostosa, dá pra descansar de verdade! Não achei com tantos atrativos para as crianças, durante a semana não tem muita recreação, no fim de semana é que fica animado. A comida achei boa, nada impressionante."
abr. de 2022,5,Ótima. Ótimo atendimento,"Ótima experiência ótima estadia muito bom local muita natureza  Aconchegante e o atendimento diferenciado desta forma vou recomendar aos amigos. Estou com um grupo hoje mas quero voltar com a família,.,................................................"
abr. de 2022,5,Excelente atendimento,"Bem localizado, atendimento impecável e com serviço de cozinha maravilhoso especialmente pelos gentis Marcos, Elvis, Romolo e a simpática Vivi, que tornou nossa estadia muito mais especial.  Voltaremos com certeza!!"
abr. de 2022,5,Lua de mel pós-pandemia 💕,"Fui com minha esposa depois de 3 anos de casados para comemorar nossa lua de mel e foi muito bom! O hotel é bem limpo, a comida é incrível e durante o dia existem atividades que nos mantém entretidos! Nota 10 pra equipe de recreação que pensa em atividade para os adultos também 😆"
abr. de 2022,5,Hotel maravilhoso atendimento perfeito!,"Lugar muito agradável, limpo, aconchegante, atendimento perfeito especialmente Jean ( coordenador da parte de alimentação), Zeli e recreador pernilongo! Passamos maravilhosos neste local! Parabéns a todos que lá trabalham."
abr. de 2022,5,Os melhores resort,"Quero agradecer a grande equipe do Grand Carimã, desde do inicio da hospedagem come comidas sensacionais  Obrigado pelo excelentíssimo Amigo Sr. Afonso e demais jean, Zeli, Elvis,Rosana, zeli, Yeni, Gerente Jacir a toda equipe, final de semana sensacional."
abr. de 2022,5,Muito Bom!!!,"Excelente o hotel, acomodações show. Refeições 🔝🔝🔝 principalmente o atendimento do garçom Sr Afonso!!!  Estrutura do hotel excelente, cômodos limpos, piscina super atraente, funcionários super prestativos."
abr. de 2022,5,Resort,"Muito bom local muito organizado comida boa perto de todos ponto turístico muita atrações no interior do resort recomendo a todos,show estamos tendo uma estadia muito boa muito bem atendido pelo seu Afonso 👍🤝🤝🤝"
abr. de 2022,5,Muito bom,"Acomodações ótimas, limpas, muito bem organizado! Refeições excelentes e com inúmeras variedades. Atendimento maravilhoso de todos os profissionais e principalmente do Sr Afonso, que sempre foi muito atencioso conosco."
abr. de 2022,5,Simplismente tudo maravilhoso,"O resort é lindo! Atendimento, quarto, infraestrutura, café da manhã, e etc.. tudo maravilhoso. Ótimo para viagem dois quanto em família. Com certeza voltarei mais vezes quando vier em Foz do Iguaçu!!"
abr. de 2022,5,Lazer e compras,"Lugar maravilhosoooo e lindo! Superou nossas expectativas! O ambiente aconchegante, café da manhã delicioso e com muitas opções. Tem recreação para quem vem com os filhos! A equipe sensacional! Anderson e Fran são atenciosos, prestativos e carinhosos! Nos sentimos em casa e certamente iremos voltar com a família toda! Super recomendamos o Grande Carimã. Ah.... O quarto e super espaçoso e muito limpo! Achamos que o chão é térmico! O ar condicionado que faz um barulhinho, mas não foi um problema."
abr. de 2022,5,Vim pra lua de mel,"Espetacular, sem defeitos, cama muito confortável, atendimento de primeira, tudo muito limpo e comida incrível.  Melhor localização possível para visitar qualquer ponto turístico de Foz    Todos os funcionários educados e cordiais.    Só poderiam deixar senão de graça ao menos mais baratas as fichas do salão de jogos."
abr. de 2022,5,Excelente,"Ótimos dias no hotel. Muito bem atendidos em todos os setores. Afonso no restaurante e o pessoal que cuidam de crianças são excelentes. Obrigado Thata, Big Big, Pandinha e Perna por cuidarem de nossos filhos enquanto aproveitávamos para cuidar da gente."
abr. de 2022,5,Excelente,"Fomos atendidos no jantar pel Sr Afonso, vale destacar o atendimento dele, gentileza e educação. No geral a limpeza do hotel também é excelente e o quarto bem confortável. O pessoal que cuida das crianças é excelente. Filhos bem cuidados pela Thata, Big Big, Padilha e Perna."
abr. de 2022,5,Bom custo benefício,"Hotel recém reformado, quarto grande, bem higienizado, excelente custo benefício ( fuja dos feriados$), recomendo!  Bom também para famílias com crianças! Café da manhã bom!  Tem programação de eventos o dia todo, para quem gosta de participar… na verdade eu e meu marido, passamos o dia fora, só voltamos para dormir 😴"
abr. de 2022,5,Viagem em família,"Adorei o lugar, limpo, atendimento atencioso, excelente estrutura, um bom serviço de buffet, pessoal super simpáticos, principalmente o Sr. Afonso. Excelente lugar, recomendo e voltarei mais vezes!!!!"
abr. de 2022,5,Excelente,"Destaque para a limpeza das instalações, quart bem confortável. No jantar fomos atendidos pelo Sr Afonso que foi super atencioso e prestativo conosco.  Com certeza iremos voltar em outras ocasiões no hotel.  Outro ponto é a jacuzzi que estava bem limpa e área da piscina também"
abr. de 2022,5,Delícia de hotel,"Hotel está em transformação e é incrível ver essa mudança. Ponto alto sem dúvida dos funcionários da parte de aeb, com reforço para o Sr Afonso, sempre simpático e pronto para ajudar. Muito obrigada a todos e sem dúvida está lindo demais o hotel."
abr. de 2022,5,Bem atendido,"Procure o sr afonso no restaurante que tem uma atenção maravilhosa. Na verdade todos funcionarios estão de parabéns  Limpeza top, preço justo, qualidade da comida maravilhosa.  Os monitores e sala da criança minha filha se divertiu muito"
abr. de 2022,5,Otimo Resort,"Lugar super aconchegante, funcionários muito educados, atenciosiosos  Garçons super gentis em especial ao Sra Afonso  Voltaremos em uma nova oportunidade  Recreação infantil maravilhosa  Limpeza geral do Hotel nota 10"
abr. de 2022,5,Viajem de Páscoa,"Hotel muito bom, aconchegante, familiar e super perto das atrações turísticas.  Uma equipe de profissionais sempre dispostos a nos atender. Obrigado especial ao Afonso que nos atendeu durante nossas refeições."
abr. de 2022,5,Tudo ótimo,Parabéns para hotel tudo de bom  Garçom Afonso super atencioso e prestativo. Fomos muito bem atendido café maravilhoso e a janta melhor ainda. Voltaremos com certeza quando estiver calor porque no frio não dá certo.
abr. de 2022,5,Hospedagem,"Gostaria de avaliar a funcionária Cléo pelo excelente trabalho e atenção para com os hóspedes do hotel, muito atenciosa e muito educada! O hotel carimã é um hotel excelente e seu atendimento é melhor ainda."
abr. de 2022,5,Sexta feira santa véspera de Páscoa !,"Estou gostando muito do atendimento super indico,fui atendido pelo clovis aqui da equipe da noite do Grand Carimã , hotel super espaçoso com vários ambientes para você e sua família venha conhecer esse lindo hotel , gostei do jantar e do café da manhã sem falar nas sobremesa."
abr. de 2022,5,Foz do Iguaçu sonhado,"Vim para foz com minha mãe para comemorar seu aniversário de 60 anos, adoramos o atendimento desde o primeiro momento, tanto na recepção, como os mensageiros e pessoal do restaurante. Foram todos muito atenciosos e muito solícitos com tudo. Só tenho a elogiar. Também agradeço as camareiras, serviço do bar e se me esqueci de mais alguém, me perdoem. O hotel está de parabéns, espero que a diretoria em si reconheça os bons funcionários com um salário digno e que os trate como seres humanos, pois eles merecem."
abr. de 2022,5,Hospedagem,Gostaria de avaliar a funcionária Cléo teve uma ótima atenção para com minha família atendimento de excelência ótima recepção hotel tendo um ótimo café e barman e músicos tudo de bom super indico o hotel
abr. de 2022,5,Minha visita está sendo maravilhosa.,O atendimento foi excelente a comida estava deliciosa e variados pratos.  Realmente o jantar estava maravilhoso. Os pratos muito bem decorados. É umadivesificação de oferta. As sobremesas encandoras.  O atendimento dos garçons foi de uma prestatovlidade impressionante.
abr. de 2022,5,Viagem romântica com meu amor,"Resort com ótimo atendimento, garçons e funcionários atenciosos e educados, comida maravilhosa, ótimas acomodações, próximo a vários pontos turísticos! Queria morar aqui! Super recomendo, com certeza voltaria mais vezes!"
