Data da opinião,Nota,Título,Conteúdo
uma avaliação Hoje,1,Decepção,"Decepção total com a estadia. Quarto cheio de infiltração, nada funciona direito. Banheiro com banheira, ou seja, quem tem algum tipo de problema para entrar se lasca. Café da manhã ruim para um hotel caro e pela localização que está. Cobram até pelo gelo que pedem. Criamos uma expectativa que não foi nada atendida. Não consigo entender também sobre os hotéis colocarem água disponível em frigobar com sódio elevadíssimo."
uma avaliação Ontem,2,Impossível Voltar - Péssima Experiência,"Minha péssima experiência começou com a entrada que depois do check-in ao entrar no quarto vejo que o mesmo não tinha sido limpo, ainda estava com toda a bagunça do último hóspede. No dia seguinte, saio para passear com a família e ao retornar no fim do dia, novamente o quarto não está arrumado/limpo, tenho que solicitar a recepção para que o façam rapidamente. Mesmo com estes problemas tento aumentar em 1 dia minha estadia, mesmo o hotel estando vazio, não me deixam fazer pela mesma tarifa que eu tinha as reservas, resultado, reservei no Novotel, por um preço melhor e uma qualidade maior. No check-out, verificaram que me cobraram a menos no check-in, verifiquei que era isso mesmo e efetuei o pgto da diferença. Dois dias depois de sair do hotel entram em contato que esqueceram…"
dez. de 2022,5,UM ÓTIMO HOTEL !,"Ótima localização; quartos novos, amplos e confortáveis; chuveiro beleza; funcionários gentis e atenciosos; wi-fi excelente; café da manhã sem muita variedade, porém, satisfatório e mais do que suficiente. Recomendo muito ! Voltarei outras vezes, sem dúvida!"
out. de 2022,5,Perto da Paulista,"Ótimo hotel, com estrutura excelente. Banheira nos quartos, o que possibilita relaxar após o dia de férias / trabalho. O café da manhã é delicioso e a equipe super atenciosa. Não é tão perto da Paulista, então, prepare o Uber. Perto de Shopping e do Carrefour. Quem quer um sushi perfeito, fica perto do Mori Ota também"
out. de 2022,4,Fim de semana com Amigos em SP,Atendimento ok! Nada a reclamar. Localização Perfeita. Perto de bons restaurantes e casa nortunas. Bairro seguro. Acomodação otima. Custo benefício otimo. Muito bem cuidado. Foi uma experiência agradável.
out. de 2022,4,Básico bom,"Check in rápido , preço justo, ótima academia , frigobar bem abastecido , serviço de quarto bom e localização excelente .  Pontos negativos : café da manhã muito básico , mesas sem jogos americano ) apartamento camas de solteiro com colchão ruim , toalhas muito gastas."
set. de 2022,4,Ótima Opção próximo à Paulista,"Hotel com ótima estrutura e localização, a poucas quadras da Avenida Paulista. Atendimento muito cordial do staff. Quarto muito confortável, com mesinha de trabalho e varanda, além de banheira na suíte. Ficamos bastante satisfeitos."
ago. de 2022,5,Excelente estrutura e localização,"O atendimento é muito cordial, os quartos são enormes e bastante confortáveis e o café da manhã é ótimo. Eles possuem depósito de malas onde gentilmente acomodaram nossas bagagens antes do início da nossa diária. O banheiro é confortável e os chuveiros tem boa pressão e temperatura de água."
ago. de 2022,5,Hotel muito bom e bem localizado!,"Hotel muito bom! Ótima localização com fácil acesso à paulista, shopping, mercado e tem até um feira bem próximo do hotel. O café da manhã tem várias opções, é muito bem servido! Os quartos são bem aconchegantes e iluminados, e as camas super confortáveis! O espaço pra colocar as roupas é bem grande também! Fiquei em um quarto executivo e era bem grande. Muito bom!"
ago. de 2022,5,"Praticidade, conforto e custo beneficio","Hotel com excelente localização, perto de excelentes restaurantes, oferece conforto nos quartos, excelente atendimento, estacionamento e cafe da manha opcional e disponvel com qualidade, farmacias e mercadinhos proximos, aliado a tranquilidade do bairro."
jul. de 2022,3,Bom,"Bem localizado, mas numa região onde td é bem caro! O hotel em si é reformado... acho que poderiam atualizar mais no geral, tudo meio antigo no quarto... o café achei bem básico. Comida do restaurante razoável tbem. Atendimento bom no geral."
jun. de 2022,4,Excelente localização,"Hotel com uma excelente localização e em um bairro maravilhoso.  Pontos positivos: Gostamos muito dos funcionários, são extremamente atenciosos e prestativos e o café da manhã superbacana.    Pontos negativos: Na real não interferiu em nada nossa estadia. Mas, o mobiliário é antigo(porém, bem úteis e conservadissímos.  Tivemos dois probleminhas e foram resolvidos de forma tão rápida que não abalou em nada nosso dia e só mostrou o quanto os funcionários estão bem preparados.    Com toda certeza, voltaremos."
jun. de 2022,1,Quarto com chão imundo e o pior café da manhã que já tive o desprazer de pagar.,"Hotel caro e péssimo. Paguei R$419 na diária.  O quarto é grande, a cama barulhenta, ar condicionado velho, e o chão estava imundo, digo imundo mesmo, andei descalço e meu pé ficou preto, só varem e não passam nem pano.  O café da manhã foi uma grande vergonha, simplesmente pior que muito hotel de quinta categoria, começando pelo suco, que era suco artificial daqueles em pó, NÃO oferecem nem suco natural.  Pouquíssimas opções de pães e 1 tipo de bolo somente, não tinha manteiga, não tinha leite disponível, tive que comer sem garfo porque simplesmente não colocava, parece que não tinha ninguém pra lavar, o atendimento era péssimo, faltava 1h para encerrar o café e o cara de pau do atendente disse que estava ruim daquele jeito por conta do horário, não tinha pratos disponíveis, faltou copo, foi um caos, uma grande falta de respeito pagar tão caro por um quarto sujo e um café da manhã de hotel beira de estrada.  Nunca mais me hospedo nesta rede."
jun. de 2022,3,Não vale o preço e mofo,"O hotel em si fica bem localizado, mas infelizmente os quartos são antigos, chão com grandes desníveis, parece que você sobe e desce uma pequena montanha. Mas o pior de tudo é o banheiro com uma marca de mofo imensa. Infelizmente não vale o preço pago, quarto 1211."
jun. de 2022,3,Uma má experiência.,"O Hotel pode, mesmo que provisório, não ter um restaurante. Contudo não ter um bar, o qual no mínimo sirva um café, não tem muita lógica. É descaso com o cliente. O hotel outrora foi muito mais limpo, conservado e principalmente focado no atendimento ao cliente."
jun. de 2022,5,Excelente experiência,"Hotel com excelente localização.    Dá para ir caminhando tanto até a Avenida Paulista como ao Parque Ibirapuera tranquilamente, bem seguro.    Ao lado do hotel tem uma farmácia 24hrs e uma padaria (Santa Etienne) também 24hrs que é espetacular.    O quarto e banheiro são bem amplos e limpos e os atendentes são bem prestativos e atenciosos.    Certamente recomendo e voltarei a me hospedar."
mai. de 2022,2,A única coisa que compensa é a localização!,"A única coisa que compensa nesse hotel e a localização porque ele e muito próximo a paulista, No mais, nada vale a pena! As camas não cabem seu corpo inteiro. O hotel e bem antigo. O café da manha é pessimo. Os paes servidos são duros, Os ovos ressecados . Não ha restaurante. Sempre voce precisa pegar uber para fazer as refeições. proximos a ele nao ha farmacia, nem padaria."
mai. de 2022,2,Péssima experiência.,"O quarto é Velho, com as paredes sujas.  As camas de solteiro são muito pequenas, solicitei troca de cama de quarto mas o hotel não permitiu.  O hotel não tem serviço de quarto para refeições. O ar condicionado é velho e faz muito barulho.  Comprei pelo Decolar e não deixou claro que a compra era de solteiro."
abr. de 2022,2,Deveriam melhorar na limpeza e conservação dos quartos.,"Foi a primeira vez que me hospedei nesta rede, este final de semana que passou, e fiquei bem decepcionado.  O Quarto 107 no primeiro andar, foi desde poeira, traças nas paredes e cortinas, ar condicionado que não desliga, banheira suja que não funciona, até roupas íntimas de hóspedes caídas no telhado da piscina abaixo da sacada.  Mandei Fotos no e-mail encontrado no site para efetuar reservas, porém sem retorno.  Decepção total!"
mar. de 2022,2,Não vale,"A localização é boa, mas os pontos positivos param por aí. A sensação é de que o hotel está bem largado e sem manutenção. Quartos mal cuidados, com acabamentos já aos pedaços. No mais, a toalha é ruim, as cobertas são finas, o atendimento é pouco educado e despreparado."
nov. de 2021,1,Decepcionante,"Hotel em decadência, tv que sai fora do ar, banheiro com banheira velha e chuveiro baixo. Quem é alto não toma banho direito. Idoso ou quem problema de mobilidade não deve ficar lá. No café da manhã peguei um prato sujo, o café era horrível e meu marido pegou um pão achando que tinha açucar de confeiteiro. Ledo engano, era farinha, muita farinha branca em cima do pão.  Nos decepcionamos pois conhecemos outros qualitys que é bem melhor que este."
out. de 2021,2,Péssimo atendimento e compreensão.,"Acabei de chegar (13h15) com meus pais idosos de 75 anos para o checkin, a Recepicionista disse q só poderia fazer as 14h, tentei com muita gentileza pedir que ela me antecipasse em exatamente 45 min, a mesma me informou que somente poderia fazer se eu pagasse meia diária, tentei argumentar mas a mesma foi inflexível.    Decepcionado com esse atendimento."
out. de 2021,1,Hotel caríssimo e pessimo,"Hotel péssimo, cheiro do quarto de coisa velha, mofada, sofá encardido, lençóis cheiram a pura cândida. Pra ajudar tem um sensor no quarto que fica piscando a noite toda, parece uma balada, não te deixa dormir. Barulhento. Atendimento ruim na recepção, muito lento, pouco automatizado, não acham sua reserva, não tem check in online."
set. de 2021,4,A limpeza podia ser melhor,"Bom quarto, espaçoso, porém bem antigo. Achei que a limpeza dos banheiros poderia ser melhor vaso sanitário e azulejos encardidos.    Roupa de cama e cama de boa qualidade, possui uma sacadinha que ventila bem o quarto, café da manhã bom, com poucas opções mas suficiente para começar o dia.    Bem localizado, perto de bons shoppings e vários locais para ir a pé."
set. de 2021,3,Minha única reclamação é o café.,"Não sei se eu dei sorte, mas minha única reclamação com este hotel é o café da manhã, que de fato é fraco. Não há variação dos itens, que por sinal são bem poucos. Já viajei bastante e o café do Quality Jardins é bem sofrível. De resto, não tenho queixas. O meu quarto estava bem limpo e foi limpo pela camareira todos os dias da minha estada, com a troca inclusive de toalhas e roupa de cama( o que achei curioso isso ocorrer em tempos de pandemia). O quarto aliás é espaçoso e confortável, não tenho queixas. Não tenho queixas também com relação ao atendimento de modo geral."
ago. de 2021,2,Triste!,"Considerando que os quartos são ok, apesar da manutenção não estar a contento, nos passou a ideia que esta unidade está em decadência ou prestes a fechar. Restaurante sem taças de vinho e com itens faltantes do cardápio. Os funcionários visivelmente constrangidos, mas tentando atender sem estrutura.  Qualidade da refeição disponível estava ruim."
jun. de 2021,2,HOTEL PARA ANÕES!,"Com todo o respeito a quem tem inanição, este hotel deveria reduzir os preços de suas diárias, pois atende um público de pessoas com menos de 1,60 de altura. Não existem camas Queen ou King nos apartamentos. O banheiro tem uma ducha na parede com uma pequena banheira dentro do box, o que dificulta até mesmo a entrada de pessoas idosas e obesas. Se você é grande como eu, ainda consegue tomar banho inclinando o tronco. De bom tem o café da manhã. Mas ... desconforto é imperdoável"
jun. de 2021,2,Hotel velho e quarto terrível,"Estamos chocados com a falta de qualidade em tudo. O quarto com cara de velho, cortinas sujas e fedidas, aparência do quarto péssima. Banheiro cheio de limbo, uma televisão que é velha com imagem de péssima qualidade. Roupa de cama e toalhas com cheiro de limpeza ruim.  Não tem roupão, edredom para um dia frio. Simplesmente fora do esperado! Não vale!"
mai. de 2021,3,Poderia melhorar e muito o café da manhã.,"Deixou a desejar no café da manhã. Pela categoria do hotel, localização, etc, pensei que fosse um buffet que representasse a marca. Mas me decepcionei. Em relação ao café, não indicaria o hotel. Fiquei em uma cama de casal que o colchão estava via isso, com declive enorme, o que atrapalhou a qualidade do meu sono. Nos demais quesitos, vale a pena."
mai. de 2021,1,Pior café da manhã que já vivenciamos,"Pior café da manhã que já tivemos, passamos no máximo 15 minutos no café por não ter variedade. O hotel acha que os clientes só comem pão. Só dava variedade daqueles pães bolinha. Fizeram massinha de mini panquecas mas esqueceram o que íamos colocar na panqueca, coloquei no prato mas não havia com o que comer. Os ovos estavam frios. O pão francês disponível em pouca quantidade estava duro e branco, quando fomos tentar ver se apareceu algo de diferente notamos que o pão francês já não tinha mais e não foi reposto. Havia frios, manteiga, sucos, e pouca variedade de frutas. A máquina do café só havia opção de curto e longo e água somente. A salsicha cheia de folhas de louro e fria, e havia uma “torta” de “frios” casca dura, fria e acredito q era ( sabor frios) pq nem dividindo ao meio a “torta” dava pra identificar frios na mesma. Apenas um atendente para recolher os utensílios, ir à cozinha levar, voltar para abastecer, ou seja era muita coisa, o rapaz coitado trabalha por 3 ali. Enfim não adianta ter o quarto legal, atendimento ok, e o café da manhã péssimo. O hotel tem que pensar como uma engrenagem “uma pecinha depende da outra”. Se a pessoa quiser ir ao hotel só pra dormir e ir embora ok, mas definitivamente se quiser viver a experiência de um hotel não é esse que ela vai experimentar o que é realmente. E coitado de quem for pela primeira vez em um hotel e experienciar isso e achar que atendimento de hotel é assim pq não é, já tivemos experiência em o  Hotel até mais um pouco mais simples que esse onde o café da manhã não deixa nada a desejar. Estava incluso no valor mas vimos q se fosse pagar sairia 28 por pessoa e não vale nem 10 reais ."
mai. de 2021,5,excelente,"excelente serviço levando-se em consideração a uma estadia de trabalho, conseguiu manter um padrão de qualidade, mesmo na vigência de pandemia, que compromete os serviços de forma geral, altamente recomendado"
mai. de 2021,3,Deixa a desejar,"Quarto limpo e confortável, café da manhã bacana. Wi-fi não funciona, precisava fazer login a cada cinco minutos e mesma assim mal mandava uma mensagem no WhatsApp. Tomadas com padrão antigo e não tinha adaptador disponível."
mai. de 2021,1,NÃO EXISTE RESPEITO COM A SAUDE E BEM ESTAR DO HOSPEDE,"Não solicitei arrumação e troca do frigobar para evitar foco de contaminação do COVID, mesmo assim no quarto dia em uma descida rápida a recepção a funcionaria em minha ausência se achou no direito de entrar no meu quarto, não havia no quarto nada para higienizar (Álcool, Agua Sanitária, Lysoform...). Fiz contato com a recepção e fui ignorada, no CHECK OUT o funcionário quis deixar de cobrar 2 cafés da manhã como forma de resolver o que ele classificou de aborrecimento.  Fiz questão de pagar e não pretendo voltar a esse hotel!  A parte mais interessante é que um dia antes do ocorrido eu comentei com esse mesmo funcionário da recepção o quanto é fácil e rápido o contagio do COVID e que meu irmão que trabalha em home office estava em estado gravíssimo na UTI por causa de COVID."
mar. de 2021,5,excelente,Ótimo. Quarto muito limpo e conservado. Atendimento excelente do check in ao check out. Comida e café da manhã muito bom restaurante com preço justo. A única observação é que tenha uma cafeteira no quarto. De resto tudo perfeito
mar. de 2021,5,Perfeito!!,"Quarto grande, cama extremamente confortável, localização perfeita e café da manhã muito bom. Com certeza voltarei a me hospedar nesse hotel. Pena que foram apenas 2 diárias.  Não tenho nenhum defeito pra relatar aqui!"
fev. de 2021,3,Pode melhorar,"O atendimento de maneira geral foi excelente, mas o conforto do quarto não foi bom. Até me surpreendi por conta do padrão de outros hotéis da rede, mas o quarto não estava a altura. Precisam melhorar/reparar."
fev. de 2021,3,regular,"Precisa de melhorias na tv ainda de plasma e canais digitais de baixa qualidade, e nas tomadas do quarto e principalmente no café da manha pão dormido ou murcho no café é inadmissível em um hotel deste nível ! serviço de quarto atendimento sem muito cordialidade e prato chegou frio ! batatas murchas !!"
jan. de 2021,4,estadia,Minha hospedagem foi curta mas suficiente para notar limpeza e conforto do quarto. O atendimento foi muito bom. Variedade do café da manhã também foi muito boa. Meu incômodo foi apenas com copos e talheres servidos no café da manhã que estavam sujos de comida e iogurte de pessoas que usaram anteriormente
jan. de 2021,4,Ótimo atendimento e bom custo-benefício.,Atendimento impecável. Funcionários muito prestativos.  O quarto é antigo mas confortável. Banheiro limpo com bons amenities e toalhas macias.  A variedade no café da manhã deixa um pouco a desejar.  Ótima localização.
jan. de 2021,5,Muito bom o Custo/Beneficio,"Ótimo hotel para quem trabalha, custo/beneficio muito bom! Café da Manhã bem completo, atendimento educado e rápido, internet gratis bem boa, room service eficiente, ótima localização, vários restaurantes pertinho!"
jan. de 2021,1,Hotel velho e defasado !,Quarto com Ar condicionado com funcionamento precário. Passamos calor a noite toda. Reclamei mas não adiantou. Café da manhã péssimo. Nem parece um Quality. Nunca mais volto. Não recomendo. Parece que foi abandonado
jan. de 2021,4,"Atendimento excelente. Num geral, o hotel é bom","Hotel muito bom, com funcionários excelentes, porém necessita de alguns ajustes. Como a disponibilidade dos itens no cardápio, tal como a sua variedade (achei bem básico e com poucos itens), a luz na varanda e o aproveitamento da área da piscina fará um diferencial."
jan. de 2021,5,Ótima experiência,"Hotel muito lindo, funcionários extremamente atenciosos, por conta da pandemia não houve a lmpeza diaria no quarto então, tivemos que tirar um tempo de nossa estadia para podermos organizar e limpar, café da manhã muito bom."
jan. de 2021,3,Deixa a desejar,"Fiquei muito incomodado, é um hotel 100% não fumante.  O vizinho de meu apto fumava muito. A fumaça invadia meu apto.  Mesmo pedindo para o vizinho não fumar e reclamando diversas vezes na recepção, não resolveu, ele fumou durante os 7 dias que fiquei ao lado do seu apto.  Apesar de termos que assinar um dcto no check-in sobre não ser permitido fumar, tem aquele que fuma e não tem ninguém que o faça seguir a regra de hospedagem."
dez. de 2020,3,Mediano,"Banheira suja, quarto com piso muito desnivelado e equipe pouco prestativa com transporte de bagagens. Comparando com hoteis da mesma categoria esta um pouco a baixo da média, porém, ainda está bem acima dos hoteis com 3 estrelas."
dez. de 2020,5,Ótimo custo-benefício,"O nosso quarto estava super limpinho, a equipe foi extremamente prestativa e solícita.  Ótima localização e o café da manhã era delicioso. O preço da diária é muito justo pelo que o hotel entrega a seus hóspedes.  Com certeza nós hospedaríamos de novo no Quality!"
dez. de 2020,5,Avaliação do Quality na Alameda Lorena,"Otima opção para hospedagem em São Paulo. Bom atendimento, boa limpeza e boa disponibilidade de recursos no hotel. Quarto agradável e confortável. Bom atendimento, e café da manhã adequado. Repetirei se possível."
dez. de 2020,5,Confortável e com bom atendimento,"Hotel bonito, confortável, com profissionais que prestam excelente atendimento. Os preços praticados são justos, considerando a categoria do hotel. Apesar das limitações de frequência de limpeza impostas pela pandemia, o lugar é bem cuidado e limpo.  O custo-benefício é bom."
dez. de 2020,5,avaliação da estadia,"tudo impecável, café todo fracionado a fim de evitar contaminação pelos utensílios, recepcionistas extremamente atenciosos, quarto espaçoso e confortável, chuveiro com variação de temperatura e jato forte, itens do frigobar variados, tudo muito bom!"
nov. de 2020,4,"Muito bom, unico problema foi a porta e o interruptor","Hotel em perfeito estado, mas o interruptor e a porta que deixaram a desejar. O interruptor muito longe e em um local que não condiz muito e a porta de entrada possui um vão muito alto, assim dando para ouvir tanto quem fala de dentro quanto quem fala de fora."
nov. de 2020,3,Bom custo benefício,"O hotel fica bem localizado e a equipe como um todo é cordial e educada. Entretanto, alguns pontos merecem destaque: ao realizar solicitações básicas através do telefone como shampoo, copos, demoravam bastante e era preciso retornar o contato para cobrar maior celeridade. Ao tentar utilizar a piscina, estava imprópria para o banho, pois o revestimento estava com bastante lodo, sinal de que não é limpa com a frequência adequada. A mobília do quarto apresenta sinais de desgaste."
nov. de 2020,4,...,"local muito bem localizado, quartos muito confortavel, atendimento excelente, faltou um pouco de limpeza na piscina, e a academia não estava funcionando devido a pandemia, no mais tudo ok.  recomendo ..."
nov. de 2020,5,otimo,"muito bom , limpeza otima , cama otima , cafe da manha maravilho , todo cuidado com o higiene por conta do covid , a vista do ap que me hospedei muito bom , o atendimento tanto na chegada e na saida.."
nov. de 2020,4,Bom custo benefício,"O Hotel possui uma ótima localização. Os funcionários da recepção são muito prestativos. Café da manhã é básico, mas gostoso. Chuveiro bom. Limpeza dos quartos, nesse período de pandemia, não está sendo feita todos os dias (mas pode ser solicitada)."
nov. de 2020,5,Excelente,"Excelente hotel e ótimo atendimento de todos os funcionários, todas as exigências sanitárias cumpridas, e mesmo com as restrições ainda sim conseguiram suprir todas as necessidades, inclusive o ótimo café da manhã."
nov. de 2020,4,APROVADO,"Ótimo atendimento, Excelente localização, próximo a restaurantes, farmácia, mercado e etc.  Devido a pandemia não usamos a área de laser. (Piscina, academia e etc).  O café da manhã estava sendo servido de acordo com as regras do combate a pandemia. mas de boa qualidade especialmente o croissant."
nov. de 2020,3,Bom mas pode melhorar,"Bom custo beneficio, mas a estrutura do hotel tem que melhorar (cama, armários). Os atendente são muito atenciosos. A localização é ótima, tem várias coisas próximas. O café devido a pandemia estava bem fraco e reduzido."
nov. de 2020,1,Equipe despreparada,"Equipe muito mal educada e café da manhã com pães duros (pães de queijo e o outro). Pouca opção de alimentos no café, bem fraco para valor pago. Precisam melhorar muito (a desculpa é o COVID-19). Sobre a equipe, não ajudam em nada. Fiz reclamação formal no Reclame Aqui."
nov. de 2020,1,Limpeza péssima.,"Ao chegar no quarto não foi realizada a limpeza, sem retirar lixos, sem reposição de itens higiênico e etc. Ao falar na recepção fomos informados que a limpeza era realizada acima de 3 diárias, um absurdo."
out. de 2020,4,Muito agradavel,"me hospedaria novamente, devido a gentileza dos funcionarios e quartos arejados, somente o cafe da manha que achei um pouco limitado, talvez pelo problema daCovid, no mais me senti bem cnfortavel, sendo o ambiente bem silencioso"
out. de 2020,3,Razoável! Valeu pelo custo-benefício,"O hotel é muito bem localizado, entre o centro e o Jardins, bairro muito tranquilo e seguro. O quarto e o banheiro são bem espaçosos. Os funcionários são gentis. A cama não estava confortável, precisa de renovar. A acústica do quarto é ruim. O café da manhã repetido e com pouquíssimas opções. A pandemia já não é mais motivo para justificar a falta de opções. Quatro dias hospedada e foram as mesmas coisas sem nenhuma variação. No entanto, o valor da estadia teve um bom custo-benefício. No geral foi satisfatório, com exceção do café da manhã."
out. de 2020,1,Sem vedação ( acústica,"Sem vedação acústica nenhuma, muito Barulho da rua no quarto, me hospedei décimo andar, quarto 1005.  Sem condições de dormir, além da rua tbm no andar de cima , portas batendo não recomendo !  Não dormi nada"
out. de 2020,5,Localização,Excelente localização! Perto da Av. Paulista. Café da manhã com boas opções e seguindo os protocolos de segurança por conta da pandemia. Quartos muito bem limpos. Funcionários muito educados e simpáticos.
