Data da opinião,Nota,Título,Conteúdo
out. de 2015,4,hotel sofisticado,"é um dos meus hoteis favoritos . Ambiente agradável, excelente acomodaçoes, único ponto é o atendimento que precisa melhorar. tem uma vista maravilhosa e proximo de tudo com certeza valeu cada centavo"
out. de 2015,4,Boa relação custo-benefício,"Hotel novo. Boas instalações. Bem localizado, apesar de estar em uma avenida, não tivemos problemas com barulho. A limpeza deixou um pouco a desejar, porém a cama era muito confortável. Café da manhã bom. Ótimo atendimento."
out. de 2015,5,Excelente,"Hotel excelente, ótimo atendimento, tudo muito confortável e limpo, quarto e banheiro bem aconchegante, ar condicionado e café da manhã maravilhoso, recepcionistas solicitos e prestativos ! Parabéns !"
out. de 2015,5,Tudo que se espera de um bom hotel,Quarto limpo silencioso equipado bom chuveiro Internet boa restaurante limpo com bom café da manhã boa comida no jantar ótimo atendimento dos funcionários perto do meu local de trabalho enfim tudo que eu preciso.
out. de 2015,5,UM HOTEL POETIZADO,"UM HOTEL POETIZADO...  Nas paredes Drummond conversa com Adélia Prado... Guimarães Rosa cochicha com os hóspedes...""FELICIDADE SE ACHA É EM HORINHAS DE DESCUIDO..."" Se possível no Hotel Ramada.  Atendimento caloroso e eficiente; ótima localização; higiene, conforto e comodidade, aconchego e preço muito acessível. Eu recomendo."
out. de 2015,5,Ótimo,"Muito boa localização, bom atendimento e boa limpeza. Café da manhã maravilhoso com um bolo de chocolate com avelã divino.  Ótimo lugar para passar as férias e descansar. Com um ótimo shopping em frente."
out. de 2015,4,Muito bom,"Muito bom hotel, recomendo. Pela única diária que tive, fui muito bem atendido e os serviços prestados foram ótimos. Café da manhã bem servido, perto de shopping com grande praça de alimentação, ponto de ônibus, etc."
out. de 2015,3,Mediano,"Pelo custo da diária poderia servir mais, como garagem, academia, abastecimento do frigobar, com certeza gastaria mais sem sair do local. Melhorar o atendimento. Quanto a limpeza do quarto parecia que era varrido há muito tempo, Piso sujo mesmo."
out. de 2015,4,Limpo !! Bem receptivo !,É um hotel bem localizado com fácil acesso aos principais pontos de BH. Próximo à shoppings center e a excelentes barezinhos. A limpeza do hotel é muito bem feita !! Nunca tive problemas com a higiene no local. É uma pena que as vezes existem hóspedes ignorantes que fumam no corredor dos quartos e conseguem atrapalhar até o sono.
out. de 2015,5,Perfeito,"Boa recepção, tudo muito limpo, cama extremamente confortável, tecnologia de acesso fácil e inclusivo, atendimento atencioso, café da manhã maravilhoso, sistema de aquecimento de água no chuveiro e torneira muito bom e o valor da diária bem em conta, ótimo custo benefício. Enfim, hotel excelente!"
out. de 2015,5,Qualidade e bom preço,"O hotel fica bem localizado apesar de fora do eixo centro-sul. Mas de carro, em 10 minutos chega-se ao centro de Belo Horizonte. O hotel fica dentro de um shopping de coisas para casa. Em frente há um bom hipermercado e um outro shopping com boas lojas e cinemas. Sempre há um food truck na porta do prédio que vale muito a pena conferir."
out. de 2015,5,Super clean,"Hotel super clean, moderno e aconchegante. Os apartamentos são ótimos e em cada um deles frases frases de pensadores, escritores ou músicos.  Tenho certo trauma com chuveiro de hotel e esse foi surpreendente. Houve um pequeno contratempo com água que vazou do box, mas rapidamente atendido pela equipe de manutenção. O buffet de almoço e jantar é simples e muito bom! Café da manhã idem.  Equipe muito atenciosa.  Vale dizer que a internet no apartamento funciona muito bem. Em todos os dias de hospedagem não precisei ficar reconectando na rede."
out. de 2015,5,Viagem de Negócios,"Hotel distante do centro da cidade de Belo Horizonte, mas a 900 metros do Minas Shopping.  Instalações novas, com um restaurante muito bom e com preço ótimo.  Café da Manhã repleto de variedades e incluso na diária."
out. de 2015,4,Ótimo custo-benefício,"O hotel oferece quartos grandes. Gostei de oferecerem um boiler com sachês variados de chás. O café da manhã é bom, com opções relativamente variadas. Hotel muito limpo, com uma localização próxima ao Minas Shopping e à bares. Não gostei de ter que pagar a diária para estacionar no shopping (17 reais). Por fim, com o custo do estacionamento, o custo-benefício se equivale a outros hotéis da região. O atendimento é bacana, mas poderiam ter uma forma mais rápida de se realizar o check-out. Para quem viaja a negócios, é uma boa opção."
out. de 2015,4,Ótima localização para turistas!,"O melhor desse hotel é a localização! Fica colado ao Minas Shopping, supermercado, restaurantes e linha expressa de ônibus. Tem uma ótima vista da cidade! Achei estranho que não tinha armário no quarto, mas tinham cabides. Bem limpo, cama confortável, atendimento excelente, local seguro e iluminado nas proximidades. Apesar de ficar perto de uma das principais vias de BH é silencioso. Café da manhã razoável. Wi-fi Grátis no quarto!"
out. de 2015,5,Ótimo hotel,"Fui muito bem recebido e o ambiente muito confortável. Gostaria só que no café da manhã, fosse acrescentado opções de bolos. Recomendo para todos este hotel. Tudo cok muito primor. Mas no geral nota 10."
out. de 2015,4,Muito bom,"Localização, conforto, limpeza, café da manhã, sem barulho, perto do shopping. Atendeu manhãs necessidades e espectativas . Recomendo para quem procura tanto a negócio ou turismo.  Além da localização a facilidade de estacionar no próprio prédio."
out. de 2015,5,viagem a passeio,"excelente hotel, atendimento cortês, com boa localização, fica próximo a shopping, com linha de ônibus em frente. O quarto tem um tamanho bom, a cama é confortável. o serviço de limpeza é eficiente. apenas o café poderia ter uma maior oferta de itens."
out. de 2015,5,Excelente custo beneficio!,"Hotel novo e quartos confortáveis. Superou minha expectativa. A chaleira disponível nos quartos permite o preparo de chás e café solúvel. Muito bom. O hotel ainda oferece 2 águas como cortesia. Mesa ampla com régua de tomadas, boa para quem precisa de trabalhar. Excelente iluminação. Para quem pensa em alugar carro, o hotel conta com um guichê da Movida, que pelo 0800 oferece preços atraentes."
out. de 2015,5,acolhedora e tranquila,"Utilizamos para fins de reunir vários membros da familia de outros estados( Brasilia, Rio,Vitoria, Goias para participar do casamento do meu filho carioca com uma mineira e o hotel atendeu plenamente as nossas expectativas e todos os sentidos e fomos muito bem atendidos e quando puder retornarei com certeza."
out. de 2015,5,Excelente,"Hotel muito bom mesmo, cafe da manhã bom, o ruim apenas é o estacionamento que é cobrado a parte , mais o restante nao tem o que reclamar, funcionario educados, higiene e arrumação muito boa, um otimo hotel"
out. de 2015,3,Regular,Atendente da recepção simpático e resolutivo!! Atendentes do café pouco educados! No primeiro dia faltavam 30 minutos para termino do horário e começaram a recolher os pratos e a varrer somente nossa mesa
out. de 2015,5,Novo e prático,"Ótimo hotel, tudo novo, café da manhã muito bom, horário de almoço e jantar curto apenas duas horas de duração, mas tem lanches e comida congelada 24 horas.  Bem localizado e em frente a dois shoppings!  Muito legal a questão dos adesivos espalhados por todo o hotel, diferente e inovador!!!  Wi-fi funciona muito bem dentro dos quartos e por todo o hotel, inclusive fora!!!"
out. de 2015,2,decepção,"Fui a BH em julho de 15, Fiz uma reserva pelo booking para 4 pessoas, 2 adultos e 2 crianças. Ao chegar lá, o hotel estava lotado e me disseram que só tinham um quarto com UMA CAMA, que além disso, nem era king size...sequer era queen...devido à prova do TRT, não havia mais nenhum hotel disponível na cidade. Tive que colocar um edredon no chão e tentar ajeitar uma cama para meu filho dormir..MUITA DECEPÇÃO, PQ NÃO FOI ISSO QUE RESERVEI E NÃO FOI POR ISSO QUE PAGUEI. O café da manhã é bem simples, tipo Ibis. Se fizer reserve nesse hotel, atente para o fato de que o quarto é bem pequeno e a cama é padrão 1,88m."
out. de 2015,5,Poético,"Gostei muito do hotel. Bonito, limpo, com bom café da manhã e bom atendimento. Fica ao lado de outro grande hotel e bem próximo a um bom shopping. Vindo do aeroporto de Confins tem um ônibus executivo que deixa na frente. De taxi até o aeroporto de Confins saiu em torno de uns 75/80 reais pelo Uber."
out. de 2015,4,"Novíssimo, moderno e de bom gosto","Praticamente, apenas pernoitei no Ramada Encore Minascasa Belo Horizonte. Porém, foi suficiente para perceber que é uma excelente opção em Belo Horizonte. Ao lado do Ouro Minas, Minas Shopping, Oitava Igreja Presbiteriana e com importantes rodovias em seu entorno, o hotel está muito bem localizado. Recepção aprazível. Café básico, mas de qualidade. Funcionários educados. Quarto impecável e moderno... Confortável. Preço acessível. Com certeza voltarei a esse hotel de muito bom gosto. Valeu a pena."
out. de 2015,5,Muito bom,"Hotel muito bom, ótima localização quase em frente ao shopping Minas, ótimo atendimento, funcionários muitos educados e dispostos a ajudar, tudo muito limpo e organizado, apartamentos com com frigobar, ar condicionado, chuveiro elétrico e TV. Café da manhã bem variado, muito gostoso e almoço a lá carte. Uma coisa que gostei bastante foi a disposição de cofre no apartamento. O que não gostei foi a lixeira do banheiro que precisa pegar pra levantar a tampa. O mais está ótimo."
out. de 2015,4,Bom Hotel,"Gostei da qualidade do café da manhã. Assim como ter um shopping center nas proximidades. Por ter a estação Minas Shopping bem em frente ao hotel, fiz a maioria dos meus deslocamentos de transporte publico (só evitei a hora do rush)"
set. de 2015,5,maravilhoso,"O hotel é afastado do Centro da cidade, mas rico em opções de transporte.  Equipe super prestativa e quartos excelentes.  Estacionamento amplo.  Convênio com academia em frente a recepção.  Dois shoppings um hiper mercado e uma churrascaria a distância museu uma pequena caminhada."
set. de 2015,4,Muito bom,"Atendimento gentil na chegada. O quarto é amplo com cama king, roupa de cama muito boa e limpa, banheiro bom e limpo. O local é de fácil acesso e muito perto de um Shopping com um Hiper mercado Extra. Também fica do lado do shopping Minas Casa onde vc encontra muitos objetos de decoração."
set. de 2015,4,Bom hotel,"O hotel tem um infraestrutura legal, quartos confortáveis. Não está localizado ao centro, mas também não está longe. Tem ônibus que passa praticamente na porta. Fica perto do Minas Shopping e da estação de metrô."
set. de 2015,4,Muito bom hotel,"Muito bom hotel, recomendo, e um preço justo ao serviço prestado. Boa localização, vários meios de transporte perto e a comodidade de um shoping à porta, recomendo aos usuários trip avisar. Boa viagem e até lá."
set. de 2015,4,Custo benefício,"O Hotel tem um bom custo/benefício e está bem localizado, próximo a região da Pampulha. Os quartos são bem espaçosos e confortáveis. Tem ótimos restaurantes próximos, com opções desde fast food até churrascaria."
set. de 2015,5,Maravilhoso!,"Gostei muito de todos os serviços.Achei um hotel bem localizado, com uma equipe bem gentil, e bem eficiente. Recomendaria a outras pessoas por ser um hotel que é básico, prático e que matem a qualidade em todos os sentido, Parabenizo a todos da equipe."
set. de 2015,5,Excelente!!,"Hotel novíssimo, muita qualidade pelo preço baixo, perto do minas shopping e vários restaurantes!! Café da manha mto bom pelo preço, e de quinta a sábado tem Food truck dentro do shopping!! Com certeza voltaria!!!"
set. de 2015,5,Final de semana,"Hotel excelente, bem localizado ótimo café da manhã Único ponto negativo é o valor do estacionamento 17$. Quartos novos bem confortáveis. Frigobar, ótimo restaurante, localizado em ótima região de BH. Recomendo, voltaria a mesm hospedar nestes hotel."
set. de 2015,5,Top,"Preço justo, café da manhã impecável, com variedade, apresenta produtos para compra na recepção com muita variedade e cama perfeita pro sono! Localização excelente. Não tem academia mas oferece parceria com a rede Malhação que é sensacional!"
set. de 2015,5,Muito Bom!,"O melhor hotel de BH! Localização TOP, ele fica dentro do completo minascasa que tem padaria, lojas e caixas eletrônicos. Além disso a Movida Rent a Car fica dentro do hotel. Na frente do hotel tem uma shopping gigante e um Extra 24 horas.  Famarcia fica a rua ao lado."
set. de 2015,5,Perfeito,"As acomodações e o atendimento são fiéis a descrição. Tudo novinho e muito bem limpo. Utilizei duas diárias no fim de semana juntamente com meu marido, e foi perfeito.O café da manhã tb é excelente e até no limite do horário tem tudo novinho, com muita variedade e farto. A tv a cabo funciona perfeitamente, e o wifi também, utilizamos tanto no notebook quanto no celular e é super rápida e o sinal é ótimo. A localização é excelente também, em frente ao minas shopping, lá encontramos tudo que precisamos de alimentação e compras.  Excelente local.  Indico e volto."
set. de 2015,5,Hotel novo,"Excelente hotel, apartamentos novos, bem decorados, cama maravilhosa e boa localização. Vale ressaltar que o hotel não possui academia e nem piscina. Única coisa que não gostei foi que no café da manhã eles servem sucos industrializados."
set. de 2015,5,Ótima,"Muito bem hospedado , recomendo a todos q me perg d um hotel en bh , apartamento otimo todo bem instalado , nao tem o q reclamar .  Vou recomendar a todos e faz bons elogios a escolha q a empresa fez pra minha estadia en bh"
set. de 2015,5,Ótima relação custo x benefício,"O hotel é moderno e localizado ao lado de um hotel que realiza eventos, sendo uma boa opção de hospedagem com excelente relação custo x benefício para quem vai ficar naquela região. Recomendo pelo conforto e preço."
set. de 2015,5,"Muito conforto, quartos amplos e café da manhã de cinema","Muito conforto, quartos amplos e café da manhã de cinema! Muito bem localizado com vista para Lagoa, perto de tudo em Lagoa Santa, piscina com hidro, academia, bar, restaurante. Próximo a pontos turísticos como a serra do cipó!"
set. de 2015,5,Eficiente,"Muito boa, funciona rios educados, quartos ótimos, cafe da manhã muito bom, a internet boa, sono agradável, cama muito boa, conforto, localização ótima, não tive aborrecimentos com certeza irei mais vezes!!!"
set. de 2015,4,Ótima relação custo/benefício,"Hospedei-me neste hotel numa viagem a trabalho e tive uma grata surpresa; os quartos, apesar de pequenos, oferecem todo o tipo de amenities e são bastante bem equipados. O café da manhã é gostoso e bem variado, e os serviços são atenciosos.  Gostei bastante!"
set. de 2015,4,Hotel funcional e com qualidade,"O hotel está novo com quartos confortáveis e bem estruturados, boa bancada de trabalho, camas confortáveis, banheiros limpos, e cafés e chás à disposição - o que ajuda a trabalhar bem. As equipes de recepção, café da manhã e limpeza são ótimas, bastante simpáticos, gentis e eficientes.Os andares (quartos) são temáticos com destaque para as características de Minas: música, arte, poesia, futebol, etc.. Com isso, tem-se uma frase interessante por tema espalhado por todo hotel."
set. de 2015,5,praticidade e muita economia,"Este hotel é excelente para quem pretende se hospedar sem muito luxo e com conforto e praticidade . Estive num congresso no Hotel Ouro Minas( maravilhoso!!!) só que eu queria gastar bem menos e daí a solução perfeita foi o Ramada que fica exatamente ao lado do outro(quase interligados). Para quem quer malhar tem uma super academia conveniada, que vc paga apenas R$15,00 e fica super a vontade...muitos equipamentos msm.  O café da manhã é delicioso com muitos pães, bolos, sucos, enfim tudo que amamos...e pão de queijo, claro! Possui frigobar completo na recepção, inclusive menus congelados para refeição no local. Restaurante bacana até as 23h.  Saindo de Confins tem um onibus que te deixa nele mas para retornar ou sair para o centro só taxi. Muito próximo do shopping Minascasa e outro bem grande com muitos restaurantes. Valeu muito a pena a estadia no Ramada."
set. de 2015,3,localização próxima ao Ourominas,"O hotel é novo e confortável, também gostei do café da manhã. Entretanto, a região é distante do centro (35-40 reais táxi até Savassi ou Pampulha), e presenciei um furto na passarela que atravessa a avenida até o Minashopping. Como eu participei de um evento no Ourominas, achei o valor acessível e o hotel bem conveniente. Se a intenção for passear em BH, prefira um local mais central."
set. de 2015,5,Muito Boa,"A única coisa que senti falta foi do abastecimento do frigobar, fora isso, café da manhã justo e a higiene do quarto é muito bem feita.  Mas não é no centro de Belo Horizonte.  A atendimento dos funcionários é ótimo, equipe simpática e prestativa."
set. de 2015,5,Excelente Custo Benefício,"Fui numa viagem muito rápida a Belo Horizonte, de um dia, mas o hotel me conquistou. Cheguei muito antes do horário do check-in, como outros hóspedes, e o hotel permitiu que nós fossemos para os quartos antes do horário programado, o que foi excelente. Há um ônibus que sai do aeroporto e para a poucos do hotel, peça ao motorista para parar no ponto do hotel Ouro Minas, que é vizinho ao Ramada. Há um shopping há uns 800m do hotel, sendo uma boa opção para refeições"
set. de 2015,5,Tranquilidade,"Recomendo o Ramada, tirando a localização que não é na área central de BH, o atendimento é de primeira, limpeza ok, o café e o jantar(que maravilha), várias opções de delivery a noite (se preferir), fora a tranquilidade dos quartos, estão de parabéns!!!"
set. de 2015,4,EnANPAD 2015,"Excelente tratamento pelos funcionários. Ótima localização com Shopping em frente ao hotel e ruas com bares ao redor. Custo-benefício ideal. Fui tratado de forma excellente pelo staff do Ramada durante minha estadia (12/9) até (16/9),"
set. de 2015,5,Excelente!,"Tudo Maravilhoso do começo ao fim! Recepção muito amigável, Apartamento super limpinho e aconchegante, fica em uma ótima localização (perto do shopping). Com certeza quando retornar a BH me hospedarei novamente!"
set. de 2015,5,Ótimo,"Hotel ótimo, atendimento perfeito, voltaria e recomendaria para qualquer pessoa, camas confortáveis, banheiro limpo quarto também, água do chuveiro quentinha. Adorei o hotel nota 10. Ar condicionado bom, localização boa,"
set. de 2015,4,Boa hospedagem,"Participei de um congresso no hotel ao lado - Ouro Minas - então este hotel se mostrou muito interessante pois só precisava dar poucos passos para estar no evento cientifico. Bom café da manhã. Internet gratuita mas caía a toda a hora. Bom quarto e boas amenidades. Uma falha terrível que coloco na foto... escreveram errado, em um dos objetos de marca do hotel, a palavra ""simplismente""... deveriam trocar todas para manter uma boa imagem"
set. de 2015,5,Excelente hotel,"Hotel muito agradável e aconchegante, com funcionários hospitaleiros e atenciosos. O apartamento é novo com cama king size e a Internet Wi-Fi é ótima, a única coisa que poderia ser melhor é a quantidade de canais na TV a cabo."
set. de 2015,5,Ótimo custo-benefício.,Ótimo atendimento e hotel muito bem localizado. O café da manhã é muito bom pelo valor do hotel. É perto de ruas com barzinhos e não muito longe do centro e outros pontos turísticos de BH. Recomendo conhecerem.
set. de 2015,5,Excelência,"Os atendentes sempre dispostos e prontos no atendimentos as demandas;  Exemplo de organização, limpeza e higienização dos ambientes;  Infraestrutura completa para uma noite de descanso;  O ambiente externo me deixou com muita tranquilidade e segurança."
set. de 2015,4,Excelente custo Benefício,"Bom hotel para no máximo duas noites, pois o mesmo não possui armários nos quartos, excelente localização, ótimo estacionamento apesar de ser pago a parte, bom café da manhã, higiene impecável, super indico."
set. de 2015,4,Localização privilegiada,"Ótima localização, atendimento cortês e extremamente atencioso, café da manhã bem servido, serviço de estacionamento, apesar de pago a parte, com boa relação custo-benefício..aconselho hospedagem as quintas e sextas-feiras pois no estacionamento lado do hotel, existe feira com food trucks!"
set. de 2015,5,HOTEL EXCELENTE,"hotel excelente, quarto confortável e ótima estrutura; funcionários atenciosos; café da manhã muito bom! Fiquei hospedada para um encontro jurídico junto ao hotel Ouro Minas e por isso, optei pelo conforto de me hospedar ao lado no Ramada. Reparei que o hotel tem uma estrutura diferenciada dentro de um mini shopping de casa, mas quanto ao barulho, nem sequer percebi, pois o quarto é muito silencioso. Em relação ao quarto, o diferencial é a decoração que a cada andar do hotel menciona um local de Minas (muito interessante e criativo). Os ""mimos"" oferecidos no quarto também são diferenciais(café, chá, água). Enfim, para quem procura um hotel com conforto, o Ramada atende perfeitamente. Preço muito bom também!"
set. de 2015,5,PARABÉNS!,"Indico, atendimento, limpeza e conforto diferenciados. Ótima localização. Certamente passa a ser minha primeira opção ao viajar para Belo Horizonte. A Equipe de atendimento esta de parabéns pela cortesia!"
set. de 2015,5,OTIMO,"Otima localização ,camas muito confortavel,não falta nada para uma boa hospedagem a tv ,internet e o ar condicionado fazem toda a diferença otima recpção,excelente refeição ,espero ter outras oportunidades de voltar"
set. de 2015,5,Maravilhoso,"Atendimento muito bom. Quarto excelente.  Fui a um show e voltei de madrugada .. me senti super segura!  Quarto muito aconchegante, acho que deveria ter mais opções de canais de filmes na tv .. fora isso .. tudo perfeito"
set. de 2015,5,Hotel Maravilhoso!!!!!!! :),"Hotel excelente, confortável, café da manha delicioso.  . Jantar servido no hotel, bom  Localização boa, com serviço do conexão aeroporto  Cama boa demaisssss/// internet muito boa  atendimento de qualidade"
set. de 2015,5,Excelente,"As instalações e serviços oferecidos foram excelentes. Os quartos tem camas muito confortáveis e o serviço de limpeza é muito eficiente. O café da manhã é muito bom, com opções variadas. Só senti falta de uma salada de frutas. E na recepção os profissionais sempre muito atenciosos. O hotel tem uma excelente localização, perto de shopping, estação de metrô, restaurantes, etc, isto é muito positivo."
set. de 2015,5,Avaliação nota 10,"tudo muito bom mas a cama é maravilhosa muito confortável excelente  nota 10 também.  no quarto tem televisão, chá  iluminação ótima, oferece também secador,  tem uma pequena ressalva só faltou um ferro para passar roupas, é algo necessário."
set. de 2015,3,Razoável,"Negativo:  O que achei sobre o Hotel, e que não tínhamos auxilio ou ajuda de nenhum funcionário no quarto, qualquer necessidade no quarto teríamos que descer.  Café da manhã sempre as mesmas coisas. Não haviam variedades na alimentação.  Positivo: Na recepção fomos bem atendidas, a parte da lanchonete bem variada. Elevadores sempre disponíveis. Cama bem confortável."
set. de 2015,5,Excelente,"Custo benefício excelente. Quartos confortável e café da manhã com variedades para o momento. Hotel modernos, com instalações modernas. Funcionários simpáticos e jovens. Internet wi fi que funciona. Localização perto do shopping. E o hotel fica em um shopping, não utilizei isso, mas é uma vantagem."
set. de 2015,5,Excelente Hotel,"Muito bom o quarto, limpeza, café da manhã. Próximo ao Minas Shopping, estação de Metrô e BRT,av Cristiano Machado dando mais facilidade de locomoção, entretenimento e alimentação. Voltarei mais vezes."
set. de 2015,5,Boa escolha,"Escolhi o hotel pela proximidade ao Congresso que participei no Ouro Minas, me surpreendi com a qualidade do hotel, quarto super confortável, limpinho, café da manhã completo e com diversidade, além da boa localização e preço justo."
set. de 2015,5,Excelente localização,"Em frente ao Minas Shopping com fácil acesso ao centro(10 minutos) de carro, onibus ou metrô e bem mais barato que o Hotel Ourominas que fica ao lado. A relação custo beneficio é otima e o hotel tem de tudo, desde wi-fi e café da manhã excelente até TV a cabo, frigobar, ar, etc..."
set. de 2015,4,Ótima custo benefício,"Gostei muito das instalações, cama confortável, quarto agradável, gostei da possibilidade de preparar um chá no quarto, a localização é ótima, a internet é boa e o preço é excelente. Só achei um pouco de barulho entre os quartos."
set. de 2015,5,Vale a pena!,"O hotel fica ao lado do Ouro Minas e atende muito bem para quem vai passar uma noite, como eu fui, a trabalho. Embora não possua guarda-roupas, existem cabides na parede. Tudo novo e limpo. Piso de madeira nos quartos e carpete nos corredores. TV por assinatura, frigobar, ar condicionado split. Cadeira e bancada, além de cama confortável. Um ótimo custo benefício. Única ressalva é sobre o chuveiro que, mesmo desligado, às vezes pingava, no quarto 1116."
