Data da opinião,Nota,Título,Conteúdo
mai. de 2015,4,Restaurante com boa comida e preço honesto,"Almoço com frequência neste hotel e sempre sou muito bem atendido.  O buffet é bem variado, o cozinheiro está sempre por perto para ter feedback sobre os alimentos.  Recomendo especialmente a garçonete Vanuza, pessoa competente e simpática."
mai. de 2015,5,Muito bom.,"Adorei o hotel, cama muito boa, quarto com cofre eletrônico, tv de led. Localização boa, bem próximo ao metro e vários bares. Café da manhã com boas opções mas faltou variedades.  Foi uma ótima experiencia eu indico e voltaria a me hospedar no hotel."
mai. de 2015,5,Muito bom,"Prédio novo super bem localizado. Próximo da estação do metrô de Botafogo e de muitos bares, cinemas, shopping, farmácia, etc... Facilitou demais o deslocamento pela cidade! E se você animar, ainda dá para alugar uma bicicletário se divertir pela orla da cidade!"
mai. de 2015,3,Abril 2015,"Novinho, padrão ibis tradicional, lanchonete no lobby, estacionamento pago (R$ 30,00), frigobar, cofre, quarto silencioso embora a rua seja bem movimentada. Na rua atrás há um café bem bacana, uma lanchonete subway e Livraria da Travessa. O atendimento foi bem atencioso."
mai. de 2015,4,Confortavel.,"Hotel com um custo medio, otima localizacao pois o bairro de Botafogo fica proximo a varios pontos turisticos do Rio de Janeiro. Quarto pequeno porem confortavel. O ar condicionado nao estava em bom funcionamento. Cafe da manha muito simples, poderia ser melhor pois o custo por pessoa e de 17,00 reais. Funcionarios educados e atenciosos."
mai. de 2015,4,Bom custo/beneficio no Rio,"Acho que é um excelente custo benefico no rio de janeiro, que possui hoteis e caros e nem sempre bons, um hotel novo, com uma design moderno, o estacionamento tb é bom, achei muito ruim o café da manhã apenas, uma excelente opção com boa localização."
mai. de 2015,3,Boa localização,"Hotel muito bem localizado, situado em um bairro da Zona Sul do Rio, próximo ao metrô e fácil de apanhar taxis. Bom atendimento, principalmente através do check in on line e check out rápido. Boa tarifa."
mai. de 2015,4,Justo.,"Acesso fácil, porém muito deserto após o horário comercial.Deserto também em feriados. Instalações padrão Íbis, sempre parecidos e sem surpresas. Café da manhã caro. Melhor tomar café em alguma padaria próxima."
abr. de 2015,4,Melhor custo-benefício,"Fiquei durante três dias no hotel com meu namorado e nossas mães. Primeiro, como chegamos mais cedo, liberaram os quartos para a gente sem nenhum problema antes do horário do check-in. Os quartos são super limpos e confortáveis. O café da manhã, apesar do custo de 17 reais,vale a pena sim, até porque não encontramos nada na região. Sobre o hotel, seria ótimo se tivesse uma piscina e academia, mas já sabíamos que o Ibis não oferece esse tipo de serviço. O bairro é uma graça, super perto do metrô e com vários barzinhos, fast-foods e farmácias. Tínhamos a opção de ficar em Copacabana, mas continuamos achando que vale a pena ir pra Botafogo, mesmo não tenho uma boa praia. Recomendo e voltaria numa próxima visita."
abr. de 2015,4,Prático e muito bem localizado,"Hotel padrão Ibis, super bem localizado, próximo ao metrô e da praia, prático e com bom custo benefício, funcionários muito atenciosos. Café da manhã disponível no local ao preço de 17 reais por pessoa."
abr. de 2015,3,Padrao Ibis,"Nao foge ao padrao IBIS. Honesto no preco, quartos bons sem qualquer requinte. Cafe da manha mediano. Localizacao mediana, para o que me propus a fazer, mas nada que desabone. Cumpre o que se propoe a ser, isso e o mais importante."
abr. de 2015,4,Hotel bem localizado,"O hotel do ibis em Botafogo é muito bem localizado. Metrô muito perto, próximo a orla, 30 minutos andando você chega no bairro da Urca.  Os funcionários são bem atenciosos e dão todo conforto aos hóspedes.  Caso você precise comprar algo, existem mercados e farmácias bem próximos ao local."
abr. de 2015,4,Boa localização,"Boa localização e ótimo custo e beneficio, estacionamento é um pouco complicado, mais tem manobrista, a não fui informado que tinha custo adicional. Existe vários restaurantes por perto, e também estação de metrô."
abr. de 2015,5,Muito bom!,"Estive hospedada no Ibis Botafogo com minha mãe no início do mês de abril. Ótimo custo benefício, hotel bem localizado, quartos limpos, café da manhã muito bom, restaurante também. Ficamos muito satisfeitas com os serviços oferecidos."
abr. de 2015,5,excelente hotel,"hotel com excelente atendimento e ótima culinária.  Confortável, ambiente gostoso e amigável.  Padrão de limpeza muito bom.  Excelente custo beneficio com locais úteis bem próximos e o melhor , praias e outros locais turísticos.  Muito bem recomendado."
abr. de 2015,4,Boa relação custo-beneficio,"Hotel bem localizado em Botafogo, próximo ao metrô e aos principais pontos turísticos: Corcovado e Pão de Açúcar. Para quem curte andar de bike, há uma estação da BikeRio Itaú a uma quadra do hotel. Recepcionistas muito gentis e café acima do padrão Ibis."
abr. de 2015,5,Excelente serviço,"Estive hospedado no Íbis Botafogo no mês de Março e só tenho a recomendar. Trata se de um hotel limpo e organizado, com uma equipe com excelência no atendimento. Esse hotel fica bem localizado e de fácil acesso ao principais pontos turísticos."
abr. de 2015,4,bom,"Bom hotel, padrao ibis. Boa localizacao limpo sem odores boa cama perto do local onde t8nha 2ue ir,p3rto ee copacabana e do aeroporto,enfim, aquilo qu3 se pode esperar d3 um ibis.os precos no rio sao altos e quando nao queremos arriscar,o ibis da c8nta do recado.neste caso foi o que aconteceu"
abr. de 2015,5,Ibis Botafogo,"Hotel padrão Ibis, mas com uma recepção moderna e um lounge aconchegante. Quartos limpos e confortáveis. Local muito bom, com mercado a uma quadra e 3 quadras da praia e do shopping. Muito bom custo benefício!"
abr. de 2015,5,Conforto,"Muito conforto e luxo no hotel. A família toda adorou. Minha mãe pretende voltar numa proxima oportunidade pois ficou realmente satisfeita. Eu claro, adorei o hotel. A comida excelente. Quartos confortáveis. Atendimento nota mil."
abr. de 2015,4,Segue o padrão da rede e possui algumas facilidades,"O Hotel Ibis Botafogo segue o padrão da rede, e possui algumas facilidades em razão da sua localização. É próximo à Estação do Metrô Botafogo, e aos 02 complexos de Cinema localizados no final da Rua Voluntários da Pátria (com diversos bares próximos). Há ainda a Livraria da Travessa (com seu ótimo Café) e para quem precisar fazer compras, tem um Hortifruti há menos de 400 metros do hotel. O bar do hotel também é bem legal. Estacionamento (a diária) é pago à parte (R$ 30,00 em abril de 2015)."
abr. de 2015,4,Padrão Ibis,"Hotel bem localizado, próximo ao metrô. Quarto padrão Ibis, nada de novidades. Tudo muito limpo, cama confortável, banheiro bom, chuveiro bom, tv ok, funcionários prestativos e simpáticos. Voltaria com certeza."
abr. de 2015,5,Meu aconchego no RJ,"A rede de hotéis Ibis é uma excelente opção para qualquer situação, seja a negócios ou a passeio, no meu caso, fériaaaas! O recepcionamento e atenção que os funcionários nos deram durante esta estadia foi show! Logo de cara, o recepcionista Phillipe foi um máximo!!! A Luana do bar também foi muito bacana comigo e com minha irmã Mírian, que somos do ES. Claro que a viagem para essa cidade maravilhosa já me deixou empolgada, mas fiquei impressionada com a educação e gentileza das pessoas por qualquer lugar que passamos!!! O hotel é uma gracinha, bem organizado e aconchegante! Um abraço pra todos, até breve, porque um dia eu vou voltar!!!!  Mirna Moschen"
abr. de 2015,4,Muito bom!,"Ficamos no hotel por uma noite no feriado de 21/4. Foi uma estadia muito agradável: o checkin foi rápido, os atendentes foram muito atenciosos, o quarto é confortável e a localização é bem perto de mercados, restaurantes e de fácil acesso para a praia (um taxi até o Leblon deu 22 reais).  O quarto tem camas confortáveis, apesar de pequeno (o que já era esperado quando nos hospedamos na rede). A ducha é ótima e a TV tem bastante canais. As toalhas poderiam ser melhores, eram muito ásperas (de muitas lavagens) e não recebemos toalhas de rosto. Outro ponto a melhorar seria manter o frigobar abastecido (eles deixam desabastecido), para maior conforto, como beber água à noite, por exemplo.  Por fim, o restaurante e bar eram muito agradáveis, com um ótimo serviço é bom custo benefício nos pratos e bebidas.  Um ponto a aprimorar é o serviço de táxi. Quando pedimos um taxi na recepção, eles falaram que não tinham nenhum contato e que poderíamos pedir pelo aplicativo. Para um turista, essa nem sempre é a melhor opção e a opção na qual nos sentimos mais seguros. Assim, acho que se fosse possível apenas ter um contato na recepção para que possa ser chamado um taxi, acho que já ajudaria quem não conhece a cidade.  Nos demais pontos, foi tudo ótimo."
abr. de 2015,5,Excelente!!!,"Hotel bem localizado. Excelente estrutura. Restaurante muito bom. Equipe nota 1.000, Cristiano, Ricardo, Eduardo, Vinicios, katia, Filipe, Giza, Camila, Luana, Fernanda e André são super competentes, profissionais atenciosos. Eu super indico!!!"
abr. de 2015,4,Um local aprazível para todas as ocasiões,"Um hotel bem organizado, limpo com saboroso café da manhã e um ótimo atendimento, em especial do Phellipe (responsável pelo check-in check-out durante a manhã)    O bairro do Botafogo é bem agradável. O hotel está há 3min do metro Botafogo, do terminal do metro de superfície, do terminal de onibus, do supermercado e de bons bares e restaurantes. Caminhando menos de 10 min, tem-se o shopping e a maravilhosa vista do Pão-de-Açúcar na praia do Botafogo.    Recomendo e retornarei."
abr. de 2015,3,Pode melhorar,"Hotel bem localizado, como quase todos da rede, com bastante movimento e necessitando de melhorias no atendimento principalmente no café da manhã e na arrumação dos quartos.  O restaurante é grande, mas, falta praticidade no fluxo de pessoas durante o período do café da manhã. Não tem local para o hóspede colocar a louça usada e os atendentes não priorizam a desocupação das mesas, ficando além de feio confuso aquele tanto de mesa suja.  Na entrada do café forma-se uma fila incoerente com os tempos atuais para o hóspede assinar uma lista de presença.  Sugestão...ou se coloca mais atendentes na hora do movimento ou se pensa em outro tipo de controle.  A limpeza dos quartos também deixa a desejar, houve dia sem varrer, dia sem lavar banheiro..."
abr. de 2015,4,Recomendo,"Recomendo o hotel Ibis Botafogo, nossa estadia durou um final de semana para conhecer um pouquinho dessa cidade Maravilhosa, e a escolha nos ajudou muito, pois a localização do hotel é ótima pra que vai se movimentar por ônibus ou metro como nós, fomos a todos os principais pontos turísticos sem nenhuma dificuldade. O café da manhã é bom, bem variado. E o quarto bem limpinho e simpático."
abr. de 2015,4,Bem localizado e bom custo x benefício,"Bem localizado, a apenas alguns metros da estação de metrô, quarto padrão Ibis e limpo. Estive hospedada durante a Copa do Mundo e o preço não estava tão exorbitante considerando o evento na cidade. Destaco o bom atendimento. Precisei de ajuda para fazer e imprimir uma reserva e foram muito atenciosos em me ajudar. É uma boa escolha de hospedagem no Rio."
abr. de 2015,5,Padrão,"Padrão da rede, limpo, atendimento rápido e cordial.    Minha única observação é quanto ao lugar, durante a noite é não é bom para comércio, restaurantes e etc, acaba necessitando de transporte para aproveitar um pouco a noite.    Ao menos não é difícil conseguir um táxi, sempre passam muitos na região e não é necessário pedir ajuda aos funcionários do hotel."
abr. de 2015,4,Muito Bom,"Hotel muito bem localizado, próximo à estação do metro Botafogo, prédio novo, mobiliário novo e clean, atendimento muito bom, diria que é um ótimo hotel dentro do padrão proposto. Perto encontram-se bons restaurantes, shopping, próximo da praia de Botafogo, enfim é um lugar para se hospedar bem a um custo ótimo levando-se em consideração os valores atuais na cidade do Rio de Janeiro. Chamo atenção entretanto para o fato de que o café da manhã não está incluso na diária, devendo-se pagar a parte um valor de R$17,00 por pessoa."
abr. de 2015,3,Bom custo/benefício,"O preço desse Ibis é uma das coisas que sempre me levam a reserválo. Fica muito próximo à Copacabana e o de Ibis de lá tem sempre um preço mais salgado.  Ele não fica exatamente em frente à praia, mas a caminhada é curta.  Não há estacionamento gratuito, deve-se pagar 30 reais por dia de estada.  No mais, os atendentes são muito gentis e o quarto possui padrão Ibis: confortável sem muito luxo."
abr. de 2015,4,Padrão Ibis de Atendimento e bem localizado,"Me hospedei no fim de semana de 11 a 12 de abril , para a Asics Golden Four Etapa RJ. Achei o hotel bem localizado, próximo a Praia de Botafogo. Fácil deslocamento de taxi para o Leblon ( 25 reais a corrida ). Tem estacionamento, que cobra a diária de R$ 30,00 . Acabei não tomando o café da manhã lá em função do horário da corrida, que iniciou as 7 hs da manhã no Recreio dos Bandeirantes. Este é o milésimo hotel da rede Ibis, daí tem um saguão diferenciado. O resto é padrão Ibis. Para quem tem Le Club, Welcome Drink na chegada. Dormi muito bem, sem problemas com barulho."
abr. de 2015,4,"Atendimento 10, Instalações Honestas","Excelente custo/beneficio, localizacao estrategica (proximo aos pontos turisticos e facil deslocamento) e atendimento excelente do Phelipe e Denize. O quarto é amplo e muito limpo, e o preco muito justo. Wifi gratuito e cordialidade."
abr. de 2015,5,Excelente,"Ótima localização , quartos aconchegantes próximo do comercio bares pizzaria , Íbis pra mim é um clássico sempre opto por hospedar na rede íbis e claro sempre oferece ótimos pratos e excelência no atendimento , recomendo fortemente !!"
abr. de 2015,4,conforto,"Otima estrutura, aconchegante, funcionarios muito prestativos, servico de QUARTO BOM, comida muito boa, precos bons, garagem privativa, facilidade para formas de pagamento, indico para quem quiser ir com a familia"
abr. de 2015,5,Muito bom,"Boa localização, próximo do metrô, com padarias, restaurantes e supermercados próximos, pessoal muito gentil e bem treinado, quartos limpos e novos. Enfim uma boa pedida bem no meio de tudo, entre as praias e o centro."
abr. de 2015,4,Bom hotel pelo preço e localização,"Hotel com boa recepção, aconchegante, tudo muito limpo!  Restaurante: café da manhã razoável, com boas opções! Pratos, costumam vir frios e demoram!  Preço justo para a localização  Localização excelente! Próximo ao metrô, shopping, via principal, para ônibus, tudo muito próximo!  Indico!"
abr. de 2015,4,"Silencio, limpeza, amabilidade em um soh lugar.","Fiquei hospedada no hotel Ibis Botafogo por 10 dia, em marcos. Solicitei um quarto longe de barulho e me deram um quarto tao silencioso que parecia que estavanuma cidade do interior. As camareiras sao muito amaveis. A localizacao eh excelente: uma corrida de taxi ate o Praia Shoping custa em torno de 7-10 reais, corrida de taxi ate o Leblon (rua Darlos de Goes), onde tem o Shopinh Desing Leblon) custa 22 reais; corrida de tai para o Shoping Rio Sul em torno deste preco tambem. A internet wifi tem velocidade rapida. A TV a cabo nao tem muitos canais. O split eh silencioso. Nao tomei cafe no hotel, que eh cobrado a parte (16 reais). Bem petinho do hotel tem um hortifruti muito bom e mais a frente um restaurante bom tambem. Portanto, para o padrao Ibis eu gostei muito de ficar hospedada la,"
abr. de 2015,5,Localização e comodidade,"Próximo a uma estação de metro e com a comodidade de uma estadia tranquila num bairro aconchegante, proximo tambem ao palacio guanabara e a varios restaurantes tradicionais do rio antigo. Limpeza impecavel"
abr. de 2015,4,Prático,"Padrão IBIS.  Prós:  Nunca terá surpresa (nem agradáveis, nem desagradáveis).  Tudo limpo, organizado e prático.  Contras:  - Estacionamento pago (tercerizado). Eles cobram por diárias dos hospedes.  - Café da Manhã não incluso;"
abr. de 2015,3,Geldeira e banheiro sujos,"Fiquei três dias hospedada no hotel, na primeira hotel liguei na recepção e informei que o banheiro estava sujo e na geladeira tinham alimentos que não eram meus. A recepcionista disse que poderia enviar uma camareira, mas eram 23h e disse que não, pois queria dormir e que na manhã seguinte limpassem. No dia seguinte ao retornar ao hotel a noite, nada havia feito. Ao terceiro e ultimo dia disse pessoalmente na recepção que não haviam limpado, a Deise me disse o seguinte ""que deveriam ter me mudado de quarto (o que não foi oferecido) e que lamentava muito e pediu desculpas, poderia mandar alguém limpar, porém fui embora e a sujeira continuou lá. Agora me diz, essa desculpa me adianta no que se fiquei TRÊS dias com banheiro e geladeira sujos."
abr. de 2015,4,Custo beneficio,"Para mim, o melhor custo beneficio da cidade do rio de janeiro, o hotel fica bem próximo a uma estação de metro e a vários pontos de ônibus. Alem disso, a localização do bairro botafogo fica entre o aeroporto e os principais pontos turísticos."
abr. de 2015,2,Escolhi o hotel em função da proximidade ao Hospital ProCardíaco onde minha mãe estava internada,"O hotel tenta e se esforça, mas não alcança...Lamentavelmente o serviço de limpeza das partes comuns como corredores não funciona bem, embora sejam limpos o quarto (mínimo) e o banheiro, Não há toalhas de rosto e pedem que o hóspede não mande lavar todos os dias a toalha de banho para plantarem um bosque! - não o farei até me mostrarem a floresta Ibis. O café da manhã é comum, fraquinho, mas o que mais me impressionou foi o baixo nível de educação do pessoal, que deve ser mais bem treinado."
abr. de 2015,4,Bom,"Hotel com bom custo/benefício porém poucos funcionários para atender e restaurante muito frio, comida boa, e os poucos funcionários na recepção são bem educados. Bar no térreo muito bom, de excelente atendimento e boas opções de lanches"
abr. de 2015,4,"Hotel simples e prático. Limpo, silencioso e tem ótimo jantar.","Estava cansada para sair e decidir a contragosto jantar no hotel, mas foi uma agradável surpresa pois o prato estava ótimo (Risoto de parmesão com Filé). O risoto estava ótimo, a carne ótima, foi uma boa surpresa em se tratando de restaurantes de hotel. Parabéns ao cozinheiro do Íbis Botafogo. Voltaria lá só pelo jantar."
abr. de 2015,4,Semana Santa,"Muito bom! Ótima localização, perto da estação do metrô, várias opco de ônibus para diversos destinos. Atendimento atencioso. Quarto aconchegante! Café da manhã para todos os gostos, simplesmente delicioso."
abr. de 2015,4,Boa localização,"Hotel conta com uma infraestrutura ótima. Funcionários sempre muito com uma gentileza e com boa vontade para te ajudar. Quarto limpo, bem organizado, contando também com um frigobar dentro dele. Café da manhã com variedade grande de escolhas. Localizado perto do metrô para poder ir aos principais pontos turísticos."
abr. de 2015,5,Réveillon,"Eu adorei a localização do hotel e o preço para o período. O melhor de tudo foi o funcionário Michel que nos recepcionou e nos deu as melhores dicas. De como usar o metrô, de comprar com antecedência os tickets do metrô para o réveillon (inclusive indo comprar pra gente). Adorei tudo. Pretendo voltar."
abr. de 2015,3,Boa Localização,"O Hotel possui acomodações simples mas moderna e tem todas as comodidades necessárias tais como um bom chuveiro, Ar condicionado, geladeira e tv. É localizado no bairro de botafogo na zona sul do Rio de Janeiro e está no máximo a 400 metros da estação do Metro"
abr. de 2015,4,Bem localizado e bom atendimento dos funcionários,É um hotel bem localizado c a estação de botafogo bem próxima (1 quadra -acesso E Mena Barreto). Tem o supermercado hortifruti praticamente do lado.  Bem próximo tem uma rua só de bares...3 quadras do botafogo praia shopping.  Os quartos n são barulhentos. Mt bom!!
abr. de 2015,5,"Comodidade, conforto e custo beneficio.","Surpreendente, ótima localização em volta tem varios lugares onde pode ser feita as refeições, tem uma pizzaria do lado, um mercado bem proximo,facil acesso a metro e onibus,pertinho do shopping,pão de açucar e copacabana, bom atendimento e cumpre as regras do padrão ibis."
mar. de 2015,4,"Ótima localização, fácil acesso as principais regiões da cidade.","Hotel simples e confortável, quarto bem limpo e organizado, com ar condicionado e frigobar. Café da manhã OK, com pães, bolos e frios.  O que mais gostei foi a localização do hotel, fica a 200 metros do metrô e tem vários pontos de ônibus próximo. Fui ao Rio à turismo e para não fazer tudo de táxi preferi ficar nesse hotel que está localizado no meio dos pontos que ia visitar, Cristo, Pão de Açúcar, Centro e Copacabana. E funcionou muito bem, ia de táxi quando tinha pressa e quando o programa era mais a tarde eu pegava metrô mesmo. Recomendo."
mar. de 2015,4,Aprovado!,"Gostei do atendimento e principalmente da localização privilegiada! fica proximo de bons restaurantes e de outros pontos turisticos como o pão de açucar. No hotel, os funcionários sao bem prestativos."
mar. de 2015,4,"Básico, mas suficientemente confortável","Hotel bom. Quartos bem limpos. Duche deliciosa, bem forte e quentinho. Só tenho a reclamar que poderiam ter 2 sabonetes, ao invés de 1. Um para o banho e outro para a pia. Além disso, deveria ter toalha de rosto. Mas gostei muito e recomendo."
mar. de 2015,5,Excellent value for money.,"Para quem procura um hotel de médio custo, mas com boa infraestrutura e localização é uma excelente opção.  Localizado perto do metro e do Aterro do Flamengo.  Minha cachorrinha foi muto bem recebida no hotel, embora seja cobrada uma taxa adicional."
mar. de 2015,4,Muito bom....,Estava em duvida em ficar mais estou muito satisfeito com o serviço. Somente evitem o trânsitode carros próximo do hotel entre as 17 as 20 horas....bem lento. Café da manha muito bom. Agora o chato é escrever 200 caracteres aqui.
mar. de 2015,5,Atendimento completo e com qualidade,"O hotel oferece o necessário para uma estadia tranquila e com qualidade, disponibilidade de refeições 24h por dia, menus variados, desjejum fora de hora, atendimento exemplar, limpeza, ótima localização."
mar. de 2015,3,O de sempre!,"Hotel que não causa nenhuma surpresa, atendimento razoável, boa cama, café da manhã horrível, caro pelo que oferece. Localização muito boa, com restaurantes na proximidade e perto do Botafogo Praia Shopping."
mar. de 2015,4,Ótima opção em Botafogo,"Muito bem localizado em Botafogo, bairro que tem vida própria, na esquina da Profº. Álvaro Rodrigues com a Paulino Fernandes, o hotel possui instalações novas e equipe muito bem treinada. Quartos padrão Ibis (uma cama de casal ou duas de solteiro), bancada de trabalho, camas confortáveis com edredon e banheiro de bom tamanho com boa ducha. O quarto possui espaço suficiente para duas pessoas."
mar. de 2015,4,Uma otina opção no Rio !,"Fiquei no movimentado fim de ano no Rio !  O hotel fica no centro do bairro, próximos a vários restaurantes, próximo ao metro e também as ótimas e legais bicicletinhas do Itau !  Fiz uma mini lua de mel no rio ! Super Legal"
mar. de 2015,4,Qualidade e custo beneficio,"Sempre que preciso escolher um hotel em alguma cidade que não conheço e não tenho indicação de hotel, escolho o Íbis. Mantem qualidade de suas acomodações independente do local, com custo-benefício incrível. Sempre será minha escolha, quando possível."
mar. de 2015,5,Muito bom!,"Excelente custo/benefício. Gosto muito da rede IBIS e recomendo. Nessa unidade, os quartos são padronizados e diferente de outros da rede, possui banheiro integrado (toilet + pia + box no mesmo ambiente). Ótima localização. Perto do metrô e da zona gastronômica e noturna de Botafogo."
mar. de 2015,4,Bom,Limpeza excelente. Local ótimo perto de vários cafés e restaurantes. Três quadras da praia. Pessoal muito atencioso. Fácil de pegar taxi a noite. Wi-Fi sinal fraco café da manhã fraco camas boa meu quarto era muito silencioso. Voltaria com certeza
mar. de 2015,5,Padrão de Qualidade,Qualidade e praticidade. A rede mostra que não para no tempo e sempre busca inovar oferecendo uma experiência muito aconchegante.  Os profissionais são atenciosos e solicitos.  Destaque também para o restaurante com um cardápio variado.
mar. de 2015,5,Excelente Custo Benefício!,"Hotel da rede Ibis com excelente localização em Botafogo, próximo ao metrô e área de restaurantes e bares. Hotel é novo, com mobilia toda nova. Cama bem confortável e chuveiro excelente. Custo benefício é muito bom, prinicipalmente se fizer a reserva antecipada e garantir descontos."
mar. de 2015,5,Prático e bem localizado,"Este hotel é uma ótima opção. O bairro de Botafogo, embora não tenha um acesso tão imediato à praia, tem ótimas opções de restaurantes e bares. O Ibis fica bem próximo da estação de metrô, e próximo do aeroporto Santos Dumont (o táxi custa mais ou menos R$ 20,00). É uma ótima opção também porque tem vários bares e restaurantes bem próximos do hotel. Recomendo!"
